,assoc,values
0,they sell,remaining 6 divided 6 analyst rating buy strong buy 0 analysts advised investors desist buying macerich company mac shares sell already .
1,they buy,bmo capital markets reissued buy rating issued 64.00 price objective shares macerich report tuesday september 25th .
2,they sell,zacks investment research upgraded shares macerich sell rating hold rating research note monday september 3rd .
3,they sell,finally goldman sachs group upgraded shares macerich sell rating neutral rating lifted price objective company 52.00 64.00 research report tuesday july 17th .
4,they sell,one research analyst rated stock sell rating twelve given hold rating six assigned buy rating company .
5,they sell,number hedge funds institutional investors recently bought sold shares mac .
6,they buy,eii capital management inc. increased holdings macerich 2.0 2nd quarter .
7,they buy,pnc financial services group inc. increased holdings macerich 15.6 1st quarter .
8,they buy,sg americas securities llc increased holdings macerich 4.9 2nd quarter .
9,they buy,bnp paribas asset management holding s.a. increased holdings macerich 17.9 2nd quarter .
10,they buy,finally us bancorp de increased holdings macerich 17.5 2nd quarter .
11,they sell,zacks investment research upgraded macerich sell rating hold rating report monday october 22nd .
12,they sell,goldman sachs group upgraded macerich sell rating neutral rating lifted price objective stock 52.00 64.00 report tuesday july 17th .
13,they buy,finally bmo capital markets set 66.00 price objective macerich gave stock buy rating report wednesday august 1st .
14,they sell,one analyst rated stock sell rating twelve issued hold rating six given buy rating company .
15,they buy,bmo capital markets reiterated buy rating set 64.00 target price shares macerich report tuesday september 25th .
16,they sell,zacks investment research upgraded macerich sell rating hold rating report monday september 3rd .
17,they sell,one investment analyst rated stock sell rating twelve issued hold rating six assigned buy rating company stock .
18,they sell,name required mail published required zacks investment research upgraded shares macerich nyse mac sell rating hold rating research note issued investors monday morning .
19,they buy,bmo capital markets reaffirmed buy rating issued 64.00 price target shares macerich report tuesday september 25th .
20,they sell,finally goldman sachs group upgraded shares macerich sell rating neutral rating upped target price company 52.00 64.00 report tuesday july 17th .
21,they sell,one analyst rated stock sell rating twelve given hold rating six assigned buy rating company .
22,they sell,average sell-side analysts anticipate macerich post 3.91 earnings per share current year .
23,they sell,zacks investment research upgraded shares macerich sell rating hold rating research note monday .
24,they sell,goldman sachs group raised shares macerich sell rating neutral rating raised price objective stock 52.00 64.00 report tuesday july 17th .
25,they buy,finally bmo capital markets set 66.00 price objective shares macerich gave stock buy rating report wednesday august 1st .
26,they sell,one analyst rated stock sell rating twelve issued hold rating six assigned buy rating company .
27,they buy,blackrock inc. increased holdings macerich 3.5 2nd quarter .
28,they buy,bank america corp de increased holdings macerich 206.8 2nd quarter .
29,they buy,cbre clarion securities llc increased holdings macerich 2.5 2nd quarter .
30,they buy,dimensional fund advisors lp increased holdings macerich 0.5 2nd quarter .
31,they buy,finally third avenue management llc increased holdings macerich 29.9 2nd quarter .
32,they sell,zacks investment research downgraded shares macerich hold rating sell rating report tuesday august 21st .
33,they buy,bmo capital markets restated buy rating issued 64.00 target price shares macerich report tuesday september 25th .
34,they sell,one research analyst rated stock sell rating twelve assigned hold rating six assigned buy rating company .
35,they sell,zacks investment research cut macerich hold rating sell rating research note tuesday august 21st .
36,they sell,goldman sachs group raised macerich sell rating neutral rating increased target price company 52.00 64.00 report tuesday july 17th .
37,they sell,one research analyst rated stock sell rating twelve assigned hold rating six issued buy rating stock .
38,they sell,several large investors recently bought sold shares mac .
39,they buy,"crabel capital management llc bought new stake macerich 2nd quarter valued 28,642,000 ."
40,they sell,zacks investment research upgraded shares macerich sell rating hold rating research report monday .
41,they buy,bmo capital markets reissued buy rating set 64.00 target price shares macerich research note tuesday september 25th .
42,they sell,one research analyst rated stock sell rating twelve assigned hold rating six given buy rating stock .
43,they sell,featured article understanding average daily trade volume google_ad_client ca-pub-0703139142419429 google_ad_slot 1418630638 google_ad_width 336 google_ad_height 280 macerich nyse mac upgraded zacks investment research sell rating hold rating note issued investors monday .
44,they buy,bmo capital markets reissued buy rating set 64.00 price objective shares macerich report tuesday september 25th .
45,they sell,one analyst rated stock sell rating twelve issued hold rating six assigned buy rating stock .
46,they sell,hedge funds institutional investors recently bought sold shares company .
47,they buy,"featured article dividend stocks may right viewcount articlehistoryid=25657333 postdate=2018-10-24 type=a tertiary=1 id=1102820 get free copy zacks research report macerich mac information research offerings zacks investment research visit zacks.com keyword macerich nyse mac mac finance,55438210 upgrade zacks investment researchratings:3,17 nyse mac receive news ratings macerich daily enter email address receive concise daily summary latest news analysts ratings macerich related companies marketbeat.com free daily email newsletter ."
