,assoc,values
0,they buy,"stock traders bought 2,246 put options company ."
1,they sell,"related news chairman gregory q. brown sold 204,953 shares business stock transaction occurred friday september 14th ."
2,they sell,"shares sold average price 126.47 total value 25,920,405.91 ."
3,they sell,"also evp john p. molloy sold 152,871 shares business stock transaction occurred wednesday september 12th ."
4,they sell,"stock sold average price 125.92 total transaction 19,249,516.32 ."
5,they sell,"insiders sold total 649,479 shares company stock worth 82,082,428 last quarter ."
6,they buy,dimensional fund advisors lp increased stake motorola solutions 0.5 1st quarter .
7,they buy,cibc world markets inc. increased stake motorola solutions 152.4 1st quarter .
8,they buy,"summit trail advisors llc increased stake motorola solutions 3,656.8 1st quarter ."
9,they buy,allianz asset management gmbh increased stake motorola solutions 13.7 1st quarter .
10,they buy,finally brown advisory inc. increased stake motorola solutions 112.5 1st quarter .
11,they buy,jefferies financial group boosted target price shares motorola solutions 140.00 gave stock buy rating report monday july 23rd .
12,they buy,zacks investment research upgraded shares motorola solutions hold rating buy rating set 137.00 target price stock report tuesday july 24th .
13,they buy,northcoast research set 128.00 target price shares motorola solutions gave stock buy rating report monday august 6th .
14,they sell,finally jpmorgan chase co. downgraded shares motorola solutions neutral rating underweight rating report friday august 3rd .
15,they sell,one research analyst rated stock sell rating three issued hold rating ten given buy rating stock .
16,they buy,stock presently consensus rating buy consensus target price 131.85 .
17,they buy,fulgent genetics flgt release quarterly earnings tuesday dynex capital dx set announce earnings wednesday palo capital inc. bought new stake motorola solutions inc nyse msi 3rd quarter according recent filing securities exchange commission .
18,they buy,"fund bought 1,875 shares communications equipment provider stock valued approximately 244,000 ."
19,they sell,google_ad_client ca-pub-0703139142419429 google_ad_slot 5621244306 google_ad_width 336 google_ad_height 280 c number large investors also recently bought sold shares msi .
20,they buy,zacks investment research lowered shares motorola solutions buy rating hold rating report monday october 8th .
21,they buy,citigroup boosted target price shares motorola solutions 130.00 146.00 gave company buy rating report tuesday september 25th .
22,they buy,jefferies financial group boosted target price shares motorola solutions 140.00 145.00 gave company buy rating report tuesday august 28th .
23,they buy,finally argus boosted target price shares motorola solutions 140.00 gave company buy rating report tuesday august 7th .
24,they sell,one research analyst rated stock sell rating three issued hold rating ten assigned buy rating stock .
25,they buy,motorola solutions consensus rating buy average target price 131.85 .
26,they sell,"news evp john p. molloy sold 152,871 shares business stock transaction occurred wednesday september 12th ."
27,they sell,"shares sold average price 125.92 total value 19,249,516.32 ."
28,they sell,"also evp mark s. hacker sold 102,628 shares business stock transaction occurred friday september 7th ."
29,they sell,"shares sold average price 127.01 total transaction 13,034,782.28 ."
30,they sell,"insiders sold total 649,479 shares company stock worth 82,082,428 last three months ."
31,they sell,group sell-side analysts anticipate motorola solutions inc post 6.57 earnings per share current fiscal year .
32,they buy,two analysts rated stock hold rating three assigned buy rating company .
33,they buy,stock average rating buy consensus target price c 27.00 .
34,they sell,"news evp mark s. hacker sold 102,628 shares firm stock transaction dated friday september 7th ."
35,they sell,"stock sold average price 127.01 total transaction 13,034,782.28 ."
36,they sell,"also ceo gregory q. brown sold 99,953 shares firm stock transaction dated friday september 14th ."
37,they sell,"stock sold average price 126.65 total value 12,659,047.45 ."
38,they sell,"insiders sold 649,479 shares company stock valued 82,082,428 last 90 days ."
39,they buy,zacks investment research cut motorola solutions buy rating hold rating research note monday october 8th .
40,they buy,citigroup increased price objective motorola solutions 130.00 146.00 gave stock buy rating research report tuesday september 25th .
41,they buy,jefferies financial group increased target price motorola solutions 140.00 145.00 gave stock buy rating report tuesday august 28th .
42,they buy,finally argus increased target price motorola solutions 140.00 gave stock buy rating report tuesday august 7th .
43,they sell,one research analyst rated stock sell rating three assigned hold rating ten issued buy rating company stock .
44,they buy,company presently average rating buy average price target 131.85 .
45,they buy,zacks investment research lowered motorola solutions buy rating hold rating research note monday october 8th .
46,they buy,citigroup increased target price motorola solutions 130.00 146.00 gave stock buy rating research note tuesday september 25th .
47,they buy,jefferies financial group increased target price motorola solutions 140.00 145.00 gave stock buy rating research note tuesday august 28th .
48,they sell,finally jpmorgan chase co. lowered motorola solutions neutral rating underweight rating research note friday august 3rd .
49,they sell,one analyst rated stock sell rating three given hold rating ten given buy rating company stock .
50,they buy,company consensus rating buy average target price 131.85 .
51,they sell,"motorola solutions news evp mark s. hacker sold 102,628 shares stock transaction dated friday september 7th ."
52,they sell,"stock sold average price 127.01 total value 13,034,782.28 ."
53,they sell,"also ceo gregory q. brown sold 99,953 shares stock transaction dated friday september 14th ."
54,they sell,"shares sold average price 126.65 total value 12,659,047.45 ."
55,they sell,"insiders sold total 649,479 shares company stock worth 82,082,428 last ninety days ."
56,they sell,zacks investment research sales averages average based survey sell-side research analysts provide coverage motorola solutions .
57,they buy,jefferies financial group upped price objective motorola solutions 140.00 gave company buy rating research report monday july 23rd .
58,they buy,zacks investment research upgraded motorola solutions hold rating buy rating set 137.00 price objective company research report tuesday july 24th .
59,they buy,northcoast research set 128.00 price objective motorola solutions gave company buy rating research report monday august 6th .
60,they sell,finally jpmorgan chase co. cut motorola solutions neutral rating underweight rating research report friday august 3rd .
61,they sell,one investment analyst rated stock sell rating three issued hold rating ten assigned buy rating company .
62,they buy,company currently average rating buy consensus target price 131.85 .
63,they sell,"motorola solutions news evp mark s. hacker sold 102,628 shares company stock transaction dated friday september 7th ."
64,they sell,"stock sold average price 127.01 total value 13,034,782.28 ."
65,they sell,"also cfo gino a. bonanotte sold 23,201 shares company stock transaction dated wednesday september 12th ."
66,they sell,"stock sold average price 125.97 total value 2,922,629.97 ."
67,they sell,"last 90 days insiders sold 649,479 shares company stock valued 82,082,428 ."
68,they buy,"mainstay capital management llc adv increased position motorola solutions 11,537.0 second quarter ."
69,they buy,"fort l.p. bought new position shares motorola solutions second quarter worth 123,000 ."
70,they buy,"finally cerebellum gp llc bought new position shares motorola solutions third quarter worth 192,000 ."
