,assoc,values
0,they buy,barclays boosted price target blackrock 472.00 490.00 gave company overweight rating report thursday march 14th .
1,they buy,bank america reaffirmed buy rating issued 498.00 price objective previously 490.00 shares blackrock research report friday march 8th .
2,they sell,zacks investment research upgraded blackrock sell rating hold rating research note wednesday march 6th .
3,they buy,morgan stanley set 515.00 price target blackrock gave stock buy rating research note friday february 8th .
4,they buy,finally jefferies financial group raised shares blackrock hold rating buy rating set 405.36 price objective company research note tuesday january 29th .
5,they buy,three research analysts rated stock hold rating twelve given buy rating company .
6,they buy,blackrock presently average rating buy consensus price target 497.95 .
7,they sell,"related news chairman laurence fink sold 44,000 shares company stock transaction monday february 11th ."
8,they sell,"shares sold average price 412.75 total transaction 18,161,000.00 ."
9,they sell,"also cfo gary shedlin sold 5,400 shares stock transaction thursday january 31st ."
10,they sell,"shares sold average price 410.74 total value 2,217,996.00 ."
11,they sell,"insiders sold 138,650 shares company stock valued 57,774,089 last three months ."
12,they sell,"blackrock news chairman laurence fink sold 44,000 shares firm stock transaction occurred monday february 11th ."
13,they sell,"shares sold average price 412.75 total transaction 18,161,000.00 ."
14,they sell,"also cfo gary shedlin sold 5,400 shares company stock transaction dated thursday january 31st ."
15,they sell,"stock sold average price 410.74 total value 2,217,996.00 ."
16,they sell,"last three months insiders sold 138,650 shares company stock valued 57,774,089 ."
17,they sell,average sell-side analysts anticipate blackrock inc. post 26.63 earnings per share current fiscal year .
18,they buy,oshkosh corp osk shares bought oberweis asset management inc .
19,they buy,northern trust corp increased position shares blackrock 0.9 4th quarter .
20,they buy,geode capital management llc increased position shares blackrock 4.4 4th quarter .
21,they buy,"rehmann capital advisory group increased position shares blackrock 51,763.3 3rd quarter ."
22,they sell,"news insider j. richard kushel sold 3,077 shares company stock transaction dated tuesday january 29th ."
23,they sell,"stock sold average price 409.29 total value 1,259,385.33 ."
24,they sell,"also coo robert l. goldstein sold 5,133 shares company stock transaction dated monday march 4th ."
25,they sell,"stock sold average price 443.00 total value 2,273,919.00 ."
26,they sell,"insiders sold 138,650 shares company stock valued 57,774,089 last quarter ."
27,they buy,jefferies financial group upgraded blackrock hold rating buy rating set 405.36 target price company report tuesday january 29th .
28,they buy,morgan stanley set 515.00 price objective blackrock gave company buy rating research note friday february 8th .
29,they buy,bank america reiterated buy rating issued 478.00 price objective previously 525.00 shares blackrock research note thursday december 6th .
30,they buy,three investment analysts rated stock hold rating twelve assigned buy rating company stock .
31,they buy,stock currently average rating buy consensus target price 497.95 .
32,they buy,zacks investment research upgraded blackrock hold rating buy rating set 491.00 price objective stock research note tuesday .
33,they buy,bank america reiterated buy rating issued 478.00 target price 525.00 shares blackrock research note thursday december 6th .
34,they buy,barclays lifted price objective shares blackrock 455.00 472.00 gave company overweight rating research note tuesday february 19th .
35,they buy,morgan stanley set 515.00 price target blackrock gave stock buy rating research note friday february 8th .
36,they buy,finally argus reissued buy rating shares blackrock research note thursday january 17th .
37,they buy,three investment analysts rated stock hold rating twelve issued buy rating company .
38,they buy,stock presently average rating buy consensus target price 497.95 .
39,they sell,"blackrock news cfo gary shedlin sold 5,400 shares business stock transaction thursday january 31st ."
40,they sell,"stock sold average price 410.74 total value 2,217,996.00 ."
41,they sell,"also insider j. richard kushel sold 3,077 shares business stock transaction tuesday january 29th ."
42,they sell,"stock sold average price 409.29 total value 1,259,385.33 ."
43,they sell,"insiders sold 138,650 shares company stock worth 57,774,089 last quarter ."
44,they buy,zacks investment research raised shares blackrock hold rating buy rating set 491.00 price objective company research report tuesday .
45,they buy,bank america reissued buy rating issued 478.00 price objective 525.00 shares blackrock research report thursday december 6th .
46,they buy,barclays upped price objective shares blackrock 455.00 472.00 gave company overweight rating research report tuesday february 19th .
47,they buy,morgan stanley set 515.00 price objective shares blackrock gave company buy rating research report friday february 8th .
48,they buy,finally argus reissued buy rating shares blackrock research report thursday january 17th .
49,they buy,three investment analysts rated stock hold rating twelve assigned buy rating company stock .
50,they buy,blackrock consensus rating buy average price target 497.95 .
51,they sell,sell-side analysts forecast blackrock post 26.42 earnings per share current year .
52,they sell,"related news chairman laurence fink sold 44,000 shares stock transaction dated monday february 11th ."
53,they sell,"shares sold average price 412.75 total transaction 18,161,000.00 ."
54,they sell,"also cfo gary shedlin sold 5,400 shares stock transaction dated thursday january 31st ."
55,they sell,"stock sold average price 410.74 total transaction 2,217,996.00 ."
56,they sell,"last quarter insiders sold 138,650 shares company stock worth 57,774,089 ."
57,they buy,toyota robot slam dunk throws mean three-pointer shares blackrock inc. nyse blk given average recommendation buy fifteen ratings firms presently covering company marketbeat.com reports .
58,they buy,four equities research analysts rated stock hold rating eleven given buy rating company .
59,they buy,argus reiterated buy rating shares blackrock research note thursday january 17th .
60,they buy,citigroup decreased target price shares blackrock 500.00 450.00 set buy rating company research note wednesday december 19th .
61,they buy,bank america reiterated buy rating issued 478.00 target price 525.00 shares blackrock research note thursday december 6th .
62,they buy,keefe bruyette woods reiterated buy rating issued 472.00 target price shares blackrock research note wednesday january 9th .
63,they buy,finally barclays reiterated buy rating shares blackrock research note thursday january 10th .
64,they sell,"news insider mark mccombe sold 3,000 shares stock transaction dated wednesday february 6th ."
65,they sell,"shares sold average price 417.04 total value 1,251,120.00 ."
66,they sell,"also insider j. richard kushel sold 3,077 shares stock transaction dated tuesday january 29th ."
67,they sell,"shares sold average price 409.29 total transaction 1,259,385.33 ."
68,they sell,"insiders sold 138,650 shares company stock valued 57,774,089 last 90 days ."
