,assoc,values
0,they sell,research note published april 11th 2019 stifel downgrade shares wm 103 .
1,they sell,similarly research note sent april 4th 2019 ubs analysts downgrade shares stock neutral set price target 106 .
2,they buy,average analysts currently moderate buy recommendation mean rating 3.91. comparison average recommendation month ago moderate buy average rating 3.73. similarly average rating observed 2 months ago moderate buy mean numerical rating 3.73 average rating observed 3 months ago moderate buy mean numerical rating 4.00 .
3,they sell,average true range company stock currently 0.81 8 analysts 11 wall street brokerage firms rate waste management inc. nyse wm buy 1 see sell .
4,they buy,getting trading period increased 200 days stock price seen 21.95 average .
