,assoc,values
0,they buy,stock downgraded rating neutral eyes ubs whereas previous rating buy eyes ubs reported monday april 8th 2019. another heavy-hitting research note published oppenheimer friday january 25th 2019 firm reiterated sbux updated rating outperform .
1,they buy,right stock subject 29 analysts evaluations average given company shares buy rating .
2,they sell,single analyst given underperform rating 1 given sell rating 10 given rating buy better .
3,they sell,"evp public affairs starbucks corporation sbux sold shares transaction finalized feb 13. similarly varma vivek c sold 50,470 shares organization stock 69.39 apiece racked 3,502,128 earnings sale ."
4,they sell,zacks rank system ranges 1 strong buy 5 strong sell .
5,they buy,sbux currently sporting zacks rank 2 buy .
6,they sell,starbucks stock rallies earnings april 25th though become strong candidate sell-the-news event .
7,they buy,cash used fuel aggressive rollout growth-hungry china buy back large chunks stock put huge increases dividend .
8,they buy,trend fades sbux stock buy-on-dips name .
9,they sell,analysts assigned mean rating 2.30 1.0 strong buy 5.0 sell .
10,they buy,mizuho set 75.00 price target shares starbucks gave stock buy rating report thursday .
11,they buy,ubs group cut shares starbucks buy rating neutral rating boosted price target stock 72.00 78.00 report monday april 8th .
12,they buy,bidaskclub upgraded shares starbucks buy rating strong-buy rating report wednesday march 27th .
13,they buy,finally zacks investment research upgraded shares starbucks hold rating buy rating set 73.00 price target company report monday january 28th .
14,they sell,one research analyst rated stock sell rating twelve given hold rating fourteen given buy rating one assigned strong buy rating stock .
15,they buy,company consensus rating buy consensus price target 68.00 .
16,they sell,"news evp vivek c. varma sold 70,364 shares stock transaction dated wednesday february 13th ."
17,they sell,"shares sold average price 70.05 total value 4,928,998.20 ."
18,they sell,"also evp vivek c. varma sold 73,242 shares stock transaction dated friday february 1st ."
19,they sell,"shares sold average price 68.36 total transaction 5,006,823.12 ."
20,they sell,"last 90 days insiders sold 565,806 shares company stock valued 38,789,988 ."
21,they sell,group 1 sell rating 8 buy rating 4 outperform rating 16 provided hold rating shares thanks data thomson reuters i/b/e/s .
22,they buy,stock downgraded neutral compared previous rating buy ubs garnered news report monday april 8th 2019. additional helpful research note sent oppenheimer friday january 25th 2019. brokerage decided reiterated sbux outperform .
