,assoc,values
0,they buy,valuengine lowered shares cbre group buy rating hold rating research report wednesday september 19th .
1,they buy,zacks investment research raised shares cbre group hold rating buy rating set 55.00 price objective company research note monday august 6th .
2,they buy,finally barclays lifted target price shares cbre group 58.00 60.00 gave company overweight rating research note thursday august 30th .
3,they buy,two investment analysts rated stock hold rating eight given buy rating one assigned strong buy rating company stock .
4,they buy,cbre group consensus rating buy consensus price target 52.19 .
5,they buy,name required mail published required squar milner financial services llc bought new stake cbre group inc nyse cbre third quarter according company recent 13f filing securities exchange commission .
6,they buy,"fund bought 4,461 shares financial services provider stock valued approximately 197,000 ."
7,they sell,number large investors also bought sold shares business .
8,they sell,"related news ceo william f. concannon sold 28,878 shares business stock transaction monday august 20th ."
9,they sell,"stock sold average price 47.47 total transaction 1,370,838.66 ."
10,they sell,"name required mail published required concannon william f ceo gws sold 28,878 shares cbre group inc. nyse cbre exchange happened august 20th 2018. stock sold average price 47.47 per share amounting transaction worth 1,370,833 ."
11,they sell,"additionally chief financial officer groch james r sold 50,000 shares stock transaction took place june 20th 2018. stock sold average price 49.01 per share total exchange amounting 2,450,310 ."
12,they buy,stock increased value last 7-day period experienced loss 0.57 past 30-day period .
13,they buy,according composite indicator trendspotter rated dg stock buy .
14,they buy,"short-term dollar general corporation dg 20-day average volume 2,644,880 shares short-term indicators sets dg stock 20 buy average basis ."
15,they buy,"medium-term dg stock 50-day average volume 2,526,680 shares medium-term indicators gave average rating 75 buy long-term period fb stock 100-day average volume 2,179,872 shares ."
16,they buy,average long-term indicators rated stock 67 buy .
17,they buy,overall picture short medium long-term indicators sets dg stock 56 buy average basis .
18,they sell,"news ceo william f. concannon sold 28,878 shares firm stock transaction dated monday august 20th ."
19,they sell,"stock sold average price 47.47 total transaction 1,370,838.66 ."
20,they sell,average sell-side analysts predict cbre group inc post 3.16 earnings per share current fiscal year .
21,they buy,valuengine lowered cbre group buy rating hold rating research note wednesday september 19th .
22,they buy,barclays lifted price target cbre group 58.00 60.00 gave company overweight rating research note thursday august 30th .
23,they buy,finally zacks investment research raised cbre group hold rating buy rating set 55.00 price target stock research note monday august 6th .
24,they buy,two investment analysts rated stock hold rating eight assigned buy rating one given strong buy rating company .
25,they buy,cbre group average rating buy average price target 52.19 .
26,they sell,number institutional investors hedge funds also recently bought sold shares cbre .
27,they buy,"whittier trust co. nevada inc. bought new stake cbre group third quarter valued 103,000 ."
28,they buy,"hanson doremus investment management bought new stake cbre group third quarter valued 155,000 ."
29,they buy,"ifp advisors inc bought new stake cbre group third quarter valued 176,000 ."
30,they buy,"squar milner financial services llc bought new stake cbre group third quarter valued 197,000 ."
31,they buy,"finally legacy private trust co. bought new stake cbre group second quarter valued 229,000 ."
32,they buy,zacks investment research upgraded shares cbre group hold rating buy rating set 55.00 target price company research note monday august 6th .
33,they buy,barclays boosted target price shares cbre group 58.00 60.00 gave company overweight rating research note thursday august 30th .
34,they buy,finally valuengine lowered shares cbre group buy rating hold rating research note wednesday september 19th .
35,they buy,two research analysts rated stock hold rating eight given buy rating one assigned strong buy rating stock .
36,they buy,company currently consensus rating buy consensus target price 52.19 .
37,they sell,"news ceo william f. concannon sold 28,878 shares company stock transaction dated monday august 20th ."
38,they sell,"shares sold average price 47.47 total transaction 1,370,838.66 ."
39,they sell,drop might tempting investor sell point fact would prove short-sighted mistake sell-side analysts think almost 67.66 gain yet come shareholders .
40,they buy,turn street general positives still outweigh negatives see cbre group inc. cbre buy 2 analyst consensus rating .
41,they buy,current time stock 8 buy 2 hold ratings .
42,they buy,valuengine lowered shares cbre group buy rating hold rating report wednesday september 19th .
43,they buy,barclays upped target price shares cbre group 58.00 60.00 gave company overweight rating report thursday august 30th .
44,they buy,finally zacks investment research upgraded shares cbre group hold rating buy rating set 55.00 target price stock report monday august 6th .
45,they buy,two equities research analysts rated stock hold rating eight issued buy rating one assigned strong buy rating company .
46,they buy,cbre group presently consensus rating buy average price target 52.19 .
47,they buy,zacks investment research lowered shares cbre group buy rating hold rating report wednesday july 18th .
48,they buy,valuengine lowered shares cbre group buy rating hold rating report wednesday september 19th .
49,they buy,finally barclays upped price target shares cbre group 58.00 60.00 gave company overweight rating report thursday august 30th .
50,they buy,two research analysts rated stock hold rating eight given buy rating one given strong buy rating company stock .
51,they buy,cbre group currently consensus rating buy consensus price target 52.19 .
52,they sell,sell-side analysts anticipate cbre group inc post 3.16 earnings per share current year .
53,they sell,large investors also recently bought sold shares company .
54,they sell,"cbre group news ceo william f. concannon sold 28,878 shares company stock transaction monday august 20th ."
55,they sell,"stock sold average price 47.47 total value 1,370,838.66 ."
56,they buy,zacks investment research raised cbre group hold rating buy rating set 55.00 target price stock report monday august 6th .
57,they buy,valuengine lowered cbre group buy rating hold rating report wednesday september 19th .
58,they buy,finally barclays boosted target price cbre group 58.00 60.00 gave stock overweight rating report thursday august 30th .
59,they buy,two investment analysts rated stock hold rating eight assigned buy rating one given strong buy rating stock .
60,they buy,company currently average rating buy consensus price target 52.19 .
61,they sell,several institutional investors also recently bought sold shares cbre .
62,they buy,atria investments llc increased holdings cbre group 14.4 second quarter .
63,they buy,optimum investment advisors increased holdings cbre group 6.8 third quarter .
64,they buy,dnb asset management increased holdings cbre group 3.8 third quarter .
65,they buy,jensen investment management inc. increased holdings cbre group 14.1 second quarter .
66,they buy,finally dnb asset management increased holdings cbre group 6.3 second quarter .
67,they buy,zacks investment research raised shares cbre group hold rating buy rating set 55.00 target price company report monday august 6th .
68,they buy,barclays increased target price shares cbre group 58.00 60.00 gave company overweight rating report thursday august 30th .
69,they buy,finally valuengine cut shares cbre group buy rating hold rating research note wednesday september 19th .
70,they buy,two research analysts rated stock hold rating eight given buy rating one assigned strong buy rating stock .
71,they buy,stock presently average rating buy consensus target price 52.19 .
72,they sell,"gateway investment advisers llc acquires 8,641 shares american eagle outfitters nyse aeo microsoft co. msft shares sold fcg advisors llc analysts lowest price target cbre group inc. nyse cbre 46.5 would mean 20.62 gain value ."
73,they sell,drop might tempting investor sell point fact would prove short-sighted mistake sell-side analysts think almost 68.61 gain yet come shareholders .
74,they buy,turn street general positives still outweigh negatives see cbre group inc. cbre buy 1.9 analyst consensus rating .
75,they buy,current time stock 8 buy 2 hold ratings .
76,they sell,"cbre group news ceo william f. concannon sold 28,878 shares stock transaction occurred monday august 20th ."
77,they sell,"stock sold average price 47.47 total transaction 1,370,838.66 ."
78,they sell,simon property group inc spg shares sold first manhattan co .
