,assoc,values
235,they buy,five analysts rated stock hold rating eleven assigned buy rating company .
236,they buy,stock average rating buy consensus target price 72.62 .
237,they buy,nucor company profile nucor corporation manufactures sells steel steel products united states internationally .
238,they buy,operates three segments steel mills steel products raw materials .
239,they buy,steel mills segment produces hot-rolled cold-rolled galvanized sheet steel products hollow structural section steel tubing steel electrical conduit plate steel structural steel products bar steel products blooms billets concrete reinforcing merchant bars wire rods special bar quality tubular plate steel products .
240,they buy,"read price earnings ratio pe viewcount type=f id=4053415 keyword nucor nyse nue nue basic material,67034610 sec filings,13f hedge fund holdings institutional investor holdingsratings:4,14 nyse nuerefreshed2 receive news ratings nucor daily enter email address receive concise daily summary latest news analysts ratings nucor related companies marketbeat.com free daily email newsletter ."
241,they buy,name required mail published required berkshire asset management llc pa boosted position shares nucor co. nyse nue 5.9 third quarter according recent filing securities exchange commission sec .
242,they buy,"firm owned 293,706 shares basic materials company stock acquiring additional 16,393 shares quarter ."
243,they buy,nucor accounts approximately 1.6 berkshire asset management llc pa investment portfolio making stock 26th biggest position .
244,they buy,"berkshire asset management llc pa owned 0.09 nucor worth 18,636,000 end recent quarter ."
245,they buy,number institutional investors also recently made changes positions stock .
246,they buy,bank montreal boosted holdings nucor 29.1 3rd quarter .
247,they buy,"bank montreal owns 446,933 shares basic materials company stock valued 28,357,000 acquiring additional 100,853 shares period ."
248,they buy,busey trust co boosted holdings nucor 3.3 3rd quarter .
249,they buy,"busey trust co owns 91,048 shares basic materials company stock valued 5,777,000 acquiring additional 2,879 shares period ."
250,they buy,hudson capital management llc boosted holdings nucor 52.1 3rd quarter .
251,they buy,"hudson capital management llc owns 16,266 shares basic materials company stock valued 1,032,000 acquiring additional 5,574 shares period ."
252,they buy,"clinton group inc. purchased new position nucor 3rd quarter valued 521,000 ."
253,they buy,finally manning napier group llc boosted holdings nucor 8.7 3rd quarter .
254,they buy,"manning napier group llc owns 93,245 shares basic materials company stock valued 5,916,000 acquiring additional 7,437 shares period ."
255,they buy,institutional investors 77.28 company stock .
256,they buy,nue stock traded 0.39 mid-day trading friday reaching 60.85 .
257,they buy,"company trading volume 176,837 shares compared average volume 2,501,010. company debt-to-equity ratio 0.43 current ratio 3.05 quick ratio 1.55. firm market capitalization 20.07 billion p/e ratio 17.48 p/e/g ratio 0.69 beta 1.51. nucor co. fifty-two week low 53.71 fifty-two week high 70.48 ."
258,they buy,nucor announced board directors authorized stock repurchase program thursday september 6th allows company buyback 2.00 billion outstanding shares .
259,they buy,buyback authorization allows basic materials company reacquire 10 shares open market purchases .
260,they buy,shares buyback programs generally sign company board believes shares undervalued .
261,they buy,firm also recently announced quarterly dividend paid friday november 9th .
262,they buy,stockholders record friday september 28th given dividend 0.38 per share .
263,they buy,represents 1.52 annualized dividend dividend yield 2.50 .
264,they buy,ex-dividend date thursday september 27th .
265,they buy,nucor dividend payout ratio dpr presently 43.30 .
266,they sell,"news insider david a. sumoski sold 51,238 shares firm stock transaction dated monday july 23rd ."
267,they sell,"stock sold average price 66.65 total transaction 3,415,012.70 ."
268,they buy,"following sale insider owns 139,839 shares company stock valued approximately 9,320,269.35 ."
269,they buy,sale disclosed filing securities exchange commission available hyperlink .
270,they sell,"also ceo john j. ferriola sold 14,607 shares firm stock transaction dated tuesday july 24th ."
271,they sell,"stock sold average price 68.25 total value 996,927.75 ."
272,they buy,"following sale chief executive officer directly owns 374,542 shares company valued approximately 25,562,491.50 ."
273,they buy,disclosure sale found .
274,they sell,"insiders sold total 119,328 shares company stock worth 8,074,991 last three months ."
275,they buy,corporate insiders 0.80 company stock .
276,they buy,number brokerages recently commented nue .
277,they buy,zacks investment research upgraded nucor hold rating buy rating set 72.00 target price company report tuesday .
278,they sell,valuengine cut nucor hold rating sell rating report tuesday september 4th .
279,they buy,keycorp upgraded nucor sector weight rating overweight rating set 77.00 target price company report tuesday july 24th .
280,they buy,seaport global securities assumed coverage nucor report thursday .
281,they buy,set buy rating 75.00 target price company .
282,they buy,finally deutsche bank lowered nucor buy rating research report tuesday october 2nd .
283,they buy,five analysts rated stock hold rating eleven issued buy rating company stock .
284,they buy,company currently average rating buy consensus price target 72.62 .
285,they buy,nucor company profile nucor corporation manufactures sells steel steel products united states internationally .
286,they buy,operates three segments steel mills steel products raw materials .
287,they buy,steel mills segment produces hot-rolled cold-rolled galvanized sheet steel products hollow structural section steel tubing steel electrical conduit plate steel structural steel products bar steel products blooms billets concrete reinforcing merchant bars wire rods special bar quality tubular plate steel products .
288,they buy,featured story understanding relative strength index viewcount articlehistoryid=25229902 postdate=2018-10-12 type=f id=4089953 want see hedge funds holding nue visit holdingschannel.com get latest 13f filings insider trades nucor co. nyse nue .
289,they buy,"keyword nucor nyse nue nue basic material,67034610 sec filings,13f hedge fund holdings institutional investor holdingsratings:4,14 nyse nue receive news ratings nucor daily enter email address receive concise daily summary latest news analysts ratings nucor related companies marketbeat.com free daily email newsletter ."
290,they buy,zynga znga buy rating reaffirmed jefferies financial group moneysupermarket.com group mony given hold rating liberum capital clinton group inc. purchased new stake shares nucor co. nyse nue third quarter according recent 13f filing securities exchange commission .
291,they buy,"fund purchased 8,206 shares basic materials company stock valued approximately 521,000 ."
292,they buy,several institutional investors also recently added reduced stakes nue .
293,they buy,"lord abbett co. llc bought new stake shares nucor 1st quarter valued 46,992,000 ."
294,they buy,"summit trail advisors llc grew stake shares nucor 4,644.4 1st quarter ."
295,they buy,"summit trail advisors llc owns 653,586 shares basic materials company stock valued 654,000 purchasing additional 639,810 shares period ."
296,they buy,"millennium management llc grew stake shares nucor 1,613.4 1st quarter ."
297,they buy,"millennium management llc owns 494,411 shares basic materials company stock valued 30,204,000 purchasing additional 465,556 shares period ."
298,they buy,pointstate capital lp grew stake shares nucor 63.9 1st quarter .
299,they buy,"pointstate capital lp owns 706,230 shares basic materials company stock valued 43,144,000 purchasing additional 275,330 shares period ."
300,they buy,finally kbc group nv grew stake shares nucor 654.6 2nd quarter .
301,they buy,"kbc group nv owns 256,632 shares basic materials company stock valued 16,039,000 purchasing additional 222,622 shares period ."
302,they buy,institutional investors hedge funds 77.28 company stock .
303,they buy,nue stock opened 60.46 friday .
304,they buy,nucor co. twelve month low 53.71 twelve month high 70.48 .
305,they buy,company debt-to-equity ratio 0.43 quick ratio 1.55 current ratio 3.05. stock market cap 20.07 billion pe ratio 17.23 p/e/g ratio 0.69 beta 1.51 .
306,they buy,nucor declared board authorized share buyback plan thursday september 6th authorizes company buyback 2.00 billion outstanding shares .
307,they buy,buyback authorization authorizes basic materials company purchase 10 shares open market purchases .
308,they buy,shares buyback plans generally indication company leadership believes shares undervalued .
309,they buy,business also recently disclosed quarterly dividend paid friday november 9th .
310,they buy,stockholders record friday september 28th given dividend 0.38 per share .
311,they buy,ex-dividend date dividend thursday september 27th .
312,they buy,represents 1.52 dividend annualized basis dividend yield 2.51 .
313,they buy,nucor payout ratio currently 43.30 .
314,they sell,"news evp d. chad utermark sold 53,483 shares nucor stock transaction dated tuesday july 24th ."
315,they sell,"stock sold average price 68.49 total transaction 3,663,050.67 ."
316,they buy,"following transaction executive vice president directly owns 155,140 shares company stock valued approximately 10,625,538.60 ."
317,they buy,transaction disclosed legal filing sec accessed link .
318,they sell,"also insider david a. sumoski sold 51,238 shares nucor stock transaction dated monday july 23rd ."
319,they sell,"shares sold average price 66.65 total value 3,415,012.70 ."
320,they buy,"following transaction insider directly owns 139,839 shares company valued 9,320,269.35 ."
321,they buy,disclosure sale found .
322,they sell,"last ninety days insiders sold 119,328 shares company stock worth 8,074,991 ."
323,they buy,insiders 0.80 company stock .
324,they buy,number equities research analysts issued reports nue shares .
325,they sell,valuengine downgraded nucor hold rating sell rating research note tuesday september 4th .
326,they buy,zacks investment research downgraded nucor buy rating hold rating research note tuesday august 14th .
327,they buy,keycorp upgraded nucor sector weight rating overweight rating set 77.00 price target company research note tuesday july 24th .
328,they buy,deutsche bank downgraded nucor buy rating research note tuesday october 2nd .
329,they buy,finally jefferies financial group restated buy rating set 80.00 price target shares nucor research note friday july 13th .
330,they buy,five research analysts rated stock hold rating eleven given buy rating company .
331,they buy,nucor currently average rating buy consensus price target 72.62 .
332,they buy,nucor nucor corporation manufactures sells steel steel products united states internationally .
333,they buy,operates three segments steel mills steel products raw materials .
334,they buy,steel mills segment produces hot-rolled cold-rolled galvanized sheet steel products hollow structural section steel tubing steel electrical conduit plate steel structural steel products bar steel products blooms billets concrete reinforcing merchant bars wire rods special bar quality tubular plate steel products .
335,they buy,"see also betaviewcount articlehistoryid=25204770 postdate=2018-10-12 type=f id=4082184 keyword nucor nyse nue nue basic material,67034610 sec filings,13f hedge fund holdings institutional investor holdingsratings:4,14 nyse nue receive news ratings nucor daily enter email address receive concise daily summary latest news analysts ratings nucor related companies marketbeat.com free daily email newsletter ."
336,they buy,"dnb asset management acquires 2,307 shares deere company de edwards lifesciences corp ew holdings reduced fox run management l.l.c ."
337,they buy,atria investments llc cut stake shares nucor co. nyse nue 6.5 3rd quarter according recent filing sec .
338,they buy,"institutional investor owned 38,720 shares basic materials company stock selling 2,699 shares period ."
339,they buy,"atria investments llc holdings nucor worth 2,457,000 end recent reporting period ."
340,they buy,institutional investors also recently added reduced stakes company .
341,they buy,almanack investment partners llc .
342,they buy,"acquired new position nucor 2nd quarter worth approximately 106,000 ."
343,they buy,parallel advisors llc lifted position nucor 120.0 2nd quarter .
344,they buy,"parallel advisors llc owns 2,231 shares basic materials company stock worth 139,000 acquiring additional 1,217 shares last quarter ."
345,they buy,"transamerica financial advisors inc. acquired new position nucor 2nd quarter worth approximately 153,000 ."
346,they buy,"bay colony advisory group inc b bay colony advisors acquired new position nucor 2nd quarter worth approximately 179,000 ."
347,they buy,"finally gifford fong associates acquired new position nucor 2nd quarter worth approximately 188,000 ."
348,they buy,77.28 stock currently owned hedge funds institutional investors .
349,they sell,"news evp d. chad utermark sold 53,483 shares business stock transaction occurred tuesday july 24th ."
350,they sell,"stock sold average price 68.49 total value 3,663,050.67 ."
351,they buy,"following completion sale executive vice president directly owns 155,140 shares company valued approximately 10,625,538.60 ."
352,they buy,sale disclosed document filed securities exchange commission available hyperlink .
353,they sell,"also insider david a. sumoski sold 51,238 shares business stock transaction occurred monday july 23rd ."
354,they sell,"shares sold average price 66.65 total value 3,415,012.70 ."
355,they buy,"following completion sale insider owns 139,839 shares company stock valued 9,320,269.35 ."
356,they buy,disclosure sale found .
357,they sell,"insiders sold total 119,328 shares company stock valued 8,074,991 last quarter ."
358,they buy,company insiders 0.80 company stock .
359,they buy,nucor nyse nue last posted quarterly earnings data thursday july 19th .
360,they buy,basic materials company reported 2.07 earnings per share eps quarter missing consensus estimate 2.10 0.03 .
361,they buy,nucor return equity 16.22 net margin 7.58 .
362,they buy,business revenue 6.46 billion quarter compared analysts expectations 6.47 billion .
363,they buy,quarter prior year firm earned 1.00 earnings per share .
364,they buy,nucor revenue quarter 24.9 compared quarter last year .
365,they buy,average equities analysts forecast nucor co. post 7.64 eps current fiscal year .
366,they buy,nucor announced board directors authorized share buyback plan thursday september 6th permits company repurchase 2.00 billion shares .
367,they buy,repurchase authorization permits basic materials company purchase 10 stock open market purchases .
368,they buy,stock repurchase plans generally sign company management believes shares undervalued .
369,they buy,company also recently declared quarterly dividend paid friday november 9th .
370,they buy,stockholders record friday september 28th issued 0.38 dividend .
371,they buy,ex-dividend date thursday september 27th .
372,they buy,represents 1.52 dividend annualized basis dividend yield 2.51 .
373,they buy,nucor dividend payout ratio dpr 43.30 .
374,they buy,nue topic several recent research reports .
375,they buy,zacks investment research raised nucor hold rating buy rating set 72.00 price target stock research report thursday july 12th .
376,they buy,jefferies financial group restated buy rating set 80.00 price objective shares nucor report friday july 13th .
377,they buy,keycorp upgraded nucor sector weight rating overweight rating set 77.00 price objective stock report tuesday july 24th .
378,they sell,valuengine downgraded nucor hold rating sell rating report tuesday september 4th .
379,they buy,finally deutsche bank downgraded nucor buy rating report tuesday october 2nd .
380,they buy,five investment analysts rated stock hold rating eleven issued buy rating stock .
381,they buy,stock currently average rating buy average price target 72.62 .
382,they buy,nucor company profile nucor corporation manufactures sells steel steel products united states internationally .
383,they buy,operates three segments steel mills steel products raw materials .
384,they buy,steel mills segment produces hot-rolled cold-rolled galvanized sheet steel products hollow structural section steel tubing steel electrical conduit plate steel structural steel products bar steel products blooms billets concrete reinforcing merchant bars wire rods special bar quality tubular plate steel products .
385,they buy,featured story price earnings ratio pe basics viewcount articlehistoryid=25201804 postdate=2018-10-12 type=f id=4074361 want see hedge funds holding nue visit holdingschannel.com get latest 13f filings insider trades nucor co. nyse nue .
386,they buy,"keyword nucor nyse nue nue basic material,67034610 sec filings,13f hedge fund holdings institutional investor holdingsratings:4,14 nyse nue receive news ratings nucor daily enter email address receive concise daily summary latest news analysts ratings nucor related companies marketbeat.com free daily email newsletter ."
387,they buy,126.91 million sales expected hubspot inc hubs quarter bankfinancial co. bfin position boosted bank new york mellon corp nucor nyse nue downgraded zacks investment research strong-buy rating hold rating research note issued thursday october 4th .
388,they buy,according zacks nucor outperformed industry belongs past year .
389,they buy,nucor remains committed expand production capabilities likely drive profitable growth strengthen position low-cost producer .
390,they buy,also seeing continued momentum automotive market .
391,they buy,company focused expanding foothold automotive space driven strong demand .
392,they buy,nucor also focused expanding business strategic acquisitions .
393,they buy,however u.s. steel industry continues impacted cheaper imports .
394,they buy,also uncertainties surrounding exemptions countries trade tariff .
395,they buy,performance company raw materials unit may also hurt due margin compression .
396,they buy,analysts also recently issued research reports stock .
397,they buy,jefferies financial group reissued buy rating set 80.00 target price shares nucor research note friday july 13th .
398,they buy,deutsche bank cut shares nucor buy rating research note tuesday october 2nd .
399,they sell,valuengine raised shares nucor sell rating hold rating research note thursday september 13th .
400,they buy,finally keycorp raised shares nucor sector weight rating overweight rating set 77.00 price objective company research note tuesday july 24th .
401,they buy,five investment analysts rated stock hold rating eleven issued buy rating company stock .
402,they buy,stock consensus rating buy average price target 72.62 .
403,they buy,shares nucor stock opened 60.81 thursday .
404,they buy,stock market capitalization 20.07 billion price-to-earnings ratio 17.32 peg ratio 0.69 beta 1.51. nucor fifty-two week low 53.71 fifty-two week high 70.48 .
405,they buy,company debt-to-equity ratio 0.43 current ratio 3.05 quick ratio 1.55 .
406,they buy,nucor nyse nue last issued quarterly earnings data thursday july 19th .
407,they buy,basic materials company reported 2.07 earnings per share quarter missing analysts consensus estimates 2.10 0.03 .
408,they buy,firm revenue 6.46 billion quarter compared analyst estimates 6.47 billion .
409,they buy,nucor return equity 16.22 net margin 7.58 .
410,they buy,company revenue 24.9 year-over-year basis .
411,they buy,quarter last year company posted 1.00 eps .
412,they sell,average sell-side analysts predict nucor post 7.64 earnings per share current year .
413,they buy,nucor announced board authorized stock repurchase plan thursday september 6th permits company repurchase 2.00 billion shares .
414,they buy,repurchase authorization permits basic materials company reacquire 10 shares open market purchases .
415,they buy,shares repurchase plans generally indication company board directors believes stock undervalued .
416,they sell,"news ceo john j. ferriola sold 14,607 shares stock transaction occurred tuesday july 24th ."
417,they sell,"shares sold average price 68.25 total value 996,927.75 ."
418,they buy,"following completion sale chief executive officer owns 374,542 shares company stock valued approximately 25,562,491.50 ."
419,they buy,transaction disclosed filing sec accessible link .
420,they sell,"also insider david a. sumoski sold 51,238 shares company stock transaction occurred monday july 23rd ."
421,they sell,"stock sold average price 66.65 total transaction 3,415,012.70 ."
422,they buy,"following completion transaction insider owns 139,839 shares company valued 9,320,269.35 ."
423,they buy,disclosure sale found .
424,they sell,"last three months insiders sold 119,328 shares company stock valued 8,074,991 ."
425,they buy,corporate insiders 0.80 company stock .
426,they buy,hedge funds recently modified holdings company .
427,they buy,almanack investment partners llc .
428,they buy,"acquired new stake nucor 2nd quarter worth approximately 106,000 ."
429,they buy,parallel advisors llc lifted holdings nucor 120.0 2nd quarter .
430,they buy,"parallel advisors llc owns 2,231 shares basic materials company stock worth 139,000 buying additional 1,217 shares last quarter ."
431,they buy,"transamerica financial advisors inc. acquired new stake nucor 2nd quarter worth approximately 153,000 ."
432,they buy,"bay colony advisory group inc b bay colony advisors acquired new stake nucor 2nd quarter worth approximately 179,000 ."
433,they buy,"finally cerebellum gp llc acquired new stake nucor 3rd quarter worth approximately 181,000 ."
434,they buy,hedge funds institutional investors 77.28 company stock .
435,they buy,nucor company profile nucor corporation manufactures sells steel steel products united states internationally .
436,they buy,operates three segments steel mills steel products raw materials .
437,they buy,steel mills segment produces hot-rolled cold-rolled galvanized sheet steel products hollow structural section steel tubing steel electrical conduit plate steel structural steel products bar steel products blooms billets concrete reinforcing merchant bars wire rods special bar quality tubular plate steel products .
438,they sell,"read average daily trade volume explainedviewcount type=a id=1093572 get free copy zacks research report nucor nue information research offerings zacks investment research visit zacks.com keyword nucor nyse nue nue basic material,67034610 downgrade zacks investment researchratings:4,14 nyse nuerefreshed1 receive news ratings nucor daily enter email address receive concise daily summary latest news analysts ratings nucor related companies marketbeat.com free daily email newsletter ."
439,they buy,royal bank canada lowers pandora media p sector perform invesco ivz pt raised 30.00 deutsche bank wilsey asset management inc. raised holdings shares nucor co. nyse nue 6.6 2nd quarter according company recent 13f filing securities exchange commission sec .
440,they buy,"institutional investor owned 151,189 shares basic materials company stock acquiring additional 9,398 shares quarter ."
441,they buy,nucor makes 4.9 wilsey asset management inc. investment portfolio making stock 12th largest holding .
442,they buy,"wilsey asset management inc. holdings nucor worth 9,451,000 recent sec filing ."
443,they buy,number large investors also added reduced stakes nue .
444,they buy,"winton group ltd grew stake shares nucor 1,877.1 2nd quarter ."
445,they buy,"winton group ltd owns 90,294 shares basic materials company stock valued 5,643,000 buying additional 85,727 shares last quarter ."
446,they buy,"laurel wealth advisors inc. bought new stake shares nucor 2nd quarter valued approximately 529,000 ."
447,they buy,global x management co llc grew stake shares nucor 18.4 2nd quarter .
448,they buy,"global x management co llc owns 54,958 shares basic materials company stock valued 3,435,000 buying additional 8,525 shares last quarter ."
449,they buy,wealthplan partners llc grew stake shares nucor 35.8 2nd quarter .
450,they buy,"wealthplan partners llc owns 73,715 shares basic materials company stock valued 4,607,000 buying additional 19,438 shares last quarter ."
451,they buy,"finally gifford fong associates bought new stake shares nucor 2nd quarter valued approximately 188,000 ."
452,they buy,77.28 stock currently owned institutional investors .
453,they buy,shares nue stock traded 0.58 trading hours thursday reaching 60.46 .
454,they buy,"2,475,400 shares company stock exchanged compared average volume 2,501,010. nucor co. fifty-two week low 53.71 fifty-two week high 70.48 ."
455,they buy,firm market cap 20.07 billion pe ratio 17.24 price-to-earnings-growth ratio 0.69 beta 1.51. company quick ratio 1.55 current ratio 3.05 debt-to-equity ratio 0.43 .
456,they buy,nucor nyse nue last issued quarterly earnings results thursday july 19th .
457,they buy,basic materials company reported 2.07 eps quarter missing analysts consensus estimates 2.10 0.03 .
458,they buy,nucor return equity 16.22 net margin 7.58 .
459,they buy,business revenue 6.46 billion quarter compared analyst estimates 6.47 billion .
460,they buy,quarter last year firm earned 1.00 earnings per share .
461,they buy,firm quarterly revenue 24.9 compared quarter last year .
