,assoc,values
0,they sell,"verity verity llc sold 8,440 shares company stock rose 13.39 market ."
1,they buy,"also increased holding international business machs nyse ibm 6,203 shares quarter total 69,219 shares risen stake tjx cos inc new nyse tjx ."
2,they sell,dived 50 investors sold eix shares 164 reduced holdings .
3,they buy,cetera advisor limited company invested 0.04 portfolio edison international nyse eix .
4,they buy,swiss fincl bank invested 0.09 edison international nyse eix .
5,they buy,"james investment rech invested 0.02 6,895 shares ."
6,they buy,notable recent exelixis inc. nasdaq exel news published nasdaq.com released 5 reasons investors buy exelixis exel 2019 nasdaq january 14 2019 also nasdaq.com article exelixis exel rallies 22.4 ytd expect ahead nasdaq published april 05 2019 nasdaq.com published health care sector update 04/25/2019 wst bmy exel alks nasdaq april 25 2019. interesting news exelixis inc. nasdaq exel released nasdaq.com article exelixis exel earnings expected grow buy nasdaq published february 05 2019 well nasdaq.com news article titled exelixis exel outperforming medical stocks year nasdaq publication date january 08 2019 .
7,they buy,wells fargo co increased price objective shares edison international 65.00 75.00 gave company market perform rating report monday april 15th .
8,they sell,zacks investment research downgraded shares edison international hold rating sell rating report monday april 15th .
9,they buy,suntrust banks increased price objective shares edison international 77.00 gave company positive rating report monday april 15th .
10,they buy,mizuho increased price objective shares edison international 57.00 66.50 gave company buy rating report thursday march 14th .
11,they sell,two analysts rated stock sell rating six given hold rating five assigned buy rating company .
12,they sell,"amp capital investors ltd sold 175,920 shares company stock rose 13.39 market ."
13,they buy,91c 27/04/2018 edison spa ednn.ml signs binding agreement soleil srl buy attiva analysts await edison international nyse eix report earnings may 7. expect 0.76 earnings per share 5.00 0.04 last year 0.8 per share .
14,they sell,negative 50 investors sold eix shares 164 reduced holdings .
15,they buy,"new york state teachers retirement invested 0.07 446,708 shares ."
16,they buy,"also increased holding mylan n v nasdaq myl 91,961 shares quarter total 639,265 shares risen stake medtronic plc nyse mdt ."
17,they sell,notable recent edison international nyse eix news published seekingalpha.com released edison continue paying dividends despite fire losses ubs analyst says seeking alpha november 26 2018 also seekingalpha.com article edison downgraded wells fargo pessimism liability legislation seeking alpha published february 11 2019 seekingalpha.com published edison sued los angeles county wildfire damage seeking alpha april 26 2019. interesting news edison international nyse eix released seekingalpha.com article socal edison moves sell 10- 30-year bonds elevated yields seeking alpha published march 12 2019 well businesswire.com news article titled thirty high school seniors awarded 1.2 million scholarships edison international business wire publication date april 02 2019 .
18,they sell,7 analysts 16 wall street brokerage firms rate edison international nyse eix buy 0 see sell .
19,they buy,getting trading period increased 200 days stock price seen 40.06 average .
20,they sell,"verity verity llc sold 8,440 shares company stock rose 13.39 market ."
21,they buy,stock increased 0.65 0.41 last trading session reaching 63.99 .
22,they sell,worsened 50 investors sold eix shares 164 reduced holdings .
23,they buy,miller howard invests ny invested 0.12 edison international nyse eix .
24,they buy,invesco invested 0.05 edison international nyse eix .
25,they buy,victory management invested 0.01 portfolio edison international nyse eix .
26,they buy,"proshare limited com invested 85,295 shares ."
27,they buy,moody comml bank tru division invested 0.08 edison international nyse eix .
28,they buy,"also increased holding illinois tool wks inc nyse itw 17,596 shares quarter total 20,266 shares risen stake international business machs nyse ibm ."
29,they sell,"verity verity llc sold 8,440 shares company stock rose 13.39 market ."
30,they buy,"also increased holding cummins inc nyse cmi 3,455 shares quarter total 26,015 shares risen stake vanguard group vig ."
31,they sell,dropped 50 investors sold eix shares 164 reduced holdings .
32,they buy,bank america de 0.02 invested edison international nyse eix 2.37 million shares .
33,they buy,massachusetts-based geode capital limited liability invested 0.07 edison international nyse eix .
34,they buy,"apg asset management nv invested 0.07 695,854 shares ."
35,they buy,hexavest invested 0.45 portfolio edison international nyse eix .
36,they buy,"also increased holding dowdupont inc 14,640 shares quarter total 66,843 shares risen stake westrock company ."
37,they buy,research note published march 1st 2019 bofa/merrill upgrade shares eix 65 .
38,they sell,similarly research note sent february 11th 2019 wells fargo analysts downgrade shares stock market perform set price target 65 .
39,they buy,average analysts currently moderate buy recommendation mean rating 3.67. comparison average recommendation month ago moderate buy average rating 3.67. similarly average rating observed 2 months ago moderate buy mean numerical rating 3.86 average rating observed 3 months ago moderate buy mean numerical rating 3.86 .
40,they sell,"stifel financial corp sold 51,921 shares company stock rose 13.39 market ."
41,they sell,"skoufalos ioannis sold 20,000 shares worth 1.86 million ."
42,they sell,fish kathleen b sold 5.11 million worth procter gamble company nyse pg friday november 16. insider taylor david sold 2.97m .
43,they sell,"fatima wednesday february 13. friday february 15 matthew price sold 1.98 million worth procter gamble company nyse pg 20,000 shares ."
44,they sell,1.01 million worth stock sold coombe gary friday november 9 .
45,they buy,investors sentiment increased 0.84 2018 q4 .
46,they sell,increased 59 investors sold pg shares 738 reduced holdings .
47,they buy,"washington invested 49,134 shares ."
48,they buy,farmers trust invested 2.99 procter gamble company nyse pg .
49,they buy,"allsquare wealth management ltd liability co invested 1,614 shares 0.12 stock ."
50,they buy,"first merchants owns 1.15 invested procter gamble company nyse pg 64,924 shares ."
51,they sell,notable recent edison international nyse eix news published seekingalpha.com released edison cut sell baml california challenging operating environment seeking alpha january 15 2019 also businesswire.com article thirty high school seniors awarded 1.2 million scholarships edison international business wire published april 02 2019 fool.com published edison international stock surging today motley fool november 16 2018. interesting news edison international nyse eix released seekingalpha.com article wildfire risk protection sempra energy edison international seeking alpha published february 12 2019 well seekingalpha.com news article titled california governor proposes wildfire protections pg e utilities seeking alpha publication date april 12 2019 .
52,they buy,stock price increased 16.88 three months dipped last six months trading period .
53,they sell,traders attempt avoid false signals rsi use extreme rsi values buy sell signals rsi readings 80 indicate overbought conditions rsi readings 20 indicate oversold conditions .
54,they sell,analyses consensus rating score stands 2.4. next one year period average individual price target estimates referred covering sell-side analysts 71.14 .
55,they sell,volume gives investor idea price action security whether buy sell security .
56,they sell,zacks investment research cut edison international hold rating sell rating research report monday april 15th .
57,they buy,mizuho lifted price objective edison international 57.00 66.50 gave company buy rating research report thursday march 14th .
58,they sell,two analysts rated stock sell rating six given hold rating five assigned buy rating stock .
59,they buy,alico inc. alco shares bought blackrock inc .
60,they sell,52 week range simple technical indicator lists highest lowest price security sold preceding 52 weeks one year .
61,they buy,stock price increased 14.83 three months dipped last six months trading period .
62,they sell,traders attempt avoid false signals rsi use extreme rsi values buy sell signals rsi readings 80 indicate overbought conditions rsi readings 20 indicate oversold conditions .
63,they sell,important understand always perfect balance buyers sellers amount security sold always identical purchased .
64,they sell,price last 200 days moving increasing trend look buy opportunities shows decreasing trend price last 200 days look sell opportunities .
65,they sell,7 analysts 16 wall street brokerage firms rate edison international nyse eix buy 0 see sell .
66,they buy,getting trading period increased 200 days stock price seen 21.13 average .
