,assoc,values
0,they sell,two equities research analysts rated stock sell recommendation thirteen issued hold recommendation four issued buy recommendation company .
1,they sell,zacks investment research lowered maxim integrated products hold rating sell rating research note tuesday april 16th .
2,they sell,bidaskclub raised maxim integrated products sell rating hold rating research note thursday april 4th .
3,they sell,"news director james r. bergman sold 14,210 shares company stock transaction wednesday february 6th ."
4,they sell,"stock sold average price 56.46 total transaction 802,296.60 ."
5,they sell,"also ceo tunc doluca sold 14,000 shares company stock transaction tuesday april 16th ."
6,they sell,"stock sold average price 60.00 total value 840,000.00 ."
7,they sell,"last 90 days insiders sold 75,316 shares company stock valued 4,235,474 ."
8,they buy,investors research corp bought new stake shares maxim integrated products inc. nasdaq mxim first quarter according recent disclosure securities exchange commission .
9,they buy,"institutional investor bought 2,680 shares semiconductor company stock valued approximately 142,000 ."
10,they buy,"american international group inc. increased stake shares maxim integrated products 27,390.1 fourth quarter ."
11,they buy,"norges bank bought new position shares maxim integrated products fourth quarter worth 142,906,000 ."
12,they sell,zacks investment research upgraded shares maxim integrated products sell rating hold rating research report tuesday april 2nd .
13,they sell,bidaskclub upgraded shares maxim integrated products sell rating hold rating research report thursday april 4th .
14,they sell,finally maxim group restated sell rating shares maxim integrated products research report friday february 8th .
15,they sell,two research analysts rated stock sell rating thirteen issued hold rating four assigned buy rating stock .
16,they sell,"maxim integrated products news vp david loftus sold 13,614 shares maxim integrated products stock transaction occurred friday march 15th ."
17,they sell,"shares sold average price 53.81 total transaction 732,569.34 ."
18,they sell,"also ceo tunc doluca sold 2,500 shares maxim integrated products stock transaction occurred friday march 1st ."
19,they sell,"shares sold average price 54.96 total transaction 137,400.00 ."
20,they sell,"last 90 days insiders sold 75,316 shares company stock valued 4,235,474 ."
21,they buy,strs ohio 6.57 million position msci inc msci american international group inc increased stake maxim integrated products mxim 27390.09 based latest 2018q4 regulatory filing sec .
22,they buy,american international group inc bought 7.61 million shares company stock declined 1.53 stock markets rallied .
23,they buy,stock increased 0.94 0.56 last trading session reaching 60.19 .
24,they sell,negative 65 investors sold mxim shares 148 reduced holdings .
25,they buy,"counsel limited liability company ny invested 0.08 19,602 shares ."
26,they buy,"piedmont investment invested 24,237 shares ."
27,they buy,regions financial invested 532 shares .
28,they buy,"moreover savings bank 0.23 invested maxim integrated products inc. nasdaq mxim 804,495 shares ."
29,they buy,state street invested 0.05 portfolio maxim integrated products inc. nasdaq mxim .
30,they sell,"234,248 worth maxim integrated products inc. nasdaq mxim sold bergman james r friday november 16 ."
31,they sell,"273,369 worth stock sold bronson joseph r friday february 1. preeshl bryan also sold 49,573 worth maxim integrated products inc. nasdaq mxim shares ."
32,they sell,"another trade 5,000 shares valued 272,750 sold doluca tunc ."
33,they sell,"2,830 shares valued 153,517 sold accardi tracy wednesday december 12 ."
34,they sell,zacks investment research raised maxim integrated products sell rating hold rating research report thursday january 3rd .
35,they sell,finally bidaskclub downgraded maxim integrated products hold rating sell rating research report tuesday march 12th .
36,they sell,two investment analysts rated stock sell rating thirteen issued hold rating four issued buy rating company stock .
37,they buy,average analysts currently moderate buy recommendation mean rating 3.46. comparison average recommendation month ago moderate buy average rating 3.46. similarly average rating observed 2 months ago moderate buy mean numerical rating 3.46 average rating observed 3 months ago moderate buy mean numerical rating 3.46 .
38,they sell,4 analysts 21 wall street brokerage firms rate maxim integrated products inc. nasdaq mxim buy 1 see sell .
39,they buy,getting trading period increased 200 days stock price seen 106.3 average .
