,assoc,values
0,they buy,decline mean best stock buy right shares seem active trading volume day reported 175544 contracts far session .
1,they buy,average daily trading volumes 996333 shares days cover increased 5.412817 days .
2,they buy,goldman analysts bumped rating stericycle inc. nasdaq srcl stock neutral buy separate flash note issued investors march 01. analysts bofa/merrill made first call equity underperform recommendation according research note dated back october 23 .
3,they sell,analysts rate stock buy strong buy others rated sell .
4,they sell,5 analysts rated stericycle inc. nasdaq srcl buy strong buy 2 advised investors desist purchasing stock sell already company stock .
5,they buy,"jefferies group llc bought new stake stericycle 3rd quarter valued approximately 368,000 ."
6,they buy,"jane street group llc bought new stake stericycle 3rd quarter valued approximately 1,031,000 ."
7,they buy,"finally paloma partners management co bought new stake stericycle 3rd quarter valued approximately 656,000 ."
8,they buy,goldman sachs group upgraded stericycle neutral rating buy rating set 66.00 price objective company research report friday march 1st .
9,they buy,bidaskclub raised stericycle hold rating buy rating report friday april 5th .
10,they sell,zacks investment research upgraded stericycle sell rating hold rating report saturday january 5th .
11,they sell,three investment analysts rated stock sell rating three issued hold rating four given buy rating stock .
12,they sell,"stericycle news director mark c. miller sold 260,314 shares business stock transaction occurred tuesday april 9th ."
13,they sell,"stock sold average price 57.18 total transaction 14,884,754.52 ."
14,they buy,average analysts currently moderate buy recommendation mean rating 3.70. comparison average recommendation month ago moderate buy average rating 3.70. similarly average rating observed 2 months ago moderate buy mean numerical rating 3.70 average rating observed 3 months ago moderate buy mean numerical rating 3.70 .
