,assoc,values
0,they sell,news director kevin l. beebe sold 440 shares business stock transaction friday march 15th .
1,they sell,"shares sold average price 189.86 total transaction 83,538.40 ."
2,they sell,"also evp jason v. silberstein sold 51,369 shares business stock transaction friday march 15th ."
3,they sell,"stock sold average price 190.71 total transaction 9,796,581.99 ."
4,they sell,"last three months insiders sold 246,558 shares company stock worth 45,484,249 ."
5,they buy,bidaskclub cut shares sba communications strong-buy rating buy rating research report tuesday april 16th .
6,they buy,suntrust banks reissued buy rating issued 217.00 target price shares sba communications research report thursday april 11th .
7,they buy,bank america raised target price shares sba communications 189.00 211.00 gave stock buy rating research report tuesday march 19th .
8,they buy,valuengine cut shares sba communications buy rating hold rating research report wednesday january 2nd .
9,they buy,finally guggenheim cut shares sba communications buy rating neutral rating set 185.00 target price stock .
10,they sell,one research analyst rated stock sell rating four issued hold rating six assigned buy rating stock .
11,they sell,zacks investment research earnings per share averages average based survey sell-side research firms follow sba communications .
12,they sell,"news chairman steven e. bernstein sold 30,241 shares firm stock transaction dated tuesday march 5th ."
13,they sell,"stock sold average price 182.71 total value 5,525,333.11 ."
14,they sell,"also svp brian d. lazarus sold 20,561 shares firm stock transaction dated wednesday march 13th ."
15,they sell,"stock sold average price 187.51 total value 3,855,393.11 ."
16,they sell,"last 90 days insiders sold 246,558 shares company stock valued 45,484,249 ."
17,they sell,zacks investment research eps calculations mean average based survey sell-side research firms follow sba communications .
18,they buy,valuengine downgraded shares sba communications buy rating hold rating research report wednesday january 2nd .
19,they buy,keycorp boosted target price shares sba communications 176.00 195.00 gave stock overweight rating report tuesday february 12th .
20,they buy,guggenheim downgraded shares sba communications buy rating neutral rating set 185.00 target price stock .
21,they buy,bidaskclub downgraded shares sba communications strong-buy rating buy rating report wednesday february 20th .
22,they buy,finally bank america boosted target price shares sba communications 189.00 211.00 gave stock buy rating report tuesday march 19th .
23,they sell,one research analyst rated stock sell rating four issued hold rating six issued buy rating stock .
24,they sell,"news evp jason v. silberstein sold 51,369 shares sba communications stock transaction occurred friday march 15th ."
25,they sell,"shares sold average price 190.71 total value 9,796,581.99 ."
26,they sell,also director kevin l. beebe sold 440 shares sba communications stock transaction occurred friday march 15th .
27,they sell,"stock sold average price 189.86 total transaction 83,538.40 ."
28,they sell,"last three months insiders sold 246,558 shares company stock worth 45,484,249 ."
29,they sell,objective using rsi help trader identify sold overbought price areas .
30,they buy,security reading 70 100 security supposed heavily bought ready downward correction .
31,they sell,"evp site leasing silberstein jason v sold 51,369 shares 8,785 transaction occurred 2019/03/15 ."
32,they buy,seen change price target analysts bofa/merrill reiterated stock buy march 19 moved pt 189 211 .
33,they buy,stock favor citigroup analysts expressed confidence using upgrade neutral buy october 31. keybanc capital mkts analysts came bullish views september 27 call made .
34,they buy,think stock overweight compared prior call sector weight .
