,assoc,values
0,they buy,go valuation ratios ppg industries p/e ratio ttm recorded 40.88 contrast overall industry ratio 17.75 meanwhile since last 5 working days ppg industries nyse ppg highest point came april 4th 2019 stock price 115.99 fell 113.43 april 1st 2019. similarly look back price performance past 6 months company increased value .
1,they buy,10 believe ppg buy .
2,they buy,1 recommends overweight 15 believes worth holding .
3,they sell,0 number analyst recommended stakeholder stock underweight 1 rated sell .
4,they buy,meantime 3 months consensus 27 different analysts rated stock overweight .
5,they buy,11 went buy 1 gave rating overweight 15 analysts advised hold stock .
6,they sell,0 analysts called underweight 0 rated stock sell .
7,they buy,going analyst recommendations ppg industries nyse ppg overall rating moderate buy suggest stock good chance increasing price analysts think current price actual price stock good investment .
8,they buy,american international group inc. increased stake shares ppg industries 3.9 third quarter .
9,they buy,cibc world markets inc. increased stake shares ppg industries 30.3 third quarter .
10,they buy,"finally pinnacle associates ltd. bought new position shares ppg industries third quarter valued approximately 243,000 ."
11,they sell,zacks investment research cut shares ppg industries hold rating sell rating research report thursday march 28th .
12,they buy,finally jpmorgan chase co. downgraded shares ppg industries overweight rating neutral rating increased price target stock 105.00 106.00 research note friday january 18th .
13,they sell,three analysts rated stock sell rating seven issued hold rating seven assigned buy rating one given strong buy rating company .
14,they buy,cabot microelectronics co. nasdaq ccmp stake increased advisor group inc .
15,they buy,victory capital management inc. increased position shares ppg industries 8.0 third quarter .
16,they sell,zacks investment research lowered ppg industries hold rating sell rating research report thursday march 28th .
17,they buy,argus upgraded ppg industries buy rating set 136.00 price objective company research report thursday december 20th .
18,they sell,three analysts rated stock sell rating seven given hold rating seven given buy rating one given strong buy rating company stock .
19,they sell,trademark violation notice ppg industries inc. ppg shares sold brown advisory inc. originally published pressoracle sole property pressoracle .
20,they sell,average consensus rating company 2.5 scale 5 equates unanimous sell rating .
21,they sell,short mean analyst recommendations calling stock sell .
22,they sell,0.3 rally might tempting investor buy point fact would prove good idea sell-side analysts think almost 10.84 gain yet come shareholders .
23,they buy,current time stock 9 buy 13 hold ratings .
24,they sell,research note published march 22nd 2019 jp morgan downgrade shares ppg 106 .
25,they buy,average analysts currently moderate buy recommendation mean rating 4.33. comparison average recommendation month ago moderate buy average rating 4.25. similarly average rating observed 2 months ago moderate buy mean numerical rating 4.25 average rating observed 3 months ago moderate buy mean numerical rating 4.25 .
26,they sell,zacks investment research raised shares ppg industries sell rating hold rating research note monday december 10th .
27,they buy,argus raised shares ppg industries buy rating set 136.00 price objective company research note thursday december 20th .
28,they buy,finally jpmorgan chase co. downgraded shares ppg industries overweight rating neutral rating boosted price objective stock 105.00 106.00 research note friday january 18th .
29,they sell,three analysts rated stock sell rating seven given hold rating seven issued buy rating one issued strong buy rating company stock .
30,they sell,exfo exfo q2 earnings revenues beat estimates analysts set vermilion energy inc vet target price 50.33 ppg industries nyse ppg downgraded investment analysts jpmorgan chase co. neutral rating underweight rating research report issued clients investors friday march 22nd marketbeat ratings reports .
31,they buy,citigroup upgraded ppg industries neutral rating buy rating set 123.00 price objective stock report thursday november 29th .
32,they buy,suntrust banks increased price objective ppg industries 110.00 gave company hold rating report tuesday january 22nd .
33,they sell,finally zacks investment research upgraded ppg industries sell rating hold rating report monday december 10th .
34,they sell,three investment analysts rated stock sell rating seven issued hold rating seven assigned buy rating one issued strong buy rating company .
35,they sell,number institutional investors recently bought sold shares ppg .
36,they sell,"featured article know many shares floating viewcount type=a id=1182806 keyword ppg industries nyse ppg ppg basic material,69350610 downgrade jpmorgan chase co.ratings:3,16 nyse ppgrefreshed1 receive news ratings ppg industries daily enter email address receive concise daily summary latest news analysts ratings ppg industries related companies marketbeat.com free daily email newsletter ."
37,they sell,virginia sona downgraded sell bidaskclub ppg industries part basic materials sector part chemicals industry .
