,assoc,values
453,they buy,company sterling jewelers division operates stores malls off-mall locations primarily kay jewelers kay jewelers outlet jared galleria jewelry jared vault various mall regional brands .
454,they buy,currently negative earnings .
455,they buy,"january 28 2017 division operated 1,588 stores ."
456,they buy,another recent important signet jewelers limited nyse sig news published benzinga.com published article titled acushnet signet jewelers downgraded hitting nomura price target july 31 2018 .
457,they buy,receive news ratings via email enter email address receive concise daily summary latest news analysts ratings free daily email newsletter .
458,they buy,investors sentiment increased 1.01 q1 2018.
459,they buy,0.19 0.82 2017q4 .
460,they sell,positive 69 investors sold signet jewelers limited shares 68 reduced holdings .
461,they buy,40 funds opened positions 99 raised stakes .
462,they buy,54.73 million shares 17.64 less 66.46 million shares 2017q4 reported .
463,they buy,"mason street advsrs limited liability accumulated 30,367 shares ."
464,they buy,dekabank deutsche girozentrale stated 0.02 portfolio signet jewelers limited nyse sig .
465,they buy,"ny state teachers retirement system owns 0.01 invested signet jewelers limited nyse sig 129,070 shares ."
466,they buy,"grp incorporated one trading limited partnership illinois-based fund reported 147,421 shares ."
467,they buy,"horizon invs llc owns 8,346 shares 0.01 us portfolio ."
468,they buy,"arizona state retirement system reported 41,000 shares stake ."
469,they buy,causeway cap management lc stated 1.22 signet jewelers limited nyse sig .
470,they buy,"poplar forest ltd co accumulated 2.02 614,406 shares ."
471,they buy,"first l p holds 0.01 77,047 shares ."
472,they buy,"stifel fin holds 0 23,856 shares portfolio ."
473,they buy,"great west life assurance invested 35,450 shares 0 stock ."
474,they buy,ubs asset mngmt americas 0 invested signet jewelers limited nyse sig .
475,they buy,"2,262 owned envestnet asset management ."
476,they buy,"fil holds 16,218 shares 0 portfolio ."
477,they buy,amica pension fund board trustees owns 974 shares 0.01 portfolio .
478,they buy,"since april 13 2018 1 buying transaction 0 selling transactions 349,905 activity ."
479,they buy,analysts expect signet jewelers limited nyse sig report 0.19 eps august 30 open.they anticipate 1.14 eps change 85.71 last quarter 1.33 eps .
480,they buy,sig profit would 11.25 million giving 82.09 p/e 0.19 eps correct .
481,they buy,0.10 eps previously signet jewelers limited analysts see 90.00 eps growth .
482,they buy,stock decreased 0.45 0.28 last trading session reaching 62.39 .
483,they buy,"54,442 shares traded ."
484,they buy,signet jewelers limited nyse sig declined 15.25 since august 24 2017 downtrending .
485,they buy,underperformed 27.82 p500 .
486,they sell,among 10 analysts covering signet jewelers limited nyse sig 0 buy rating 0 sell 10 hold .
487,they buy,therefore 0 positive .
488,they buy,signet jewelers limited 12 analyst reports since march 12 2018 according sratingsintel .
489,they buy,firm neutral rating given tuesday march 20 bank america .
490,they buy,cowen co maintained signet jewelers limited nyse sig thursday march 15 hold rating .
491,they buy,nomura maintained signet jewelers limited nyse sig rating thursday june 21. nomura buy rating 62 target .
492,they buy,rating maintained wells fargo wednesday march 14 hold .
493,they buy,stock signet jewelers limited nyse sig neutral rating given tuesday april 10 jp morgan .
494,they buy,stock signet jewelers limited nyse sig earned neutral rating nomura tuesday july 31. buckingham research maintained neutral rating 36 target thursday march 15 report .
495,they buy,needham downgraded stock hold rating thursday march 15 report .
496,they buy,susquehanna maintained signet jewelers limited nyse sig thursday march 15 hold rating .
497,they buy,company maintained friday june 8 citigroup .
498,they buy,signet jewelers limited engages retail sale diamond jewelry watches products united states canada puerto rico united kingdom republic ireland channel islands .
499,they buy,company market cap 3.69 billion .
500,they buy,company sterling jewelers division operates stores malls off-mall locations primarily kay jewelers kay jewelers outlet jared galleria jewelry jared vault various mall regional brands .
501,they buy,currently negative earnings .
502,they buy,"january 28 2017 division operated 1,588 stores ."
503,they buy,moreover maverick capital limited 0 invested signet jewelers limited nyse sig .
504,they buy,nebraska-based farmers merchants invests inc invested 0 signet jewelers limited nyse sig .
505,they buy,royal national bank canada 0 invested signet jewelers limited nyse sig .
506,they buy,stratos wealth limited stated 0 signet jewelers limited nyse sig .
507,they buy,moreover manufacturers life ins 0 invested signet jewelers limited nyse sig .
508,they buy,"26,000 reported quantres asset mngmt ."
509,they buy,amica retiree med trust reported 154 shares 0.01 holdings .
510,they buy,"horizon investments lc reported 8,346 shares 0.01 holdings ."
511,they buy,amica pension fund board trustees stated 0.01 portfolio signet jewelers limited nyse sig .
512,they buy,"tudor corporation et al holds 59,063 shares ."
513,they buy,"qs invsts limited liability reported 86,569 shares ."
514,they buy,teachers retirement systems state kentucky invested 0.01 portfolio signet jewelers limited nyse sig .
515,they buy,"snow cap mngmt l p owns 43,123 shares 0.08 portfolio ."
516,they buy,"stone ridge asset ltd liability holds 0.04 15,568 shares ."
517,they buy,"bb reported 6,096 shares ."
518,they buy,"since april 13 2018 1 buying transaction 0 insider sales 349,905 activity ."
519,they buy,investment analysts telsey advisory group 63 target price signet jewelers nyse sig .
520,they buy,telsey advisory group recent target price means potential upside 0.98 company last price .
521,they buy,rating revealed research report friday 24 august .
522,they sell,among 10 analysts covering signet jewelers limited nyse sig 0 buy rating 0 sell 10 hold .
523,they buy,therefore 0 positive .
524,they buy,signet jewelers limited 62 highest 35.0 lowest target .
525,they buy,51.63 average target currents 62.39 stock price .
526,they buy,signet jewelers limited 12 analyst reports since march 12 2018 according sratingsintel .
527,they buy,rating downgraded bank america tuesday march 20 neutral .
528,they buy,firm neutral rating given thursday march 15 buckingham research .
529,they buy,friday june 8 stock rating maintained citigroup neutral .
530,they buy,firm hold rating given thursday march 15 needham .
531,they buy,per wednesday march 14 company rating maintained wells fargo .
532,they buy,nomura downgraded stock neutral rating tuesday july 31 report .
533,they buy,jp morgan maintained signet jewelers limited nyse sig tuesday april 10 neutral rating .
534,they buy,stock signet jewelers limited nyse sig buy rating given thursday june 21 nomura .
535,they buy,firm hold rating susquehanna given thursday march 15. cowen co maintained signet jewelers limited nyse sig thursday march 15 hold rating .
536,they buy,stock decreased 0.45 0.28 last trading session reaching 62.39 .
537,they buy,"103,976 shares traded ."
538,they buy,signet jewelers limited nyse sig declined 15.25 since august 24 2017 downtrending .
539,they buy,underperformed 27.82 p500 .
540,they buy,analysts await signet jewelers limited nyse sig report earnings august 30 open .
541,they buy,expect 0.19 eps 85.71 1.14 last year 1.33 per share .
542,they buy,sig profit 11.25 million 82.09 p/e 0.19 eps becomes reality .
543,they buy,0.10 actual eps reported signet jewelers limited previous quarter wall street forecasts 90.00 eps growth .
544,they buy,signet jewelers limited engages retail sale diamond jewelry watches products united states canada puerto rico united kingdom republic ireland channel islands .
545,they buy,company market cap 3.69 billion .
546,they buy,company sterling jewelers division operates stores malls off-mall locations primarily kay jewelers kay jewelers outlet jared galleria jewelry jared vault various mall regional brands .
547,they buy,currently negative earnings .
548,they buy,"january 28 2017 division operated 1,588 stores ."
549,they buy,another recent important signet jewelers limited nyse sig news published benzinga.com published article titled acushnet signet jewelers downgraded hitting nomura price target july 31 2018 .
550,they buy,receive news ratings via email enter email address receive concise daily summary latest news analysts ratings free daily email newsletter .
551,they buy,zacks investment research upgraded shares signet jewelers nyse sig hold rating buy rating research note published tuesday morning .
552,they buy,zacks investment research currently 71.00 target price stock .
553,they buy,according zacks shares signet jewelers surged also outperformed industry past three months .
554,they buy,company augmenting digital marketing efforts planned capital investments uplift performance .
555,they buy,also three-year strategic initiatives signet path brilliance plan includes cost effectiveness investment e-commerce development omnichannel capabilities product innovations looks encouraging .
556,they buy,additionally company focusing double-digit growth e-commerce also striving achieve 15 total sales fiscal 2021 reflects increase 8 fiscal 2018. however note spite posting better-than-expected earnings first-quarter fiscal 2019 management issued soft second quarter guidance .
557,they buy,also waning store sales margins major concerns .
558,they buy,number research firms also recently weighed sig .
559,they buy,nomura downgraded shares signet jewelers buy rating neutral rating set 62.00 price target company .
560,they buy,research report tuesday july 31st .
561,they buy,noted move valuation call .
562,they sell,valuengine upgraded shares signet jewelers strong sell rating sell rating research report thursday july 12th .
563,they buy,royal bank canada set 51.00 price target shares signet jewelers gave company hold rating research report monday june 11th .
564,they buy,susquehanna bancshares reiterated neutral rating issued 60.00 price target shares signet jewelers research report thursday june 7th .
565,they buy,finally citigroup lifted price target shares signet jewelers 39.00 52.00 gave company neutral rating research report friday june 8th .
566,they sell,one analyst rated stock sell rating twelve assigned hold rating three assigned buy rating company .
567,they buy,stock presently consensus rating hold consensus price target 54.62 .
568,they buy,signet jewelers nyse sig last released quarterly earnings results wednesday june 6th .
569,they buy,company reported 0.10 earnings per share quarter beating analysts consensus estimates 0.09 0.19 .
570,they buy,signet jewelers negative net margin 1.01 positive return equity 18.52 .
571,they buy,company revenue 1.48 billion quarter compared consensus estimate 1.40 billion .
572,they sell,period previous year business earned 1.03 earnings per share .
573,they buy,firm quarterly revenue 5.5 year-over-year basis .
574,they sell,sell-side analysts anticipate signet jewelers post 4 eps current fiscal year .
575,they buy,company also recently disclosed quarterly dividend paid friday august 31st .
576,they buy,investors record friday august 3rd paid 0.37 dividend .
577,they buy,ex-dividend date dividend thursday august 2nd .
578,they buy,represents 1.48 dividend annualized basis yield 2.36 .
579,they buy,signet jewelers dividend payout ratio dpr 22.73 .
580,they buy,number large investors recently made changes positions stock .
581,they buy,blackrock inc. increased stake signet jewelers 27.3 second quarter .
582,they buy,"blackrock inc. owns 6,861,060 shares company stock valued 382,504,000 acquiring additional 1,470,230 shares last quarter ."
583,they buy,dimensional fund advisors lp increased stake signet jewelers 30.3 second quarter .
584,they buy,"dimensional fund advisors lp owns 3,809,824 shares company stock valued 212,403,000 acquiring additional 886,476 shares last quarter ."
585,they buy,"contrarius investment management ltd bought new position signet jewelers second quarter valued approximately 121,682,000 ."
586,they buy,millennium management llc increased stake signet jewelers 742.9 first quarter .
587,they buy,"millennium management llc owns 915,947 shares company stock valued 35,282,000 acquiring additional 807,282 shares last quarter ."
588,they buy,finally schroder investment management group increased stake signet jewelers 0.3 first quarter .
589,they buy,"schroder investment management group owns 834,032 shares company stock valued 32,127,000 acquiring additional 2,679 shares last quarter ."
590,they buy,93.60 stock currently owned institutional investors hedge funds .
591,they buy,"get free copy zacks research report signet jewelers sig information research offerings zacks investment research visit zacks.com keyword signet jewelers nyse sig sig retail/wholesale g8127610 upgrade zacks investment researchratings:3,13 nyse sig receive news ratings signet jewelers daily enter email address receive concise daily summary latest news analysts ratings signet jewelers related companies marketbeat.com free daily email newsletter ."
592,they buy,voya financial nyse voya given new 62.00 price target credit suisse group nisa investment advisors llc acquired new stake shares signet jewelers ltd. nyse sig second quarter according recent 13f filing securities exchange commission .
593,they buy,"firm acquired 2,000 shares company stock valued approximately 112,000 ."
594,they buy,number large investors also recently added reduced stakes sig .
595,they buy,blackrock inc. increased stake signet jewelers 53.9 1st quarter .
596,they buy,"blackrock inc. owns 5,390,830 shares company stock valued 207,656,000 purchasing additional 1,888,931 shares last quarter ."
597,they buy,dimensional fund advisors lp boosted holdings shares signet jewelers 50.2 1st quarter .
598,they buy,"dimensional fund advisors lp owns 2,923,348 shares company stock valued 112,607,000 acquiring additional 976,431 shares last quarter ."
599,they buy,millennium management llc boosted holdings shares signet jewelers 742.9 1st quarter .
600,they buy,"millennium management llc owns 915,947 shares company stock valued 35,282,000 acquiring additional 807,282 shares last quarter ."
601,they buy,prudential financial inc. boosted holdings shares signet jewelers 176.3 1st quarter .
602,they buy,"prudential financial inc. owns 442,248 shares company stock valued 17,035,000 acquiring additional 282,190 shares last quarter ."
603,they buy,finally kbc group nv boosted holdings shares signet jewelers 472.6 1st quarter .
604,they buy,"kbc group nv owns 234,035 shares company stock valued 9,015,000 acquiring additional 193,162 shares last quarter ."
605,they buy,institutional investors hedge funds 93.60 company stock .
606,they buy,sig topic number recent analyst reports .
607,they sell,valuengine downgraded shares signet jewelers sell rating strong sell rating report wednesday may 2nd .
608,they sell,zacks investment research raised shares signet jewelers strong sell rating hold rating report tuesday may 22nd .
609,they buy,telsey advisory group raised price objective shares signet jewelers 114.00 125.00 gave stock market perform rating report friday june 1st .
610,they buy,wells fargo co reissued hold rating shares signet jewelers report wednesday june 6th .
611,they buy,finally susquehanna bancshares reissued neutral rating issued 60.00 price objective shares signet jewelers report thursday june 7th .
612,they sell,one analyst rated stock sell rating twelve issued hold rating three issued buy rating company .
613,they buy,signet jewelers currently consensus rating hold consensus target price 54.62 .
614,they buy,shares nyse sig opened 62.67 friday .
615,they buy,company current ratio 3.04 quick ratio 0.85 debt-to-equity ratio 0.36. signet jewelers ltd. 1-year low 33.11 1-year high 77.94 .
616,they buy,company market cap 3.77 billion price-to-earnings ratio 9.59 peg ratio 1.99 beta 0.81 .
617,they buy,signet jewelers nyse sig last released quarterly earnings data wednesday june 6th .
618,they buy,company reported 0.10 earnings per share eps quarter beating consensus estimate 0.09 0.19 .
619,they buy,firm revenue 1.48 billion quarter compared analysts expectations 1.40 billion .
620,they buy,signet jewelers negative net margin 1.01 positive return equity 18.52 .
621,they buy,company revenue quarter 5.5 compared quarter last year .
622,they sell,quarter last year business posted 1.03 earnings per share .
623,they buy,equities research analysts predict signet jewelers ltd. post 4 eps current fiscal year .
624,they buy,business also recently disclosed quarterly dividend paid friday august 31st .
625,they buy,stockholders record friday august 3rd given dividend 0.37 per share .
626,they buy,represents 1.48 annualized dividend dividend yield 2.36 .
627,they buy,ex-dividend date dividend thursday august 2nd .
628,they buy,signet jewelers payout ratio currently 22.73 .
629,they buy,"signet jewelers profile keyword signet jewelers nyse sig sig retail/wholesale g8127610 sec filings,13f hedge fund holdings institutional investor holdingsratings:3,13 nyse sigrefreshed2 receive news ratings signet jewelers daily enter email address receive concise daily summary latest news analysts ratings signet jewelers related companies marketbeat.com free daily email newsletter ."
630,they buy,municipal employees retirement system michigan trims position oxford industries inc nyse oxm zacks investment research downgraded shares signet jewelers nyse sig buy rating hold rating research note published tuesday august 7th .
631,they buy,according zacks shares signet jewelers surged also outperformed industry past three months .
632,they buy,company augmenting digital marketing efforts planned capital investments uplift performance .
633,they buy,also three-year strategic initiatives signet path brilliance plan includes cost effectiveness investment e-commerce development omnichannel capabilities product innovations looks encouraging .
634,they buy,additionally company focusing double-digit growth e-commerce also striving achieve 15 total sales fiscal 2021 reflects increase 8 fiscal 2018. however note spite posting better-than-expected earnings first-quarter fiscal 2019 management issued soft second quarter guidance .
635,they buy,also waning store sales margins major concerns .
636,they buy,number brokerages also weighed sig .
637,they buy,nomura lowered shares signet jewelers buy rating neutral rating set 62.00 price target stock .
638,they buy,report tuesday july 31st .
639,they buy,noted move valuation call .
640,they sell,valuengine upgraded shares signet jewelers strong sell rating sell rating report thursday july 12th .
641,they buy,royal bank canada set 51.00 target price shares signet jewelers gave company hold rating report monday june 11th .
642,they buy,susquehanna bancshares restated neutral rating set 60.00 target price shares signet jewelers report thursday june 7th .
643,they buy,finally citigroup lifted target price shares signet jewelers 39.00 52.00 gave company neutral rating report friday june 8th .
644,they sell,one analyst rated stock sell rating twelve assigned hold rating three issued buy rating company .
645,they buy,company presently average rating hold consensus price target 54.62 .
646,they buy,signet jewelers nyse sig last announced earnings results wednesday june 6th .
647,they buy,company reported 0.10 earnings per share eps quarter topping zacks consensus estimate 0.09 0.19 .
648,they buy,firm revenue 1.48 billion quarter compared analyst estimates 1.40 billion .
649,they buy,signet jewelers negative net margin 1.01 positive return equity 18.52 .
650,they buy,signet jewelers revenue 5.5 compared quarter last year .
651,they sell,quarter last year business earned 1.03 earnings per share .
652,they buy,equities analysts predict signet jewelers post 4 eps current year .
653,they buy,company also recently declared quarterly dividend paid friday august 31st .
654,they buy,investors record friday august 3rd paid dividend 0.37 per share .
655,they buy,represents 1.48 annualized dividend yield 2.36 .
656,they buy,ex-dividend date thursday august 2nd .
657,they buy,signet jewelers dividend payout ratio dpr 22.73 .
658,they buy,number institutional investors recently added reduced stakes stock .
659,they buy,raymond james associates boosted holdings shares signet jewelers 38.1 4th quarter .
660,they buy,"raymond james associates owns 9,160 shares company stock valued 518,000 buying additional 2,528 shares period ."
661,they buy,"metlife investment advisors llc acquired new position shares signet jewelers 4th quarter valued 1,058,000 ."
662,they buy,wells fargo company mn boosted holdings shares signet jewelers 1.4 1st quarter .
663,they buy,"wells fargo company mn owns 354,948 shares company stock valued 13,672,000 buying additional 4,798 shares period ."
664,they buy,meag munich ergo kapitalanlagegesellschaft mbh boosted holdings shares signet jewelers 927.4 1st quarter .
665,they buy,"meag munich ergo kapitalanlagegesellschaft mbh owns 29,753 shares company stock valued 1,133,000 buying additional 26,857 shares period ."
666,they buy,finally nuwave investment management llc boosted holdings shares signet jewelers 496.0 1st quarter .
667,they buy,"nuwave investment management llc owns 5,912 shares company stock valued 228,000 buying additional 4,920 shares period ."
668,they buy,93.60 stock currently owned hedge funds institutional investors .
669,they sell,"get free copy zacks research report signet jewelers sig information research offerings zacks investment research visit zacks.com keyword signet jewelers nyse sig sig retail/wholesale g8127610 downgrade zacks investment researchratings:3,13 nyse sigrefreshed2 receive news ratings signet jewelers daily enter email address receive concise daily summary latest news analysts ratings signet jewelers related companies marketbeat.com free daily email newsletter ."
670,they buy,q2 2020 eps estimates lions gate entertainment corp. class lgf.a decreased barrington research
