,assoc,values
220,they buy,signet jewelers nyse sig last announced earnings results wednesday june 6th .
221,they buy,company reported 0.10 eps quarter beating analysts consensus estimates 0.09 0.19 .
222,they buy,business revenue 1.48 billion quarter compared analysts expectations 1.40 billion .
223,they buy,signet jewelers negative net margin 1.01 positive return equity 18.52 .
224,they buy,company quarterly revenue 5.5 year-over-year basis .
225,they buy,period previous year company posted 1.03 eps .
226,they buy,equities research analysts expect signet jewelers post 4 eps current fiscal year .
227,they buy,firm also recently announced quarterly dividend paid friday august 31st .
228,they buy,stockholders record friday august 3rd issued 0.37 dividend .
229,they buy,ex-dividend date thursday august 2nd .
230,they buy,represents 1.48 dividend annualized basis dividend yield 2.53 .
231,they buy,signet jewelers payout ratio 22.73 .
232,they buy,number brokerages recently issued reports sig .
233,they buy,wells fargo co reiterated hold rating shares signet jewelers research note wednesday june 6th .
234,they buy,telsey advisory group boosted price objective shares signet jewelers 114.00 125.00 gave stock market perform rating research report friday june 1st .
235,they sell,valuengine downgraded shares signet jewelers sell rating strong sell rating research report tuesday july 3rd .
236,they buy,susquehanna bancshares restated neutral rating set 60.00 price objective shares signet jewelers research report thursday june 7th .
237,they sell,finally zacks investment research upgraded shares signet jewelers strong sell rating hold rating research report tuesday may 22nd .
238,they sell,one equities research analyst rated stock sell rating twelve given hold rating three issued buy rating company .
239,they buy,signet jewelers currently consensus rating hold consensus target price 55.12 .
240,they buy,signet jewelers company profile signet jewelers limited engages retail sale diamond jewelry watches products united states canada united kingdom republic ireland channel islands .
241,they buy,sterling jewelers division operates stores malls off-mall locations primarily kay jewelers kay jewelers outlet jared galleria jewelry jared vault various mall-based regional brands well jamesallen.com online jewelry retailer website .
242,they buy,"keyword signet jewelers nyse sig sig retail/wholesale g8127610 news sentiment media analysis social media sentimentratings:3,13 nyse sigrefreshed2 receive news ratings signet jewelers daily enter email address receive concise daily summary latest news analysts ratings signet jewelers related companies marketbeat.com free daily email newsletter ."
243,they buy,citizens financial group inc cfg expected announce earnings 0.90 per share wbi investments inc. acquired new stake signet jewelers ltd. nyse sig 2nd quarter according company recent filing sec .
244,they buy,"firm acquired 21,312 shares company stock valued approximately 1,188,000 ."
245,they sell,number large investors also recently bought sold shares business .
246,they buy,blackrock inc. increased stake signet jewelers 53.9 1st quarter .
247,they buy,"blackrock inc. owns 5,390,830 shares company stock valued 207,656,000 buying additional 1,888,931 shares last quarter ."
248,they buy,dimensional fund advisors lp increased stake signet jewelers 50.2 1st quarter .
249,they buy,"dimensional fund advisors lp owns 2,923,348 shares company stock valued 112,607,000 buying additional 976,431 shares last quarter ."
250,they buy,"contrarius investment management ltd purchased new stake signet jewelers 2nd quarter valued 121,682,000 ."
251,they buy,millennium management llc increased stake signet jewelers 742.9 1st quarter .
252,they buy,"millennium management llc owns 915,947 shares company stock valued 35,282,000 buying additional 807,282 shares last quarter ."
253,they buy,finally schroder investment management group increased stake signet jewelers 0.3 1st quarter .
254,they buy,"schroder investment management group owns 834,032 shares company stock valued 32,127,000 buying additional 2,679 shares last quarter ."
255,they buy,hedge funds institutional investors 93.60 company stock .
256,they buy,several equities research analysts commented stock .
257,they buy,wells fargo co reiterated hold rating shares signet jewelers research note wednesday june 6th .
258,they buy,telsey advisory group increased price objective shares signet jewelers 114.00 125.00 gave company market perform rating research note friday june 1st .
259,they sell,valuengine lowered shares signet jewelers sell rating strong sell rating research note tuesday july 3rd .
260,they buy,susquehanna bancshares restated neutral rating set 60.00 price target shares signet jewelers research note thursday june 7th .
261,they sell,finally zacks investment research upgraded shares signet jewelers strong sell rating hold rating research note tuesday may 22nd .
262,they sell,one equities research analyst rated stock sell rating twelve given hold rating three given buy rating company .
263,they buy,signet jewelers consensus rating hold consensus price target 55.12 .
264,they buy,signet jewelers nyse sig last issued quarterly earnings results wednesday june 6th .
265,they buy,company reported 0.10 earnings per share eps quarter topping thomson reuters consensus estimate 0.09 0.19 .
266,they buy,signet jewelers negative net margin 1.01 positive return equity 18.52 .
267,they buy,company revenue 1.48 billion quarter compared analyst estimates 1.40 billion .
268,they buy,quarter last year business posted 1.03 eps .
269,they buy,signet jewelers quarterly revenue 5.5 compared quarter last year .
270,they sell,equities analysts forecast signet jewelers ltd. post 4 earnings per share current fiscal year .
271,they buy,firm also recently disclosed quarterly dividend paid friday august 31st .
272,they buy,investors record friday august 3rd issued 0.37 dividend .
273,they buy,represents 1.48 annualized dividend yield 2.40 .
274,they buy,ex-dividend date thursday august 2nd .
275,they buy,signet jewelers dividend payout ratio dpr presently 22.73 .
276,they buy,signet jewelers company profile want see hedge funds holding sig visit holdingschannel.com get latest 13f filings insider trades signet jewelers ltd. nyse sig .
277,they buy,"keyword signet jewelers nyse sig sig retail/wholesale g8127610 sec filings,13f hedge fund holdings institutional investor holdingsratings:3,13 nyse sig receive news ratings signet jewelers daily enter email address receive concise daily summary latest news analysts ratings signet jewelers related companies marketbeat.com free daily email newsletter ."
278,they sell,perspecta prsp raised buy zacks investment research valuengine upgraded shares signet jewelers nyse sig strong sell rating sell rating report published friday august 10th .
279,they buy,several equities research analysts also commented sig .
280,they sell,zacks investment research upgraded shares signet jewelers strong sell rating hold rating report tuesday may 22nd .
281,they buy,telsey advisory group boosted price target shares signet jewelers 114.00 125.00 gave company market perform rating report friday june 1st .
282,they buy,wells fargo co restated hold rating shares signet jewelers report wednesday june 6th .
283,they buy,susquehanna bancshares reiterated neutral rating set 60.00 price objective shares signet jewelers research note thursday june 7th .
284,they buy,finally thestreet lowered shares signet jewelers c rating d+ rating research note wednesday june 6th .
285,they sell,one analyst rated stock sell rating twelve issued hold rating three issued buy rating stock .
286,they buy,company presently average rating hold average target price 55.12 .
287,they buy,shares sig stock traded 0.97 trading hours friday reaching 61.70 .
288,they buy,"1,222,732 shares stock exchanged compared average volume 1,060,513. stock market cap 3.78 billion pe ratio 9.48 p/e/g ratio 2.00 beta 0.81. company current ratio 3.04 quick ratio 0.85 debt-to-equity ratio 0.36. signet jewelers 12-month low 33.11 12-month high 77.94 ."
289,they buy,firm also recently disclosed quarterly dividend paid friday august 31st .
290,they buy,stockholders record friday august 3rd issued 0.37 dividend .
291,they buy,represents 1.48 annualized dividend dividend yield 2.40 .
292,they buy,ex-dividend date thursday august 2nd .
293,they buy,signet jewelers dividend payout ratio dpr currently 22.73 .
294,they buy,"keyword signet jewelers nyse sig sig retail/wholesale g8127610 upgrade valuengineratings:3,13 nyse sigrefreshed2 receive news ratings signet jewelers daily enter email address receive concise daily summary latest news analysts ratings signet jewelers related companies marketbeat.com free daily email newsletter ."
295,they buy,name required signet jewelers nyse sig price objective hoisted telsey advisory group 56.00 63.00 research report report published friday marketbeat reports .
296,they buy,currently market perform rating stock .
297,they buy,research analysts also issued reports company .
298,they buy,zacks investment research raised signet jewelers hold rating buy rating set 67.00 target price stock report thursday july 12th .
299,they sell,valuengine lowered signet jewelers sell rating strong sell rating report tuesday july 3rd .
300,they buy,susquehanna bancshares reissued neutral rating set 60.00 target price shares signet jewelers report thursday june 7th .
301,they buy,citigroup boosted target price signet jewelers 39.00 52.00 gave stock neutral rating report friday june 8th .
302,they buy,finally thestreet lowered signet jewelers c rating d+ rating report wednesday june 6th .
303,they sell,one investment analyst rated stock sell rating twelve given hold rating three issued buy rating stock .
304,they buy,company consensus rating hold average target price 55.12 .
305,they buy,sig stock opened 61.70 friday .
306,they buy,company current ratio 3.04 quick ratio 0.85 debt-to-equity ratio 0.36. company market cap 3.78 billion p/e ratio 9.48 price-to-earnings-growth ratio 2.00 beta 0.81. signet jewelers 1-year low 33.11 1-year high 77.94 .
307,they buy,company also recently declared quarterly dividend paid friday august 31st .
308,they buy,investors record friday august 3rd paid 0.37 dividend .
309,they buy,ex-dividend date dividend thursday august 2nd .
310,they buy,represents 1.48 annualized dividend yield 2.40 .
311,they buy,signet jewelers dividend payout ratio dpr presently 22.73 .
312,they buy,"keyword signet jewelers nyse sig sig retail/wholesale g8127610 boost price target telsey advisory groupratings:3,13 nyse sig receive news ratings signet jewelers daily enter email address receive concise daily summary latest news analysts ratings signet jewelers related companies marketbeat.com free daily email newsletter ."
313,they buy,prudential financial inc pru position boosted zurcher kantonalbank zurich cantonalbank stoneridge investment partners llc trimmed position signet jewelers ltd. nyse sig 69.1 second quarter according recent 13f filing securities exchange commission .
314,they buy,"fund owned 20,742 shares company stock selling 46,441 shares quarter ."
315,they buy,"stoneridge investment partners llc holdings signet jewelers worth 1,156,000 recent filing securities exchange commission ."
316,they buy,number large investors also recently added reduced stakes stock .
317,they buy,aperio group llc boosted stake signet jewelers 108.9 2nd quarter .
318,they buy,"aperio group llc owns 56,858 shares company stock valued 3,170,000 purchasing additional 29,646 shares period ."
319,they buy,"piedmont investment advisors llc bought new stake signet jewelers 2nd quarter valued approximately 783,000 ."
320,they buy,first quadrant l p ca boosted stake signet jewelers 5.9 2nd quarter .
321,they buy,"first quadrant l p ca owns 596,423 shares company stock valued 33,251,000 purchasing additional 33,368 shares period ."
322,they buy,ironwood financial llc boosted stake signet jewelers 11.5 2nd quarter .
323,they buy,"ironwood financial llc owns 24,299 shares company stock valued 1,355,000 purchasing additional 2,514 shares period ."
324,they buy,finally bnp paribas arbitrage sa boosted stake signet jewelers 42.0 2nd quarter .
325,they buy,"bnp paribas arbitrage sa owns 247,591 shares company stock valued 13,803,000 purchasing additional 73,291 shares period ."
326,they buy,institutional investors hedge funds 93.60 company stock .
327,they buy,several brokerages recently weighed sig .
328,they buy,thestreet upgraded signet jewelers d+ rating c- rating research note tuesday .
329,they buy,telsey advisory group upped price target signet jewelers 56.00 63.00 gave company market perform rating report friday .
330,they sell,valuengine cut signet jewelers hold rating sell rating report wednesday june 27th .
331,they buy,zacks investment research raised signet jewelers hold rating buy rating set 71.00 price target company report tuesday .
332,they buy,finally susquehanna bancshares reaffirmed neutral rating issued 60.00 price target shares signet jewelers report thursday june 7th .
333,they sell,one equities research analyst rated stock sell rating twelve assigned hold rating three given buy rating company .
334,they buy,stock consensus rating hold consensus target price 55.12 .
335,they buy,signet jewelers nyse sig last announced quarterly earnings data wednesday june 6th .
336,they buy,company reported 0.10 eps quarter beating zacks consensus estimate 0.09 0.19 .
337,they buy,firm revenue 1.48 billion quarter compared analyst estimates 1.40 billion .
338,they buy,signet jewelers positive return equity 18.52 negative net margin 1.01 .
339,they buy,business quarterly revenue 5.5 compared quarter last year .
340,they buy,period last year company earned 1.03 eps .
341,they buy,equities research analysts expect signet jewelers ltd. post 4 eps current fiscal year .
342,they buy,company also recently disclosed quarterly dividend paid friday august 31st .
343,they buy,shareholders record friday august 3rd given 0.37 dividend .
344,they buy,ex-dividend date dividend thursday august 2nd .
345,they buy,represents 1.48 dividend annualized basis yield 2.40 .
346,they buy,signet jewelers payout ratio 22.73 .
347,they buy,"signet jewelers profile keyword signet jewelers nyse sig sig retail/wholesale g8127610 sec filings,13f hedge fund holdings institutional investor holdingsratings:3,13 nyse sigrefreshed3 receive news ratings signet jewelers daily enter email address receive concise daily summary latest news analysts ratings signet jewelers related companies marketbeat.com free daily email newsletter ."
348,they buy,name required analysts expect signet jewelers ltd. nyse sig report 1.33 billion sales current quarter according zacks .
349,they buy,two analysts issued estimates signet jewelers earnings lowest sales estimate coming 1.32 billion highest estimate coming 1.35 billion .
350,they buy,signet jewelers posted sales 1.40 billion quarter last year would indicate negative year-over-year growth rate 5 .
351,they buy,business scheduled announce next earnings report market opens thursday august 30th .
352,they buy,average analysts expect signet jewelers report full-year sales 6.11 billion current year estimates ranging 6.06 billion 6.16 billion .
353,they buy,next fiscal year analysts anticipate company post sales 5.97 billion per share estimates ranging 5.96 billion 5.99 billion .
354,they buy,zacks investment research sales averages mean average based survey research analysts cover signet jewelers .
355,they buy,signet jewelers nyse sig last issued quarterly earnings data wednesday june 6th .
356,they buy,company reported 0.10 earnings per share eps quarter topping thomson reuters consensus estimate 0.09 0.19 .
357,they buy,firm revenue 1.48 billion quarter compared consensus estimate 1.40 billion .
358,they buy,signet jewelers negative net margin 1.01 positive return equity 18.52 .
359,they buy,business revenue quarter 5.5 compared quarter last year .
360,they sell,period last year business posted 1.03 earnings per share .
361,they buy,sig stock traded 1.49 mid-day trading friday hitting 62.40 .
362,they buy,"658,700 shares company exchanged compared average volume 2,326,885. company quick ratio 0.85 current ratio 3.04 debt-to-equity ratio 0.36. company market capitalization 3.54 billion pe ratio 9.58 price-to-earnings-growth ratio 1.87 beta 0.81. signet jewelers 1-year low 33.11 1-year high 77.94 ."
363,they buy,company also recently disclosed quarterly dividend paid friday august 31st .
364,they buy,investors record friday august 3rd paid 0.37 dividend .
365,they buy,ex-dividend date thursday august 2nd .
366,they buy,represents 1.48 dividend annualized basis yield 2.37 .
367,they buy,signet jewelers dividend payout ratio dpr 22.73 .
368,they buy,number large investors recently made changes positions sig .
369,they buy,"nisa investment advisors llc bought new position signet jewelers second quarter valued approximately 112,000 ."
370,they buy,"trilogy capital inc. bought new position signet jewelers first quarter valued approximately 121,000 ."
371,they buy,"itau unibanco holding s.a. bought new position signet jewelers second quarter valued approximately 132,000 ."
372,they buy,first mercantile trust co. increased stake signet jewelers 54.9 first quarter .
373,they buy,"first mercantile trust co. owns 4,290 shares company stock valued 165,000 acquiring additional 1,520 shares last quarter ."
374,they buy,"finally st. johns investment management company llc bought new position signet jewelers second quarter valued approximately 193,000 ."
375,they buy,95.40 stock currently owned institutional investors hedge funds .
376,they buy,signet jewelers signet jewelers limited engages retail sale diamond jewelry watches products united states canada united kingdom republic ireland channel islands .
377,they buy,sterling jewelers division operates stores malls off-mall locations primarily kay jewelers kay jewelers outlet jared galleria jewelry jared vault various mall-based regional brands well jamesallen.com online jewelry retailer website .
378,they buy,"read nasdaq stock market viewcount type=c tertiary=1 id=449031keyword signet jewelers nyse sig sig retail/wholesale g8127610 ratings consensusratings:3,13 nyse sig get free copy zacks research report signet jewelers sig information research offerings zacks investment research visit zacks.com xact kapitalforvaltning ab raised position signet jewelers ltd. nyse sig 18.5 second quarter according company recent disclosure sec ."
379,they buy,"firm owned 9,600 shares company stock acquiring additional 1,500 shares quarter ."
380,they buy,"xact kapitalforvaltning ab holdings signet jewelers worth 535,000 end recent quarter ."
381,they sell,number hedge funds also recently bought sold shares sig .
382,they buy,"trilogy capital inc. bought new stake signet jewelers 1st quarter valued 121,000 ."
383,they buy,first mercantile trust co. raised position shares signet jewelers 54.9 1st quarter .
384,they buy,"first mercantile trust co. owns 4,290 shares company stock worth 165,000 acquiring additional 1,520 shares last quarter ."
385,they buy,nuwave investment management llc raised position shares signet jewelers 496.0 1st quarter .
386,they buy,"nuwave investment management llc owns 5,912 shares company stock worth 228,000 acquiring additional 4,920 shares last quarter ."
387,they buy,"seven eight capital lp bought new position shares signet jewelers 1st quarter worth 259,000 ."
388,they buy,"finally profund advisors llc bought new position shares signet jewelers 1st quarter worth 266,000 ."
389,they buy,93.60 stock currently owned institutional investors .
390,they buy,sig subject several recent research reports .
391,they buy,nomura boosted price target signet jewelers 41.00 62.00 gave stock buy rating research report thursday june 21st .
392,they buy,zacks investment research upgraded signet jewelers hold rating buy rating set 67.00 target price stock research note thursday july 12th .
393,they buy,thestreet upgraded signet jewelers d+ rating c- rating research note tuesday .
394,they buy,royal bank canada set 51.00 price target signet jewelers gave company hold rating research note monday june 11th .
395,they sell,finally valuengine upgraded signet jewelers sell rating hold rating research note thursday june 21st .
396,they sell,one research analyst rated stock sell rating twelve assigned hold rating three issued buy rating stock .
397,they buy,stock currently average rating hold consensus price target 55.12 .
398,they buy,signet jewelers nyse sig last issued quarterly earnings data wednesday june 6th .
399,they buy,company reported 0.10 earnings per share quarter topping consensus estimate 0.09 0.19 .
400,they buy,signet jewelers positive return equity 18.52 negative net margin 1.01 .
401,they buy,company revenue 1.48 billion quarter compared analyst estimates 1.40 billion .
402,they sell,period prior year business posted 1.03 earnings per share .
403,they buy,firm revenue quarter 5.5 compared quarter last year .
404,they buy,equities research analysts expect signet jewelers ltd. post 4 eps current year .
405,they buy,business also recently disclosed quarterly dividend paid friday august 31st .
406,they buy,stockholders record friday august 3rd paid 0.37 dividend .
407,they buy,represents 1.48 annualized dividend dividend yield 2.40 .
408,they buy,ex-dividend date thursday august 2nd .
409,they buy,signet jewelers payout ratio currently 22.73 .
410,they buy,"signet jewelers company profile keyword signet jewelers nyse sig sig retail/wholesale g8127610 sec filings,13f hedge fund holdings institutional investor holdingsratings:3,13 nyse sigrefreshed3 receive news ratings signet jewelers daily enter email address receive concise daily summary latest news analysts ratings signet jewelers related companies marketbeat.com free daily email newsletter ."
411,they buy,head head analysis loral space communications ltd. lorl vuzix vuzi capital rech global invsts holds 0.07 portfolio signet jewelers limited nyse sig 6.18 million shares .
412,they buy,"state alaska department revenue alaska-based fund reported 4,740 shares ."
413,they buy,"prudential financial owns 0.03 invested signet jewelers limited nyse sig 442,248 shares ."
414,they buy,gradient ltd llc holds 0 signet jewelers limited nyse sig 4 shares .
415,they buy,"geode cap mgmt ltd holds 0.01 562,006 shares portfolio ."
416,they buy,point72 asia hong kong limited reported 488 shares .
417,they buy,"13,537 reported verition fund management lc ."
418,they buy,"natixis advsr l p holds 0.01 portfolio signet jewelers limited nyse sig 19,625 shares ."
419,they buy,"stephens incorporated ar owns 256,571 shares ."
420,they buy,"moreover cadence capital limited liability company 0.02 invested signet jewelers limited nyse sig 7,114 shares ."
421,they buy,"wolverine asset management lc reported 27,992 shares ."
422,they buy,"federated invsts pa reported 58,650 shares stake ."
423,they buy,franklin inc invested 0 portfolio signet jewelers limited nyse sig .
424,they buy,california-based schwab charles inv mngmt invested 0.01 signet jewelers limited nyse sig .
425,they buy,"hancock co stated 13,630 shares ."
426,they buy,"since april 13 2018 1 insider buy 0 sales 349,905 activity ."
427,they buy,telsey advisory group 63 pt 3.69 billion market cap company 0.98 upside potential .
428,they buy,report sent investors 24 august signet jewelers nyse sig shares market perform rating reconfirmed equity analysts telsey advisory group .
429,they sell,among 10 analysts covering signet jewelers limited nyse sig 0 buy rating 0 sell 10 hold .
430,they buy,therefore 0 positive .
431,they buy,signet jewelers limited 62 highest 35.0 lowest target .
432,they buy,51.63 average target currents 62.39 stock price .
433,they buy,signet jewelers limited 12 analyst reports since march 12 2018 according sratingsintel .
434,they buy,thursday march 15 stock rating maintained susquehanna hold .
435,they buy,firm neutral rating given friday june 8 citigroup .
436,they buy,firm hold rating given wednesday march 14 wells fargo .
437,they buy,firm buy rating given thursday june 21 nomura .
438,they buy,per tuesday march 20 company rating downgraded bank america .
439,they buy,buckingham research maintained stock neutral rating thursday march 15 report .
440,they buy,cowen co maintained signet jewelers limited nyse sig thursday march 15 hold rating .
441,they buy,rating downgraded nomura neutral tuesday july 31. company maintained tuesday april 10 jp morgan .
442,they buy,company downgraded thursday march 15 needham .
443,they buy,stock decreased 0.45 0.28 last trading session reaching 62.39 .
444,they buy,"103,976 shares traded ."
445,they buy,signet jewelers limited nyse sig declined 15.25 since august 24 2017 downtrending .
446,they buy,underperformed 27.82 p500 .
447,they buy,analysts await signet jewelers limited nyse sig report earnings august 30 open .
448,they sell,expect 0.19 earnings per share 85.71 1.14 last year 1.33 per share .
449,they buy,sig profit 11.25 million 82.09 p/e 0.19 eps becomes reality .
450,they sell,0.10 actual earnings per share reported signet jewelers limited previous quarter wall street forecasts 90.00 eps growth .
451,they buy,signet jewelers limited engages retail sale diamond jewelry watches products united states canada puerto rico united kingdom republic ireland channel islands .
452,they buy,company market cap 3.69 billion .
