,assoc,values
239,they buy,stock current distance 20-day simple moving average sma20 0.91 sma50 sma200 3.4 10.52 respectively .
240,they buy,company shows return assets roa value 12.6 .
241,they buy,return equity roe value stands 46.8 .
242,they buy,return investment roi value 40.6 .
243,they buy,paychex inc. nasdaq payx currently weekly volatility 1.09 percent monthly volatility 1.21 percent .
244,they buy,talking performance stock paychex inc. currently weekly performance 0.42 monthly performance percentage 2.47 percent quarterly performance 6.97 percent 6 months performance shows percent value 21.76 yearly performance 24.75 percent .
245,they buy,company profile paychex inc. recognized leader payroll human resource benefits outsourcing industry steadfast commitment success record achievement continues tradition delivering excellence .
246,they buy,company offers ever-growing variety payroll human resource products services help clients best run business .
247,they buy,wide range services including payroll processing retirement services insurance fully outsourced human resource solution paychex customizes offering client business whether small large simple complex .
248,they buy,posted kathy lenkie sep 25th 2018 comments royal london asset management ltd. acquired new position shares paychex inc. nasdaq payx 2nd quarter according company recent filing securities exchange commission .
249,they buy,"firm acquired 131,237 shares business services provider stock valued approximately 8,971,000 ."
250,they sell,hedge funds also recently bought sold shares company .
251,they buy,advisors preferred llc increased position shares paychex 116.4 second quarter .
252,they buy,"advisors preferred llc owns 1,567 shares business services provider stock worth 107,000 purchasing additional 843 shares period ."
253,they buy,"clarus wealth advisors bought new position shares paychex second quarter worth 109,000 ."
254,they buy,"summit trail advisors llc increased position shares paychex 17,216.0 first quarter ."
255,they buy,"summit trail advisors llc owns 116,537 shares business services provider stock worth 117,000 purchasing additional 115,864 shares period ."
256,they buy,"fort l.p. bought new position shares paychex second quarter worth 121,000 ."
257,they buy,"finally financial gravity wealth inc. bought new position shares paychex first quarter worth 137,000 ."
258,they buy,hedge funds institutional investors 66.95 company stock .
259,they sell,"news vp john b. gibson sold 47,250 shares paychex stock transaction dated wednesday september 5th ."
260,they sell,"stock sold average price 73.50 total transaction 3,472,875.00 ."
261,they buy,sale disclosed document filed sec available hyperlink .
262,they sell,"also director david j. s. flaschen sold 6,250 shares paychex stock transaction dated monday july 30th ."
263,they sell,"shares sold average price 69.62 total value 435,125.00 ."
264,they buy,"following sale director directly owns 32,787 shares company valued 2,282,630.94 ."
265,they buy,disclosure sale found .
266,they sell,"insiders sold 248,559 shares company stock worth 17,599,054 last three months ."
267,they buy,insiders 11.80 company stock .
268,they buy,shares payx stock opened 74.54 tuesday .
269,they buy,paychex inc. 12 month low 59.34 12 month high 75.57 .
270,they buy,stock market cap 27.01 billion pe ratio 30.71 peg ratio 3.23 beta 0.96 .
271,they buy,paychex nasdaq payx last announced quarterly earnings results wednesday june 27th .
272,they buy,business services provider reported 0.61 eps quarter missing zacks consensus estimate 0.62 0.01 .
273,they buy,paychex net margin 27.62 return equity 44.29 .
274,they buy,firm revenue 871.10 million quarter compared analyst estimates 868.60 million .
275,they sell,period previous year business posted 0.54 earnings per share .
276,they buy,business revenue quarter 9.0 compared quarter last year .
277,they sell,sell-side analysts anticipate paychex inc. post 2.84 eps current fiscal year .
278,they buy,paychex paychex inc provides payroll human resource hr retirement insurance services small medium-sized businesses united states europe .
279,they buy,company offers payroll processing services payroll tax administration services employee payment services regulatory compliance services new-hire reporting garnishment processing .
280,they buy,"featured article short selling explanation shorting stocks viewcount articlehistoryid=24652325 postdate=2018-9-25 type=f id=4065580 keyword paychex nasdaq payx payx business service,70432610 sec filings,13f hedge fund holdings institutional investor holdingsratings:3,13 nasdaq payx receive news ratings paychex daily enter email address receive concise daily summary latest news analysts ratings paychex related companies marketbeat.com free daily email newsletter ."
281,they buy,northern trust corp decreases position ingersoll-rand plc ir royal london asset management ltd. takes 8.32 million position edison international eix russell investments group ltd. lifted position paychex inc. nasdaq payx 1.3 second quarter according company recent form 13f filing securities exchange commission .
282,they buy,"institutional investor owned 209,805 shares business services provider stock buying additional 2,781 shares quarter ."
283,they buy,"russell investments group ltd. owned approximately 0.06 paychex worth 14,329,000 end recent quarter ."
284,they buy,several institutional investors also recently made changes positions payx .
285,they buy,daiwa securities group inc. lifted holdings shares paychex 9.9 first quarter .
286,they buy,"daiwa securities group inc. owns 10,881 shares business services provider stock worth 670,000 buying additional 976 shares last quarter ."
287,they buy,oppenheimer co. inc. raised stake paychex 146.5 first quarter .
288,they buy,"oppenheimer co. inc. owns 18,709 shares business services provider stock valued 1,152,000 purchasing additional 11,118 shares last quarter ."
289,they buy,manning napier group llc raised stake paychex 26.7 first quarter .
290,they buy,"manning napier group llc owns 93,332 shares business services provider stock valued 5,747,000 purchasing additional 19,645 shares last quarter ."
291,they buy,sumitomo mitsui trust holdings inc. raised stake paychex 0.7 first quarter .
292,they buy,"sumitomo mitsui trust holdings inc. owns 1,070,308 shares business services provider stock valued 65,920,000 purchasing additional 6,991 shares last quarter ."
293,they buy,finally atria investments llc raised stake paychex 6.5 first quarter .
294,they buy,"atria investments llc owns 37,091 shares business services provider stock valued 2,284,000 purchasing additional 2,265 shares last quarter ."
295,they buy,66.95 stock currently owned hedge funds institutional investors .
296,they buy,number brokerages recently weighed payx .
297,they buy,bidaskclub raised shares paychex buy rating strong-buy rating research note saturday september 8th .
298,they buy,guggenheim began coverage shares paychex research note monday august 20th .
299,they buy,issued neutral rating 75.00 target price stock .
300,they sell,jpmorgan chase co. downgraded shares paychex neutral rating underweight rating set 65.00 target price stock .
301,they buy,research note tuesday august 14th .
302,they buy,credit suisse group began coverage shares paychex research note friday august 10th .
303,they buy,issued neutral rating 72.00 target price stock .
304,they buy,finally wolfe research began coverage shares paychex research note tuesday july 17th .
305,they buy,issued market perform rating stock .
306,they sell,two analysts rated stock sell rating ten assigned hold rating two issued buy rating one given strong buy rating stock .
307,they buy,stock presently consensus rating hold consensus target price 68.42 .
308,they buy,shares payx stock traded 0.71 trading hours monday hitting 74.54 .
309,they buy,"1,548,200 shares company stock exchanged compared average volume 2,118,165. company market capitalization 27.01 billion pe ratio 29.27 price-to-earnings-growth ratio 3.23 beta 0.96. paychex inc. 12-month low 59.34 12-month high 75.57 ."
310,they buy,paychex nasdaq payx last posted quarterly earnings results wednesday june 27th .
311,they buy,business services provider reported 0.61 eps quarter missing consensus estimate 0.62 0.01 .
312,they buy,business revenue 871.10 million quarter compared analysts expectations 868.60 million .
313,they buy,paychex return equity 44.29 net margin 27.62 .
314,they buy,company revenue 9.0 compared quarter last year .
315,they sell,period last year business posted 0.54 earnings per share .
316,they buy,equities analysts forecast paychex inc. post 2.84 eps current fiscal year .
317,they buy,paychex company profile paychex inc provides payroll human resource hr retirement insurance services small medium-sized businesses united states europe .
318,they buy,company offers payroll processing services payroll tax administration services employee payment services regulatory compliance services new-hire reporting garnishment processing .
319,they buy,"recommended story p 500 index different djia viewcount type=f id=3887698 keyword paychex nasdaq payx payx business service,70432610 sec filings,13f hedge fund holdings institutional investor holdingsratings:3,13 nasdaq payxrefreshed3 receive news ratings paychex daily enter email address receive concise daily summary latest news analysts ratings paychex related companies marketbeat.com free daily email newsletter ."
320,they buy,russell investments group ltd. decreases position turquoise hill resources ltd trq sg americas securities llc 1.45 million position first financial bankshares inc ffin bidaskclub upgraded shares paychex nasdaq payx buy rating strong-buy rating research note issued investors saturday september 8th .
321,they buy,several analysts also recently issued reports stock .
322,they buy,guggenheim began coverage shares paychex research report monday august 20th .
323,they buy,set neutral rating 75.00 target price stock .
324,they sell,jpmorgan chase co. cut shares paychex neutral rating underweight rating set 65.00 target price stock .
325,they buy,research report tuesday august 14th .
326,they buy,credit suisse group began coverage shares paychex research report friday august 10th .
327,they buy,set neutral rating 72.00 target price stock .
328,they buy,wolfe research began coverage shares paychex report tuesday july 17th .
329,they buy,set market perform rating stock .
330,they buy,finally valuengine upgraded shares paychex hold rating buy rating report monday july 2nd .
331,they sell,two research analysts rated stock sell rating ten given hold rating two issued buy rating one assigned strong buy rating stock .
332,they buy,stock presently consensus rating hold consensus target price 68.42 .
333,they buy,payx stock traded 0.49 mid-day trading friday hitting 75.25 .
334,they buy,"company trading volume 4,011,154 shares compared average volume 1,257,879. stock market cap 26.84 billion p/e ratio 29.51 peg ratio 3.21 beta 0.96. paychex 12-month low 58.22 12-month high 75.57 ."
335,they buy,firm also recently disclosed quarterly dividend paid thursday august 23rd .
336,they buy,stockholders record wednesday august 1st paid dividend 0.56 per share .
337,they buy,ex-dividend date dividend tuesday july 31st .
338,they buy,represents 2.24 dividend annualized basis dividend yield 2.98 .
339,they buy,paychex dividend payout ratio presently 87.84 .
340,they sell,"related news vp laurie l. zaucha sold 13,320 shares stock transaction occurred wednesday july 25th ."
341,they sell,"shares sold average price 72.00 total transaction 959,040.00 ."
342,they buy,"following completion sale vice president owns 40,022 shares company stock valued 2,881,584 ."
343,they buy,transaction disclosed filing securities exchange commission available hyperlink .
344,they sell,"also vp john b. gibson sold 47,250 shares firm stock transaction wednesday september 5th ."
345,they sell,"stock sold average price 73.50 total transaction 3,472,875.00 ."
346,they buy,disclosure sale found .
347,they sell,"insiders sold 248,559 shares company stock valued 17,599,054 last three months ."
348,they buy,11.80 stock currently owned corporate insiders .
349,they sell,several hedge funds institutional investors recently bought sold shares payx .
350,they buy,aperio group llc raised holdings shares paychex 7.6 second quarter .
351,they buy,"aperio group llc owns 225,572 shares business services provider stock worth 15,418,000 purchasing additional 15,961 shares last quarter ."
352,they buy,clinton group inc. raised holdings shares paychex 23.4 second quarter .
353,they buy,"clinton group inc. owns 54,411 shares business services provider stock worth 3,719,000 purchasing additional 10,320 shares last quarter ."
354,they buy,mitsubishi ufj kokusai asset management co. ltd. raised holdings shares paychex 7.1 second quarter .
355,they buy,"mitsubishi ufj kokusai asset management co. ltd. owns 57,476 shares business services provider stock worth 3,928,000 purchasing additional 3,786 shares last quarter ."
356,they buy,meadow creek investment management llc raised holdings shares paychex 2.8 second quarter .
357,they buy,"meadow creek investment management llc owns 53,424 shares business services provider stock worth 3,652,000 purchasing additional 1,456 shares last quarter ."
358,they buy,finally cadence capital management llc raised holdings shares paychex 54.2 second quarter .
359,they buy,"cadence capital management llc owns 50,882 shares business services provider stock worth 3,478,000 purchasing additional 17,875 shares last quarter ."
360,they buy,66.96 stock owned institutional investors hedge funds .
361,they buy,paychex company profile paychex inc provides payroll human resource hr retirement insurance services small medium-sized businesses united states europe .
362,they buy,company offers payroll processing services payroll tax administration services employee payment services regulatory compliance services new-hire reporting garnishment processing .
363,they buy,"reading companies p 500 selected viewcount type=a id=1082011 keyword paychex nasdaq payx payx business service,70432610 upgrade bidaskclubratings:3,13 nasdaq payxrefreshed2 receive news ratings paychex daily enter email address receive concise daily summary latest news analysts ratings paychex related companies marketbeat.com free daily email newsletter ."
364,they sell,john b. sanfilippo son jbss raised buy bidaskclub bidaskclub lowers altaba nasdaq aaba strong sell bidaskclub lowered shares paychex nasdaq payx strong-buy rating buy rating research note issued investors wednesday august 29th .
365,they buy,number research analysts also weighed payx .
366,they buy,stifel nicolaus raised target price paychex 66.00 69.00 gave company hold rating report thursday june 28th .
367,they buy,citigroup raised target price paychex 64.00 67.00 gave company neutral rating report thursday june 28th .
368,they buy,wells fargo co lifted price target paychex 64.00 67.00 gave stock market perform rating report thursday june 28th .
369,they buy,robert w. baird lifted price target paychex 67.00 70.00 gave stock neutral rating report thursday june 28th .
370,they buy,finally morgan stanley lifted price target paychex 66.00 67.00 gave stock equal weight rating report thursday june 28th .
371,they sell,two investment analysts rated stock sell rating ten assigned hold rating two assigned buy rating one issued strong buy rating company stock .
372,they buy,company currently consensus rating hold average price target 68.42 .
373,they buy,shares payx stock traded 0.71 trading hours wednesday reaching 74.54 .
374,they buy,"company trading volume 1,548,271 shares compared average volume 2,118,165. paychex 12 month low 59.34 12 month high 75.57 ."
375,they buy,firm market capitalization 27.01 billion pe ratio 29.27 p/e/g ratio 3.23 beta 0.96 .
376,they sell,"paychex news director david j. s. flaschen sold 6,250 shares firm stock transaction monday july 30th ."
377,they sell,"stock sold average price 69.62 total value 435,125.00 ."
378,they buy,"following completion sale director directly owns 32,787 shares company stock valued 2,282,630.94 ."
379,they buy,transaction disclosed document filed securities exchange commission accessible link .
380,they sell,"also vp john b. gibson sold 47,250 shares firm stock transaction wednesday september 5th ."
381,they sell,"stock sold average price 73.50 total value 3,472,875.00 ."
382,they buy,disclosure sale found .
383,they sell,"insiders sold 248,559 shares company stock worth 17,599,054 last quarter ."
384,they buy,11.80 stock currently owned corporate insiders .
385,they buy,number large investors recently added reduced stakes payx .
386,they buy,advisors preferred llc grew position shares paychex 116.4 second quarter .
387,they buy,"advisors preferred llc owns 1,567 shares business services provider stock valued 107,000 purchasing additional 843 shares last quarter ."
388,they buy,"clarus wealth advisors purchased new position shares paychex second quarter valued 109,000 ."
389,they buy,"summit trail advisors llc grew position shares paychex 17,216.0 first quarter ."
390,they buy,"summit trail advisors llc owns 116,537 shares business services provider stock valued 117,000 purchasing additional 115,864 shares last quarter ."
391,they buy,"fort l.p. purchased new position shares paychex second quarter valued 121,000 ."
392,they buy,"finally financial gravity wealth inc. purchased new position shares paychex first quarter valued 137,000 ."
393,they buy,66.95 stock owned institutional investors hedge funds .
394,they buy,paychex paychex inc provides payroll human resource hr retirement insurance services small medium-sized businesses united states europe .
395,they buy,company offers payroll processing services payroll tax administration services employee payment services regulatory compliance services new-hire reporting garnishment processing .
396,they sell,"featured story investing dividend stocksviewcount type=a id=1077647 keyword paychex nasdaq payx payx business service,70432610 downgrade bidaskclubratings:3,13 nasdaq payxrefreshed3 receive news ratings paychex daily enter email address receive concise daily summary latest news analysts ratings paychex related companies marketbeat.com free daily email newsletter ."
397,they sell,t-mobile us tmus lowered sell bidaskclub targa resources trgp pt raised 54.00 barclays bidaskclub cut shares paychex nasdaq payx strong-buy rating buy rating research note issued investors wednesday august 29th .
398,they buy,payx topic several reports .
399,they buy,wolfe research assumed coverage shares paychex research report tuesday july 17th .
400,they buy,issued market perform rating stock .
401,they buy,robert w. baird lifted target price shares paychex 67.00 70.00 gave stock neutral rating research report thursday june 28th .
402,they buy,valuengine raised shares paychex hold rating buy rating research report monday july 2nd .
403,they buy,morgan stanley raised price target shares paychex 66.00 67.00 gave stock equal weight rating report thursday june 28th .
404,they buy,finally wells fargo co raised price target shares paychex 64.00 67.00 gave stock market perform rating report thursday june 28th .
405,they sell,two analysts rated stock sell rating ten assigned hold rating two issued buy rating one issued strong buy rating company .
406,they buy,paychex presently average rating hold average price target 68.42 .
407,they buy,paychex stock traded 0.49 trading hours wednesday hitting 75.25 .
408,they buy,"4,011,154 shares company traded hands compared average volume 1,257,879. stock market cap 26.84 billion price-to-earnings ratio 29.51 peg ratio 3.21 beta 0.96. paychex 1-year low 58.22 1-year high 75.57 ."
409,they buy,paychex nasdaq payx last announced quarterly earnings data wednesday june 27th .
410,they buy,business services provider reported 0.61 earnings per share eps quarter missing thomson reuters consensus estimate 0.62 0.01 .
411,they buy,business revenue 871.10 million quarter compared analyst estimates 868.60 million .
412,they buy,paychex return equity 44.29 net margin 27.62 .
413,they buy,business revenue quarter 9.0 year-over-year basis .
414,they buy,period prior year firm earned 0.54 eps .
415,they sell,equities research analysts anticipate paychex post 2.84 earnings per share current year .
416,they buy,firm also recently announced quarterly dividend paid thursday august 23rd .
417,they buy,shareholders record wednesday august 1st paid 0.56 dividend .
418,they buy,represents 2.24 dividend annualized basis yield 2.98 .
419,they buy,ex-dividend date dividend tuesday july 31st .
420,they buy,paychex dividend payout ratio dpr presently 87.84 .
421,they sell,"paychex news vp john b. gibson sold 47,250 shares paychex stock transaction occurred wednesday september 5th ."
422,they sell,"shares sold average price 73.50 total value 3,472,875.00 ."
423,they buy,transaction disclosed legal filing securities exchange commission accessed sec website .
424,they sell,"also vp jennifer r. vossler sold 4,000 shares paychex stock transaction occurred wednesday august 15th ."
425,they sell,"shares sold average price 70.51 total transaction 282,040.00 ."
426,they buy,disclosure sale found .
427,they sell,"insiders sold 248,559 shares company stock valued 17,599,054 last quarter ."
428,they buy,corporate insiders 11.80 company stock .
429,they buy,several large investors recently added reduced stakes payx .
430,they buy,"american century companies inc. bought new position shares paychex second quarter valued approximately 83,230,000 ."
431,they buy,select equity group l.p. raised position shares paychex 12.9 first quarter .
432,they buy,"select equity group l.p. owns 8,689,359 shares business services provider stock valued 535,178,000 purchasing additional 995,527 shares period ."
433,they buy,"millennium management llc bought new position shares paychex first quarter valued approximately 43,805,000 ."
434,they buy,"smith asset management group lp bought new position shares paychex first quarter valued approximately 26,952,000 ."
435,they buy,"finally marshall wace llp bought new position shares paychex second quarter valued approximately 26,339,000 ."
436,they buy,66.96 stock currently owned institutional investors .
437,they buy,paychex paychex inc provides payroll human resource hr retirement insurance services small medium-sized businesses united states europe .
438,they buy,company offers payroll processing services payroll tax administration services employee payment services regulatory compliance services new-hire reporting garnishment processing .
439,they sell,"featured article diversificationviewcount type=a id=1077647 keyword paychex nasdaq payx payx business service,70432610 downgrade bidaskclubratings:3,13 nasdaq payxrefreshed3 receive news ratings paychex daily enter email address receive concise daily summary latest news analysts ratings paychex related companies marketbeat.com free daily email newsletter ."
440,they buy,"american century companies inc. sells 43,201 shares ugi corp nyse ugi nicolet bankshares ncbs stock rating lowered bidaskclub majesty queen right province alberta represented alberta investment management corp trimmed position shares paychex inc. nasdaq payx 37.3 2nd quarter according recent form 13f filing securities exchange commission ."
441,they buy,"firm owned 229,900 shares business services provider stock selling 136,600 shares period ."
442,they buy,"majesty queen right province alberta represented alberta investment management corp owned approximately 0.06 paychex worth 15,714,000 end recent quarter ."
443,they buy,number institutional investors hedge funds also recently modified holdings stock .
444,they buy,"american century companies inc. acquired new position shares paychex 2nd quarter worth approximately 83,230,000 ."
445,they buy,select equity group l.p. boosted holdings shares paychex 12.9 1st quarter .
446,they buy,"select equity group l.p. owns 8,689,359 shares business services provider stock worth 535,178,000 acquiring additional 995,527 shares last quarter ."
447,they buy,"millennium management llc acquired new position shares paychex 1st quarter worth approximately 43,805,000 ."
448,they buy,"marshall wace llp acquired new position shares paychex 2nd quarter worth approximately 26,339,000 ."
449,they buy,"finally donaldson capital management llc boosted holdings shares paychex 4,317.7 2nd quarter ."
450,they buy,"donaldson capital management llc owns 367,774 shares business services provider stock worth 25,137,000 acquiring additional 359,449 shares last quarter ."
451,they buy,hedge funds institutional investors 66.96 company stock .
452,they buy,payx stock opened 74.76 friday .
453,they buy,paychex inc. 1 year low 58.09 1 year high 74.92 .
454,they buy,stock market cap 26.56 billion price-to-earnings ratio 30.20 peg ratio 3.18 beta 0.96 .
455,they buy,paychex nasdaq payx last posted quarterly earnings data wednesday june 27th .
456,they buy,business services provider reported 0.61 eps quarter missing zacks consensus estimate 0.62 0.01 .
457,they buy,paychex return equity 44.29 net margin 27.62 .
458,they buy,business revenue 871.10 million quarter compared analyst estimates 868.60 million .
459,they sell,quarter prior year company earned 0.54 earnings per share .
460,they buy,company quarterly revenue 9.0 year-over-year basis .
461,they sell,equities analysts forecast paychex inc. post 2.84 earnings per share current year .
462,they buy,firm also recently disclosed quarterly dividend paid thursday august 23rd .
