,assoc,values
0,they sell,average consensus rating company 1.7 scale 5 equates unanimous sell rating .
1,they buy,short mean analyst recommendations calling stock buy .
2,they sell,09/10/2018 moser christopher exec vice pres operations sold 43.98 thousand shares price per share 35.11 .
3,they sell,callen david performs svp chief accounting offficer job sold 9.2 thousand shares 305.53 thousand .
4,they sell,analysts assigned mean rating 1.70 1.0 strong buy 5.0 sell .
5,they buy,average analysts currently strong buy recommendation mean rating 4.67. comparison average recommendation month ago strong buy average rating 4.67. similarly average rating observed 2 months ago strong buy mean numerical rating 4.60 average rating observed 3 months ago strong buy mean numerical rating 4.60 .
6,they buy,citigroup raised nrg energy neutral rating buy rating set 38.00 target price company research note monday august 6th .
7,they buy,valuengine raised nrg energy hold rating buy rating research note saturday october 6th .
8,they buy,bank america lifted price target nrg energy 40.00 42.00 gave stock buy rating report thursday september 27th .
9,they sell,finally zacks investment research lowered nrg energy hold rating sell rating report tuesday october 9th .
10,they buy,three research analysts rated stock hold rating four given buy rating stock .
11,they buy,nrg energy currently consensus rating buy average target price 38.17 .
12,they sell,"nrg energy news evp elizabeth r. killinger sold 24,600 shares nrg energy stock transaction dated thursday september 13th ."
13,they sell,"stock sold average price 35.84 total transaction 881,664.00 ."
14,they sell,"also evp christopher moser sold 43,975 shares nrg energy stock transaction dated monday september 10th ."
15,they sell,"stock sold average price 35.11 total value 1,543,962.25 ."
16,they sell,"last 90 days insiders sold 83,775 shares company stock valued 2,959,754 ."
17,they buy,"whittier trust co. nevada inc. bought new position nrg energy 2nd quarter valued approximately 130,000 ."
18,they buy,"stratos wealth partners ltd. bought new position nrg energy 3rd quarter valued approximately 145,000 ."
19,they buy,"finally cerebellum gp llc bought new position nrg energy 2nd quarter valued approximately 168,000 ."
20,they sell,dived 32 investors sold nrg energy inc. shares 138 reduced holdings .
21,they buy,canada pension plan investment board invested 0.05 portfolio nrg energy inc. nyse nrg .
22,they buy,connor clark lunn inv limited invested 0.01 nrg energy inc. nyse nrg .
23,they buy,arizona state retirement systems 0.02 invested nrg energy inc. nyse nrg .
24,they buy,"oakbrook investments ltd co 0.02 invested nrg energy inc. nyse nrg 11,567 shares ."
25,they buy,stock increased 1.19 0.45 last trading session reaching 38.4 .
26,they sell,among 3 analysts covering nrg energy nyse nrg 2 buy rating 0 sell 1 hold .
27,they buy,firm buy rating bank america given tuesday august 7. rating maintained bank america thursday september 27 buy .
28,they buy,technicals front nrg energy inc. nyse nrg overall 88 buy rating .
29,they buy,stock also flashing buy barchart trendspotter trading system .
30,they buy,traders hoping speculate nrg short-term trajectory know short terms indicators stock averaged 80 buy average daily trading volume past 20 days 3821265 shares .
31,they buy,nrg stock overall 0.75 buy signal considering medium term indicators 50-day average daily volume remained almost 3610116 shares .
32,they buy,also worth noting stock whose average daily volume 100 days prior writing 4066209 shares 100 buy basis long term indicators .
33,they sell,09/10/2018 moser christopher exec vice pres operations sold 43.98 thousand shares price per share 35.11 .
34,they sell,callen david performs svp chief accounting offficer job sold 9.2 thousand shares 305.53 thousand .
35,they buy,analysts citigroup upped rating shares nrg energy inc. nyse nrg neutral buy opinion released august 06. citigroup analysts downgraded rating nrg stock buy neutral separate flash note investors july 30 .
36,they sell,average consensus rating company 1.7 scale 5 equates unanimous sell rating .
37,they buy,short mean analyst recommendations calling stock buy .
38,they buy,ky skyscr adsbygoogle window.adsbygoogle .push posted lars charter nov 5th 2018 valuengine cut shares nrg energy nyse nrg buy rating hold rating report published thursday .
39,they buy,citigroup raised nrg energy neutral rating buy rating set 38.00 price target stock research report monday august 6th .
40,they buy,bank america raised target price nrg energy 40.00 42.00 gave company buy rating report thursday september 27th .
41,they sell,zacks investment research downgraded nrg energy hold rating sell rating report tuesday october 9th .
42,they buy,three analysts rated stock hold rating four issued buy rating company .
43,they buy,company presently consensus rating buy average price target 38.17 .
44,they sell,average sell-side analysts anticipate nrg energy post 2.5 eps current fiscal year .
45,they sell,"nrg energy news evp elizabeth r. killinger sold 24,600 shares firm stock transaction thursday september 13th ."
46,they sell,"stock sold average price 35.84 total value 881,664.00 ."
47,they sell,"also evp christopher moser sold 15,200 shares stock transaction thursday september 6th ."
48,they sell,"shares sold average price 35.14 total value 534,128.00 ."
49,they sell,"last ninety days insiders sold 83,775 shares company stock worth 2,959,754 ."
50,they sell,"keyword nrg energy nyse nrg nrg utilitie,62937750 downgrade valuengineratings:4,5 nyse nrg receive news ratings nrg energy daily enter email address receive concise daily summary latest news analysts ratings nrg energy related companies marketbeat.com free daily email newsletter ."
51,they buy,quintana energy services qes upgraded hold valuengine quotient technology quot upgraded buy valuengine average 12-month price target analysts expect nrg energy inc. nyse nrg 40.05 .
52,they sell,0.94 rally might tempting investor buy point fact would prove good idea sell-side analysts think almost 36.29 gain yet come shareholders .
53,they buy,turn street general positives still outweigh negatives see nrg energy inc. nrg buy 1.7 analyst consensus rating .
54,they buy,current time stock 8 buy 1 hold ratings .
55,they buy,posted david hasegawa nov 4th 2018 comments calamos advisors llc bought new stake shares nrg energy inc nyse nrg 3rd quarter according company recent disclosure securities exchange commission .
56,they buy,"firm bought 14,320 shares utilities provider stock valued approximately 536,000 ."
57,they sell,several institutional investors also bought sold shares nrg .
58,they sell,"nrg energy news svp david callen sold 9,200 shares company stock transaction monday august 6th ."
59,they sell,"shares sold average price 33.21 total value 305,532.00 ."
60,they sell,"also evp christopher moser sold 15,200 shares stock transaction dated thursday september 6th ."
61,they sell,"stock sold average price 35.14 total transaction 534,128.00 ."
62,they sell,"insiders sold 92,975 shares company stock valued 3,265,286 last 90 days ."
63,they sell,zacks investment research lowered nrg energy hold rating sell rating research note tuesday october 9th .
64,they buy,valuengine upgraded nrg energy hold rating buy rating report saturday october 6th .
65,they buy,bank america boosted target price nrg energy 40.00 42.00 gave stock buy rating report thursday september 27th .
66,they buy,three analysts rated stock hold rating four given buy rating company stock .
67,they buy,company average rating buy average price target 38.17 .
68,they buy,bank america corp de raises stake sp plus corp sp united bankshares inc. nasdaq ubsi shares bought bank montreal nrg energy nyse nrg scheduled announcing earnings results market opens thursday november 8th .
69,they buy,citigroup downgraded shares nrg energy buy rating neutral rating set 33.00 target price stock .
70,they buy,valuengine raised shares nrg energy hold rating buy rating research report saturday october 6th .
71,they buy,zacks investment research raised shares nrg energy hold rating strong-buy rating set 35.00 target price stock research report monday july 9th .
72,they buy,two research analysts rated stock hold rating five given buy rating company stock .
73,they buy,company consensus rating buy average price target 38.17 .
74,they sell,"related news svp david callen sold 9,200 shares firm stock transaction occurred monday august 6th ."
75,they sell,"shares sold average price 33.21 total transaction 305,532.00 ."
76,they sell,"also evp elizabeth r. killinger sold 24,600 shares firm stock transaction occurred thursday september 13th ."
77,they sell,"stock sold average price 35.84 total transaction 881,664.00 ."
78,they sell,"last 90 days insiders sold 92,975 shares company stock valued 3,265,286 ."
79,they sell,senseonics sens release earnings thursday wabash national wnc rating increased sell valuengine addison capital co acquired new stake shares nrg energy inc nyse nrg 3rd quarter according company recent form 13f filing securities exchange commission .
80,they buy,"whittier trust co. nevada inc. bought new stake nrg energy 2nd quarter valued 130,000 ."
81,they buy,"cerebellum gp llc bought new stake nrg energy 2nd quarter valued 168,000 ."
82,they sell,"news evp elizabeth r. killinger sold 24,600 shares nrg energy stock transaction occurred thursday september 13th ."
83,they sell,"shares sold average price 35.84 total value 881,664.00 ."
84,they sell,"also evp christopher moser sold 43,975 shares nrg energy stock transaction occurred monday september 10th ."
85,they sell,"shares sold average price 35.11 total transaction 1,543,962.25 ."
86,they sell,"insiders sold 92,975 shares company stock valued 3,265,286 last quarter ."
87,they sell,sell-side analysts predict nrg energy inc post 2.5 eps current year .
