,assoc,values
0,they sell,"workday news ceo aneel bhusri sold 300,000 shares company stock transaction dated monday march 4th ."
1,they sell,"shares sold average price 179.58 total value 53,874,000.00 ."
2,they sell,"also director david a. duffield sold 278,758 shares company stock transaction dated monday march 4th ."
3,they sell,"stock sold average price 179.40 total transaction 50,009,185.20 ."
4,they sell,"insiders sold total 1,126,562 shares company stock worth 208,547,706 last quarter ."
5,they sell,four analysts rated stock sell rating nine given hold rating nineteen given buy rating two assigned strong buy rating company stock .
6,they buy,workday average rating buy consensus price target 185.69 .
7,they sell,group sell-side analysts forecast workday inc post earnings per share current fiscal year .
8,they buy,sumitomo mitsui trust holdings inc. increased holdings shares workday 9.2 first quarter .
9,they buy,etf managers group llc increased holdings shares workday 8.0 first quarter .
10,they buy,bank america reiterated buy rating set 208.00 price target shares workday report friday may 17th .
11,they buy,piper jaffray companies reiterated overweight rating set 220.00 price target shares workday report wednesday february 27th .
12,they buy,monness crespi hardt reissued buy rating issued 220.00 price objective previously 185.00 shares workday research note tuesday february 26th .
13,they sell,finally citigroup boosted price objective shares workday 106.00 138.00 gave stock sell rating research note friday march 1st .
14,they sell,four research analysts rated stock sell rating nine assigned hold rating nineteen issued buy rating two issued strong buy rating stock .
15,they buy,workday presently average rating buy average target price 185.69 .
16,they sell,"news ceo aneel bhusri sold 300,000 shares stock transaction dated monday march 4th ."
17,they sell,"shares sold average price 179.58 total transaction 53,874,000.00 ."
18,they sell,"also director david a. duffield sold 1,054 shares stock transaction dated wednesday may 15th ."
19,they sell,"stock sold average price 205.21 total transaction 216,291.34 ."
20,they sell,"insiders sold 1,126,562 shares company stock worth 208,547,706 last ninety days ."
21,they buy,"toronto dominion bank buys 238,615 shares take-two interactive software inc nasdaq ttwo toronto dominion bank increased stake workday inc nasdaq wday 35.0 1st quarter according recent form 13f filing securities exchange commission sec ."
22,they sell,google_ad_client ca-pub-0703139142419429 google_ad_slot 5621244306 google_ad_width 336 google_ad_height 280 c institutional investors also recently bought sold shares company .
23,they buy,"laurel wealth advisors llc bought new stake workday fourth quarter worth approximately 26,000 ."
24,they buy,needham company llc restated buy rating issued 230.00 price target previously 170.00 shares workday research report friday march 1st .
25,they buy,finally keycorp upped price target shares workday 216.00 235.00 gave company overweight rating research report friday march 1st .
26,they sell,four investment analysts rated stock sell rating nine given hold rating nineteen issued buy rating two given strong buy rating stock .
27,they buy,company average rating buy average target price 185.69 .
28,they sell,"news director david a. duffield sold 1,054 shares firm stock transaction wednesday may 15th ."
29,they sell,"shares sold average price 205.21 total transaction 216,291.34 ."
30,they sell,"also insider robynne sisco sold 23,808 shares firm stock transaction tuesday april 16th ."
31,they sell,"shares sold average price 194.75 total transaction 4,636,608.00 ."
32,they sell,"last quarter insiders sold 1,126,562 shares company stock valued 208,547,706 ."
33,they buy,keycorp lifted price objective workday 179.00 216.00 gave company overweight rating research note monday february 11th .
34,they buy,needham company llc reiterated buy rating set 230.00 price objective previously 170.00 shares workday research note friday march 1st .
35,they buy,finally piper jaffray companies reaffirmed overweight rating issued 220.00 price objective shares workday report wednesday february 27th .
36,they sell,four research analysts rated stock sell rating nine given hold rating nineteen issued buy rating two issued strong buy rating company stock .
37,they buy,stock currently average rating buy consensus target price 185.69 .
38,they sell,"news director david a. duffield sold 1,054 shares company stock transaction occurred wednesday may 15th ."
39,they sell,"stock sold average price 205.21 total transaction 216,291.34 ."
40,they sell,also cfo robynne sisco sold 926 shares company stock transaction occurred monday march 4th .
41,they sell,"shares sold average price 189.35 total value 175,338.10 ."
42,they sell,"last 90 days insiders sold 1,126,562 shares company stock worth 208,547,706 ."
43,they sell,"workday news svp james p. shaughnessy sold 4,800 shares firm stock transaction dated monday march 11th ."
44,they sell,"stock sold average price 184.98 total value 887,904.00 ."
45,they sell,"also director david a. duffield sold 1,054 shares firm stock transaction dated wednesday may 15th ."
46,they sell,"stock sold average price 205.21 total value 216,291.34 ."
47,they sell,"last quarter insiders sold 1,126,562 shares company stock worth 208,547,706 ."
48,they sell,warning workday inc wday shares sold glynn capital management llc first posted tech know bits property tech know bits .
49,they buy,foresight wealth management llc reduces stake spdr portfolio large cap etf nysearca splg eagle asset management inc. bought new position shares workday inc nasdaq wday 1st quarter according recent form 13f filing securities exchange commission .
50,they buy,"institutional investor bought 1,690 shares software maker stock valued approximately 325,000 ."
51,they sell,number institutional investors also bought sold shares wday .
52,they buy,"norges bank bought new stake workday fourth quarter valued 198,900,000 ."
53,they buy,"american century companies inc. bought new stake workday fourth quarter valued 132,247,000 ."
54,they buy,"finally assenagon asset management s.a. bought new stake workday first quarter valued 49,230,000 ."
55,they buy,needham company llc restated buy rating set 230.00 price target 170.00 shares workday report friday march 1st .
56,they buy,finally keycorp increased target price shares workday 216.00 235.00 gave company overweight rating research note friday march 1st .
57,they sell,four research analysts rated stock sell rating nine assigned hold rating nineteen given buy rating two assigned strong buy rating company stock .
58,they buy,stock consensus rating buy consensus target price 185.69 .
59,they sell,group sell-side analysts predict workday inc post earnings per share current fiscal year .
60,they sell,goodyear tire rubber co gt shares sold janus henderson group plc workday nasdaq wday stock buy rating restated research analysts bank america report released friday briefing.com automated import reports .
61,they sell,citigroup boosted price objective shares workday 106.00 138.00 gave company sell rating research report friday march 1st .
62,they buy,finally keycorp boosted price objective shares workday 216.00 235.00 gave company overweight rating research report friday march 1st .
63,they sell,four research analysts rated stock sell rating nine assigned hold rating nineteen issued buy rating two given strong buy rating company .
64,they buy,workday currently consensus rating buy average target price 185.69 .
65,they sell,"related news director david a. duffield sold 278,758 shares company stock transaction occurred monday march 4th ."
66,they sell,"shares sold average price 179.40 total transaction 50,009,185.20 ."
67,they sell,"also ceo aneel bhusri sold 300,000 shares company stock transaction occurred monday march 4th ."
68,they sell,"stock sold average price 179.58 total transaction 53,874,000.00 ."
69,they sell,"insiders sold 1,126,562 shares company stock valued 208,547,706 last ninety days ."
70,they buy,sumitomo mitsui trust holdings inc. increased stake workday inc nasdaq wday 9.2 1st quarter according recent 13f filing securities exchange commission sec .
71,they sell,number hedge funds also recently bought sold shares stock .
72,they sell,"workday news director david a. duffield sold 1,054 shares stock transaction occurred wednesday may 15th ."
73,they sell,"shares sold average price 205.21 total transaction 216,291.34 ."
74,they sell,"also ceo aneel bhusri sold 300,000 shares stock transaction occurred monday march 4th ."
75,they sell,"stock sold average price 179.58 total transaction 53,874,000.00 ."
76,they sell,"last three months insiders sold 1,126,562 shares company stock worth 208,547,706 ."
77,they sell,sell-side analysts predict workday inc post eps current fiscal year .
78,they buy,keycorp upped target price shares workday 179.00 216.00 gave stock overweight rating research note monday february 11th .
79,they buy,needham company llc reissued buy rating set 230.00 price target 170.00 shares workday research report friday march 1st .
80,they buy,finally piper jaffray companies reissued overweight rating set 220.00 price target shares workday research report wednesday february 27th .
81,they sell,four equities research analysts rated stock sell rating nine given hold rating nineteen assigned buy rating two issued strong buy rating company stock .
82,they buy,company presently average rating buy average price target 185.69 .
83,they buy,"cetera advisor networks llc purchases 1,157 shares southern co nyse national asset management inc. increased stake shares workday inc nasdaq wday 122.2 1st quarter according company recent form 13f filing sec ."
84,they sell,google_ad_client ca-pub-0703139142419429 google_ad_slot 5621244306 google_ad_width 336 google_ad_height 280 c hedge funds also recently bought sold shares company .
85,they buy,keycorp lifted target price shares workday 179.00 216.00 gave company overweight rating research note monday february 11th .
86,they buy,needham company llc reiterated buy rating issued 230.00 target price 170.00 shares workday research note friday march 1st .
87,they buy,finally piper jaffray companies reissued overweight rating issued 220.00 price target shares workday research report wednesday february 27th .
88,they sell,four research analysts rated stock sell rating nine given hold rating nineteen assigned buy rating two assigned strong buy rating company .
89,they buy,workday currently consensus rating buy consensus price target 185.69 .
90,they buy,"1832 asset management l.p. increased position workday 1,817.2 fourth quarter ."
91,they buy,jennison associates llc increased position workday 6.0 fourth quarter .
92,they sell,related news cfo robynne sisco sold 926 shares firm stock transaction monday march 4th .
93,they sell,"shares sold average price 189.35 total transaction 175,338.10 ."
94,they sell,"also svp james p. shaughnessy sold 4,800 shares stock transaction monday march 11th ."
95,they sell,"shares sold average price 184.98 total transaction 887,904.00 ."
96,they sell,"last ninety days insiders sold 1,126,562 shares company stock valued 208,547,706 ."
97,they buy,keycorp upped price target shares workday 179.00 216.00 gave stock overweight rating research report monday february 11th .
98,they buy,needham company llc reissued buy rating issued 230.00 price objective previously 170.00 shares workday research report friday march 1st .
99,they buy,deutsche bank increased price objective shares workday 155.00 190.00 gave stock hold rating research report friday march 1st .
100,they buy,finally piper jaffray companies reissued overweight rating issued 220.00 price objective shares workday research report wednesday february 27th .
101,they sell,four investment analysts rated stock sell rating nine given hold rating nineteen issued buy rating two given strong buy rating company stock .
102,they buy,workday presently consensus rating buy average target price 185.69 .
103,they buy,research note published may 17th 2019 bofa/merrill reiterated shares wday 234.additionally research note made public march 1st 2019 analysts needham reiterated common shares wday stock buy combined 12-month price target 230 .
104,they buy,shares arbor realty trust inc. increased 30.69 year alone .
105,they sell,looking investment recommendation say scale 1 5 1 strong buy 3 hold 5 sell abr given 3.00 2.30 placed wday .
106,they sell,"workday news director david a. duffield sold 1,054 shares firm stock transaction wednesday may 15th ."
107,they sell,"stock sold average price 205.21 total value 216,291.34 ."
108,they sell,"also insider robynne sisco sold 23,808 shares firm stock transaction tuesday april 16th ."
109,they sell,"shares sold average price 194.75 total value 4,636,608.00 ."
110,they sell,"insiders sold 1,126,562 shares company stock worth 208,547,706 last quarter ."
111,they sell,citigroup raised price target shares workday 106.00 138.00 gave stock sell rating research report friday march 1st .
112,they buy,finally keycorp raised price objective workday 216.00 235.00 gave stock overweight rating research note friday march 1st .
113,they sell,four equities research analysts rated stock sell rating nine issued hold rating nineteen assigned buy rating two assigned strong buy rating company .
114,they buy,company presently consensus rating buy consensus target price 185.69 .
115,they buy,"whittier trust co. 56,000 holdings ambev a/s abev workday nasdaq wday stock buy rating reissued analysts needham company llc note issued investors friday marketbeat.com reports ."
116,they buy,monness crespi hardt reaffirmed buy rating set 220.00 price objective previously 185.00 shares workday research report tuesday february 26th .
117,they buy,piper jaffray companies reaffirmed overweight rating set 220.00 price objective shares workday research report wednesday .
118,they buy,cantor fitzgerald set 185.00 price objective workday gave company buy rating research report sunday december 2nd .
119,they sell,two investment analysts rated stock sell rating nine issued hold rating nineteen issued buy rating two issued strong buy rating company stock .
120,they buy,company currently consensus rating buy consensus price target 187.86 .
121,they sell,"workday news insider robynne sisco sold 6,048 shares workday stock transaction tuesday january 15th ."
122,they sell,"stock sold average price 164.75 total value 996,408.00 ."
123,they sell,also director david a. duffield sold 911 shares workday stock transaction tuesday january 15th .
124,they sell,"stock sold average price 164.91 total value 150,233.01 ."
125,they sell,"last three months insiders sold 999,158 shares company stock valued 163,638,983 ."
126,they sell,several institutional investors recently bought sold shares wday .
127,they buy,"laurel wealth advisors llc bought new stake shares workday fourth quarter worth 26,000 ."
128,they buy,"finally pearl river capital llc bought new stake shares workday fourth quarter worth 45,000 ."
129,they sell,news director david a. duffield sold 911 shares company stock transaction tuesday january 15th .
130,they sell,"stock sold average price 164.91 total transaction 150,233.01 ."
131,they sell,"also ceo aneel bhusri sold 300,000 shares company stock transaction monday december 3rd ."
132,they sell,"shares sold average price 165.54 total value 49,662,000.00 ."
133,they sell,"insiders sold total 999,158 shares company stock worth 163,638,983 last ninety days ."
134,they sell,"director 10 owner duffield david sold 1,054 shares 625,771 transaction occurred 2019/05/15 ."
135,they buy,"trading activity significantly improved volume ready counter increased 2,382,887 shares versus 1,419,670 average daily trading volume past 20 days ."
136,they buy,seen change price target analysts bofa/merrill reiterated stock buy may 17 moved pt 208 234 .
137,they buy,brokerage firm needham looks cautious stick prior recommendation buy call march 01. however change target price 170 230 .
138,they buy,monness crespi hardt reiterated call buy march 01. hand set new target price 250 versus 220 .
139,they buy,gvt rec adsbygoogle window.adsbygoogle .push posted charles blunt may 19th 2019 state board administration florida retirement system increased holdings shares workday inc nasdaq wday 3.0 1st quarter according company recent 13f filing securities exchange commission sec .
140,they sell,"related news director david a. duffield sold 1,054 shares firm stock transaction dated wednesday may 15th ."
141,they sell,"stock sold average price 205.21 total transaction 216,291.34 ."
142,they sell,also cfo robynne sisco sold 926 shares workday stock transaction occurred monday march 4th .
143,they sell,"shares sold average price 189.35 total value 175,338.10 ."
144,they sell,"last three months insiders sold 1,126,562 shares company stock worth 208,547,706 ."
145,they buy,"regentatlantic capital llc buys shares 2,999 analog devices inc. adi workday nasdaq wday stock buy rating reaffirmed equities research analysts bank america research note issued investors friday briefing.com automated import reports ."
146,they sell,citigroup raised price objective shares workday 106.00 138.00 gave company sell rating report friday march 1st .
147,they buy,finally keycorp raised price objective shares workday 216.00 235.00 gave company overweight rating report friday march 1st .
148,they sell,four research analysts rated stock sell rating nine issued hold rating nineteen assigned buy rating two issued strong buy rating company .
149,they buy,stock consensus rating buy consensus price target 185.69 .
150,they sell,"related news ceo aneel bhusri sold 300,000 shares workday stock transaction monday march 4th ."
151,they sell,"shares sold average price 179.58 total transaction 53,874,000.00 ."
152,they sell,"also director david a. duffield sold 278,758 shares workday stock transaction monday march 4th ."
153,they sell,"stock sold average price 179.40 total transaction 50,009,185.20 ."
154,they sell,"insiders sold total 1,126,562 shares company stock worth 208,547,706 last quarter ."
155,they buy,fuel tech ftek lifted buy valuengine glynn capital management llc trimmed holdings shares workday inc nasdaq wday 2.9 fourth quarter according company recent filing securities exchange commission sec .
156,they buy,commonwealth equity services llc increased position shares workday 10.9 4th quarter .
157,they buy,"alphacrest capital management llc bought new stake shares workday 4th quarter worth 303,000 ."
158,they sell,"news insider robynne sisco sold 6,048 shares workday stock transaction occurred tuesday january 15th ."
159,they sell,"shares sold average price 164.75 total value 996,408.00 ."
160,they sell,"also director david a. duffield sold 309,667 shares workday stock transaction occurred friday december 7th ."
161,they sell,"shares sold average price 161.50 total transaction 50,011,220.50 ."
162,they sell,"insiders sold 999,158 shares company stock worth 163,638,983 last quarter ."
163,they buy,keycorp boosted target price shares workday 179.00 216.00 gave company overweight rating research note monday february 11th .
164,they buy,monness crespi hardt reissued buy rating set 185.00 target price 175.00 shares workday research note friday november 30th .
165,they buy,needham company llc boosted price target shares workday 170.00 230.00 gave company buy rating report friday .
166,they sell,two investment analysts rated stock sell rating nine assigned hold rating seventeen issued buy rating two issued strong buy rating stock .
167,they buy,workday presently average rating buy average price target 178.31 .
168,they buy,google_ad_client ca-pub-0703139142419429 google_ad_slot 1418630638 google_ad_width 336 google_ad_height 280 victory capital management inc. bought new stake workday inc nasdaq wday first quarter according company recent form 13f filing securities exchange commission .
169,they buy,"fund bought 156,012 shares software maker stock valued approximately 30,087,000 ."
170,they sell,"news director david a. duffield sold 1,054 shares stock transaction dated wednesday may 15th ."
171,they sell,"stock sold average price 205.21 total value 216,291.34 ."
172,they sell,also cfo robynne sisco sold 926 shares stock transaction dated monday march 4th .
173,they sell,"shares sold average price 189.35 total value 175,338.10 ."
174,they sell,"last quarter insiders sold 1,126,562 shares company stock valued 208,547,706 ."
175,they buy,needham company llc reiterated buy rating set 230.00 target price 170.00 shares workday research report friday march 1st .
176,they buy,finally keycorp boosted target price workday 216.00 235.00 gave stock overweight rating research report friday march 1st .
177,they sell,four research analysts rated stock sell rating nine assigned hold rating nineteen assigned buy rating two issued strong buy rating company .
178,they buy,workday currently consensus rating buy average target price 185.69 .
