,assoc,values
225,they sell,"also evp henry gomez sold 14,563 shares stock transaction friday june 1st ."
226,they sell,"shares sold average price 15.33 total value 223,250.79 ."
227,they buy,disclosure sale found .
228,they sell,"last quarter insiders sold 4,600,991 shares company stock valued 71,507,782 ."
229,they buy,company insiders 1.18 company stock .
230,they buy,several analysts recently commented company .
231,they buy,nomura assumed coverage hewlett packard enterprise report thursday june 28th .
232,they buy,set neutral rating 16.00 price objective company .
233,they buy,sanford c. bernstein lowered hewlett packard enterprise outperform rating market perform rating decreased price objective company 20.00 18.00 report tuesday .
234,they buy,valuengine lowered hewlett packard enterprise buy rating hold rating report wednesday may 2nd .
235,they buy,pivotal research reduced target price hewlett packard enterprise 20.00 18.00 set hold rating company research note thursday june 14th .
236,they buy,finally zacks investment research lowered hewlett packard enterprise buy rating hold rating research note monday april 30th .
237,they sell,two research analysts rated stock sell rating seventeen given hold rating seven issued buy rating company stock .
238,they buy,hewlett packard enterprise average rating hold average price target 17.05 .
239,they buy,hewlett packard enterprise nyse hpe last released quarterly earnings data tuesday may 22nd .
240,they sell,technology company reported 0.34 earnings per share quarter beating zacks consensus estimate 0.31 0.03 .
241,they buy,business revenue 7.47 billion quarter compared analyst estimates 7.39 billion .
242,they buy,hewlett packard enterprise return equity 8.25 net margin 9.36 .
243,they buy,company revenue 9.7 year-over-year basis .
244,they buy,quarter last year business posted 0.35 eps .
245,they sell,analysts forecast hewlett packard enterprise co post 1.47 earnings per share current year .
246,they buy,business also recently disclosed quarterly dividend paid wednesday october 3rd .
247,they buy,shareholders record wednesday september 12th paid dividend 0.1125 per share .
248,they buy,ex-dividend date tuesday september 11th .
249,they buy,represents 0.45 dividend annualized basis dividend yield 2.84 .
250,they buy,hewlett packard enterprise payout ratio currently 46.88 .
251,they buy,several hedge funds institutional investors recently added reduced stakes business .
252,they buy,"city holding co. purchased new position shares hewlett packard enterprise 2nd quarter valued 278,000 ."
253,they buy,winton group ltd raised stake shares hewlett packard enterprise 70.8 2nd quarter .
254,they buy,"winton group ltd owns 1,193,187 shares technology company stock valued 17,432,000 buying additional 494,697 shares last quarter ."
255,they buy,"andra ap fonden purchased new position shares hewlett packard enterprise 2nd quarter valued 3,515,000 ."
256,they buy,global x management co llc raised stake shares hewlett packard enterprise 914.1 2nd quarter .
257,they buy,"global x management co llc owns 104,985 shares technology company stock valued 1,534,000 buying additional 94,632 shares last quarter ."
258,they buy,finally qube research technologies ltd raised stake shares hewlett packard enterprise 304.0 2nd quarter .
259,they buy,"qube research technologies ltd owns 38,785 shares technology company stock valued 567,000 buying additional 29,184 shares last quarter ."
260,they buy,institutional investors hedge funds 83.38 company stock .
261,they buy,hewlett packard enterprise nyse hpe hewlett packard enterprise company operates technology company .
262,they buy,company operates four segments hybrid intelligent edge financial services corporate investments .
263,they buy,hybrid segment provides industry standard servers well mission-critical servers address full array customers computing needs converged storage solutions including all-flash arrays hybrid storage solutions traditional storage solutions comprising tape storage networking legacy external disk products .
264,they buy,"featured story diversificationviewcount articlehistoryid=23293537 postdate=2018-8-23 type=h tertiary=1 id=522257keyword hewlett packard enterprise nyse hpe hpe computer technology stocks technicalsratings:3,24 nyse hpe receive news ratings hewlett packard enterprise daily enter email address receive concise daily summary latest news analysts ratings hewlett packard enterprise related companies marketbeat.com free daily email newsletter ."
265,they buy,coty coty rating lowered hold bmo capital markets barings llc reduced position shares hewlett packard enterprise co nyse hpe 5.3 2nd quarter according recent filing securities exchange commission sec .
266,they buy,"fund owned 637,606 shares technology company stock selling 35,831 shares period ."
267,they buy,"barings llc holdings hewlett packard enterprise worth 9,316,000 end recent quarter ."
268,they buy,institutional investors also recently added reduced stakes company .
269,they buy,"spectrum financial alliance ltd llc acquired new position hewlett packard enterprise first quarter valued approximately 121,000 ."
270,they buy,"summit trail advisors llc raised stake shares hewlett packard enterprise 1,771.8 first quarter ."
271,they buy,"summit trail advisors llc owns 120,565 shares technology company stock valued 121,000 purchasing additional 114,124 shares period ."
272,they buy,"migdal insurance financial holdings ltd. raised stake shares hewlett packard enterprise 16,531.4 second quarter ."
273,they buy,"migdal insurance financial holdings ltd. owns 8,482 shares technology company stock valued 124,000 purchasing additional 8,431 shares period ."
274,they buy,"highlander capital management llc purchased new stake shares hewlett packard enterprise first quarter valued approximately 148,000 ."
275,they buy,"finally farmers trust co. purchased new stake shares hewlett packard enterprise second quarter valued approximately 150,000 ."
276,they buy,83.38 stock currently owned institutional investors .
277,they buy,number analysts recently issued reports hpe shares .
278,they buy,morgan stanley lifted price objective shares hewlett packard enterprise 20.00 21.00 gave company overweight rating research note wednesday may 23rd .
279,they buy,oppenheimer set 20.00 price objective shares hewlett packard enterprise gave company buy rating research note tuesday may 22nd .
280,they buy,maxim group reiterated hold rating set 18.00 price objective shares hewlett packard enterprise research note wednesday may 23rd .
281,they buy,zacks investment research lowered shares hewlett packard enterprise buy rating hold rating research note monday april 30th .
282,they buy,finally wells fargo co reiterated hold rating shares hewlett packard enterprise research note friday may 25th .
283,they sell,two research analysts rated stock sell rating seventeen issued hold rating seven issued buy rating company .
284,they buy,company consensus rating hold average target price 17.05 .
285,they buy,hpe stock opened 15.82 thursday .
286,they buy,company debt-to-equity ratio 0.42 current ratio 1.04 quick ratio 0.89. hewlett packard enterprise co 1-year low 12.81 1-year high 19.48 .
287,they buy,firm market cap 25.24 billion price-to-earnings ratio 16.48 price-to-earnings-growth ratio 1.24 beta 1.75 .
288,they buy,hewlett packard enterprise nyse hpe last released earnings results tuesday may 22nd .
289,they sell,technology company reported 0.34 earnings per share quarter beating consensus estimate 0.31 0.03 .
290,they buy,hewlett packard enterprise net margin 9.36 return equity 8.25 .
291,they buy,firm revenue 7.47 billion quarter compared analyst estimates 7.39 billion .
292,they sell,quarter previous year firm earned 0.35 earnings per share .
293,they buy,firm revenue quarter 9.7 compared quarter last year .
294,they sell,equities research analysts predict hewlett packard enterprise co post 1.47 earnings per share current fiscal year .
295,they buy,company also recently declared quarterly dividend paid wednesday october 3rd .
296,they buy,stockholders record wednesday september 12th issued dividend 0.1125 per share .
297,they buy,represents 0.45 annualized dividend dividend yield 2.84 .
298,they buy,ex-dividend date tuesday september 11th .
299,they buy,hewlett packard enterprise dividend payout ratio dpr 46.88 .
300,they buy,"hewlett packard enterprise profile keyword hewlett packard enterprise nyse hpe hpe computer technology sec filings,13f hedge fund holdings institutional investor holdingsratings:3,24 nyse hperefreshed2 receive news ratings hewlett packard enterprise daily enter email address receive concise daily summary latest news analysts ratings hewlett packard enterprise related companies marketbeat.com free daily email newsletter ."
301,they buy,myomo myo issues earnings results misses expectations 0.02 eps acadian asset management llc purchased new stake hewlett packard enterprise co nyse hpe second quarter according company recent filing securities exchange commission .
302,they buy,"firm purchased 446,697 shares technology company stock valued approximately 6,527,000 ."
303,they buy,number hedge funds also recently made changes positions business .
304,they buy,daiwa securities group inc. grew position hewlett packard enterprise 7.5 first quarter .
305,they buy,"daiwa securities group inc. owns 52,519 shares technology company stock worth 921,000 buying additional 3,648 shares last quarter ."
306,they buy,hanson mcclain inc. grew position hewlett packard enterprise 18.7 first quarter .
307,they buy,"hanson mcclain inc. owns 18,576 shares technology company stock worth 326,000 buying additional 2,929 shares last quarter ."
308,they buy,"nuwave investment management llc grew position hewlett packard enterprise 64,068.1 first quarter ."
309,they buy,"nuwave investment management llc owns 72,510 shares technology company stock worth 1,321,000 buying additional 72,397 shares last quarter ."
310,they buy,polaris capital management llc grew position hewlett packard enterprise 107.4 first quarter .
311,they buy,"polaris capital management llc owns 1,395,900 shares technology company stock worth 24,484,000 buying additional 722,700 shares last quarter ."
312,they buy,finally commerzbank aktiengesellschaft fi grew position hewlett packard enterprise 9.2 first quarter .
313,they buy,"commerzbank aktiengesellschaft fi owns 541,327 shares technology company stock worth 9,495,000 buying additional 45,724 shares last quarter ."
314,they buy,hedge funds institutional investors 83.38 company stock .
315,they sell,"hewlett packard enterprise news director margaret c. whitman sold 255,485 shares business stock transaction dated friday july 6th ."
316,they sell,"shares sold average price 15.01 total value 3,834,829.85 ."
317,they buy,"following transaction director directly owns 127,154 shares company valued 1,908,581.54 ."
318,they buy,transaction disclosed document filed sec available link .
319,they sell,"also director margaret c. whitman sold 337,000 shares company stock transaction occurred monday july 9th ."
320,they sell,"shares sold average price 15.03 total transaction 5,065,110.00 ."
321,they buy,"following completion sale director directly owns 127,154 shares company stock valued approximately 1,911,124.62 ."
322,they buy,disclosure sale found .
323,they sell,"insiders sold total 5,274,991 shares company stock worth 82,076,102 last quarter ."
324,they buy,insiders 1.18 company stock .
325,they buy,hewlett packard enterprise nyse hpe last released quarterly earnings data tuesday may 22nd .
326,they sell,technology company reported 0.34 earnings per share eps quarter beating consensus estimate 0.31 0.03 .
327,they buy,business revenue 7.47 billion quarter compared analyst estimates 7.39 billion .
328,they buy,hewlett packard enterprise net margin 9.36 return equity 8.25 .
329,they buy,hewlett packard enterprise quarterly revenue 9.7 compared quarter last year .
330,they buy,quarter previous year business earned 0.35 eps .
331,they sell,equities research analysts expect hewlett packard enterprise co post 1.47 earnings per share current fiscal year .
332,they buy,company also recently announced quarterly dividend paid wednesday october 3rd .
333,they buy,investors record wednesday september 12th issued 0.1125 dividend .
334,they buy,ex-dividend date tuesday september 11th .
335,they buy,represents 0.45 annualized dividend yield 2.84 .
336,they buy,hewlett packard enterprise dividend payout ratio dpr presently 46.88 .
337,they buy,several research analysts issued reports stock .
338,they buy,pivotal research restated hold rating issued 20.00 price target shares hewlett packard enterprise research report wednesday may 23rd .
339,they buy,zacks investment research upgraded shares hewlett packard enterprise hold rating buy rating set 17.00 price target stock research report monday july 16th .
340,they buy,bmo capital markets restated hold rating issued 19.00 price target shares hewlett packard enterprise research report tuesday may 22nd .
341,they buy,nomura assumed coverage shares hewlett packard enterprise research report thursday june 28th .
342,they buy,issued neutral rating 16.00 price target stock .
343,they buy,finally sanford c. bernstein lowered shares hewlett packard enterprise outperform rating market perform rating decreased price target stock 20.00 18.00 research report tuesday .
344,they sell,two investment analysts rated stock sell rating seventeen issued hold rating seven assigned buy rating company .
345,they buy,stock currently consensus rating hold average price target 17.05 .
346,they buy,"keyword hewlett packard enterprise nyse hpe hpe computer technology sec filings,13f hedge fund holdings institutional investor holdingsratings:3,24 nyse hperefreshed3 receive news ratings hewlett packard enterprise daily enter email address receive concise daily summary latest news analysts ratings hewlett packard enterprise related companies marketbeat.com free daily email newsletter ."
347,they buy,coca-cola co ko stake lessened acg wealth toronto dominion bank raised position shares hewlett packard enterprise co nyse hpe 169.1 2nd quarter according recent form 13f filing securities exchange commission .
348,they buy,"firm owned 2,286,503 shares technology company stock buying additional 1,436,905 shares quarter ."
349,they buy,"toronto dominion bank owned 0.15 hewlett packard enterprise worth 33,402,000 end recent quarter ."
350,they buy,institutional investors also recently made changes positions company .
351,they buy,"spectrum financial alliance ltd llc bought new position shares hewlett packard enterprise 1st quarter valued approximately 121,000 ."
352,they buy,"summit trail advisors llc grew position hewlett packard enterprise 1,771.8 1st quarter ."
353,they buy,"summit trail advisors llc owns 120,565 shares technology company stock valued 121,000 acquiring additional 114,124 shares last quarter ."
354,they buy,"migdal insurance financial holdings ltd. grew position hewlett packard enterprise 16,531.4 2nd quarter ."
355,they buy,"migdal insurance financial holdings ltd. owns 8,482 shares technology company stock valued 124,000 acquiring additional 8,431 shares last quarter ."
356,they buy,"highlander capital management llc bought new position hewlett packard enterprise 1st quarter valued 148,000 ."
357,they buy,"finally farmers trust co. bought new position hewlett packard enterprise 2nd quarter valued 150,000 ."
358,they buy,83.38 stock owned institutional investors hedge funds .
359,they buy,hpe topic several research analyst reports .
360,they buy,oppenheimer set 20.00 price objective hewlett packard enterprise gave company buy rating research report tuesday may 22nd .
361,they buy,zacks investment research raised hewlett packard enterprise hold rating buy rating set 19.00 price target stock research report thursday may 24th .
362,they buy,pivotal research reissued hold rating set 20.00 price target shares hewlett packard enterprise research report wednesday may 23rd .
363,they buy,maxim group reissued hold rating set 18.00 price target shares hewlett packard enterprise research report wednesday may 23rd .
364,they buy,finally bmo capital markets restated hold rating set 19.00 price objective shares hewlett packard enterprise research note tuesday may 22nd .
365,they sell,two research analysts rated stock sell rating seventeen issued hold rating seven given buy rating company .
366,they buy,stock currently consensus rating hold consensus price target 17.05 .
367,they buy,shares hpe stock traded 0.13 mid-day trading wednesday reaching 15.91 .
368,they buy,"stock trading volume 328,398 shares compared average volume 6,807,242. company debt-to-equity ratio 0.42 quick ratio 0.89 current ratio 1.04. firm market capitalization 25.24 billion pe ratio 16.52 p/e/g ratio 1.24 beta 1.75. hewlett packard enterprise co 1-year low 12.81 1-year high 19.48 ."
369,they buy,hewlett packard enterprise nyse hpe last posted earnings results tuesday may 22nd .
370,they buy,technology company reported 0.34 eps quarter topping consensus estimate 0.31 0.03 .
371,they buy,firm revenue 7.47 billion quarter compared analyst estimates 7.39 billion .
372,they buy,hewlett packard enterprise return equity 8.25 net margin 9.36 .
373,they buy,hewlett packard enterprise revenue quarter 9.7 compared quarter last year .
374,they sell,period last year company earned 0.35 earnings per share .
375,they sell,sell-side analysts forecast hewlett packard enterprise co post 1.47 earnings per share current year .
376,they buy,business also recently announced quarterly dividend paid wednesday october 3rd .
377,they buy,investors record wednesday september 12th issued dividend 0.1125 per share .
378,they buy,represents 0.45 annualized dividend yield 2.83 .
379,they buy,ex-dividend date dividend tuesday september 11th .
380,they buy,hewlett packard enterprise dividend payout ratio dpr 46.88 .
381,they buy,"hewlett packard enterprise keyword hewlett packard enterprise nyse hpe hpe computer technology sec filings,13f hedge fund holdings institutional investor holdingsratings:3,24 nyse hperefreshed1 receive news ratings hewlett packard enterprise daily enter email address receive concise daily summary latest news analysts ratings hewlett packard enterprise related companies marketbeat.com free daily email newsletter ."
382,they sell,"establishment labs nasdaq esta posts earnings results beats estimates 0.15 eps hewlett packard enterprise co nyse hpe insider antonio f. neri sold 36,556 shares business stock transaction occurred friday august 17th ."
383,they sell,"shares sold average price 16.50 total value 603,174.00 ."
384,they buy,"following sale insider owns 170,721 shares company valued 2,816,896.50 ."
385,they buy,transaction disclosed legal filing securities exchange commission available sec website .
386,they buy,shares hpe stock opened 15.78 wednesday .
387,they buy,company current ratio 1.04 quick ratio 0.89 debt-to-equity ratio 0.42. firm market capitalization 25.24 billion p/e ratio 16.50 p/e/g ratio 1.24 beta 1.75. hewlett packard enterprise co one year low 12.81 one year high 19.48 .
388,they buy,hewlett packard enterprise nyse hpe last announced quarterly earnings results tuesday may 22nd .
389,they buy,technology company reported 0.34 eps quarter beating thomson reuters consensus estimate 0.31 0.03 .
390,they buy,business revenue 7.47 billion quarter compared analyst estimates 7.39 billion .
391,they buy,hewlett packard enterprise return equity 8.25 net margin 9.36 .
392,they buy,hewlett packard enterprise quarterly revenue 9.7 year-over-year basis .
393,they buy,quarter previous year firm earned 0.35 eps .
394,they sell,research analysts expect hewlett packard enterprise co post 1.44 earnings per share current fiscal year .
395,they buy,business also recently declared quarterly dividend paid wednesday october 3rd .
396,they buy,investors record wednesday september 12th paid 0.1125 dividend .
397,they buy,represents 0.45 annualized dividend yield 2.85 .
398,they buy,ex-dividend date dividend tuesday september 11th .
399,they buy,hewlett packard enterprise dividend payout ratio 46.88 .
400,they buy,number research firms recently issued reports hpe .
401,they buy,maxim group restated hold rating set 18.00 price objective shares hewlett packard enterprise research report wednesday may 23rd .
402,they buy,nomura began coverage hewlett packard enterprise research report thursday june 28th .
403,they buy,set neutral rating 16.00 price objective stock .
404,they buy,zacks investment research cut hewlett packard enterprise buy rating hold rating research report monday april 30th .
405,they buy,pivotal research lowered price objective hewlett packard enterprise 20.00 18.00 set hold rating stock research report thursday june 14th .
406,they buy,finally bmo capital markets restated hold rating set 19.00 price objective shares hewlett packard enterprise research report tuesday may 22nd .
407,they sell,two equities research analysts rated stock sell rating seventeen given hold rating seven issued buy rating company stock .
408,they buy,stock presently average rating hold average target price 17.05 .
409,they sell,number institutional investors recently bought sold shares hpe .
410,they buy,morgan stanley boosted stake hewlett packard enterprise 429.8 second quarter .
411,they buy,"morgan stanley owns 9,860,955 shares technology company stock worth 144,068,000 purchasing additional 7,999,613 shares last quarter ."
412,they buy,prudential financial inc. boosted stake hewlett packard enterprise 196.3 first quarter .
413,they buy,"prudential financial inc. owns 8,753,931 shares technology company stock worth 153,544,000 purchasing additional 5,799,831 shares last quarter ."
414,they buy,boston partners boosted stake hewlett packard enterprise 67.2 second quarter .
415,they buy,"boston partners owns 13,969,750 shares technology company stock worth 204,098,000 purchasing additional 5,615,283 shares last quarter ."
416,they buy,lsv asset management boosted stake hewlett packard enterprise 44.5 second quarter .
417,they buy,"lsv asset management owns 15,752,632 shares technology company stock worth 230,145,000 purchasing additional 4,848,200 shares last quarter ."
418,they buy,"finally millennium management llc boosted stake hewlett packard enterprise 2,277.0 first quarter ."
419,they buy,"millennium management llc owns 3,824,026 shares technology company stock worth 67,073,000 purchasing additional 3,663,150 shares last quarter ."
420,they buy,83.38 stock currently owned institutional investors .
421,they buy,hewlett packard enterprise company profile hewlett packard enterprise company operates technology company .
422,they buy,company operates four segments hybrid intelligent edge financial services corporate investments .
423,they buy,hybrid segment provides industry standard servers well mission-critical servers address full array customers computing needs converged storage solutions including all-flash arrays hybrid storage solutions traditional storage solutions comprising tape storage networking legacy external disk products .
424,they buy,"keyword hewlett packard enterprise nyse hpe hpe computer technology insider trading insider trades stocksratings:3,24 nyse hpe receive news ratings hewlett packard enterprise daily enter email address receive concise daily summary latest news analysts ratings hewlett packard enterprise related companies marketbeat.com free daily email newsletter ."
425,they buy,nanthealth nh downgraded hold zacks investment research analysts expect hewlett packard enterprise company nyse hpe report 0.38 eps september 4.they anticipate 0.07 eps change 22.58 last quarter 0.31 eps .
426,they buy,hpe profit would 575.31m giving 10.41 p/e 0.38 eps correct .
427,they buy,0.34 eps previously hewlett packard enterprise company analysts see 11.76 eps growth .
428,they buy,stock increased 0.25 0.04 last trading session reaching 15.82 .
429,they buy,8.28 million shares traded .
430,they buy,hewlett packard enterprise company nyse hpe risen 6.20 since august 23 2017 uptrending .
431,they buy,underperformed 6.37 p500 .
432,they buy,hewlett packard enterprise company provides technology solutions business public sector enterprises .
433,they buy,company market cap 23.95 billion .
434,they buy,operates enterprise group financial services corporate investments divisions .
435,they buy,8.92 p/e ratio .
436,they buy,enterprise group segment offers industry standard servers mission-critical servers address array customers computing needs converged storage solutions including 3par storeserv storeonce storevirtual products well traditional storage solutions tape storage networking legacy external disk products enterprise small- medium-size business software-defined switches routers wireless local area network equipment network virtualization equipment security software location services network management products data center care proactive care technology consulting services well aruba services communications media solutions .
437,they buy,recent hewlett packard enterprise company nyse hpe news published globenewswire.com released hpe triples performance enhances energy efficiency new supercomputer national renewable energy august 14 2018. also schaeffersresearch.com published news titled citron spoils nvda surge canopy growth boosted weed supply deal august 21 2018. globenewswire.com news article titled hpe advances intelligent storage capabilities ai cloud automation hpe 3par publication date july 24 2018 also interesting one .
