,assoc,values
0,they sell,"wilbanks smith thomas asset management llc sold 7,640 shares company stock declined 4.08 stock markets rallied ."
1,they buy,stock increased 0.91 0.36 last trading session reaching 39.97 .
2,they buy,historical pfe news 20/03/2018 roche tecentriq chemotherapy phase iii impower131 study met co-primary endpoint 23/05/2018 fda grants breakthrough therapy designation tafamidis treatment patients transthyretin cardiomyopathy 23/03/2018 glaxosmithkline ends talks pfizer consumer-healthcare unit 01/05/2018 pfe gotten acceptable offer consumer health unit 29/05/2018 pfizer xalkori® crizotinib receives fda breakthrough therapy designation two new indications 09/04/2018 allogene therapeutics completes agreement pfizer allogeneic car immuno-oncology portfolio 16/05/2018 phase lll impower150 study showed genentech tecentriq avastin plus carboplatin paclitaxel helped people specific type metastatic lung cancer live significantly longer compared 11/04/2018 pfizer inc pfe.n berenberg raises target price 37 36 16/03/2018 ian read btw pfe 40 years wanted noncompete 25/04/2018 asklepios biopharma pfizer dosed first patient mini-dystrophin gene therapy phase 1b trial manatuck hill partners llc increased stake vertex energy inc vtnr 225.92 based latest 2018q4 regulatory filing sec .
3,they buy,manatuck hill partners llc bought 1.35m shares company stock declined 11.19 stock markets rallied .
4,they sell,"historical vtnr news 11/05/2018 vertex resource group lenders agreed provide co 70 mln senior secured credit facilities three-year term 06/04/2018 stat plus new york panel review vertex pricing first test new law 16/04/2018 transformational tax executive michael davis joins vertex 20/04/2018 l3 vertex bidders submit refresh bids sources say 22:27 bst20 apr 2018 proprietary 20/03/2018 stat plus vertex battles u.k. price cystic fibrosis drug 26/04/2018 stat plus new york panel votes lower cost pricey vertex drug cystic fibrosis 26/04/2018 stat plus vertex latest cystic fibrosis drug reports strong sales first quarter since approval 01/05/2018 l3 sell vertex aerospace 540m cash 28/03/2018 atidot says raised 5 mln series funding round led vertex ventures 01/05/2018 l3 signs pact sell vertex aerospace american industrial p manatuck hill partners llc manages 1.24b 193.84m us long portfolio decreased stake vicor corp nasdaq vicr 26,697 shares 99,297 shares valued 3.75 million 2018q4 according filing ."
5,they buy,"also increased holding vanguard charlotte fds bndx 243,606 shares quarter total 410,358 shares risen stake spdr index shs fds gmm ."
6,they sell,dived 42 investors sold pfe shares 792 reduced holdings .
7,they buy,sheets smith wealth mngmt invested 0.56 pfizer inc. nyse pfe .
8,they buy,"moreover dubuque state bank 0.33 invested pfizer inc. nyse pfe 42,164 shares ."
9,they buy,ckw fincl grp invested 0 pfizer inc. nyse pfe .
10,they buy,penobscot inv mngmt communication 1.03 invested pfizer inc. nyse pfe .
11,they sell,"news evp douglas m. lankler sold 38,800 shares business stock transaction dated wednesday january 30th ."
12,they sell,"shares sold average price 41.19 total transaction 1,598,172.00 ."
13,they sell,"also insider alexander r. mackenzie sold 15,000 shares business stock transaction dated monday april 1st ."
14,they sell,"stock sold average price 42.83 total transaction 642,450.00 ."
15,they sell,"last three months insiders sold 332,526 shares company stock valued 14,346,539 ."
16,they sell,"first hawaiian bank sold 24,015 shares company stock declined 4.08 stock markets rallied ."
17,they buy,stock increased 0.91 0.36 last trading session reaching 39.97 .
18,they buy,historical pfe news 13/04/2018 stat plus pharmalittle sanofi warns canada industry treatment pfizer got big boost new tax law 10/04/2018 pfizer independent committee phase 3 atlas trial inlyta recommended stopping trial planned interim analysis due futility 01/05/2018 pfe splitting company still table forseeable future 10/04/2018 pfizer joins trinetx global health research network formed 26/04/2018 bristol-myers 1q eliquis revenue 1.51 billion 15/05/2018 pfizer biosimilar retacrit® epoetin alfa-epbx approved u.s. fda 07/05/2018 roche fda grants priority review tecentriq lung cancer treatment 22/05/2018 study analyzing observational data shows real-world effectiveness prevnar® 13 adults age 65+ 21/03/2018 pfizer continues evaluate potential strategic alternatives consumer healthcare business 08/03/2018 pfizer announces favorable outcome fda advisory committee meeting xeljanz® tofacitinib moderately severely shikiar asset management inc increased stake starwood property trust inc stwd 10.91 based latest 2018q4 regulatory filing sec .
19,they buy,"shikiar asset management inc bought 43,410 shares company stock declined 0.09 stock markets rallied ."
20,they buy,stock increased 0.66 0.15 last trading session reaching 23.05 .
21,they sell,historical stwd news 01/05/2018 real deal miami starwood lnr sell millennium plaza weston 04/05/2018 starwood property trust 1q net 99.9m 23/04/2018 starwood energy group expands senior leadership team 16/04/2018 american express marriott unveil new refreshed starwood preferred guest co-branded credit cards 18/04/2018 starwood capital group offer prices euros 04/05/2018 starwood property trust qtrly total revenues 260.6 mln 11/05/2018 iwg approached lone star starwood tdr capital 19/04/2018 starwood ceo sternlicht says would like representation supervisory boards immofinanz ca immo commensurate shareholding 22/03/2018 ca immo spokeswoman declines comment starwood offer acquire stake company 13/04/2018 victoria park ab says board directors 1 board victoria park ab publ victoria park recommends shareholders victoria park accept starwood offer analysts await pfizer inc. nyse pfe report earnings may 7. expect 0.77 earnings per share 0.00 0.00 last year 0.77 per share .
22,they buy,"also increased holding boeing co nyse ba 977 shares quarter total 20,946 shares risen stake abbott labs nyse abt ."
23,they sell,fall 42 investors sold pfe shares 792 reduced holdings .
24,they buy,"moreover paradigm asset mngmt 0 invested pfizer inc. nyse pfe 85,750 shares ."
25,they buy,cabot invested 0.26 pfizer inc. nyse pfe .
26,they buy,michigan-based clarkston cap prtnrs ltd limited liability company invested 0.5 pfizer inc. nyse pfe .
27,they buy,moreover hirtle callaghan com ltd liability com 0.13 invested pfizer inc. nyse pfe .
28,they buy,etrade capital mgmt ltd liability invested 0.3 portfolio pfizer inc. nyse pfe .
29,they buy,"centurylink investment mngmt invested 1.65 81,030 shares ."
30,they buy,optimum investment advsrs invested 0.46 pfizer inc. nyse pfe .
31,they buy,city invested 1.25 pfizer inc. nyse pfe .
32,they buy,notable recent starwood property trust inc. nyse stwd news published seekingalpha.com released starwood property trust buy top-shelf 8.6 commercial mortgage reit seeking alpha march 12 2019 also seekingalpha.com article starwood property trust sleep-well-at night reit yields 8.6 still upside seeking alpha published july 16 2018 fool.com published starwood property trust inc. stwd q3 2018 earnings conference call transcript motley fool november 09 2018. interesting news starwood property trust inc. nyse stwd released seekingalpha.com article starwood property completes purchase energy project finance debt business seeking alpha published september 19 2018 well seekingalpha.com news article titled maintaining strong buy sustainable infrastructure reit seeking alpha publication date august 20 2018 .
33,they buy,investors sentiment increased 1.38 q4 2018.
34,they sell,positive 29 investors sold stwd shares 86 reduced holdings .
35,they buy,"bremer tru national association 0.01 invested starwood property trust inc. nyse stwd 2,998 shares ."
36,they buy,"raymond james finance advsr inc invested 0.03 277,258 shares ."
37,they buy,zurcher kantonalbank zurich cantonalbank invested 0 portfolio starwood property trust inc. nyse stwd .
38,they buy,"brown advisory invested 0 14,755 shares ."
39,they sell,"miles capital inc sold 7,450 shares company stock declined 4.08 stock markets rallied ."
40,they buy,stock increased 0.91 0.36 last trading session reaching 39.97 .
41,they buy,historical pfe news 01/05/2018 pfizer sees fy rev 53.5b- 55.5b 04/04/2018 pfizer fda accepts nda grants priority review dacomitinib 07/05/2018 roche tecentriq gets fda priority review first-line lung cancer treatment 20/03/2018 phase iii impower131 study showed genentech tecentriq atezolizumab plus chemotherapy carboplatin abraxane reduced 21/03/2018 glaxosmithkline leads race buy 20bn pfizer unit 17/05/2018 fda gottlieb cos inquiries received include pharmacia upjohn co questcor pharmaceuticals boehringer ingelheim nps pharma 20/04/2018 biogen boosts investment neurology 1 bln ionis deal 01/05/2018 pfizer revenue growth stalls company mulls otc unit future–update 03/04/2018 pfizer inc pfe.n says allogene receive rights co 16 pre-clinical car assets licensed cellectis servier 17/04/2018 canada seeks u.s. help solve epipen shortage notable recent applied materials inc. nasdaq amat news published nasdaq.com released applied materials amat shares cross 200 dma nasdaq march 15 2019 also nasdaq.com article applied materials inc. amat ex-dividend date scheduled february 20 2019 nasdaq published february 19 2019 nasdaq.com published applied materials amat dips broader markets know nasdaq march 27 2019. interesting news applied materials inc. nasdaq amat released nasdaq.com article applied materials amat gains market dips know nasdaq published april 24 2019 well nasdaq.com news article titled analysts estimate applied materials amat report decline earnings look nasdaq publication date february 07 2019 .
42,they sell,turned negative 100 investors sold amat shares 289 reduced holdings .
43,they buy,mutual america capital management limited liability invested 0.07 applied materials inc. nasdaq amat .
44,they buy,moreover ontario teachers pension plan board 0.05 invested applied materials inc. nasdaq amat .
45,they buy,"balyasny asset llc invested 397,449 shares ."
46,they buy,notable recent pfizer inc. nyse pfe news published streetinsider.com released pfizer pfe announces fda approval ibrance treatment men hr+ her2- metastatic breast cancer streetinsider.com april 04 2019 also bizjournals.com article pfizer spinout springworks nets 125 million vcs glaxosmithkline new york business journal published april 01 2019 investorplace.com published investors buy dip mrk stock investorplace.com april 24 2019. interesting news pfizer inc. nyse pfe released fool.com article better buy pfizer vs. abbvie motley fool published april 28 2019 well finance.yahoo.com news article titled economic calendar top 5 things watch week yahoo finance publication date april 28 2019 .
47,they sell,negative 42 investors sold pfe shares 792 reduced holdings .
48,they buy,moreover wilbanks smith thomas asset limited liability 0.38 invested pfizer inc. nyse pfe .
49,they buy,new york-based chemung canal trust communication invested 2.93 pfizer inc. nyse pfe .
50,they buy,"midas mngmt corp invested 35,000 shares 0.73 stock ."
51,they buy,new york-based douglass winthrop limited liability invested 0.12 pfizer inc. nyse pfe .
52,they sell,"arete wealth advisors llc sold 8,857 shares company stock declined 4.08 stock markets rallied ."
53,they buy,stock increased 0.91 0.36 last trading session reaching 39.97 .
54,they sell,fall 80 investors sold gm shares 320 reduced holdings .
55,they buy,westover cap advsrs ltd liability invested 1.51 portfolio general motors company nyse gm .
56,they buy,johnson grp incorporated incorporated invested 0.15 general motors company nyse gm .
57,they buy,"public sector pension investment board 0.02 invested general motors company nyse gm 67,673 shares ."
58,they buy,eli lilly co. nyse lly report top-line results long-term phase 3 study tanezumab patients osteoarthritis streetinsider.com published april 18 2019 bizjournals.com published pfizer spinout springworks nets 125 million vcs glaxosmithkline new york business journal april 01 2019. interesting news pfizer inc. nyse pfe released 247wallst.com article big pharma scares short sellers 24/7 wall st. published april 26 2019 well investorplace.com news article titled investors buy dip mrk stock investorplace.com publication date april 24 2019 .
59,they buy,"also increased holding spdr p 500 etf tr spy 11,993 shares quarter total 21,020 shares risen stake verizon communications inc nyse vz ."
60,they sell,"beddow capital management inc sold 33,755 shares company stock declined 4.08 stock markets rallied ."
61,they buy,stock increased 0.91 0.36 last trading session reaching 39.97 .
62,they buy,historical pfe news 21/05/2018 karo pharma karo pharma receives milestone payment rorgamma project pfizer 09/05/2018 seeking insights rare diseases pfizer scales ai analytics platform 30/05/2018 fda xeljanz made pfizer labs 03/04/2018 arie belldegrun raises 300m grabs pfizer allogeneic car-t portfolio launches groundbreaking drive commercialization pfe inside look 10/04/2018 pfizer signs lease spiral hudson yards manhattan 19/03/2018 bioduro collaboration pfizer inc. leads creation shelf-stable fluorosulfation reagent 09/05/2018 mylan ceo working closely fda pfizer epipen supply 05/03/2018 pfizer inc littman also appointed corporate governance science technology committees pfizer board 15/03/2018 global methicillin-resistant staphylococcus aureus mrsa drugs market reach us 3.9 billion 2025 upsurge 22/03/2018 gsk pole position clinch pfizer assets investors sentiment increased 1.05 2018 q4 .
63,they sell,improved 24 investors sold afg shares 112 reduced holdings .
64,they buy,"pictet asset mngmt 0.01 invested american financial group inc. nyse afg 28,536 shares ."
65,they buy,vanguard grp incorporated inc invested 0.03 7.32 million shares .
66,they buy,new york-based laurion capital mgmt lp invested 0.01 american financial group inc. nyse afg .
67,they buy,"meiji yasuda asset mngmt com limited invested 0.09 11,190 shares ."
68,they buy,"moreover rhumbline advisers 0.04 invested american financial group inc. nyse afg 194,652 shares ."
69,they buy,"insider joseph gregory g bought 1,000 shares worth 92,912 ."
70,they sell,"109,768 shares sold lindner carl h iii worth 10.00 million ."
71,they sell,zacks investment research upgraded shares pfizer sell rating hold rating research report wednesday april 10th .
72,they buy,bank america increased price target shares pfizer 45.00 48.00 gave company buy rating research report monday april 1st .
73,they buy,finally valuengine downgraded shares pfizer buy rating hold rating research report thursday january 24th .
74,they sell,one analyst rated stock sell rating fourteen issued hold rating seven given buy rating company stock .
75,they buy,"swarthmore group inc. purchases shares 139,300 verizon communications inc. vz sonora investment management llc acquires 13,847 shares pfizer inc. pfe name required mail published required asset management group inc increased stake pfizer inc pfe 19.67 based latest 2018q4 regulatory filing sec ."
76,they buy,"asset management group inc bought 7,286 shares company stock declined 4.08 stock markets rallied ."
77,they buy,stock increased 0.91 0.36 last trading session reaching 39.97 .
78,they sell,"first midwest bank trust division sold 3,260 shares company stock declined 1.50 stock markets rallied ."
79,they buy,stock increased 0.28 0.64 last trading session reaching 230.53 .
80,they buy,"also increased holding ishares tr iwr 63,391 shares quarter total 84,853 shares risen stake ishares tr iwm ."
81,they sell,worsened 42 investors sold pfe shares 792 reduced holdings .
82,they buy,miller howard invs ny invested 2.86 2.24m shares .
83,they buy,"moreover crawford investment counsel 0.28 invested pfizer inc. nyse pfe 187,112 shares ."
84,they buy,"moreover grisanti cap limited company 0.07 invested pfizer inc. nyse pfe 2,300 shares ."
85,they buy,"miller investment mngmt lp invested 0.37 29,000 shares ."
86,they buy,brandywine glob inv ltd co invested 5.83 million shares .
87,they sell,"stillwater capital advisors llc sold 10,188 shares company stock declined 4.08 stock markets rallied ."
88,they buy,stock increased 0.91 0.36 last trading session reaching 39.97 .
89,they buy,75c reaffirms 2018 guidance 23/03/2018 gsk dropping pfizer consumer health bid augurs well dividend 22/03/2018 glaxo said submitted final bid buy pfizer otc unit gallagher fiduciary advisors llc decreased stake fifth third bancorp fitb 4.82 based latest 2018q4 regulatory filing sec .
90,they sell,"gallagher fiduciary advisors llc sold 291,966 shares company stock declined 0.18 stock markets rallied ."
91,they buy,stock increased 0.50 0.14 last trading session reaching 28.4 .
92,they buy,historical fitb news 21/05/2018 fifth third bancorp cost savings personnel reductions occur predominantly non-client facing roles 21/05/2018 fifth third bancorp merge mb fincl inc. creating leading retail comml franchise attractive chicago market 15/03/2018 fifth third names christopher j. bell president insurance services 26/04/2018 cincinnatibuscou exclusive fifth third plans 15 new branches including one greater cincinnati 21/05/2018 fifth third bancorp expect investment generate irr approximately 18.5 percent 20/03/2018 brian lamb named one top 100 influential blacks corporate america 22/05/2018 fifth third bancorp deal buy mb financial announced monday includes 151m termination fee payable mb certain circumstances 24/04/2018 fifth third announces first quarter 2018 net income common shareholders 689 million 0.97 per diluted share 24/05/2018 u.s. senate votes 69-24 favor confirming former banker jelena mcwilliams lead federal deposit insurance corporation 24/04/2018 fifth third bancorp quarterly profit doubles analysts await pfizer inc. nyse pfe report earnings may 7. expect 0.77 earnings per share 0.00 0.00 last year 0.77 per share .
93,they sell,fall 42 investors sold pfe shares 792 reduced holdings .
94,they buy,new york-based focused wealth management inc invested 1 pfizer inc. nyse pfe .
95,they buy,proshare advsr limited liability corporation invested 0.35 pfizer inc. nyse pfe .
96,they buy,"howe rusling incorporated invested 76,265 shares 0.7 stock ."
97,they buy,brinker capital invested 0.53 portfolio pfizer inc. nyse pfe .
98,they buy,texas-based fruth investment mngmt invested 0.3 pfizer inc. nyse pfe .
99,they buy,"also increased holding ishares tr iwr 33,815 shares quarter total 53,076 shares risen stake vanguard index fds vo ."
100,they sell,worsened 54 investors sold fitb shares 229 reduced holdings .
101,they buy,oklahoma-based cap advsrs ok invested 0.07 fifth third bancorp nasdaq fitb .
102,they buy,moreover raymond james na 0.01 invested fifth third bancorp nasdaq fitb .
103,they buy,acropolis inv ltd liability co invested 0.05 portfolio fifth third bancorp nasdaq fitb .
104,they buy,"blair william co il 0.03 invested fifth third bancorp nasdaq fitb 150,077 shares ."
105,they sell,"capital investment advisors llc sold 36,576 shares company stock declined 4.08 stock markets rallied ."
106,they buy,stock increased 0.91 0.36 last trading session reaching 39.97 .
107,they buy,"also increased holding ishr ibnd dec 2025 trm 28,765 shares quarter total 886,089 shares risen stake ishares trust core divid gwth dgro ."
108,they sell,worsened 42 investors sold pfe shares 792 reduced holdings .
109,they buy,indiana-based kessler invest group inc limited com invested 4.72 pfizer inc. nyse pfe .
110,they buy,wasatch invested 0.09 pfizer inc. nyse pfe .
111,they buy,"foundation resources management owns 5.08 invested pfizer inc. nyse pfe 538,598 shares ."
112,they sell,turned negative 36 investors sold idti shares 105 reduced holdings .
113,they buy,jpmorgan chase co invested 0.01 integrated device technology inc. nasdaq idti .
114,they buy,california pub employees retirement system invested 0.02 integrated device technology inc. nasdaq idti .
115,they sell,"markston international llc sold 12,000 shares company stock declined 4.08 stock markets rallied ."
116,they buy,stock increased 0.91 0.36 last trading session reaching 39.97 .
117,they buy,historical pfe news 29/03/2018 pfizer announces positive topline results phase 3 attr-act study tafamidis patients transthyretin cardiomyopathy 17/05/2018 focus-takeda ceo prescribes surgical r cuts 62 bln shire deal 20/04/2018 pfizer bond trading 2x average clients net buyers 09/05/2018 seeking insights rare diseases pfizer scales ai analytics platform 19/04/2018 aratana scarcity value driven product development 22/03/2018 british consumer goods group reckitt benckiser pulled discussions pfizer buying consumer healthcare business 09/05/2018 mylan ceo working closely fda pfizer epipen supply 18/05/2018 fda merck genentech stopped enrolling patients whose tumors pd-l1 low status keytruda/tecentriq monotherapy arms per dmcs recommendations 22/05/2018 pfizer begins phase 1/2 study evaluate respiratory syncytial virus rsv vaccine 23/04/2018 stat plus pharmalittle fresenius walks away akorn deal fda bounces pfizer biosimilar wafra investment advisory group inc increased stake activision blizzard atvi 57.87 based latest 2018q4 regulatory filing sec .
118,they buy,"wafra investment advisory group inc bought 123,704 shares company stock declined 18.09 stock markets rallied ."
119,they buy,stock increased 1.56 0.74 last trading session reaching 48.15 .
120,they buy,historical atvi news 09/04/2018 get ready blizzcon® 2018 05/04/2018 moody places activision blizzard inc. baa2 senior unsecured ratings review upgrade 17/05/2018 call duty black ops 4 delivers game changing experience deepest engaging call duty ever 03/05/2018 activision blizzard inc board authorized debt paydown much 1.8 bln 2018 03/05/2018 activision blizzard shares rise reopening 21/03/2018 activision concerns overblown even fortnite gains steam says analyst marketwatch 03/05/2018 activision blizzard reports 15.7 pct rise adjusted revenue 05/05/2018 surging popularity epic games fortnite significantly hurting activision blizzard gaming business 03/05/2018 activision blizzard sees 2q eps 26c 14/03/2018 activision blizzard inc. vs game technology co. ltd. fwd entered 03/14/2018 since march 12 2019 1 insider buy 0 sales 4.30 million activity .
121,they buy,"also increased holding alibaba group holding nyse baba 3,339 shares quarter total 14,240 shares risen stake united technologies corporatio nyse utx ."
122,they sell,dropped 42 investors sold pfe shares 792 reduced holdings .
123,they buy,hendershot investments 0.08 invested pfizer inc. nyse pfe .
124,they buy,moreover horrell inc 0 invested pfizer inc. nyse pfe 159 shares .
125,they buy,"moreover inv counsel 0.45 invested pfizer inc. nyse pfe 23,588 shares ."
126,they buy,moreover btc management 0.98 invested pfizer inc. nyse pfe .
127,they buy,"baxter bros owns 0.21 invested pfizer inc. nyse pfe 17,738 shares ."
128,they buy,"heritage invsts management corporation invested 1.19 408,586 shares ."
129,they sell,"schaper benz wise investment counsel inc sold 8,457 shares company stock declined 4.08 stock markets rallied ."
130,they buy,stock increased 0.91 0.36 last trading session reaching 39.97 .
131,they sell,turned negative 42 investors sold pfe shares 792 reduced holdings .
132,they buy,"suffolk management limited liability corporation invested 5,942 shares 0.05 stock ."
133,they buy,e shaw invested 0.03 pfizer inc. nyse pfe .
134,they buy,"highland cap mgmt ltd llc invested 369,524 shares ."
135,they buy,notable recent pfizer inc. nyse pfe news published investorplace.com released investors buy dip mrk stock investorplace.com april 24 2019 also seekingalpha.com article stocks watch eyes apple uber f8 avengers seeking alpha published april 27 2019 bizjournals.com published pfizer spinout springworks nets 125 million vcs glaxosmithkline new york business journal april 01 2019. interesting news pfizer inc. nyse pfe released streetinsider.com article pfizer pfe receives positive chmp opinion talzenna streetinsider.com published april 26 2019 well streetinsider.com news article titled pfizer pfe .
136,they buy,"also increased holding enbridge nyse enb 33,450 shares quarter total 161,386 shares risen stake amazon.com nasdaq amzn ."
137,they sell,lazard asset management llc sold 2.66m shares company stock declined 4.08 stock markets rallied .
138,they buy,stock increased 0.91 0.36 last trading session reaching 39.97 .
139,they buy,"also increased holding turtle beach corp 284,618 shares quarter total 304,760 shares risen stake airgain inc ."
140,they sell,"huber capital management llc sold 155,600 shares company stock declined 4.08 stock markets rallied ."
141,they buy,stock increased 0.91 0.36 last trading session reaching 39.97 .
142,they sell,"683 capital management llc sold 95,000 shares company stock declined 5.32 stock markets rallied ."
143,they buy,historical kr news 08/03/2018 kroger trading activity surges 16 times average 23/05/2018 supermarket chain kroger gobble mealkit seller home chef 30/04/2018 fidelity new millennium adds bat exits kroger 08/03/2018 kroger higher labor costs drove expenses 23/03/2018 truth report target corp kroger co mulling merger 17/05/2018 ocado kroger deal wins sceptics cheers investors 23/05/2018 kroger sees deal slightly adding 2019 earnings 23/03/2018 truth report possible target-kroger merger 23/03/2018 target kroger shares rise merger report source tells cnbc deal 24/04/2018 kroger closes 50-day moving average technicals investors sentiment increased 0.94 2018 q4 .
144,they sell,improved 53 investors sold kr shares 235 reduced holdings .
145,they buy,jpmorgan chase invested 0.06 kroger co. nyse kr .
146,they buy,oklahoma-based bokf na invested 0.02 kroger co. nyse kr .
147,they buy,"manufacturers life insurance 0.03 invested kroger co. nyse kr 874,729 shares ."
