,assoc,values
223,they buy,finally citigroup reduced price objective shares kinder morgan 21.00 20.00 set buy rating stock research note friday july 20th .
224,they sell,one investment analyst rated stock sell rating three assigned hold rating sixteen given buy rating one issued strong buy rating company .
225,they buy,kinder morgan average rating buy average price target 20.81 .
226,they buy,kmi stock traded 0.09 midday trading thursday reaching 17.51 .
227,they buy,"company stock trading volume 19,466,576 shares compared average volume 14,314,321. kinder morgan 52 week low 14.69 52 week high 19.83 ."
228,they buy,stock market cap 39.11 billion pe ratio 26.53 peg ratio 2.51 beta 0.73. company debt-to-equity ratio 1.03 quick ratio 0.41 current ratio 0.49 .
229,they buy,"news director william a. smith purchased 5,556 shares kinder morgan stock transaction dated thursday july 26th ."
230,they buy,"shares bought average cost 18.09 per share total value 100,508.04 ."
231,they buy,"following completion transaction director directly owns 14,587 shares company valued approximately 263,878.83 ."
232,they buy,acquisition disclosed filing sec accessed sec website .
233,they buy,"also insider richard d. kinder purchased 500,000 shares kinder morgan stock transaction dated thursday september 27th ."
234,they sell,"shares purchased average cost 17.55 per share total transaction 8,775,000.00 ."
235,they buy,"following completion transaction insider owns 235,212,353 shares company stock valued 4,127,976,795.15 ."
236,they buy,disclosure purchase found .
237,they buy,company insiders 14.16 company stock .
238,they buy,"keyword kinder morgan nyse kmi kmi oils/energy,49456b10 initiated coverage credit suisse group agratings:4,19 nyse kmi receive news ratings kinder morgan daily enter email address receive concise daily summary latest news analysts ratings kinder morgan related companies marketbeat.com free daily email newsletter ."
239,they buy,"name required kinder morgan inc nyse kmi insider richard d. kinder purchased 500,000 shares firm stock transaction occurred thursday september 27th ."
240,they buy,"shares bought average cost 17.55 per share total value 8,775,000.00 ."
241,they buy,"following completion acquisition insider owns 235,212,353 shares company stock valued 4,127,976,795.15 ."
242,they buy,acquisition disclosed document filed securities exchange commission available link .
243,they buy,shares kmi stock opened 17.51 friday .
244,they buy,kinder morgan inc fifty-two week low 14.69 fifty-two week high 19.83 .
245,they buy,firm market capitalization 39.11 billion pe ratio 26.53 peg ratio 2.51 beta 0.73. company debt-to-equity ratio 1.03 current ratio 0.49 quick ratio 0.41 .
246,they buy,kinder morgan nyse kmi last announced quarterly earnings results wednesday july 18th .
247,they buy,pipeline company reported 0.21 earnings per share quarter beating analysts consensus estimates 0.19 0.02 .
248,they buy,kinder morgan positive return equity 5.07 negative net margin 1.82 .
249,they buy,business revenue 3.43 billion quarter compared analysts expectations 3.42 billion .
250,they sell,quarter last year business posted 0.14 earnings per share .
251,they buy,business revenue quarter 1.8 year-over-year basis .
252,they sell,group sell-side analysts anticipate kinder morgan inc post 0.83 earnings per share current fiscal year .
253,they buy,several hedge funds recently made changes positions company .
254,they buy,"first pacific advisors llc purchased new stake kinder morgan 1st quarter worth 246,833,000 ."
255,they buy,"abrams capital management l.p. purchased new stake kinder morgan 1st quarter worth 127,598,000 ."
256,they buy,tortoise capital advisors l.l.c .
257,they buy,increased position kinder morgan 13.6 2nd quarter .
258,they buy,tortoise capital advisors l.l.c .
259,they buy,"owns 18,255,609 shares pipeline company stock worth 322,577,000 purchasing additional 2,186,054 shares last quarter ."
260,they buy,"point72 asset management l.p. purchased new stake kinder morgan 2nd quarter worth 34,301,000 ."
261,they buy,finally millennium management llc increased position kinder morgan 81.4 2nd quarter .
262,they buy,"millennium management llc owns 3,673,782 shares pipeline company stock worth 64,916,000 purchasing additional 1,648,737 shares last quarter ."
263,they buy,institutional investors hedge funds 60.34 company stock .
264,they buy,"keyword kinder morgan nyse kmi kmi oils/energy,49456b10 insider trading insider trades stocksratings:4,19 nyse kmirefreshed2 receive news ratings kinder morgan daily enter email address receive concise daily summary latest news analysts ratings kinder morgan related companies marketbeat.com free daily email newsletter ."
265,they buy,name required hennessy advisors inc. reduced stake shares kinder morgan inc nyse kmi 6.3 3rd quarter according recent form 13f filing securities exchange commission .
266,they buy,"firm owned 2,699,101 shares pipeline company stock selling 180,000 shares quarter ."
267,they buy,kinder morgan accounts approximately 1.8 hennessy advisors inc. portfolio making stock 6th largest holding .
268,they buy,"hennessy advisors inc. holdings kinder morgan worth 47,855,000 end recent reporting period ."
269,they buy,google_ad_client ca-pub-0703139142419429 google_ad_slot 5621244306 google_ad_width 336 google_ad_height 280 c institutional investors hedge funds also recently modified holdings company .
270,they buy,"flagship harbor advisors llc acquired new position kinder morgan second quarter worth 110,000 ."
271,they buy,"ostrum asset management acquired new position kinder morgan first quarter worth 121,000 ."
272,they buy,"landaas co. wi adv acquired new position kinder morgan second quarter worth 133,000 ."
273,they buy,"mount yale investment advisors llc acquired new position kinder morgan first quarter worth 144,000 ."
274,they buy,finally clal insurance enterprises holdings ltd grew position kinder morgan 100.0 second quarter .
275,they buy,"clal insurance enterprises holdings ltd owns 10,000 shares pipeline company stock worth 177,000 buying additional 5,000 shares period ."
276,they buy,institutional investors 60.34 company stock .
277,they buy,kmi topic several recent analyst reports .
278,they buy,goldman sachs group initiated coverage shares kinder morgan research report monday .
279,they buy,set conviction-buy rating 24.00 target price stock .
280,they buy,sanford c. bernstein upgraded shares kinder morgan market perform rating outperform rating research report tuesday june 26th .
281,they buy,wells fargo co restated buy rating shares kinder morgan research report thursday july 19th .
282,they buy,jpmorgan chase co. upped target price shares kinder morgan 20.00 21.00 gave stock overweight rating research report friday july 27th .
283,they buy,finally stifel nicolaus upped target price shares kinder morgan 21.00 23.00 gave stock buy rating research report wednesday august 1st .
284,they sell,one analyst rated stock sell rating three given hold rating seventeen assigned buy rating one issued strong buy rating company .
285,they buy,kinder morgan average rating buy average target price 21.01 .
286,they buy,shares kmi stock traded 0.57 trading hours wednesday hitting 18.00 .
287,they buy,"company stock trading volume 26,093,300 shares compared average volume 14,228,164. firm market capitalization 39.11 billion pe ratio 28.10 p/e/g ratio 2.51 beta 0.73. kinder morgan inc twelve month low 14.69 twelve month high 19.83 ."
288,they buy,company debt-to-equity ratio 1.03 current ratio 0.49 quick ratio 0.41 .
289,they buy,kinder morgan nyse kmi last released quarterly earnings results wednesday july 18th .
290,they buy,pipeline company reported 0.21 eps quarter beating consensus estimate 0.19 0.02 .
291,they buy,business revenue 3.43 billion quarter compared analyst estimates 3.42 billion .
292,they buy,kinder morgan negative net margin 1.82 positive return equity 5.07 .
293,they buy,company quarterly revenue 1.8 year-over-year basis .
294,they buy,period prior year business earned 0.14 earnings per share .
295,they sell,group sell-side analysts anticipate kinder morgan inc post 0.83 earnings per share current year .
296,they buy,kinder morgan company profile kinder morgan inc operates energy infrastructure company north america .
297,they buy,operates natural gas pipelines co2 terminals products pipelines kinder morgan canada segments .
298,they buy,natural gas pipelines segment owns operates interstate intrastate natural gas pipeline storage systems natural gas crude oil gathering systems natural gas processing treating facilities natural gas liquids ngl fractionation facilities transportation systems liquefied natural gas facilities .
299,they buy,want see hedge funds holding kmi visit holdingschannel.com get latest 13f filings insider trades kinder morgan inc nyse kmi .
300,they buy,google_ad_client ca-pub-0703139142419429 google_ad_slot 1418630638 google_ad_width 336 google_ad_height 280 brokerages expect kinder morgan inc nyse kmi post 3.53 billion sales current fiscal quarter zacks investment research reports .
301,they buy,two analysts provided estimates kinder morgan earnings .
302,they buy,highest sales estimate 3.61 billion lowest 3.46 billion .
303,they buy,kinder morgan reported sales 3.28 billion quarter last year would suggest positive year-over-year growth rate 7.6 .
304,they buy,business expected report next quarterly earnings report market closes wednesday october 17th .
305,they buy,average analysts expect kinder morgan report full year sales 14.37 billion current year estimates ranging 14.00 billion 14.80 billion .
306,they buy,next financial year analysts anticipate company post sales 15.00 billion estimates ranging 14.39 billion 15.47 billion .
307,they sell,zacks sales calculations average based survey sell-side research analysts cover kinder morgan .
308,they buy,kinder morgan nyse kmi last released quarterly earnings data wednesday july 18th .
309,they buy,pipeline company reported 0.21 earnings per share quarter beating consensus estimate 0.19 0.02 .
310,they buy,kinder morgan positive return equity 5.07 negative net margin 1.82 .
311,they buy,company revenue 3.43 billion quarter compared analyst estimates 3.42 billion .
312,they buy,period prior year company posted 0.14 eps .
313,they buy,company revenue 1.8 compared quarter last year .
314,they buy,shares kmi stock traded 0.14 trading hours tuesday hitting 17.56 .
315,they buy,"company trading volume 227,900 shares compared average volume 14,286,448. kinder morgan 12 month low 14.69 12 month high 19.83 ."
316,they buy,firm market cap 39.11 billion p/e ratio 26.63 p/e/g ratio 2.51 beta 0.73. company current ratio 0.49 quick ratio 0.41 debt-to-equity ratio 1.03 .
317,they buy,"kinder morgan news director william a. smith purchased 5,556 shares firm stock transaction occurred thursday july 26th ."
318,they sell,"shares acquired average cost 18.09 per share total transaction 100,508.04 ."
319,they buy,"following transaction director directly owns 14,587 shares company valued 263,878.83 ."
320,they buy,purchase disclosed document filed securities exchange commission accessible link .
321,they buy,"also insider richard d. kinder acquired 500,000 shares firm stock transaction thursday september 27th ."
322,they buy,"stock purchased average price 17.55 per share total transaction 8,775,000.00 ."
323,they buy,"following completion transaction insider directly owns 235,212,353 shares company valued approximately 4,127,976,795.15 ."
324,they buy,disclosure purchase found .
325,they buy,14.16 stock owned corporate insiders .
326,they buy,institutional investors hedge funds recently made changes positions business .
327,they buy,"flagship harbor advisors llc bought new position kinder morgan 2nd quarter valued 110,000 ."
328,they buy,"ostrum asset management bought new position kinder morgan 1st quarter valued 121,000 ."
329,they buy,"landaas co. wi adv bought new position kinder morgan 2nd quarter valued 133,000 ."
330,they buy,"mount yale investment advisors llc bought new position kinder morgan 1st quarter valued 144,000 ."
331,they buy,finally clal insurance enterprises holdings ltd boosted position kinder morgan 100.0 2nd quarter .
332,they buy,"clal insurance enterprises holdings ltd owns 10,000 shares pipeline company stock valued 177,000 buying additional 5,000 shares last quarter ."
333,they buy,hedge funds institutional investors 60.34 company stock .
334,they buy,"see also insider trading need knowviewcount articlehistoryid=25220558 postdate=2018-10-12 type=c secondary=1 id=487054keyword kinder morgan nyse kmi kmi oils/energy,49456b10 ratings consensusratings:4,20 nyse kmi get free copy zacks research report kinder morgan kmi information research offerings zacks investment research visit zacks.com brokerages forecast kinder morgan inc nyse kmi report 0.20 earnings per share eps current quarter zacks investment research reports ."
335,they buy,two analysts issued estimates kinder morgan earnings .
336,they buy,lowest eps estimate 0.18 highest 0.22 .
337,they buy,kinder morgan reported earnings 0.15 per share quarter last year would suggest positive year year growth rate 33.3 .
338,they buy,firm expected issue next quarterly earnings report market closes wednesday october 17th .
339,they buy,according zacks analysts expect kinder morgan report full-year earnings 0.86 per share current financial year eps estimates ranging 0.84 0.91 .
340,they sell,next fiscal year analysts anticipate company post earnings 0.98 per share eps estimates ranging 0.90 1.11 .
341,they sell,zacks eps averages average based survey sell-side research analysts follow kinder morgan .
342,they buy,kinder morgan nyse kmi last issued quarterly earnings results wednesday july 18th .
343,they buy,pipeline company reported 0.21 earnings per share eps quarter topping thomson reuters consensus estimate 0.19 0.02 .
344,they buy,kinder morgan negative net margin 1.82 positive return equity 5.07 .
345,they buy,company revenue 3.43 billion quarter compared analyst estimates 3.42 billion .
346,they buy,quarter last year business posted 0.14 eps .
347,they buy,kinder morgan quarterly revenue 1.8 compared quarter last year .
348,they buy,shares kmi stock traded 0.14 trading hours friday hitting 17.56 .
349,they buy,"227,900 shares company exchanged compared average volume 14,286,448. company quick ratio 0.41 current ratio 0.49 debt-to-equity ratio 1.03. kinder morgan 52-week low 14.69 52-week high 19.83 ."
350,they buy,firm market cap 39.11 billion p/e ratio 26.63 peg ratio 2.51 beta 0.73 .
351,they buy,"kinder morgan news director william a. smith acquired 5,556 shares kinder morgan stock transaction occurred thursday july 26th ."
352,they buy,"stock acquired average cost 18.09 per share total transaction 100,508.04 ."
353,they buy,"following purchase director owns 14,587 shares company stock valued 263,878.83 ."
354,they buy,acquisition disclosed legal filing securities exchange commission accessed sec website .
355,they buy,"also insider richard d. kinder acquired 500,000 shares kinder morgan stock transaction occurred thursday september 27th ."
356,they sell,"stock acquired average price 17.55 per share total value 8,775,000.00 ."
357,they buy,"following completion purchase insider directly owns 235,212,353 shares company valued approximately 4,127,976,795.15 ."
358,they buy,disclosure purchase found .
359,they buy,14.16 stock currently owned insiders .
360,they buy,number institutional investors recently added reduced stakes kmi .
361,they buy,"flagship harbor advisors llc purchased new position shares kinder morgan 2nd quarter valued 110,000 ."
362,they buy,"ostrum asset management purchased new position shares kinder morgan 1st quarter valued 121,000 ."
363,they buy,"landaas co. wi adv purchased new position shares kinder morgan 2nd quarter valued 133,000 ."
364,they buy,"mount yale investment advisors llc purchased new position shares kinder morgan 1st quarter valued 144,000 ."
365,they buy,finally clal insurance enterprises holdings ltd grew position shares kinder morgan 100.0 2nd quarter .
366,they buy,"clal insurance enterprises holdings ltd owns 10,000 shares pipeline company stock valued 177,000 purchasing additional 5,000 shares last quarter ."
367,they buy,institutional investors hedge funds 60.34 company stock .
368,they buy,kinder morgan company profile kinder morgan inc operates energy infrastructure company north america .
369,they buy,operates natural gas pipelines co2 terminals products pipelines kinder morgan canada segments .
370,they buy,natural gas pipelines segment owns operates interstate intrastate natural gas pipeline storage systems natural gas crude oil gathering systems natural gas processing treating facilities natural gas liquids ngl fractionation facilities transportation systems liquefied natural gas facilities .
371,they buy,"featured article book value per share bvpsviewcount articlehistoryid=25220561 postdate=2018-10-12 type=c tertiary=1 id=487053keyword kinder morgan nyse kmi kmi oils/energy,49456b10 ratings consensusratings:4,20 nyse kmi get free copy zacks research report kinder morgan kmi information research offerings zacks investment research visit zacks.com kinder morgan nyse kmi scheduled posting quarterly earnings results market closes wednesday october 17th ."
372,they buy,analysts expect kinder morgan post earnings 0.20 per share quarter .
373,they buy,kinder morgan nyse kmi last issued quarterly earnings data wednesday july 18th .
374,they buy,pipeline company reported 0.21 eps quarter topping analysts consensus estimates 0.19 0.02 .
375,they buy,kinder morgan negative net margin 1.82 positive return equity 5.07 .
376,they buy,firm revenue 3.43 billion quarter compared analyst estimates 3.42 billion .
377,they buy,quarter previous year business posted 0.14 eps .
378,they buy,firm revenue 1.8 compared quarter last year .
379,they buy,average analysts expect kinder morgan post 1 eps current fiscal year 1 eps next fiscal year .
380,they buy,shares kmi stock opened 17.53 friday .
381,they buy,firm market capitalization 39.11 billion price-to-earnings ratio 26.56 peg ratio 2.51 beta 0.73. kinder morgan 12 month low 14.69 12 month high 19.83 .
382,they buy,company current ratio 0.49 quick ratio 0.41 debt-to-equity ratio 1.03 .
383,they buy,several equities research analysts recently weighed stock .
384,they buy,credit suisse group assumed coverage shares kinder morgan research report thursday .
385,they buy,issued outperform rating 23.00 target price company .
386,they buy,goldman sachs group assumed coverage shares kinder morgan research report monday .
387,they buy,issued conviction-buy rating 24.00 target price company .
388,they sell,valuengine raised shares kinder morgan strong sell rating sell rating research report wednesday august 15th .
389,they buy,stifel nicolaus boosted target price shares kinder morgan 21.00 23.00 gave stock buy rating research report wednesday august 1st .
390,they buy,finally jpmorgan chase co. boosted target price shares kinder morgan 20.00 21.00 gave stock overweight rating research report friday july 27th .
391,they sell,one investment analyst rated stock sell rating three given hold rating seventeen issued buy rating one assigned strong buy rating stock .
392,they buy,stock average rating buy average target price 21.07 .
393,they buy,"keyword kinder morgan nyse kmi kmi oils/energy,49456b10 earningsratings:4,20 nyse kmi receive news ratings kinder morgan daily enter email address receive concise daily summary latest news analysts ratings kinder morgan related companies marketbeat.com free daily email newsletter ."
394,they buy,name required expected sep 2018 quarter kmi eps 0.2 dec 2018 projected 0.24 .
395,they buy,means could 33.33 14.29 growth two quarters respectively .
396,they buy,yearly earnings expected rise 25.76 0.83 .
397,they buy,coming year growth 18.07 lifting earnings 0.98 .
398,they buy,rsi last trading period 39.9. kmi recorded change past week returned last three months kmi stock monthly performance revealed shift price .
399,they buy,year date ytd performance stands bi-yearly performance specified activity trend 13.63 shares moved past 12 months .
400,they buy,kinder morgan inc. nyse kmi eps 0.19 reported june quarter .
401,they buy,comparison quarter year ago eps 0.14 .
402,they buy,means growth general stands 36 .
403,they buy,therefore prediction 0.19 given analysts brought negative surprise 0 .
404,they buy,kmi jun 18 quarter revenue 3.43 billion compared 3.37 billion recorded quarter last year giving 2 growth rate .
405,they buy,company 0.06 billion revenue growth quarter surprised wall street investors need consider assess stock .
406,they buy,kinder morgan inc. kmi currently trades 17.42 lower previous price .
407,they buy,total 2.23 billion million outstanding shares atr around 0.38. company stock volume rose 25.67 million better 11.7 million represents 50-day average .
408,they buy,5-day decrease price means kmi lower year-to-date .
409,they buy,shares surrendered 43175.58 since 19.83 52-week high price recorded 16th january 2018. overall seen growth rate last 12 months .
410,they buy,current price per share 2.73 52 week low 14.69 set 3rd april 2018 .
411,they sell,16 analysts 20 wall street brokerage firms rate kmi stock buy 0 see sell .
412,they buy,rest 4 describe hold .
413,they buy,stock traded higher intra-day high 17.94 .
414,they buy,one point session potential discontinued price lows 17.34 .
415,they buy,analysts set kmi consensus price 21.29 effectively giving 22.22 projection returns .
416,they buy,projected estimates met stock likely hit highest price 26 49.25 current price levels .
417,they buy,kmi roe lower 5.69 average industry .
418,they buy,average roe sector 17.74 .
419,they buy,southwestern energy company nyse swn shares depreciated last trading period taking overall 5-day performance 0.95 .
420,they buy,kmi price 5.32 weaker 50-day average 5.32 .
421,they buy,getting trading period increased 200 days stock price seen 4.85 average .
422,they buy,general public currently hold control total 583.32 million shares number publicly available trading .
423,they buy,total shares issued investors 585.19 million .
424,they buy,company management holds total 0.2 institutional investors hold 93.4 remaining shares .
425,they buy,kmi share price finished last trade 20 day simple moving average upbeat gap 200 day simple moving average 9.73 closing session 0.03 distance 50 day simple moving average .
426,they buy,southwestern energy company swn shares last observed trading since november 10 2017 peak 6.72 hit .
427,they buy,last month price growth 4.93 puts swn performance year .
428,they buy,consequently shares price trending higher 55.56 52-week worst price since feb. 09 2018. however regaining value 18.49 last 6 months .
429,they buy,technical perspective appears likely stock experience bull run market result strong support seen recently 5.1 5.21 .
430,they buy,immediate resistance area 5.5 williams r 14 swn moved 67.95 stochastic k points 58.12 .
431,they buy,swn beta 0.86 meaning investors could reap lower returns although also poses lower risks .
432,they buy,company allocated 1.06 per share yearly profit outstanding shares .
433,they buy,last reported revenue 816 million 1 versus 811 million corresponding quarter last year .
434,they buy,eps jun 18 quarter came 0.18 compared 0.08 year-ago quarter represented 125 year-over-year earnings per share growth .
435,they buy,swn roa 7.7 higher 1.72 industry average .
436,they buy,although robust percentage would better consideration given well peers within industry performed .
437,they buy,companies within sector roa 10.65 .
438,they buy,verition fund management llc trimmed holdings shares kinder morgan inc nyse kmi 76.5 2nd quarter according company recent 13f filing securities exchange commission sec .
439,they buy,"firm owned 12,500 shares pipeline company stock selling 40,743 shares quarter ."
440,they buy,"verition fund management llc holdings kinder morgan worth 221,000 recent sec filing ."
441,they buy,several hedge funds also made changes positions company .
442,they buy,ashford capital management inc. grew holdings kinder morgan 37.3 2nd quarter .
443,they buy,"ashford capital management inc. owns 32,848 shares pipeline company stock valued 580,000 buying additional 8,920 shares last quarter ."
444,they buy,california public employees retirement system grew holdings kinder morgan 3.1 2nd quarter .
445,they buy,"california public employees retirement system owns 4,639,878 shares pipeline company stock valued 81,987,000 buying additional 141,666 shares last quarter ."
446,they buy,richmond hill investment co. lp grew holdings kinder morgan 63.3 2nd quarter .
447,they buy,"richmond hill investment co. lp owns 370,571 shares pipeline company stock valued 6,548,000 buying additional 143,608 shares last quarter ."
448,they buy,richmond hill investments llc grew holdings kinder morgan 59.7 2nd quarter .
449,they buy,"richmond hill investments llc owns 1,025,469 shares pipeline company stock valued 18,120,000 buying additional 383,392 shares last quarter ."
450,they buy,finally griffin asset management inc. grew holdings kinder morgan 4.8 2nd quarter .
451,they buy,"griffin asset management inc. owns 62,625 shares pipeline company stock valued 1,107,000 buying additional 2,867 shares last quarter ."
452,they buy,60.34 stock owned institutional investors hedge funds .
453,they buy,kmi stock opened 17.42 friday .
