,assoc,values
454,they buy,company current ratio 0.49 quick ratio 0.41 debt-to-equity ratio 1.03. stock market capitalization 39.11 billion price-to-earnings ratio 26.39 p/e/g ratio 2.51 beta 0.73. kinder morgan inc 1 year low 14.69 1 year high 19.83 .
455,they buy,"related news director william a. smith purchased 5,556 shares kinder morgan stock transaction thursday july 26th ."
456,they buy,"shares bought average price 18.09 per share total value 100,508.04 ."
457,they buy,"following transaction director directly owns 14,587 shares company stock valued 263,878.83 ."
458,they buy,transaction disclosed document filed securities exchange commission available sec website .
459,they buy,"also insider richard d. kinder purchased 500,000 shares kinder morgan stock transaction thursday september 27th ."
460,they buy,"stock bought average cost 17.55 per share total transaction 8,775,000.00 ."
461,they buy,"following transaction insider directly owns 235,212,353 shares company valued 4,127,976,795.15 ."
462,they buy,disclosure purchase found .
463,they buy,14.16 stock owned company insiders .
464,they buy,"keyword kinder morgan nyse kmi kmi oils/energy,49456b10 sec filings,13f hedge fund holdings institutional investor holdingsratings:4,20 nyse kmirefreshed1 receive news ratings kinder morgan daily enter email address receive concise daily summary latest news analysts ratings kinder morgan related companies marketbeat.com free daily email newsletter ."
465,they buy,"10,695 shares acadia pharmaceuticals inc. nasdaq acad purchased verition fund management llc btr capital management inc. raised holdings shares kinder morgan inc nyse kmi 1.5 3rd quarter according recent filing securities exchange commission ."
466,they buy,"institutional investor owned 420,059 shares pipeline company stock acquiring additional 6,047 shares quarter ."
467,they buy,"btr capital management inc. holdings kinder morgan worth 7,448,000 end recent reporting period ."
468,they buy,several institutional investors hedge funds also modified holdings kmi .
469,they buy,"flagship harbor advisors llc acquired new stake shares kinder morgan second quarter worth 110,000 ."
470,they buy,"ostrum asset management acquired new stake shares kinder morgan first quarter worth 121,000 ."
471,they buy,"landaas co. wi adv acquired new stake shares kinder morgan second quarter worth 133,000 ."
472,they buy,"mount yale investment advisors llc acquired new stake shares kinder morgan first quarter worth 144,000 ."
473,they buy,finally clal insurance enterprises holdings ltd lifted holdings shares kinder morgan 100.0 second quarter .
474,they buy,"clal insurance enterprises holdings ltd owns 10,000 shares pipeline company stock worth 177,000 buying additional 5,000 shares last quarter ."
475,they buy,60.34 stock owned institutional investors .
476,they buy,"related news insider richard d. kinder acquired 500,000 shares business stock transaction occurred thursday september 27th ."
477,they buy,"shares bought average cost 17.55 per share total value 8,775,000.00 ."
478,they buy,"following completion purchase insider directly owns 235,212,353 shares company valued 4,127,976,795.15 ."
479,they buy,purchase disclosed filing securities exchange commission available sec website .
480,they buy,"also director william a. smith acquired 5,556 shares business stock transaction occurred thursday july 26th ."
481,they buy,"stock bought average cost 18.09 per share total transaction 100,508.04 ."
482,they buy,"following completion purchase director owns 14,587 shares company stock valued 263,878.83 ."
483,they buy,disclosure purchase found .
484,they buy,14.16 stock owned insiders .
485,they buy,kinder morgan nyse kmi last posted quarterly earnings data wednesday july 18th .
486,they buy,pipeline company reported 0.21 eps quarter topping zacks consensus estimate 0.19 0.02 .
487,they buy,company revenue 3.43 billion quarter compared analyst estimates 3.42 billion .
488,they buy,kinder morgan positive return equity 5.07 negative net margin 1.82 .
489,they buy,firm quarterly revenue 1.8 year-over-year basis .
490,they sell,period previous year firm earned 0.14 earnings per share .
491,they sell,average sell-side analysts predict kinder morgan inc post 0.83 earnings per share current fiscal year .
492,they buy,number equities research analysts recently weighed kmi shares .
493,they buy,wells fargo co raised kinder morgan market perform rating buy rating report wednesday june 20th .
494,they buy,sanford c. bernstein upgraded kinder morgan market perform rating outperform rating research report tuesday june 26th .
495,they buy,raymond james upgraded kinder morgan market perform rating outperform rating research report monday june 18th .
496,they buy,stifel nicolaus raised price target kinder morgan 21.00 23.00 gave stock buy rating research report wednesday august 1st .
497,they sell,finally valuengine upgraded kinder morgan strong sell rating sell rating research report wednesday august 15th .
498,they sell,one equities research analyst rated stock sell rating three assigned hold rating seventeen issued buy rating one given strong buy rating company .
499,they buy,kinder morgan average rating buy average price target 21.07 .
500,they buy,kinder morgan company profile kinder morgan inc operates energy infrastructure company north america .
501,they buy,operates natural gas pipelines co2 terminals products pipelines kinder morgan canada segments .
502,they buy,natural gas pipelines segment owns operates interstate intrastate natural gas pipeline storage systems natural gas crude oil gathering systems natural gas processing treating facilities natural gas liquids ngl fractionation facilities transportation systems liquefied natural gas facilities .
503,they buy,"keyword kinder morgan nyse kmi kmi oils/energy,49456b10 sec filings,13f hedge fund holdings institutional investor holdingsratings:4,20 nyse kmirefreshed1 receive news ratings kinder morgan daily enter email address receive concise daily summary latest news analysts ratings kinder morgan related companies marketbeat.com free daily email newsletter ."
504,they buy,ishares p 500 value etf ive etf portfolio partners inc. 5th largest position american national bank cut position shares kinder morgan inc nyse kmi 13.2 third quarter according company recent disclosure securities exchange commission sec .
505,they buy,"institutional investor owned 194,389 shares pipeline company stock selling 29,614 shares quarter ."
506,they buy,"american national bank holdings kinder morgan worth 3,447,000 end recent quarter ."
507,they buy,several hedge funds institutional investors also recently modified holdings company .
508,they buy,american research management co. grew holdings shares kinder morgan 7.6 third quarter .
509,they buy,"american research management co. owns 46,210 shares pipeline company stock worth 819,000 buying additional 3,252 shares last quarter ."
510,they buy,"centre asset management llc purchased new stake kinder morgan third quarter valued approximately 557,000 ."
511,they buy,"old port advisors purchased new stake kinder morgan second quarter valued approximately 420,000 ."
512,they buy,"royal london asset management ltd. purchased new stake kinder morgan second quarter valued approximately 14,570,000 ."
513,they buy,"finally bdo wealth advisors llc grew holdings kinder morgan 3,803.4 second quarter ."
514,they buy,"bdo wealth advisors llc owns 25,450 shares pipeline company stock valued 450,000 purchasing additional 24,798 shares period ."
515,they buy,institutional investors hedge funds 60.34 company stock .
516,they buy,kmi subject number recent analyst reports .
517,they buy,goldman sachs group initiated coverage shares kinder morgan report monday .
518,they buy,issued conviction-buy rating 24.00 target price company .
519,they buy,sanford c. bernstein upgraded shares kinder morgan market perform rating outperform rating report tuesday june 26th .
520,they buy,wells fargo co restated buy rating shares kinder morgan report thursday july 19th .
521,they buy,jpmorgan chase co. boosted target price shares kinder morgan 20.00 21.00 gave company overweight rating report friday july 27th .
522,they buy,finally stifel nicolaus boosted target price shares kinder morgan 21.00 23.00 gave company buy rating report wednesday august 1st .
523,they sell,one investment analyst rated stock sell rating three issued hold rating seventeen assigned buy rating one given strong buy rating company .
524,they buy,company presently consensus rating buy consensus target price 21.07 .
525,they buy,kinder morgan nyse kmi last announced quarterly earnings results wednesday july 18th .
526,they buy,pipeline company reported 0.21 earnings per share quarter beating analysts consensus estimates 0.19 0.02 .
527,they buy,kinder morgan negative net margin 1.82 positive return equity 5.07 .
528,they buy,firm revenue 3.43 billion quarter compared analysts expectations 3.42 billion .
529,they buy,period previous year company posted 0.14 earnings per share .
530,they buy,kinder morgan revenue 1.8 compared quarter last year .
531,they buy,average equities analysts forecast kinder morgan inc post 0.83 eps current fiscal year .
532,they buy,"news director william a. smith bought 5,556 shares kinder morgan stock transaction dated thursday july 26th ."
533,they buy,"shares acquired average cost 18.09 per share total value 100,508.04 ."
534,they buy,"following completion transaction director owns 14,587 shares company valued approximately 263,878.83 ."
535,they buy,purchase disclosed document filed sec accessed sec website .
536,they buy,"also insider richard d. kinder bought 500,000 shares kinder morgan stock transaction dated thursday september 27th ."
537,they sell,"shares purchased average cost 17.55 per share total transaction 8,775,000.00 ."
538,they buy,"following completion transaction insider owns 235,212,353 shares company stock valued approximately 4,127,976,795.15 ."
539,they buy,disclosure purchase found .
540,they buy,insiders 14.16 company stock .
541,they buy,"kinder morgan profile keyword kinder morgan nyse kmi kmi oils/energy,49456b10 sec filings,13f hedge fund holdings institutional investor holdingsratings:4,20 nyse kmirefreshed1 receive news ratings kinder morgan daily enter email address receive concise daily summary latest news analysts ratings kinder morgan related companies marketbeat.com free daily email newsletter ."
542,they buy,matomy media group mtmy sets new 1-year low 26.00 taking everything account kinder morgan inc. nyse kmi scores 64 buy technical side .
543,they buy,stock also flashing buy barchart trendspotter trading system .
544,they buy,traders hoping speculate kmi short-term trajectory know short terms indicators stock averaged 20 buy average daily trading volume past 20 days 12952165 shares .
545,they buy,kmi stock overall 0.75 buy signal considering medium term indicators 50-day average daily volume remained almost 11595930 shares .
546,they buy,also worth noting stock whose average daily volume 100 days prior writing shares 100 buy basis long term indicators .
547,they buy,share price currently staying around first support level 17.76 .
548,they buy,next support placed zone 17.53 .
549,they buy,till time kmi stock trades level bulls nothing fear .
550,they buy,momentum oscillators front rsi touched 49.43 daily chart may remain cause concern .
551,they buy,price breaks 17.53 level closing basis may see profit booking stock may show weakness .
552,they buy,flipside hitting 18.45 mark may result pull-back move towards 18.91 level .
553,they buy,kinder morgan inc. kmi projected climb 18.28 percent next 12 months according price target estimates compiled finviz .
554,they buy,meanwhile set 26-month high price target .
555,they buy,represents whopping 44.44 percent increase shares trading today .
556,they buy,12-month median price target assigned analysts stands 21 represents return potential 16.67 percent compared closing price stock 18 wednesday october 10. lowest price target stock 19 slightly 5.56 percent kmi current share price .
557,they buy,rundown insider trading activity sense kinder morgan inc. nyse kmi .
558,they buy,earliest insider trade took place 09/27/2018 .
559,they sell,kinder richard gathered total 500 thousand shares company average share price 17.55 .
560,they buy,total purchase set 8.78 million .
561,they buy,transaction executive chairman 10 owner account balance stood 246 million shares .
562,they buy,stock grew 2.56 percent since insider purchase .
563,they buy,07/26/2018 smith william director purchased 5.56 thousand shares price per share 18.09 .
564,they buy,added 100.51 thousand shares insider fortune stock saw percent retreat value since news became public .
565,they buy,transaction left 34.17 thousand shares director account .
566,they buy,01/22/2018 director smith william performed purchase transaction worth 107.36 thousand .
567,they buy,purchase 19.52 added 5.5 thousand shares insider portfolio position .
568,they buy,meanwhile shares recorded percent decrease since transaction reported .
569,they buy,insider left 28.61 thousand shares remaining account .
570,they buy,martin thomas performs v.p job bought 3 thousand shares 51.3 thousand .
571,they buy,acquisition occurred 12/05/2017 priced 17.1 per share .
572,they buy,share price soared 5.26 percent since reporting date .
573,they buy,martin thomas left stake 1.15 million kmi stock worth 20.65 million insider buying .
574,they buy,kmi shares dropped points percent wednesday 18 heavy trade volume 25.956 million shares .
575,they buy,opening session 18.57 shares went high 18.67 low 17.98 range within stock price traded throughout day .
576,they buy,firm left market cap 40.2 billion 2.23 billion shares outstanding .
577,they buy,kinder morgan inc. kmi stock lost percent market value 21 trading days .
578,they buy,analysts bernstein upped rating shares kinder morgan inc. nyse kmi mkt perform outperform opinion released june 26. wells fargo analysts bumped recommendation kmi stock market perform outperform separate flash note investors june 18. analysts citigroup issued upgrade neutral buy stock research note dated back march 27 .
579,they buy,kmi stock trailing 3-year beta 0.72 offering possibility lower rate return also posing less risk .
580,they sell,portion company profit allocated outstanding share common stock 0.76 share trailing twelve months .
581,they buy,stock value fallen percent year date ytd decline percent 12 month time .
582,they buy,company shares still trade percent away 1-year high 19.83 22.53 percent 52-week low 14.69 .
583,they sell,average consensus rating company 1.7 scale 5 equates unanimous sell rating .
584,they buy,short mean analyst recommendations calling stock buy .
585,they buy,shares kinder morgan inc. kmi trading p/e ratio 62.3 times earnings reported past 12 months .
586,they buy,industry kmi operates average p/e 43.13. p/e ratio went low 31.16x high 144.14 5-year span .
587,they buy,sporting 2.92 price-to-sales ratio .
588,they buy,compare industry average p/s 3.04 .
589,they buy,49.7 percent gross profit margin kinder morgan inc. operating margin sits 17.8 percent .
590,they buy,along net profit margin percent .
591,they buy,analysts forecasting revenue climb 7.4 percent 3.52b next fiscal quarter earnings seen soaring nearly 40 percent 0.21 per share .
592,they buy,history shown shares kinder morgan inc. gone 19 different earnings reaction days predicted add 0.02 percent company reports upcoming earnings .
593,they buy,last reported earnings results earned 0.2 per share better 0.19 adjusted expected thomson reuters consensus estimate .
594,they buy,revenue 3.43b worse 3.59b analysts expected .
595,they buy,earnings estimated increase percent year 12.18 percent next year continue increase 12 percent annually next 5 years .
596,they buy,ky skyscr adsbygoogle window.adsbygoogle .push personal capital advisors corp increased holdings kinder morgan inc nyse kmi 6.2 3rd quarter holdingschannel reports .
597,they buy,"fund owned 2,289,385 shares pipeline company stock buying additional 134,608 shares quarter ."
598,they buy,"personal capital advisors corp holdings kinder morgan worth 40,591,000 recent sec filing ."
599,they buy,google_ad_client ca-pub-0703139142419429 google_ad_slot 5621244306 google_ad_width 336 google_ad_height 280 c several institutional investors also modified holdings kmi .
600,they buy,"flagship harbor advisors llc bought new stake kinder morgan 2nd quarter valued 110,000 ."
601,they buy,"ostrum asset management bought new stake kinder morgan 1st quarter valued 121,000 ."
602,they buy,"landaas co. wi adv bought new stake kinder morgan 2nd quarter valued 133,000 ."
603,they buy,"mount yale investment advisors llc bought new stake kinder morgan 1st quarter valued 144,000 ."
604,they buy,finally clal insurance enterprises holdings ltd increased stake kinder morgan 100.0 2nd quarter .
605,they buy,"clal insurance enterprises holdings ltd owns 10,000 shares pipeline company stock valued 177,000 purchasing additional 5,000 shares last quarter ."
606,they buy,institutional investors 60.34 company stock .
607,they buy,shares kmi stock traded 0.36 trading hours tuesday reaching 18.57 .
608,they buy,"company trading volume 16,061,900 shares compared average volume 14,167,383. kinder morgan inc one year low 14.69 one year high 19.83 ."
609,they buy,firm market capitalization 39.11 billion pe ratio 27.75 p/e/g ratio 2.51 beta 0.73. company quick ratio 0.41 current ratio 0.49 debt-to-equity ratio 1.03 .
610,they buy,kinder morgan nyse kmi last announced quarterly earnings results wednesday july 18th .
611,they buy,pipeline company reported 0.21 eps quarter topping analysts consensus estimates 0.19 0.02 .
612,they buy,kinder morgan negative net margin 1.82 positive return equity 5.07 .
613,they buy,firm revenue 3.43 billion quarter compared analyst estimates 3.42 billion .
614,they sell,period previous year business posted 0.14 earnings per share .
615,they buy,business revenue quarter 1.8 year-over-year basis .
616,they sell,analysts anticipate kinder morgan inc post 0.83 earnings per share current year .
617,they buy,number research firms weighed kmi .
618,they buy,goldman sachs group began coverage shares kinder morgan research note monday .
619,they buy,set conviction-buy rating 24.00 price objective company .
620,they buy,wells fargo co restated buy rating shares kinder morgan research note thursday july 19th .
621,they buy,jpmorgan chase co. raised price objective shares kinder morgan 20.00 21.00 gave company overweight rating research note friday july 27th .
622,they buy,citigroup reduced price objective shares kinder morgan 21.00 20.00 set buy rating company research note friday july 20th .
623,they buy,finally us capital advisors restated buy rating shares kinder morgan research note tuesday july 17th .
624,they sell,one analyst rated stock sell rating three issued hold rating seventeen given buy rating one given strong buy rating company .
625,they buy,kinder morgan average rating buy consensus price target 21.01 .
626,they buy,"related news insider richard d. kinder purchased 500,000 shares kinder morgan stock transaction dated thursday september 27th ."
627,they sell,"stock purchased average cost 17.55 per share total transaction 8,775,000.00 ."
628,they buy,"following completion purchase insider directly owns 235,212,353 shares company stock valued approximately 4,127,976,795.15 ."
629,they buy,purchase disclosed document filed sec available hyperlink .
630,they buy,"also director william a. smith purchased 5,556 shares kinder morgan stock transaction dated thursday july 26th ."
631,they buy,"stock bought average price 18.09 per share total value 100,508.04 ."
632,they buy,"following completion purchase director directly owns 14,587 shares company stock valued 263,878.83 ."
633,they buy,disclosure purchase found .
634,they buy,insiders 14.16 company stock .
635,they buy,kinder morgan profile want see hedge funds holding kmi visit holdingschannel.com get latest 13f filings insider trades kinder morgan inc nyse kmi .
636,they buy,google_ad_client ca-pub-0703139142419429 google_ad_slot 1418630638 google_ad_width 336 google_ad_height 280 centre asset management llc purchased new position kinder morgan inc nyse kmi third quarter according recent 13f filing securities exchange commission sec .
637,they buy,"firm purchased 31,420 shares pipeline company stock valued approximately 557,000 ."
638,they sell,number large investors also recently bought sold shares business .
639,they buy,tortoise capital advisors l.l.c .
640,they buy,grew holdings shares kinder morgan 13.6 second quarter .
641,they buy,tortoise capital advisors l.l.c .
642,they buy,"owns 18,255,609 shares pipeline company stock valued 322,577,000 buying additional 2,186,054 shares last quarter ."
643,they buy,dimensional fund advisors lp grew holdings shares kinder morgan 2.1 second quarter .
644,they buy,"dimensional fund advisors lp owns 15,483,633 shares pipeline company stock valued 273,561,000 buying additional 322,787 shares last quarter ."
645,they buy,legal general group plc grew holdings shares kinder morgan 0.7 second quarter .
646,they buy,"legal general group plc owns 11,028,849 shares pipeline company stock valued 194,841,000 buying additional 80,214 shares last quarter ."
647,they buy,russell investments group ltd. grew holdings shares kinder morgan 4.0 second quarter .
648,they buy,"russell investments group ltd. owns 9,914,182 shares pipeline company stock valued 174,778,000 buying additional 381,663 shares last quarter ."
649,they buy,finally putnam investments llc grew holdings shares kinder morgan 8.6 second quarter .
650,they buy,"putnam investments llc owns 9,255,454 shares pipeline company stock valued 163,544,000 buying additional 730,488 shares last quarter ."
651,they buy,institutional investors hedge funds 60.34 company stock .
652,they sell,"kinder morgan news director william a. smith purchased 5,556 shares stock transaction dated thursday july 26th ."
653,they buy,"shares bought average price 18.09 per share total value 100,508.04 ."
654,they buy,"following completion transaction director directly owns 14,587 shares company valued approximately 263,878.83 ."
655,they buy,transaction disclosed filing sec accessed hyperlink .
656,they sell,"also insider richard d. kinder purchased 500,000 shares stock transaction dated thursday september 27th ."
657,they sell,"stock acquired average cost 17.55 per share total transaction 8,775,000.00 ."
658,they buy,"following transaction insider owns 235,212,353 shares company stock valued 4,127,976,795.15 ."
659,they buy,disclosure purchase found .
660,they buy,insiders 14.16 company stock .
661,they buy,kinder morgan nyse kmi last announced quarterly earnings data wednesday july 18th .
662,they buy,pipeline company reported 0.21 eps quarter topping consensus estimate 0.19 0.02 .
663,they buy,business revenue 3.43 billion quarter compared analyst estimates 3.42 billion .
664,they buy,kinder morgan negative net margin 1.82 positive return equity 5.07 .
665,they buy,company revenue quarter 1.8 year-over-year basis .
666,they buy,quarter previous year firm posted 0.14 earnings per share .
667,they sell,analysts forecast kinder morgan inc post 0.83 earnings per share current year .
668,they buy,number research analysts recently issued reports stock .
669,they buy,goldman sachs group assumed coverage shares kinder morgan report monday .
670,they buy,set conviction-buy rating 24.00 price objective company .
671,they buy,wells fargo co reiterated buy rating shares kinder morgan report thursday july 19th .
672,they buy,jpmorgan chase co. boosted price target shares kinder morgan 20.00 21.00 gave stock overweight rating report friday july 27th .
673,they buy,citigroup cut price target shares kinder morgan 21.00 20.00 set buy rating stock report friday july 20th .
674,they buy,finally us capital advisors restated buy rating shares kinder morgan report tuesday july 17th .
675,they sell,one equities research analyst rated stock sell rating three issued hold rating seventeen given buy rating one given strong buy rating company .
676,they buy,company currently consensus rating buy consensus price target 21.01 .
677,they buy,"kinder morgan profile keyword kinder morgan nyse kmi kmi oils/energy,49456b10 sec filings,13f hedge fund holdings institutional investor holdingsratings:4,20 nyse kmirefreshed1 receive news ratings kinder morgan daily enter email address receive concise daily summary latest news analysts ratings kinder morgan related companies marketbeat.com free daily email newsletter ."
678,they buy,name required richmond hill investment co. lp boosted stake kinder morgan inc nyse kmi 63.3 second quarter according recent 13f filing securities exchange commission .
679,they buy,"institutional investor owned 370,571 shares pipeline company stock buying additional 143,608 shares quarter ."
680,they buy,kinder morgan makes approximately 9.6 richmond hill investment co. lp portfolio making stock 4th largest holding .
681,they buy,"richmond hill investment co. lp holdings kinder morgan worth 6,548,000 end recent reporting period ."
682,they buy,number institutional investors also recently modified holdings stock .
683,they buy,"etrade capital management llc purchased new position kinder morgan 1st quarter valued approximately 391,000 ."
684,they buy,aperio group llc lifted position shares kinder morgan 8.2 1st quarter .
