,assoc,values
463,they sell,barron blog 21/05/2018 micron intel extend leadership 3d nand flash memory 22/03/2018 micron technology 2q eps 2.67 21/05/2018 moody upgrades micron technology cfr ba1 outlook positive 11/05/2018 hosokawa micron 6277.t 6-mth group recurring profit 3.12 bln yen 2017/18 forecast profit 5.30 bln yen 30/05/2018 memory-chip market fears flip micron 6 trading day 14/05/2018 coatue buys new 1.2 position micron 16/03/2018 micron buying calls one way play says jp morgan barron blog among 15 analysts covering echo global logistics nasdaq echo 9 buy rating 2 sell 4 hold .
464,they buy,therefore 60 positive .
465,they buy,echo global logistics 51 analyst reports since august 11 2015 according sratingsintel .
466,they buy,per wednesday august 30 company rating maintained cowen co. firm neutral rating given tuesday august 11 macquarie research .
467,they buy,stock echo global logistics inc. nasdaq echo earned overweight rating jp morgan monday july 11. firm earned hold rating friday september 4 thestreet .
468,they buy,stifel nicolaus maintained echo global logistics inc. nasdaq echo rating monday july 17. stifel nicolaus buy rating 2300 target .
469,they buy,firm outperform rating given monday july 16 cowen co. william blair maintained shares echo report friday august 21 outperform rating .
470,they buy,firm earned buy rating monday january 8 susquehanna .
471,they buy,stock echo global logistics inc. nasdaq echo neutral rating given thursday february 8 credit suisse .
472,they buy,rating maintained susquehanna wednesday february 7 buy .
473,they buy,"hood river capital management llc manages 698.72m 1.78b us long portfolio decreased stake advanced micro devices inc nasdaq amd 688,521 shares 1.17 million shares valued 11.80 million 2018q1 according filing ."
474,they buy,"also reduced holding chegg inc nyse chgg 293,007 shares quarter leaving 825,595 shares cut stake western alliance bancorp nyse wal ."
475,they buy,investors sentiment decreased 1.13 q1 2018.
476,they buy,0.11 1.24 2017q4 .
477,they sell,fall 52 investors sold mu shares 282 reduced holdings .
478,they buy,138 funds opened positions 241 raised stakes .
479,they buy,846.69 million shares 4.13 less 883.15 million shares 2017q4 reported .
480,they buy,"carret asset mngmt limited liability reported 6,880 shares ."
481,they buy,new york-based hap trading invested 0.12 micron technology inc. nasdaq mu .
482,they buy,"cetera advisors limited liability company accumulated 0.12 38,379 shares ."
483,they buy,"veritable lp accumulated 19,358 shares 0.02 stock ."
484,they buy,"managed asset portfolios lc owns 322,815 shares ."
485,they buy,"andra ap 0.19 invested micron technology inc. nasdaq mu 137,600 shares ."
486,they buy,"proshare advsr limited liability holds 996,457 shares ."
487,they buy,1.84 million accumulated macquarie gru limited .
488,they buy,"avalon glob asset ltd accumulated 203,560 shares 3.66 stock ."
489,they buy,"hudson bay cap mgmt lp owns 0.01 invested micron technology inc. nasdaq mu 11,500 shares ."
490,they buy,pittenger anderson holds 0 300 shares .
491,they buy,"878,303 reported aperio gp ltd co. hwg lp holds 1.57 portfolio micron technology inc. nasdaq mu 32,459 shares ."
492,they buy,"marco management ltd llc reported 76,315 shares ."
493,they buy,"pictet bancorporation tru ltd owns 30,400 shares 0.56 us portfolio ."
494,they buy,since march 15 2018 0 buys 10 insider sales 13.66 million activity .
495,they sell,"thorsen steven l. jr sold 1.36 million worth stock 28,089 shares ."
496,they sell,"bailey robert l also sold 139,220 worth micron technology inc. nasdaq mu shares ."
497,they sell,switz robert e also sold 5.40 million worth micron technology inc. nasdaq mu shares .
498,they sell,"532 micron technology inc. nasdaq mu shares value 31,814 sold arnzen april s. insider byrne patrick j sold 14,360 shares worth 665,058 ."
499,they sell,insider johnson mercedes sold 1.26m .
500,they buy,analysts await micron technology inc. nasdaq mu report earnings september 20 close .
501,they buy,expect 3.26 eps 63.82 1.27 last year 1.99 per share .
502,they buy,mu profit 3.78 billion 3.33 p/e 3.26 eps becomes reality .
503,they buy,3.12 actual eps reported micron technology inc. previous quarter wall street forecasts 4.49 eps growth .
504,they buy,"tegean capital management llc manages 366.79 million 186.74 million us long portfolio upped stake assured guaranty ltd nyse ago 43,700 shares 526,200 shares valued 19.05m 2018q1 according filing ."
505,they buy,"also increased holding citigroup inc nyse c 15,000 shares quarter total 315,000 shares risen stake tcf finl corp nyse tcb ."
506,they buy,ontario teachers pension plan board lessened holdings shares micron technology inc. nasdaq mu 98.5 2nd quarter according company recent 13f filing securities exchange commission .
507,they buy,"fund owned 46,276 shares semiconductor manufacturer stock selling 2,953,724 shares period ."
508,they buy,"ontario teachers pension plan board holdings micron technology worth 2,427,000 end recent quarter ."
509,they buy,institutional investors hedge funds also modified holdings company .
510,they buy,global x management co. llc raised stake micron technology 136.3 1st quarter .
511,they buy,"global x management co. llc owns 35,932 shares semiconductor manufacturer stock worth 1,873,000 acquiring additional 20,727 shares last quarter ."
512,they buy,hl financial services llc raised stake shares micron technology 38.1 1st quarter .
513,they buy,"hl financial services llc owns 36,907 shares semiconductor manufacturer stock valued 1,924,000 buying additional 10,183 shares last quarter ."
514,they buy,fdx advisors inc. raised stake shares micron technology 187.0 1st quarter .
515,they buy,"fdx advisors inc. owns 14,984 shares semiconductor manufacturer stock valued 781,000 buying additional 9,763 shares last quarter ."
516,they buy,atria investments llc raised stake shares micron technology 25.2 1st quarter .
517,they buy,"atria investments llc owns 22,707 shares semiconductor manufacturer stock valued 1,184,000 buying additional 4,572 shares last quarter ."
518,they buy,finally cypress capital management llc wy raised stake shares micron technology 5.6 1st quarter .
519,they buy,"cypress capital management llc wy owns 42,145 shares semiconductor manufacturer stock valued 2,197,000 buying additional 2,225 shares last quarter ."
520,they buy,hedge funds institutional investors 74.04 company stock .
521,they sell,"news director robert e. switz sold 75,000 shares stock transaction occurred monday july 2nd ."
522,they sell,"shares sold average price 53.34 total value 4,000,500.00 ."
523,they buy,"following sale director directly owns 120,257 shares company valued 6,414,508.38 ."
524,they buy,transaction disclosed document filed securities exchange commission accessed sec website .
525,they sell,"also svp steven l. thorsen jr. sold 40,000 shares stock transaction occurred friday july 20th ."
526,they sell,"shares sold average price 55.09 total transaction 2,203,600.00 ."
527,they buy,"following completion sale senior vice president owns 126,990 shares company valued 6,995,879.10 ."
528,they buy,disclosure sale found .
529,they sell,"insiders sold 140,000 shares company stock valued 7,604,100 last three months ."
530,they buy,0.53 stock currently owned corporate insiders .
531,they buy,number equities analysts weighed company .
532,they buy,royal bank canada reduced price objective micron technology 70.00 set outperform rating company research note tuesday .
533,they buy,robert w. baird dropped target price micron technology 100.00 75.00 set outperform rating stock research report friday .
534,they buy,deutsche bank restated buy rating set 80.00 target price shares micron technology research report thursday september 6th .
535,they buy,noted move valuation call .
536,they sell,bidaskclub upgraded micron technology sell rating hold rating research report saturday august 25th .
537,they buy,finally zacks investment research cut micron technology buy rating hold rating research report tuesday august 21st .
538,they buy,nine investment analysts rated stock hold rating twenty-three issued buy rating two assigned strong buy rating company stock .
539,they buy,company presently average rating buy consensus price target 70.90 .
540,they buy,shares mu stock opened 43.04 tuesday .
541,they buy,company debt-to-equity ratio 0.20 current ratio 2.63 quick ratio 2.06. micron technology inc. 12 month low 32.81 12 month high 64.66 .
542,they buy,firm market cap 52.03 billion p/e ratio 9.76 peg ratio 0.52 beta 1.63 .
543,they buy,micron technology nasdaq mu last announced earnings results wednesday june 20th .
544,they buy,semiconductor manufacturer reported 3.15 eps quarter beating analysts consensus estimates 3.13 0.02 .
545,they buy,business revenue 7.80 billion quarter compared analysts expectations 7.76 billion .
546,they buy,micron technology net margin 43.35 return equity 51.12 .
547,they buy,business revenue 40.1 compared quarter last year .
548,they sell,period prior year company earned 1.62 earnings per share .
549,they sell,sell-side analysts anticipate micron technology inc. post 11.56 earnings per share current year .
550,they buy,micron technology announced board approved stock repurchase plan monday may 21st allows company repurchase 10.00 billion outstanding shares .
551,they buy,repurchase authorization allows semiconductor manufacturer purchase 16.2 stock open market purchases .
552,they buy,stock repurchase plans usually sign company board directors believes shares undervalued .
553,they buy,micron technology company profile micron technology inc provides semiconductor systems worldwide .
554,they buy,company operates four segments compute networking business unit storage business unit mobile business unit embedded business unit .
555,they buy,offers ddr3 ddr4 dram products computers servers networking devices communications equipment consumer electronics automotive industrial applications lower power dram products smartphones tablets automotive laptop computers mobile consumer device applications ddr2 dram ddr dram gddr5 gddr5x dram sdram rldram products networking devices servers consumer electronics communications equipment computer peripherals automotive industrial applications well computer memory upgrades hybrid memory cube semiconductor memory devices .
556,they buy,"read consider index fund viewcount type=f id=3965241 keyword micron technology nasdaq mu mu computer technology,59511210 sec filings,13f hedge fund holdings institutional investor holdingsratings:4,30 nasdaq murefreshed1 receive news ratings micron technology daily enter email address receive concise daily summary latest news analysts ratings micron technology related companies marketbeat.com free daily email newsletter ."
557,they buy,zacks analysts expect royal caribbean cruises ltd rcl announce quarterly sales 2.82 billion somewhat positive news coverage somewhat unlikely affect rapid7 rpd stock price equities analysts predict micron technology inc. nasdaq mu report 8.22 billion sales current fiscal quarter zacks reports .
558,they buy,four analysts provided estimates micron technology earnings estimates ranging 8.20 billion 8.26 billion .
559,they buy,micron technology reported sales 6.14 billion quarter last year would suggest positive year-over-year growth rate 33.9 .
560,they buy,firm expected announce next quarterly earnings results market closes thursday september 20th .
561,they buy,according zacks analysts expect micron technology report full-year sales 30.17 billion current fiscal year estimates ranging 30.13 billion 30.21 billion .
562,they buy,next year analysts anticipate company post sales 31.92 billion per share estimates ranging 29.33 billion 33.48 billion .
563,they buy,zacks sales averages average based survey research analysts provide coverage micron technology .
564,they buy,micron technology nasdaq mu last issued quarterly earnings data wednesday june 20th .
565,they buy,semiconductor manufacturer reported 3.15 eps quarter topping consensus estimate 3.13 0.02 .
566,they buy,micron technology net margin 43.35 return equity 51.12 .
567,they buy,firm revenue 7.80 billion quarter compared analyst estimates 7.76 billion .
568,they buy,period prior year business posted 1.62 eps .
569,they buy,business revenue quarter 40.1 compared quarter last year .
570,they buy,shares mu stock opened 44.90 tuesday .
571,they buy,company current ratio 2.63 quick ratio 2.06 debt-to-equity ratio 0.20. micron technology one year low 32.81 one year high 64.66 .
572,they buy,company market capitalization 52.03 billion pe ratio 10.18 p/e/g ratio 0.52 beta 1.63 .
573,they buy,micron technology announced board directors approved share buyback plan monday may 21st permits company repurchase 10.00 billion outstanding shares .
574,they buy,repurchase authorization permits semiconductor manufacturer repurchase 16.2 shares open market purchases .
575,they buy,shares repurchase plans generally indication company management believes stock undervalued .
576,they sell,"news director robert e. switz sold 75,000 shares company stock transaction monday july 2nd ."
577,they sell,"shares sold average price 53.34 total value 4,000,500.00 ."
578,they buy,"following completion transaction director owns 120,257 shares company valued approximately 6,414,508.38 ."
579,they buy,sale disclosed document filed sec available link .
580,they sell,"also director robert e. switz sold 25,000 shares company stock transaction friday july 13th ."
581,they sell,"shares sold average price 56.00 total transaction 1,400,000.00 ."
582,they buy,"following completion transaction director owns 120,257 shares company stock valued approximately 6,734,392 ."
583,they buy,disclosure sale found .
584,they sell,"last three months insiders sold 140,000 shares company stock worth 7,604,100 ."
585,they buy,insiders 0.53 company stock .
586,they buy,several institutional investors recently modified holdings mu .
587,they buy,"senator investment group lp acquired new position shares micron technology 2nd quarter valued 140,277,000 ."
588,they buy,amundi pioneer asset management inc. boosted stake micron technology 47.5 1st quarter .
589,they buy,"amundi pioneer asset management inc. owns 6,078,300 shares semiconductor manufacturer stock worth 316,921,000 purchasing additional 1,958,119 shares period ."
590,they buy,point72 asset management l.p. boosted stake micron technology 632.0 2nd quarter .
591,they buy,"point72 asset management l.p. owns 2,027,604 shares semiconductor manufacturer stock worth 106,328,000 purchasing additional 1,750,604 shares period ."
592,they buy,natixis boosted stake micron technology 345.7 2nd quarter .
593,they buy,"natixis owns 2,028,745 shares semiconductor manufacturer stock worth 106,388,000 purchasing additional 1,573,549 shares period ."
594,they buy,finally parnassus investments ca boosted stake micron technology 40.0 2nd quarter .
595,they buy,"parnassus investments ca owns 4,900,000 shares semiconductor manufacturer stock worth 256,956,000 purchasing additional 1,400,000 shares period ."
596,they buy,institutional investors hedge funds 74.04 company stock .
597,they buy,micron technology company profile micron technology inc provides semiconductor systems worldwide .
598,they buy,company operates four segments compute networking business unit storage business unit mobile business unit embedded business unit .
599,they buy,offers ddr3 ddr4 dram products computers servers networking devices communications equipment consumer electronics automotive industrial applications lower power dram products smartphones tablets automotive laptop computers mobile consumer device applications ddr2 dram ddr dram gddr5 gddr5x dram sdram rldram products networking devices servers consumer electronics communications equipment computer peripherals automotive industrial applications well computer memory upgrades hybrid memory cube semiconductor memory devices .
600,they buy,"recommended story short selling stocks day traders viewcount articlehistoryid=24098310 postdate=2018-9-11 type=c id=468469keyword micron technology nasdaq mu mu computer technology,59511210 ratings consensusratings:4,30 nasdaq mu get free copy zacks research report micron technology mu information research offerings zacks investment research visit zacks.com receive news ratings micron technology daily enter email address receive concise daily summary latest news analysts ratings micron technology related companies marketbeat.com free daily email newsletter ."
601,they buy,name required mail published required wall street analysts predict micron technology inc. nasdaq mu announce 3.30 earnings per share current fiscal quarter zacks reports .
602,they buy,four analysts provided estimates micron technology earnings .
603,they buy,highest eps estimate 3.33 lowest 3.27 .
604,they buy,micron technology posted earnings 2.02 per share quarter last year suggests positive year-over-year growth rate 63.4 .
605,they buy,firm scheduled issue next earnings report market closes thursday september 20th .
606,they buy,google_ad_client ca-pub-0703139142419429 google_ad_slot 5621244306 google_ad_width 336 google_ad_height 280 c according zacks analysts expect micron technology report full year earnings 11.72 per share current year eps estimates ranging 11.69 11.76 .
607,they buy,next financial year analysts forecast company post earnings 10.98 per share eps estimates ranging 8.74 12.54 .
608,they sell,zacks earnings per share averages mean average based survey research analysts follow micron technology .
609,they buy,micron technology nasdaq mu last issued quarterly earnings data wednesday june 20th .
610,they buy,semiconductor manufacturer reported 3.15 earnings per share eps quarter beating analysts consensus estimates 3.13 0.02 .
611,they buy,micron technology net margin 43.35 return equity 51.12 .
612,they buy,firm revenue 7.80 billion quarter compared consensus estimate 7.76 billion .
613,they buy,quarter previous year firm posted 1.62 eps .
614,they buy,company revenue quarter 40.1 compared quarter last year .
615,they buy,mu subject number recent research reports .
616,they buy,benchmark initiated coverage shares micron technology research report friday june 22nd .
617,they buy,set buy rating 80.00 price objective company .
618,they buy,zacks investment research raised shares micron technology hold rating buy rating set 67.00 price objective company research report thursday may 24th .
619,they sell,ubs group raised shares micron technology sell rating neutral rating set 35.00 price objective company research report tuesday june 26th .
620,they buy,credit suisse group set 90.00 price objective shares micron technology gave company buy rating research report thursday june 21st .
621,they buy,finally deutsche bank boosted price objective shares micron technology 68.00 72.00 gave company buy rating research report tuesday may 22nd .
622,they buy,nine analysts rated stock hold rating twenty-three given buy rating two given strong buy rating company stock .
623,they buy,micron technology currently average rating buy average target price 71.30 .
624,they buy,shares mu stock traded 0.21 mid-day trading friday reaching 44.86 .
625,they buy,"46,722,814 shares company stock traded hands compared average volume 33,773,872. micron technology 12 month low 32.31 12 month high 64.66 ."
626,they buy,company debt-to-equity ratio 0.20 current ratio 2.63 quick ratio 2.06. company market cap 52.03 billion price-to-earnings ratio 10.17 peg ratio 0.50 beta 1.63 .
627,they buy,micron technology declared board directors authorized stock repurchase program monday may 21st permits company repurchase 10.00 billion shares .
628,they buy,repurchase authorization permits semiconductor manufacturer buy 16.2 shares open market purchases .
629,they buy,shares repurchase programs generally sign company board believes stock undervalued .
630,they sell,"micron technology news director robert e. switz sold 25,000 shares business stock transaction friday july 13th ."
631,they sell,"shares sold average price 56.00 total value 1,400,000.00 ."
632,they buy,"following sale director owns 120,257 shares company valued approximately 6,734,392 ."
633,they buy,sale disclosed filing sec accessed sec website .
634,they sell,"also director robert e. switz sold 75,000 shares business stock transaction monday july 2nd ."
635,they sell,"stock sold average price 53.34 total transaction 4,000,500.00 ."
636,they buy,"following completion sale director owns 120,257 shares company valued approximately 6,414,508.38 ."
637,they buy,disclosure sale found .
638,they sell,"insiders sold total 140,000 shares company stock valued 7,604,100 last ninety days ."
639,they buy,0.53 stock currently owned insiders .
640,they buy,number hedge funds recently made changes positions mu .
641,they buy,"clearwater capital advisors llc purchased new stake micron technology 1st quarter worth 104,000 ."
642,they buy,brasada capital management lp lifted stake micron technology 100.0 1st quarter .
643,they buy,"brasada capital management lp owns 2,000 shares semiconductor manufacturer stock worth 104,000 purchasing additional 1,000 shares last quarter ."
644,they buy,tradewinds capital management llc lifted stake micron technology 411.8 2nd quarter .
645,they buy,"tradewinds capital management llc owns 1,996 shares semiconductor manufacturer stock worth 105,000 purchasing additional 1,606 shares last quarter ."
646,they buy,"credit agricole lifted stake micron technology 199,900.0 2nd quarter ."
647,they buy,"credit agricole owns 2,000 shares semiconductor manufacturer stock worth 105,000 purchasing additional 1,999 shares last quarter ."
648,they buy,"finally avestar capital llc lifted stake micron technology 7,994.3 1st quarter ."
649,they buy,"avestar capital llc owns 2,833 shares semiconductor manufacturer stock worth 129,000 purchasing additional 2,798 shares last quarter ."
650,they buy,institutional investors hedge funds 74.02 company stock .
651,they buy,micron technology company profile micron technology inc provides semiconductor systems worldwide .
652,they buy,company operates four segments compute networking business unit storage business unit mobile business unit embedded business unit .
653,they buy,offers ddr3 ddr4 dram products computers servers networking devices communications equipment consumer electronics automotive industrial applications lower power dram products smartphones tablets automotive laptop computers mobile consumer device applications ddr2 dram ddr dram gddr5 gddr5x dram sdram rldram products networking devices servers consumer electronics communications equipment computer peripherals automotive industrial applications well computer memory upgrades hybrid memory cube semiconductor memory devices .
654,they buy,see also average daily trade volume explained get free copy zacks research report micron technology mu information research offerings zacks investment research visit zacks.com google_ad_client ca-pub-0703139142419429 google_ad_slot 1418630638 google_ad_width 336 google_ad_height 280 winslow capital management llc increased adobe systems inc adbe stake 31.16 reported 2018q1 sec filing .
655,they buy,"winslow capital management llc acquired 485,801 shares adobe systems inc adbe stock rose 14.81 ."
656,they buy,winslow capital management llc holds 2.04 million shares 441.85m value 1.56m last quarter .
657,they buy,adobe systems inc 129.78 billion valuation .
658,they buy,stock increased 1.60 4.17 last trading session reaching 265.04 .
659,they buy,1.76m shares traded .
660,they buy,adobe systems incorporated nasdaq adbe risen 70.50 since september 10 2017 uptrending .
661,they buy,outperformed 57.93 p500 .
662,they buy,historical adbe news 15/05/2018 duquesne added intc baba mu nflx adbe 1q 13f 17/04/2018 adobe announces deal company website 05/04/2018 adobe systems inc murphy assume cfo role adobe evp cfo mark garrett 27/03/2018 adobe cloud platform innovation showcased summit 21/05/2018 adobe buys magento 1.7 billion boost commerce ambitions 15/03/2018 adobe systems 2q net 583.1m 27/03/2018 adobe announces significant partner momentum summit 2018 15/03/2018 adobe systems reaffirms 2018 forecast 04/04/2018 adobe summit experience everything 27/03/2018 adobe creates experience league train clients tools mack-cali realty corporation nyse cli decrease 13.29 short interest .
663,they buy,cli si 1.48m shares september released finra .
664,they buy,13.29 1.71m shares previously .
665,they buy,"761,800 avg volume 2 days mack-cali realty corporation nyse cli short sellers cover cli short positions ."
666,they buy,si mack-cali realty corporation float 1.66 .
667,they buy,stock increased 3.00 0.62 last trading session reaching 21.29 .
668,they buy,"307,387 shares traded ."
669,they buy,mack-cali realty corporation nyse cli declined 31.32 since september 10 2017 downtrending .
670,they buy,underperformed 43.89 p500 .
671,they buy,historical cli news 02/05/2018 mack-cali sees fy core ffo/shr 1.80 1.90 est .
672,they buy,1.83 05/03/2018 p revises mack-cali realty l.p. rating bb bb+ outlook negative 02/05/2018 mack-cali realty 1q ffo 50c/shr 28/03/2018 mack-cali non-deal roadshow scheduled suntrust apr .
673,they buy,4 15/03/2018 mack-cali realty corp demarco addition board expanded total number members nine ten 02/05/2018 mack-cali realty 1q net 50.7m 27/04/2018 roseland kicks leasing metropolitan lofts downtown morristown 02/05/2018 mack-cali 1q core ffo/shr 50c est .
