,assoc,values
903,they buy,brasada capital management lp lifted position shares micron technology 100.0 first quarter .
904,they buy,"brasada capital management lp owns 2,000 shares semiconductor manufacturer stock worth 104,000 acquiring additional 1,000 shares last quarter ."
905,they buy,tradewinds capital management llc lifted position shares micron technology 411.8 second quarter .
906,they buy,"tradewinds capital management llc owns 1,996 shares semiconductor manufacturer stock worth 105,000 acquiring additional 1,606 shares last quarter ."
907,they buy,"credit agricole lifted position shares micron technology 199,900.0 second quarter ."
908,they buy,"credit agricole owns 2,000 shares semiconductor manufacturer stock worth 105,000 acquiring additional 1,999 shares last quarter ."
909,they buy,"finally avestar capital llc lifted position shares micron technology 7,994.3 first quarter ."
910,they buy,"avestar capital llc owns 2,833 shares semiconductor manufacturer stock worth 129,000 acquiring additional 2,798 shares last quarter ."
911,they buy,74.02 stock owned institutional investors hedge funds .
912,they buy,micron technology micron technology inc provides semiconductor systems worldwide .
913,they buy,company operates four segments compute networking business unit storage business unit mobile business unit embedded business unit .
914,they buy,offers ddr3 ddr4 dram products computers servers networking devices communications equipment consumer electronics automotive industrial applications lower power dram products smartphones tablets automotive laptop computers mobile consumer device applications ddr2 dram ddr dram gddr5 gddr5x dram sdram rldram products networking devices servers consumer electronics communications equipment computer peripherals automotive industrial applications well computer memory upgrades hybrid memory cube semiconductor memory devices .
915,they buy,"reading return equity roe viewcount articlehistoryid=24044143 postdate=2018-9-9 type=c id=468468keyword micron technology nasdaq mu mu computer technology,59511210 ratings consensusratings:4,30 nasdaq mu get free copy zacks research report micron technology mu information research offerings zacks investment research visit zacks.com receive news ratings micron technology daily enter email address receive concise daily summary latest news analysts ratings micron technology related companies marketbeat.com free daily email newsletter ."
916,they buy,name required mail published required brokerages predict micron technology inc. nasdaq mu report sales 8.22 billion current quarter according zacks investment research .
917,they buy,four analysts provided estimates micron technology earnings lowest sales estimate coming 8.20 billion highest estimate coming 8.26 billion .
918,they buy,micron technology reported sales 6.14 billion quarter last year would suggest positive year-over-year growth rate 33.9 .
919,they buy,business scheduled issue next earnings report market closes thursday september 20th .
920,they buy,according zacks analysts expect micron technology report full year sales 30.17 billion current fiscal year estimates ranging 30.13 billion 30.21 billion .
921,they buy,next fiscal year analysts anticipate firm report sales 31.92 billion per share estimates ranging 29.33 billion 33.48 billion .
922,they sell,zacks sales averages mean average based survey sell-side research analysts follow micron technology .
923,they buy,micron technology nasdaq mu last issued earnings results wednesday june 20th .
924,they buy,semiconductor manufacturer reported 3.15 earnings per share eps quarter topping consensus estimate 3.13 0.02 .
925,they buy,business revenue 7.80 billion quarter compared analysts expectations 7.76 billion .
926,they buy,micron technology net margin 43.35 return equity 51.12 .
927,they buy,business revenue quarter 40.1 compared quarter last year .
928,they sell,period previous year company earned 1.62 earnings per share .
929,they buy,shares mu stock opened 50.70 friday .
930,they buy,micron technology 52 week low 30.05 52 week high 64.66 .
931,they buy,company market capitalization 57.92 billion pe ratio 11.49 p/e/g ratio 0.53 beta 1.61. company debt-to-equity ratio 0.20 current ratio 2.63 quick ratio 2.06 .
932,they buy,micron technology announced board directors initiated stock repurchase plan monday may 21st allows company buyback 10.00 billion shares .
933,they buy,buyback authorization allows semiconductor manufacturer purchase 16.2 stock open market purchases .
934,they buy,stock buyback plans usually sign company management believes stock undervalued .
935,they sell,"micron technology news director robert e. switz sold 75,000 shares company stock transaction occurred monday july 2nd ."
936,they sell,"shares sold average price 53.34 total value 4,000,500.00 ."
937,they buy,"following completion transaction director directly owns 120,257 shares company valued 6,414,508.38 ."
938,they buy,transaction disclosed document filed sec accessible sec website .
939,they sell,"also svp steven l. thorsen jr. sold 40,000 shares company stock transaction occurred friday july 20th ."
940,they sell,"stock sold average price 55.09 total transaction 2,203,600.00 ."
941,they buy,"following completion transaction senior vice president owns 126,990 shares company stock valued 6,995,879.10 ."
942,they buy,disclosure sale found .
943,they sell,"last quarter insiders sold 140,000 shares company stock valued 7,604,100 ."
944,they buy,company insiders 0.53 company stock .
945,they buy,several hedge funds recently added reduced stakes company .
946,they buy,dimensional fund advisors lp lifted holdings shares micron technology 0.3 second quarter .
947,they buy,"dimensional fund advisors lp owns 13,543,491 shares semiconductor manufacturer stock worth 710,326,000 buying additional 40,694 shares last quarter ."
948,they buy,amundi pioneer asset management inc. lifted holdings shares micron technology 47.5 first quarter .
949,they buy,"amundi pioneer asset management inc. owns 6,078,300 shares semiconductor manufacturer stock worth 316,921,000 buying additional 1,958,119 shares last quarter ."
950,they buy,schwab charles investment management inc. lifted holdings shares micron technology 4.9 second quarter .
951,they buy,"schwab charles investment management inc. owns 5,113,462 shares semiconductor manufacturer stock worth 268,150,000 buying additional 238,829 shares last quarter ."
952,they buy,parnassus investments ca lifted holdings shares micron technology 40.0 second quarter .
953,they buy,"parnassus investments ca owns 4,900,000 shares semiconductor manufacturer stock worth 256,956,000 buying additional 1,400,000 shares last quarter ."
954,they buy,finally sumitomo mitsui trust holdings inc. lifted holdings shares micron technology 7.1 second quarter .
955,they buy,"sumitomo mitsui trust holdings inc. owns 4,185,658 shares semiconductor manufacturer stock worth 219,496,000 buying additional 277,992 shares last quarter ."
956,they buy,77.43 stock currently owned hedge funds institutional investors .
957,they buy,micron technology micron technology inc provides semiconductor systems worldwide .
958,they buy,company operates four segments compute networking business unit storage business unit mobile business unit embedded business unit .
959,they buy,offers ddr3 ddr4 dram products computers servers networking devices communications equipment consumer electronics automotive industrial applications lower power dram products smartphones tablets automotive laptop computers mobile consumer device applications ddr2 dram ddr dram gddr5 gddr5x dram sdram rldram products networking devices servers consumer electronics communications equipment computer peripherals automotive industrial applications well computer memory upgrades hybrid memory cube semiconductor memory devices .
960,they buy,"read penny stocks need know viewcount type=c id=457454keyword micron technology nasdaq mu mu computer technology,59511210 ratings consensusratings:4,30 nasdaq mu get free copy zacks research report micron technology mu information research offerings zacks investment research visit zacks.com receive news ratings micron technology daily enter email address receive concise daily summary latest news analysts ratings micron technology related companies marketbeat.com free daily email newsletter ."
961,they buy,stealthgas nasdaq gass posts earnings results new york company inc. nyse nwy releases quarterly earnings results beats estimates 0.03 eps investors sentiment decreased 1.13 q1 2018.
962,they buy,0.11 1.24 2017q4 .
963,they sell,dropped 52 investors sold micron technology inc. shares 282 reduced holdings .
964,they buy,138 funds opened positions 241 raised stakes .
965,they buy,846.69 million shares 4.13 less 883.15 million shares 2017q4 reported .
966,they buy,"bessemer gru inc holds 2,301 shares 0 portfolio ."
967,they buy,"barrett asset mngmt limited liability owns 6,369 shares 0.02 us portfolio ."
968,they buy,reilly financial limited co holds 0 micron technology inc. nasdaq mu 400 shares .
969,they buy,"menora mivtachim holding ltd holds 0.86 520,950 shares ."
970,they buy,"lmr prtn llp invested 48,783 shares 0.21 stock ."
971,they buy,"eidelman virant cap 4.13 invested micron technology inc. nasdaq mu 121,057 shares ."
972,they buy,"eagle asset mngmt invested 0.23 825,941 shares ."
973,they buy,"fincl architects holds 0.11 10,811 shares ."
974,they buy,"homrich berg holds 0.11 micron technology inc. nasdaq mu 30,011 shares ."
975,they buy,"arizona state retirement systems invested 436,070 shares ."
976,they buy,etrade management lc invested 0.01 portfolio micron technology inc. nasdaq mu .
977,they buy,"utah retirement reported 203,295 shares stake ."
978,they buy,moreover royal state bank canada 0.08 invested micron technology inc. nasdaq mu .
979,they buy,"moreover bartlett commerce llc 0 invested micron technology inc. nasdaq mu 1,000 shares ."
980,they buy,"6,080 accumulated checchi cap advisers lc ."
981,they buy,since march 15 2018 0 insider buys 11 selling transactions 13.69 million activity .
982,they sell,"thorsen steven l. jr sold 40,000 shares worth 2.20 million ."
983,they sell,"139,220 worth micron technology inc. nasdaq mu sold bailey robert l. shares 1.26m sold johnson mercedes ."
984,they sell,"shares 31,814 sold arnzen april s. another trade 13,695 shares valued 768,439 sold deboer scott j. shares 665,058 sold byrne patrick j wednesday may 2 ."
985,they buy,analysts expect micron technology inc. nasdaq mu report 3.26 eps september 20 close.they anticipate 1.27 eps change 63.82 last quarter 1.99 eps .
986,they buy,mu profit would 3.78 billion giving 3.44 p/e 3.26 eps correct .
987,they buy,3.12 eps previously micron technology inc. analysts see 4.49 eps growth .
988,they buy,stock increased 0.47 0.21 last trading session reaching 44.86 .
989,they buy,42.30m shares traded 13.26 average .
990,they buy,micron technology inc. nasdaq mu risen 108.46 since september 9 2017 uptrending .
991,they buy,outperformed 95.89 p500 .
992,they sell,among 24 analysts covering micron nasdaq mu 18 buy rating 0 sell 6 hold .
993,they buy,therefore 75 positive .
994,they buy,micron 45 analyst reports since march 12 2018 according sratingsintel .
995,they buy,per monday march 26 company rating maintained argus research .
996,they buy,firm earned buy rating monday may 14 evercore .
997,they buy,stock micron technology inc. nasdaq mu earned market perform rating bmo capital markets wednesday march 21. tuesday june 19 stock rating maintained rbc capital markets buy .
998,they buy,stock micron technology inc. nasdaq mu earned buy rating keybanc capital markets monday april 16. firm earned hold rating monday march 26 bernstein .
999,they buy,stock buy rating stifel nicolaus tuesday may 22. stock micron technology inc. nasdaq mu earned buy rating cowen co thursday march 22. jp morgan maintained shares mu report thursday june 21 overweight rating .
1000,they buy,citigroup downgraded stock hold rating friday march 23 report .
1001,they buy,micron technology inc. provides semiconductor systems worldwide .
1002,they buy,company market cap 52.03 billion .
1003,they buy,firm operates four divisions compute networking business unit storage business unit mobile business unit embedded business unit .
1004,they buy,4.5 p/e ratio .
1005,they buy,offers ddr3 ddr4 dram products computers servers networking devices communications equipment consumer electronics automotive industrial applications mobile low-power dram products smartphones tablets automotive laptop computers mobile consumer device applications ddr2 ddr dram gddr5 gddr5x dram sdram rldram products networking devices servers consumer electronics communications equipment computer peripherals automotive industrial applications computer memory upgrades hybrid memory cube semiconductor memory devices use networking computing applications .
1006,they buy,notable recent micron technology inc. nasdaq mu news published seekingalpha.com released semi stocks limp towards weekend september 07 2018 also seekingalpha.com article new micron undervalued beast published august 27 2018 seekingalpha.com published micron focus long term august 28 2018. interesting news micron technology inc. nasdaq mu released fool.com article micron technology twitter wynn resorts slumped today published september 06 2018 well seekingalpha.com news article titled micron usual bears wrong publication date august 16 2018 .
1007,they buy,receive news ratings via email enter email address receive concise daily summary latest news analysts ratings free daily email newsletter .
1008,they buy,micron technology inc. nasdaq mu earned average recommendation buy thirty-four research firms presently covering firm marketbeat ratings reports .
1009,they sell,one equities research analyst rated stock sell recommendation eight issued hold recommendation twenty-two issued buy recommendation two issued strong buy recommendation company .
1010,they buy,average 12 month price target among brokers issued report stock last year 74.17 .
1011,they buy,number brokerages recently issued reports mu .
1012,they buy,morgan stanley downgraded micron technology overweight rating equal weight rating set 65.00 price target company .
1013,they buy,report thursday may 31st .
1014,they buy,bidaskclub raised micron technology buy rating strong-buy rating report thursday may 31st .
1015,they buy,zacks investment research raised micron technology hold rating buy rating set 67.00 price target company report thursday may 24th .
1016,they buy,mkm partners upped price target micron technology 72.00 gave company buy rating report tuesday may 22nd .
1017,they buy,finally credit suisse group increased price objective micron technology 70.00 80.00 gave company outperform rating report tuesday may 22nd .
1018,they buy,shares mu stock traded 0.96 trading hours tuesday reaching 50.66 .
1019,they buy,"714,847 shares stock exchanged compared average volume 31,138,124. company debt-to-equity ratio 0.20 quick ratio 2.06 current ratio 2.63. micron technology 12-month low 30.05 12-month high 64.66 ."
1020,they buy,firm market capitalization 57.92 billion price-to-earnings ratio 11.33 peg ratio 0.53 beta 1.61 .
1021,they buy,micron technology declared board directors authorized share repurchase plan monday may 21st permits company repurchase 10.00 billion shares .
1022,they buy,repurchase authorization permits semiconductor manufacturer reacquire 16.2 stock open market purchases .
1023,they buy,stock repurchase plans usually indication company leadership believes stock undervalued .
1024,they sell,"news director robert e. switz sold 75,000 shares firm stock transaction monday july 2nd ."
1025,they sell,"stock sold average price 53.34 total value 4,000,500.00 ."
1026,they buy,"following completion transaction director owns 120,257 shares company valued 6,414,508.38 ."
1027,they buy,sale disclosed document filed sec available link .
1028,they sell,"also svp steven l. thorsen jr. sold 40,000 shares firm stock transaction friday july 20th ."
1029,they sell,"shares sold average price 55.09 total value 2,203,600.00 ."
1030,they buy,"following completion transaction senior vice president owns 126,990 shares company stock valued approximately 6,995,879.10 ."
1031,they buy,disclosure sale found .
1032,they sell,"last 90 days insiders sold 140,000 shares company stock valued 7,604,100 ."
1033,they buy,company insiders 0.53 company stock .
1034,they buy,several hedge funds recently made changes positions company .
1035,they buy,"clearwater capital advisors llc purchased new stake micron technology 1st quarter worth 104,000 ."
1036,they buy,brasada capital management lp increased position micron technology 100.0 1st quarter .
1037,they buy,"brasada capital management lp owns 2,000 shares semiconductor manufacturer stock worth 104,000 purchasing additional 1,000 shares last quarter ."
1038,they buy,tradewinds capital management llc increased position micron technology 411.8 2nd quarter .
1039,they buy,"tradewinds capital management llc owns 1,996 shares semiconductor manufacturer stock worth 105,000 purchasing additional 1,606 shares last quarter ."
1040,they buy,"credit agricole increased position micron technology 199,900.0 2nd quarter ."
1041,they buy,"credit agricole owns 2,000 shares semiconductor manufacturer stock worth 105,000 purchasing additional 1,999 shares last quarter ."
1042,they buy,"finally avestar capital llc increased position micron technology 7,994.3 1st quarter ."
1043,they buy,"avestar capital llc owns 2,833 shares semiconductor manufacturer stock worth 129,000 purchasing additional 2,798 shares last quarter ."
1044,they buy,institutional investors hedge funds 77.43 company stock .
1045,they buy,micron technology micron technology inc provides semiconductor systems worldwide .
1046,they buy,company operates four segments compute networking business unit storage business unit mobile business unit embedded business unit .
1047,they buy,offers ddr3 ddr4 dram products computers servers networking devices communications equipment consumer electronics automotive industrial applications lower power dram products smartphones tablets automotive laptop computers mobile consumer device applications ddr2 dram ddr dram gddr5 gddr5x dram sdram rldram products networking devices servers consumer electronics communications equipment computer peripherals automotive industrial applications well computer memory upgrades hybrid memory cube semiconductor memory devices .
1048,they buy,"see also book value share viewcount type=c secondary=1 id=455599keyword micron technology nasdaq mu mu computer technology,59511210 ratings consensusratings:4,30 nasdaq mu receive news ratings micron technology daily enter email address receive concise daily summary latest news analysts ratings micron technology related companies marketbeat.com free daily email newsletter ."
1049,they buy,name required mail published required analysts expect micron technology inc. nasdaq mu post 3.30 earnings per share current fiscal quarter zacks reports .
1050,they buy,four analysts issued estimates micron technology earnings highest eps estimate coming 3.33 lowest estimate coming 3.27 .
1051,they buy,micron technology posted earnings per share 2.02 quarter last year indicates positive year-over-year growth rate 63.4 .
1052,they buy,business scheduled announce next earnings results market closes thursday september 20th .
1053,they buy,average analysts expect micron technology report full-year earnings 11.72 per share current financial year eps estimates ranging 11.69 11.76 .
1054,they buy,next financial year analysts forecast company post earnings 11.16 per share eps estimates ranging 8.74 12.65 .
1055,they buy,zacks investment research eps calculations mean average based survey research analysts provide coverage micron technology .
1056,they buy,micron technology nasdaq mu last posted quarterly earnings data wednesday june 20th .
1057,they buy,semiconductor manufacturer reported 3.15 earnings per share quarter beating zacks consensus estimate 3.13 0.02 .
1058,they buy,micron technology return equity 51.12 net margin 43.35 .
1059,they buy,company revenue 7.80 billion quarter compared analyst estimates 7.76 billion .
1060,they buy,quarter last year company earned 1.62 eps .
1061,they buy,firm revenue quarter 40.1 year-over-year basis .
1062,they buy,several brokerages commented mu .
1063,they buy,robert w. baird increased target price micron technology 100.00 gave company outperform rating research note wednesday may 30th .
1064,they buy,mkm partners increased target price micron technology 77.00 gave company buy rating research note thursday june 21st .
1065,they buy,jpmorgan chase co. increased target price micron technology 82.00 84.00 gave company buy rating research note thursday june 21st .
1066,they sell,bidaskclub upgraded micron technology sell rating hold rating research note saturday .
1067,they buy,finally valuengine downgraded micron technology buy rating hold rating research note monday july 2nd .
1068,they buy,nine research analysts rated stock hold rating twenty-three issued buy rating two given strong buy rating stock .
1069,they buy,company average rating buy consensus target price 71.83 .
1070,they buy,mu stock traded 0.27 thursday reaching 52.34 .
1071,they buy,"26,123,100 shares company traded hands compared average volume 47,077,074. micron technology one year low 30.70 one year high 64.66 ."
1072,they buy,company quick ratio 2.06 current ratio 2.63 debt-to-equity ratio 0.20. firm market cap 58.80 billion pe ratio 11.87 price-to-earnings-growth ratio 0.54 beta 1.61 .
1073,they buy,micron technology declared board initiated share buyback program monday may 21st permits company repurchase 10.00 billion outstanding shares .
1074,they buy,repurchase authorization permits semiconductor manufacturer purchase 16.2 stock open market purchases .
1075,they buy,stock repurchase programs often indication company board directors believes stock undervalued .
1076,they sell,"related news svp steven l. thorsen jr. sold 40,000 shares firm stock transaction friday july 20th ."
1077,they sell,"stock sold average price 55.09 total value 2,203,600.00 ."
1078,they buy,"following transaction senior vice president directly owns 126,990 shares company stock valued approximately 6,995,879.10 ."
1079,they buy,sale disclosed legal filing sec available sec website .
1080,they sell,"also director robert e. switz sold 25,000 shares firm stock transaction friday july 13th ."
1081,they sell,"stock sold average price 56.00 total value 1,400,000.00 ."
1082,they buy,"following completion transaction director directly owns 120,257 shares company valued 6,734,392 ."
1083,they buy,disclosure sale found .
1084,they sell,"last 90 days insiders sold 140,000 shares company stock worth 7,604,100 ."
1085,they buy,company insiders 0.53 company stock .
1086,they buy,institutional investors recently made changes positions stock .
1087,they buy,gideon capital advisors inc. raised holdings micron technology 209.9 first quarter .
1088,they buy,"gideon capital advisors inc. owns 62,336 shares semiconductor manufacturer stock valued 3,250,000 acquiring additional 42,223 shares period ."
1089,they buy,rhumbline advisers raised holdings micron technology 0.5 first quarter .
1090,they buy,"rhumbline advisers owns 1,947,554 shares semiconductor manufacturer stock valued 101,545,000 acquiring additional 10,158 shares period ."
1091,they buy,cadence capital management llc raised holdings micron technology 18.1 second quarter .
1092,they buy,"cadence capital management llc owns 32,470 shares semiconductor manufacturer stock valued 1,703,000 acquiring additional 4,972 shares period ."
1093,they buy,"finemark national bank trust bought new stake micron technology second quarter valued 201,000 ."
1094,they buy,finally malaga cove capital llc raised holdings micron technology 37.9 second quarter .
1095,they buy,"malaga cove capital llc owns 19,907 shares semiconductor manufacturer stock valued 1,044,000 acquiring additional 5,469 shares period ."
1096,they buy,74.02 stock currently owned institutional investors .
1097,they buy,micron technology company profile micron technology inc provides semiconductor systems worldwide .
1098,they buy,company operates four segments compute networking business unit storage business unit mobile business unit embedded business unit .
1099,they buy,offers ddr3 ddr4 dram products computers servers networking devices communications equipment consumer electronics automotive industrial applications lower power dram products smartphones tablets automotive laptop computers mobile consumer device applications ddr2 dram ddr dram gddr5 gddr5x dram sdram rldram products networking devices servers consumer electronics communications equipment computer peripherals automotive industrial applications well computer memory upgrades hybrid memory cube semiconductor memory devices .
1100,they buy,"see also technical analysisviewcount type=c tertiary=1 id=457453keyword micron technology nasdaq mu mu computer technology,59511210 ratings consensusratings:4,30 nasdaq mu get free copy zacks research report micron technology mu information research offerings zacks investment research visit zacks.com receive news ratings micron technology daily enter email address receive concise daily summary latest news analysts ratings micron technology related companies marketbeat.com free daily email newsletter ."
