,assoc,values
370,they buy,9 institutions increased investment jblu stock 10 institutions decreased investment jetblue airways corporation jblu stock last quarter .
371,they buy,private advisory group llc increased stake facebook 129.0 first quarter .
372,they buy,citigroup downgraded facebook buy rating lowered price objective stock 220.00 210.00 research note thursday july 26th .
373,they buy,morgan stanley upped price target shares facebook 185.00 175.00 gave stock buy rating research report friday october 12th .
374,they buy,credit suisse group set 265.00 price target shares facebook gave stock buy rating research report monday july 16th .
375,they buy,goldman sachs group restated buy rating set 225.00 price target shares facebook research report monday july 23rd .
376,they sell,finally pivotal research restated sell rating set 138.00 price target shares facebook research report friday june 29th .
377,they sell,four analysts rated stock sell rating six issued hold rating forty-one issued buy rating one assigned strong buy rating stock .
378,they buy,facebook currently average rating buy consensus price target 205.11 .
379,they sell,"news ceo mark zuckerberg sold 137,400 shares firm stock transaction dated wednesday august 1st ."
380,they sell,"shares sold average price 172.93 total transaction 23,760,582.00 ."
381,they sell,"also coo sheryl sandberg sold 55,000 shares firm stock transaction dated tuesday october 23rd ."
382,they sell,"shares sold average price 152.90 total transaction 8,409,500.00 ."
383,they sell,"insiders sold 3,898,162 shares company stock valued 687,717,145 last ninety days ."
384,they sell,according composite indicator trendspotter rated gt stock sell .
385,they sell,"short-term goodyear tire rubber company gt 20-day average volume 4,024,140 shares short-term indicators sets gt stock 60 sell average basis ."
386,they sell,"medium-term gt stock 50-day average volume 3,499,046 shares medium-term indicators gave average rating 100 sell long-term period fb stock 100-day average volume 3,297,538 shares ."
387,they sell,average long-term indicators rated stock 100 sell .
388,they sell,overall picture short medium long-term indicators sets gt stock 88 sell average basis .
389,they sell,wolfe research example initiated rating shares goodyear tire rubber company outperform according research note tuesday october 2nd 2018. giving stock hold buy rating stated research report friday august 31st 2018. morgan stanley hand downgrade overweight equal-weight rating stock research note dated monday august 13th 2018 .
390,they sell,meantime 6 new institutions bought shares goodyear tire rubber company first time 2 institutions sold holdings company common stock .
391,they buy,29 institutions increased investment gt stock 18 institutions decreased investment goodyear tire rubber company gt stock last quarter .
392,they sell,institutional investors also bought sold shares company .
393,they buy,natixis increased stake facebook 420.1 first quarter .
394,they buy,zacks investment research downgraded shares facebook strong-buy rating hold rating report wednesday july 11th .
395,they buy,valuengine raised shares facebook hold rating buy rating report friday july 6th .
396,they buy,bidaskclub raised shares facebook hold rating buy rating report tuesday july 17th .
397,they buy,finally cleveland research reaffirmed buy rating shares facebook report tuesday .
398,they sell,four analysts rated stock sell rating six issued hold rating forty-one issued buy rating one given strong buy rating company stock .
399,they buy,stock currently average rating buy consensus price target 205.11 .
400,they sell,sell-side analysts anticipate facebook inc. post 7.07 earnings per share current fiscal year .
401,they sell,"related news insider christopher k. cox sold 10,600 shares firm stock transaction occurred monday august 13th ."
402,they sell,"shares sold average price 180.98 total transaction 1,918,388.00 ."
403,they sell,"also ceo mark zuckerberg sold 602,000 shares firm stock transaction occurred wednesday august 29th ."
404,they sell,"stock sold average price 176.67 total transaction 106,355,340.00 ."
405,they sell,"insiders sold 3,898,162 shares company stock valued 687,717,145 last three months ."
406,they sell,according composite indicator trendspotter rated mu stock sell .
407,they sell,"short-term micron technology inc. mu 20-day average volume 34,756,898 shares short-term indicators sets mu stock 100 sell average basis ."
408,they sell,"medium-term mu stock 50-day average volume 38,287,676 shares medium-term indicators gave average rating 100 sell long-term period fb stock 100-day average volume 38,275,449 shares ."
409,they sell,average long-term indicators rated stock 100 sell .
410,they sell,overall picture short medium long-term indicators sets mu stock 100 sell average basis .
411,they sell,susquehanna example downgrade rating shares micron technology inc. positive neutral according research note tuesday october 23rd 2018. giving stock mkt perform rating stated research report monday october 22nd 2018. piper jaffray hand initiated neutral rating stock posting 48 price target shares company stock research note dated wednesday october 10th 2018 .
412,they sell,meantime 20 new institutions bought shares micron technology inc. first time 18 institutions sold holdings company common stock .
413,they buy,85 institutions increased investment mu stock 64 institutions decreased investment micron technology inc. mu stock last quarter .
414,they sell,institutional investors also bought sold shares company .
415,they buy,natixis increased stake facebook 420.1 first quarter .
416,they buy,zacks investment research downgraded shares facebook strong-buy rating hold rating report wednesday july 11th .
417,they buy,valuengine raised shares facebook hold rating buy rating report friday july 6th .
418,they buy,bidaskclub raised shares facebook hold rating buy rating report tuesday july 17th .
419,they buy,finally cleveland research reaffirmed buy rating shares facebook report tuesday .
420,they sell,four analysts rated stock sell rating six issued hold rating forty-one issued buy rating one given strong buy rating company stock .
421,they buy,stock currently average rating buy consensus price target 205.11 .
422,they sell,"related news coo sheryl sandberg sold 55,000 shares firm stock transaction occurred tuesday october 23rd ."
423,they sell,"shares sold average price 152.90 total transaction 8,409,500.00 ."
424,they sell,"also ceo mark zuckerberg sold 137,128 shares firm stock transaction occurred monday july 30th ."
425,they sell,"stock sold average price 169.58 total transaction 23,254,166.24 ."
426,they sell,"insiders sold 3,898,162 shares company stock valued 687,717,145 last ninety days ."
427,they sell,according composite indicator trendspotter rated key stock sell .
428,they sell,"short-term keycorp key 20-day average volume 14,591,270 shares short-term indicators sets key stock 80 sell average basis ."
429,they sell,"medium-term key stock 50-day average volume 11,854,698 shares medium-term indicators gave average rating 100 sell long-term period fb stock 100-day average volume 10,633,729 shares ."
430,they sell,average long-term indicators rated stock 100 sell .
431,they sell,overall picture short medium long-term indicators sets key stock 96 sell average basis .
432,they buy,standpoint research example upgrade rating shares keycorp hold buy according research note friday october 12th 2018. argus initiated target price stock 24 giving stock buy rating stated research report tuesday june 26th 2018. susquehanna hand upgrade neutral positive rating stock research note dated tuesday april 24th 2018 .
433,they sell,meantime 8 new institutions bought shares keycorp first time 7 institutions sold holdings company common stock .
434,they buy,39 institutions increased investment key stock 35 institutions decreased investment keycorp key stock last quarter .
