,assoc,values
0,they sell,number hedge funds also bought sold shares bkng .
1,they buy,rathbone brothers plc increased holdings shares booking 0.8 3rd quarter .
2,they buy,"lfa lugano financial advisors sa bought new stake shares booking 3rd quarter valued approximately 109,000 ."
3,they buy,swedbank increased holdings shares booking 17.0 3rd quarter .
4,they buy,manning napier group llc increased holdings shares booking 0.7 3rd quarter .
5,they buy,"finally lourd capital llc bought new stake shares booking 3rd quarter valued approximately 488,000 ."
6,they sell,booking news ceo gillian tans sold 295 shares business stock transaction monday september 17th .
7,they sell,"stock sold average price 1,917.94 total transaction 565,792.30 ."
8,they buy,"cowen set 2,200.00 price target booking gave company buy rating report monday october 22nd ."
9,they buy,"suntrust banks restated buy rating set 2,300.00 price objective shares booking research report thursday august 9th ."
10,they buy,"finally morgan stanley restated overweight rating set 2,200.00 price objective previously 2,100.00 shares booking research report wednesday july 11th ."
11,they buy,fourteen investment analysts rated stock hold rating fifteen assigned buy rating one assigned strong buy rating company .
12,they buy,"stock average rating buy average target price 2,138.41 ."
13,they buy,"finally rossmore private capital bought new stake shares booking 3rd quarter valued 208,000 ."
14,they sell,zacks investment research raised shares booking sell rating hold rating research report tuesday august 7th .
15,they buy,"morgan stanley reissued overweight rating set 2,200.00 price objective previously 2,100.00 shares booking research report wednesday july 11th ."
16,they buy,"suntrust banks reissued buy rating set 2,300.00 price objective shares booking research report tuesday july 10th ."
17,they buy,"finally mizuho lowered target price shares booking 2,400.00 set buy rating stock research note friday august 10th ."
18,they buy,fourteen research analysts rated stock hold rating fifteen assigned buy rating one given strong buy rating stock .
19,they buy,"booking presently consensus rating buy average price target 2,138.41 ."
20,they sell,related news ceo gillian tans sold 295 shares company stock transaction monday october 15th .
21,they sell,"shares sold average price 1,803.58 total value 532,056.10 ."
22,they sell,news ceo gillian tans sold 295 shares booking stock transaction occurred monday september 17th .
23,they sell,"shares sold average price 1,917.94 total transaction 565,792.30 ."
24,they sell,group sell-side analysts forecast booking holdings inc. post 89.45 earnings per share current fiscal year .
25,they buy,company growing organically also strategic partnerships recently invested 200 million grab.com .
26,they buy,firm currently buy rating business services provider stock .
27,they buy,"suntrust banks reiterated buy rating issued 2,300.00 target price shares booking research note thursday august 9th ."
28,they buy,"morgan stanley reiterated overweight rating issued 2,200.00 target price previously 2,100.00 shares booking research note wednesday july 11th ."
29,they buy,"finally mizuho dropped price objective shares booking 2,400.00 set buy rating company research report friday august 10th ."
30,they buy,fourteen investment analysts rated stock hold rating fifteen issued buy rating one issued strong buy rating stock .
31,they buy,"company currently consensus rating buy average price target 2,138.41 ."
32,they sell,news ceo gillian tans sold 295 shares company stock transaction dated monday september 17th .
33,they sell,"shares sold average price 1,917.94 total value 565,792.30 ."
34,they buy,grab bought uber regional business march present eight countries valued 11 billion understand changed round .
