,assoc,values
0,they buy,titles follows papa john’s stock buy wake shaq deal investorplace.com released march 25 2019 papa john stock gained 21 march nasdaq april 04 2019 domino earnings watch motley fool publish date february 15 2019 domino pizza king restaurant industry seeking alpha last street’s key stock analysts research reports live trading news publication date march 20 2019 .
1,they buy,however last 3 month span 27 different analysts given opinion stock lastly settled calling moderate buy .
2,they sell,recently april 4th 2019 jp morgan downgrade neutral rating .
3,they buy,march 29th 2019 nomura upgrade neutral .
4,they sell,wedbush downgrade neutral rating february 4th 2019 sandler neill upgrade buy rating january 11th 2019 barclays reiterated underweight rating january 2nd 2019 .
5,they buy,td securities lifted price objective shares keyera c 43.00 c 44.00 gave company buy rating report monday february 25th .
6,they buy,one investment analyst rated stock hold rating six given buy rating company .
7,they buy,company presently average rating buy average target price c 40.33 .
8,they sell,average sell-side analysts predict keyera post 1.82000004026549 earnings per share current year .
