,assoc,values
200,they sell,"insiders sold 36,889 shares company stock worth 2,688,936 last ninety days ."
201,they sell,zacks investment research raised shares jacobs engineering group sell rating buy rating set 88.00 target price stock research note tuesday april 23rd .
202,they buy,cowen reaffirmed buy rating set 92.00 target price shares jacobs engineering group research note wednesday april 24th .
203,they buy,mkm partners boosted price target shares jacobs engineering group 87.00 gave company buy rating research report tuesday february 26th .
204,they buy,valuengine raised shares jacobs engineering group hold rating buy rating research report monday february 25th .
205,they buy,finally citigroup set 83.00 price target shares jacobs engineering group gave company buy rating research report wednesday february 20th .
206,they buy,two equities research analysts rated stock hold rating fifteen given buy rating company .
207,they buy,stock presently consensus rating buy consensus target price 84.12 .
