,assoc,values
224,they buy,business revenue 3.5 compared quarter last year .
225,they buy,research analysts expect dover post 4.82 eps current year .
226,they buy,company also recently declared quarterly dividend paid monday september 17th .
227,they buy,stockholders record friday august 31st paid dividend 0.48 per share .
228,they buy,ex-dividend date dividend thursday august 30th .
229,they buy,represents 1.92 annualized dividend dividend yield 2.34 .
230,they buy,positive change dover previous quarterly dividend 0.47 .
231,they buy,dover dividend payout ratio dpr currently 47.64 .
232,they sell,"news director kristiane c. graham sold 50,000 shares firm stock transaction monday august 6th ."
233,they sell,"stock sold average price 82.75 total transaction 4,137,500.00 ."
234,they buy,"following transaction director owns 367,324 shares company valued 30,396,061 ."
235,they buy,sale disclosed legal filing sec accessible link .
236,they buy,company insiders 2.60 company stock .
237,they buy,several institutional investors recently made changes positions company .
238,they buy,butensky cohen financial security inc. increased stake shares dover 8.3 third quarter .
239,they buy,"butensky cohen financial security inc. owns 20,187 shares industrial products company stock valued 1,787,000 buying additional 1,550 shares period ."
240,they buy,bank montreal grew stake dover 20.4 third quarter .
241,they buy,"bank montreal owns 133,270 shares industrial products company stock valued 11,800,000 purchasing additional 22,562 shares last quarter ."
242,they buy,town country bank trust co dba first bankers trust co grew stake dover 5.4 third quarter .
243,they buy,"town country bank trust co dba first bankers trust co owns 13,495 shares industrial products company stock valued 1,195,000 purchasing additional 693 shares last quarter ."
244,they buy,"davenport co llc purchased new position dover third quarter valued 256,000 ."
245,they buy,finally spearhead capital advisors llc grew stake dover 5.0 third quarter .
246,they buy,"spearhead capital advisors llc owns 36,579 shares industrial products company stock valued 3,196,000 purchasing additional 1,733 shares last quarter ."
247,they buy,hedge funds institutional investors 90.73 company stock .
248,they buy,dover dover corporation provides equipment components specialty systems consumable supplies software digital solutions support services worldwide .
249,they buy,company operates three segments engineered systems fluids refrigeration food equipment .
250,they buy,engineered systems segment offers precision marking coding digital textile printing soldering dispensing equipment related consumables services automation components including manual clamps power clamps rotary linear mechanical indexers conveyors pick place units glove ports manipulators well end-of-arm robotic grippers slides end effectors fast-moving consumer goods digital textile printing vehicle service environmental solutions industrials end markets .
251,they buy,"read ex-dividendviewcount articlehistoryid=25231749 postdate=2018-10-12 type=a secondary=1 id=1097623 get free copy zacks research report dover dov information research offerings zacks investment research visit zacks.com keyword dover nyse dov dov industrial product,26000310 upgrade zacks investment researchratings:3,16 nyse dov receive news ratings dover daily enter email address receive concise daily summary latest news analysts ratings dover related companies marketbeat.com free daily email newsletter ."
252,they buy,name required mail published required investment analysts gordon haskett initiated coverage shares dover nyse dov research report issued friday fly reports .
253,they buy,brokerage set buy rating industrial products company stock .
254,they buy,number brokerages also issued reports dov .
255,they buy,bank america upped target price shares dover 95.00 105.00 gave stock buy rating research report wednesday september 26th .
256,they buy,barclays upped target price shares dover 96.00 gave stock overweight rating research report wednesday september 12th .
257,they buy,oppenheimer reiterated hold rating shares dover research report tuesday september 11th .
258,they buy,stifel nicolaus upped target price shares dover 85.00 92.00 gave stock hold rating research report wednesday september 12th .
259,they buy,finally royal bank canada upped target price shares dover 86.00 gave stock sector perform rating research report wednesday september 12th .
260,they buy,twelve research analysts rated stock hold rating six issued buy rating stock .
261,they buy,dover currently average rating hold average target price 90.77 .
262,they buy,shares dov stock traded 0.75 trading hours friday reaching 82.09 .
263,they buy,"8,771 shares company exchanged compared average volume 1,710,408. dover fifty-two week low 70.12 fifty-two week high 90.26 ."
264,they buy,firm market capitalization 13.08 billion price-to-earnings ratio 20.40 peg ratio 1.53 beta 1.34. company current ratio 1.35 quick ratio 0.93 debt-to-equity ratio 1.05 .
265,they buy,dover nyse dov last announced earnings results thursday july 19th .
266,they buy,industrial products company reported 1.30 earnings per share eps quarter topping zacks consensus estimate 1.21 0.09 .
267,they buy,dover net margin 9.64 return equity 18.66 .
268,they buy,company revenue 1.80 billion quarter compared analyst estimates 1.78 billion .
269,they buy,period prior year business earned 1.04 earnings per share .
270,they buy,dover quarterly revenue 3.5 year-over-year basis .
271,they sell,average equities research analysts forecast dover post 4.82 earnings per share current fiscal year .
272,they sell,"related news director kristiane c. graham sold 50,000 shares stock transaction occurred monday august 6th ."
273,they sell,"shares sold average price 82.75 total value 4,137,500.00 ."
274,they buy,"following transaction director directly owns 367,324 shares company valued 30,396,061 ."
275,they buy,sale disclosed document filed securities exchange commission available link .
276,they buy,corporate insiders 2.60 company stock .
277,they buy,hedge funds institutional investors recently made changes positions stock .
278,they buy,"winthrop partners wny llc acquired new position dover first quarter valued approximately 126,000 ."
279,they buy,"fort l.p. acquired new position dover second quarter valued approximately 118,000 ."
280,they buy,"centaurus financial inc. acquired new position dover second quarter valued approximately 127,000 ."
281,they buy,"piedmont investment advisors llc acquired new position dover second quarter valued approximately 133,000 ."
282,they buy,"finally lourd capital llc acquired new stake dover third quarter worth 214,000 ."
283,they buy,institutional investors hedge funds 90.73 company stock .
284,they buy,dover company profile dover corporation provides equipment components specialty systems consumable supplies software digital solutions support services worldwide .
285,they buy,company operates three segments engineered systems fluids refrigeration food equipment .
286,they buy,engineered systems segment offers precision marking coding digital textile printing soldering dispensing equipment related consumables services automation components including manual clamps power clamps rotary linear mechanical indexers conveyors pick place units glove ports manipulators well end-of-arm robotic grippers slides end effectors fast-moving consumer goods digital textile printing vehicle service environmental solutions industrials end markets .
287,they buy,"recommended story price earnings ratio pe viewcount articlehistoryid=25219385 postdate=2018-10-12 type=a id=1098208 keyword dover nyse dov dov industrial product,26000310 initiated coverage gordon haskettratings:3,15 nyse dov receive news ratings dover daily enter email address receive concise daily summary latest news analysts ratings dover related companies marketbeat.com free daily email newsletter ."
288,they buy,caterpillar inc. cat position increased bridge creek capital management llc brokerages set vinci sa dg target price 96.55 salem capital management inc. bought new stake shares dover corp nyse dov third quarter holdingschannel reports .
289,they buy,"institutional investor bought 2,550 shares industrial products company stock valued approximately 226,000 ."
290,they buy,google_ad_client ca-pub-0703139142419429 google_ad_slot 5621244306 google_ad_width 336 google_ad_height 280 c number institutional investors also recently modified holdings dov .
291,they buy,sei investments co. increased stake dover 19.5 1st quarter .
292,they buy,"sei investments co. owns 69,770 shares industrial products company stock valued 6,852,000 purchasing additional 11,394 shares last quarter ."
293,they buy,"gsa capital partners llp acquired new stake shares dover first quarter worth 627,000 ."
294,they buy,principal financial group inc. increased stake shares dover 1.5 first quarter .
295,they buy,"principal financial group inc. owns 242,186 shares industrial products company stock worth 23,787,000 acquiring additional 3,651 shares period ."
296,they buy,"bb securities llc acquired new stake shares dover first quarter worth 924,000 ."
297,they buy,finally nomura asset management co. ltd. increased stake shares dover 13.5 first quarter .
298,they buy,"nomura asset management co. ltd. owns 29,971 shares industrial products company stock worth 2,944,000 acquiring additional 3,567 shares period ."
299,they buy,institutional investors hedge funds 90.73 company stock .
300,they buy,dov stock traded 1.18 midday trading tuesday hitting 86.20 .
301,they buy,"59,159 shares stock traded hands compared average volume 1,705,083. firm market cap 13.08 billion pe ratio 21.68 p/e/g ratio 1.53 beta 1.34. company debt-to-equity ratio 1.05 quick ratio 0.93 current ratio 1.35. dover corp 1-year low 70.12 1-year high 90.26 ."
302,they buy,dover nyse dov last released quarterly earnings results thursday july 19th .
303,they buy,industrial products company reported 1.30 eps quarter beating thomson reuters consensus estimate 1.21 0.09 .
304,they buy,company revenue 1.80 billion quarter compared analyst estimates 1.78 billion .
305,they buy,dover net margin 9.64 return equity 18.66 .
306,they buy,firm revenue 3.5 year-over-year basis .
307,they sell,quarter last year business earned 1.04 earnings per share .
308,they sell,research analysts predict dover corp post 4.82 earnings per share current fiscal year .
309,they buy,company also recently declared quarterly dividend paid monday september 17th .
310,they buy,investors record friday august 31st given dividend 0.48 per share .
311,they buy,represents 1.92 annualized dividend yield 2.23 .
312,they buy,ex-dividend date dividend thursday august 30th .
313,they buy,positive change dover previous quarterly dividend 0.47 .
314,they buy,dover dividend payout ratio dpr currently 47.64 .
315,they buy,number analysts recently weighed dov shares .
316,they buy,citigroup upgraded shares dover neutral rating buy rating set 105.00 price objective stock research note friday september 7th .
317,they buy,bank america increased price objective shares dover 95.00 105.00 gave stock buy rating research note wednesday september 26th .
318,they buy,seaport global securities reiterated hold rating issued 80.00 price objective shares dover research note friday july 20th .
319,they buy,oppenheimer reiterated hold rating shares dover research note thursday july 19th .
320,they sell,finally zacks investment research upgraded shares dover strong sell rating hold rating research note tuesday july 17th .
321,they buy,thirteen equities research analysts rated stock hold rating four given buy rating company .
322,they buy,company currently average rating hold consensus target price 92.77 .
323,they sell,"related news director kristiane c. graham sold 50,000 shares firm stock transaction monday august 6th ."
324,they sell,"shares sold average price 82.75 total transaction 4,137,500.00 ."
325,they buy,"following sale director owns 367,324 shares company valued 30,396,061 ."
326,they buy,transaction disclosed document filed sec accessed link .
327,they buy,2.60 stock currently owned company insiders .
328,they buy,dover profile dover corporation provides equipment components specialty systems consumable supplies software digital solutions support services worldwide .
329,they buy,company operates three segments engineered systems fluids refrigeration food equipment .
330,they buy,engineered systems segment offers precision marking coding digital textile printing soldering dispensing equipment related consumables services automation components including manual clamps power clamps rotary linear mechanical indexers conveyors pick place units glove ports manipulators well end-of-arm robotic grippers slides end effectors fast-moving consumer goods digital textile printing vehicle service environmental solutions industrials end markets .
331,they buy,read compound annual growth rate cagr want see hedge funds holding dov visit holdingschannel.com get latest 13f filings insider trades dover corp nyse dov .
332,they buy,google_ad_client ca-pub-0703139142419429 google_ad_slot 1418630638 google_ad_width 336 google_ad_height 280 dover corp nyse dov stock analysts suntrust banks boosted q3 2018 earnings per share estimates shares dover report issued wednesday september 12th zacks investment research reports .
333,they buy,suntrust banks analyst c. brady anticipates industrial products company post earnings 1.25 per share quarter previous estimate 1.18 .
334,they buy,suntrust banks also issued estimates dover q4 2018 earnings 1.31 eps fy2018 earnings 4.77 eps q1 2019 earnings 1.06 eps q2 2019 earnings 1.41 eps .
335,they buy,dover nyse dov last issued earnings results thursday july 19th .
336,they buy,industrial products company reported 1.30 eps quarter beating zacks consensus estimate 1.21 0.09 .
337,they buy,dover return equity 18.66 net margin 9.64 .
338,they buy,company revenue 1.80 billion quarter compared consensus estimate 1.78 billion .
339,they buy,period previous year firm posted 1.04 earnings per share .
340,they buy,dover quarterly revenue 3.5 compared quarter last year .
341,they buy,dov subject number reports .
342,they sell,valuengine upgraded dover sell rating hold rating research note tuesday july 31st .
343,they buy,ubs group boosted target price dover 80.00 86.00 gave stock neutral rating report thursday august 30th .
344,they buy,seaport global securities reissued hold rating set 80.00 target price shares dover report friday july 20th .
345,they buy,bmo capital markets dropped target price dover 98.00 93.00 set outperform rating stock report friday july 20th .
346,they buy,finally citigroup boosted target price dover 84.00 85.00 gave stock neutral rating report friday july 20th .
347,they buy,thirteen equities research analysts rated stock hold rating four issued buy rating company stock .
348,they buy,company currently consensus rating hold average target price 92.77 .
349,they buy,dov stock traded 1.72 midday trading monday reaching 85.66 .
350,they buy,"company trading volume 1,475,263 shares compared average volume 1,703,904. company quick ratio 0.93 current ratio 1.35 debt-to-equity ratio 1.05. dover fifty-two week low 70.12 fifty-two week high 90.26 ."
351,they buy,company market cap 13.08 billion p/e ratio 21.39 peg ratio 1.53 beta 1.34 .
352,they sell,number hedge funds institutional investors recently bought sold shares business .
353,they buy,blackrock inc. grew position dover 1.3 1st quarter .
354,they buy,"blackrock inc. owns 10,252,508 shares industrial products company stock worth 1,007,002,000 purchasing additional 135,700 shares last quarter ."
355,they buy,bank america corp de grew position dover 15.9 2nd quarter .
356,they buy,"bank america corp de owns 5,304,419 shares industrial products company stock worth 388,283,000 purchasing additional 726,930 shares last quarter ."
357,they buy,boston partners grew position dover 110.3 2nd quarter .
358,they buy,"boston partners owns 5,131,152 shares industrial products company stock worth 375,601,000 purchasing additional 2,691,480 shares last quarter ."
359,they buy,third point llc grew position dover 2.0 2nd quarter .
360,they buy,"third point llc owns 4,000,000 shares industrial products company stock worth 292,800,000 purchasing additional 80,000 shares last quarter ."
361,they buy,finally northern trust corp grew position dover 15.2 2nd quarter .
362,they buy,"northern trust corp owns 2,323,795 shares industrial products company stock worth 170,101,000 purchasing additional 306,116 shares last quarter ."
363,they buy,hedge funds institutional investors 90.73 company stock .
364,they sell,"dover news director kristiane c. graham sold 50,000 shares company stock transaction monday august 6th ."
365,they sell,"stock sold average price 82.75 total value 4,137,500.00 ."
366,they buy,"following transaction director owns 367,324 shares company stock valued 30,396,061 ."
367,they buy,transaction disclosed filing securities exchange commission available link .
368,they buy,2.60 stock currently owned corporate insiders .
369,they buy,business also recently declared quarterly dividend paid monday september 17th .
370,they buy,shareholders record friday august 31st issued 0.48 dividend .
371,they buy,ex-dividend date thursday august 30th .
372,they buy,represents 1.92 annualized dividend dividend yield 2.24 .
373,they buy,boost dover previous quarterly dividend 0.47 .
374,they buy,dover dividend payout ratio currently 47.64 .
375,they buy,dover dover corporation provides equipment components specialty systems consumable supplies software digital solutions support services worldwide .
376,they buy,company operates three segments engineered systems fluids refrigeration food equipment .
377,they buy,engineered systems segment offers precision marking coding digital textile printing soldering dispensing equipment related consumables services automation components including manual clamps power clamps rotary linear mechanical indexers conveyors pick place units glove ports manipulators well end-of-arm robotic grippers slides end effectors fast-moving consumer goods digital textile printing vehicle service environmental solutions industrials end markets .
378,they buy,recommended story diversification important investing get free copy zacks research report dover dov information research offerings zacks investment research visit zacks.com google_ad_client ca-pub-0703139142419429 google_ad_slot 1418630638 google_ad_width 336 google_ad_height 280 past 52 weeks dover corporation nyse dov embarked rally seen rise 9.53 1.52 since start year .
379,they buy,equity price sank week trend led investors traders taking note stock .
380,they buy,look monthly performance shows stock recorded fall past 30 days .
381,they buy,equity price climbed 12 past three months led overall six-month increase stand 9.44 .
382,they buy,shares dover corporation dov dropped 7.5 last recorded high 90.26 attained september 21 close 82.76 per share .
383,they buy,past 52 weeks shares dover corporation trading low 70.06 witnessing massive surge 18.13 12.7 .
384,they buy,price movement led dov stock receiving attention become one watch .
385,they buy,dipped wednesday got market worried .
386,they buy,stock beta stands 1.37 compared 200-day moving average 50-day moving average dov price stands 2.74 respectively .
387,they buy,average daily volatility week 1.91 1.41 recorded past month .
388,they buy,experts research firms bullish near-term performance dover corporation predicting 91.73 price target short-term 12 months basis .
389,they buy,average price target analysts see 10.84 rise stock would lead dov market cap surge 13.66b .
390,they sell,stock rated average 2.5 roughly stands towards bearish end spectrum .
391,they buy,reuters looked 17 analysts track dover corporation nyse dov find 12 rated hold .
392,they sell,5 5 analysts rated buy strong buy 0 advised investors desist buying stock sell already possess .
393,they buy,look dov technical analysis shows 14-day relative strength index rsi oversold zone reaching 27.25 point .
394,they buy,trading volume added 629218 shares compared readings past three months recently exchanged 2209218 shares .
395,they buy,means improved activity short-term traders per session average trading volume 1580000 shares 1.4 times normal volume .
396,they buy,price morgan stanley nyse ms currently stands 44.62 went found strong support 43.95 share .
397,they buy,ms price drops critical support would lead bearish trend .
398,they buy,short-term dip 43.29 mark would also bad stock means stock would plunge 2.98 current position .
399,they buy,however stock price able trade resistance point around 45.85 could likely surge higher try break upward resistance stands 47.08 share .
400,they buy,average daily volatility past one month stands 1.94 .
401,they buy,stock plunged 0.24 52-weeks high 44.515 reached mar .
402,they buy,12 2018. general 52-weeks lowest point stands 45.94 setback observed oct. 10 2018 .
403,they buy,analysts predicted price target morgan stanley ms 1 year stands average 58.67/share .
404,they buy,means would likely increase 31.49 current position .
405,they buy,current price stock moving 44.515 46.41 .
406,they buy,brokerage firms lower target stock average one setting price target low 50 .
407,they buy,hand one analyst super bullish price setting target high 72 .
408,they buy,smith shellnut wilson llc adv acquired new stake dover corp nyse dov 3rd quarter according company recent disclosure securities exchange commission sec .
409,they buy,"firm acquired 2,840 shares industrial products company stock valued approximately 251,000 ."
410,they buy,several hedge funds also recently added reduced stakes company .
411,they buy,bank america corp de grew position shares dover 15.9 second quarter .
412,they buy,"bank america corp de owns 5,304,419 shares industrial products company stock worth 388,283,000 buying additional 726,930 shares last quarter ."
413,they buy,boston partners grew position shares dover 110.3 second quarter .
414,they buy,"boston partners owns 5,131,152 shares industrial products company stock worth 375,601,000 buying additional 2,691,480 shares last quarter ."
415,they buy,third point llc grew position shares dover 2.0 second quarter .
416,they buy,"third point llc owns 4,000,000 shares industrial products company stock worth 292,800,000 buying additional 80,000 shares last quarter ."
417,they buy,northern trust corp lifted stake dover 15.2 second quarter .
418,they buy,"northern trust corp owns 2,323,795 shares industrial products company stock worth 170,101,000 purchasing additional 306,116 shares last quarter ."
419,they buy,finally wedge capital management l l p nc lifted stake dover 11.1 second quarter .
420,they buy,"wedge capital management l l p nc owns 1,830,239 shares industrial products company stock worth 133,973,000 purchasing additional 182,723 shares last quarter ."
421,they buy,90.73 stock owned institutional investors hedge funds .
422,they buy,shares dov opened 82.76 thursday .
423,they buy,dover corp 12-month low 70.12 12-month high 90.26 .
424,they buy,firm market cap 13.08 billion p/e ratio 20.54 peg ratio 1.53 beta 1.34. company current ratio 1.35 quick ratio 0.93 debt-to-equity ratio 1.05 .
425,they buy,business also recently announced quarterly dividend paid monday september 17th .
426,they buy,shareholders record friday august 31st paid 0.48 dividend .
427,they buy,represents 1.92 dividend annualized basis yield 2.32 .
428,they buy,boost dover previous quarterly dividend 0.47 .
429,they buy,ex-dividend date thursday august 30th .
430,they buy,dover dividend payout ratio dpr presently 47.64 .
431,they buy,dov topic several research analyst reports .
432,they buy,barclays raised price objective dover 96.00 gave stock overweight rating research note wednesday september 12th .
433,they buy,bank america raised price objective dover 95.00 105.00 gave stock buy rating research note wednesday september 26th .
434,they buy,morgan stanley reduced price objective dover 88.00 83.00 set overweight rating stock research note friday july 20th .
435,they buy,bmo capital markets reduced price objective dover 98.00 set positive rating stock research note monday june 18th .
436,they buy,finally stifel nicolaus raised price objective dover 85.00 92.00 gave stock hold rating research note wednesday september 12th .
437,they buy,thirteen analysts rated stock hold rating four assigned buy rating company .
438,they buy,stock presently consensus rating hold average target price 92.77 .
439,they sell,"dover news director kristiane c. graham sold 50,000 shares firm stock transaction monday august 6th ."
440,they sell,"stock sold average price 82.75 total value 4,137,500.00 ."
441,they buy,"following sale director directly owns 367,324 shares company valued 30,396,061 ."
442,they buy,transaction disclosed document filed securities exchange commission accessible link .
443,they buy,company insiders 2.60 company stock .
444,they buy,dover profile dover corporation provides equipment components specialty systems consumable supplies software digital solutions support services worldwide .
445,they buy,company operates three segments engineered systems fluids refrigeration food equipment .
