,assoc,values
446,they buy,engineered systems segment offers precision marking coding digital textile printing soldering dispensing equipment related consumables services automation components including manual clamps power clamps rotary linear mechanical indexers conveyors pick place units glove ports manipulators well end-of-arm robotic grippers slides end effectors fast-moving consumer goods digital textile printing vehicle service environmental solutions industrials end markets .
447,they buy,"read stop orderviewcount articlehistoryid=25169682 postdate=2018-10-11 type=f id=4077552 keyword dover nyse dov dov industrial product,26000310 sec filings,13f hedge fund holdings institutional investor holdingsratings:3,15 nyse dov receive news ratings dover daily enter email address receive concise daily summary latest news analysts ratings dover related companies marketbeat.com free daily email newsletter ."
448,they buy,"private trust co. na acquires new position ishares tr/msci philippines et ephe next financial group inc 272,000 holdings ishares us preferred stock etf pff dover corporation nyse dov stock enjoyed overall uptrend 5.08 beginning 2018. closing share price quoted october 09 2018 85.66 ."
449,they sell,drop might tempting investor sell point fact would prove short-sighted mistake sell-side analysts think almost 22.58 gain yet come shareholders .
450,they buy,analysts seemed set 105 highest price target way greater gains .
451,they buy,average 12-month price target expect stock 92.5 .
452,they sell,mean price target represents 7.99 upside previous closing price .
453,they buy,median price target presented 91 next 12-months suggests 6.23 upside current levels .
454,they buy,analysts lowest price target stock 81 would mean gain value .
455,they buy,fresh roundup today notes dov stock added around 13.1 value past 12 months suggesting investors expressed joy time period .
456,they buy,turn street general positives still outweigh negatives see dover corporation dov neutral 2.5 analyst consensus rating .
457,they buy,current time stock 5 buy 12 hold ratings .
458,they buy,stock registered 52-week high 90.26 september 21 52-week low 70.06 april 27. currently shares trading 5.1 ytd moving average 80.56 .
459,they buy,moving dover corporation dov last reported june 2018 earnings .
460,they buy,brief highlights performed well quarter earnings 25 year-over-year 1.3 .
461,they sell,company surprised analysts 7 expecting 1.21 per share .
462,they buy,overall quarterly revenues dropped reach 1.8 billion reported 1.99 billion period year ago .
463,they buy,see investors really expect september 2018 financial results consensus analyst estimates calling current quarter earnings per share 1.28 1.16 quarter year ago .
464,they buy,however earnings-per-share expected see growth 16.04 next year .
465,they buy,company believes achieve long-term annual earnings growth rate 14.58 .
466,they buy,end income statement seen revenue 7.46 billion trailing 12 months .
467,they buy,help decide whether worth wait money dover corporation nyse dov currently trading 19.18x company trailing-12-month earnings per share represents discount compared sector 24.72x comes industry 27x .
468,they buy,popular method valuing stock study historic price-to-earnings p/e ratio using reported earnings past 12 months .
469,they buy,eps number stock recent four quarters earnings stood 4.47 .
470,they buy,p/e ratio popular simple effective tautologically everyone uses .
471,they buy,14-day absolute atr average true range tuesday october 09 2018 shows price average moves 1.29 .
472,they buy,average daily volatility 1.44 past week .
473,they buy,low volatility good stock means calm confident investors .
474,they buy,check recent dover corporation dov volume see changed 1.48 million shares versus average daily volume 1.57 million shares .
475,they buy,look daily chart dov observe stock held 13.44 gains 6-month period maintains 22.28 distance recent low .
476,they buy,past 5-day performance share stays negative three-week moving average .
477,they buy,comparing 50-day sma dover corporation shares price 0.05 .
478,they buy,also closed 6.37 higher 200-day sma .
479,they buy,often seen last line defense long term trends find support else considered broken and/or bear market .
480,they buy,daily chart stock clearly reveals slide prices closed tuesday 1-month performance 0.15 .
481,they buy,centaurus financial inc. bought new stake shares dover corp nyse dov 2nd quarter according recent disclosure securities exchange commission .
482,they buy,"institutional investor bought 1,729 shares industrial products company stock valued approximately 127,000 ."
483,they buy,large investors also made changes positions company .
484,they buy,"winthrop partners wny llc purchased new stake shares dover first quarter worth 126,000 ."
485,they buy,"fort l.p. purchased new stake shares dover second quarter worth 118,000 ."
486,they buy,"piedmont investment advisors llc purchased new stake shares dover second quarter worth 133,000 ."
487,they buy,"first commonwealth financial corp pa purchased new position dover first quarter worth approximately 211,000 ."
488,they buy,"finally sciencast management lp purchased new position dover first quarter worth approximately 250,000 ."
489,they buy,90.73 stock currently owned institutional investors .
490,they buy,shares nyse dov opened 85.66 wednesday .
491,they buy,firm market capitalization 13.08 billion pe ratio 21.39 peg ratio 1.53 beta 1.34. dover corp twelve month low 70.12 twelve month high 90.26 .
492,they buy,company quick ratio 0.93 current ratio 1.35 debt-to-equity ratio 1.05 .
493,they sell,business also recently announced quarterly dividend paid monday september 17th .
494,they buy,investors record friday august 31st issued 0.48 dividend .
495,they buy,ex-dividend date thursday august 30th .
496,they buy,positive change dover previous quarterly dividend 0.47 .
497,they buy,represents 1.92 dividend annualized basis yield 2.24 .
498,they buy,dover dividend payout ratio dpr 47.64 .
499,they sell,"dover news director kristiane c. graham sold 50,000 shares dover stock transaction dated monday august 6th ."
500,they sell,"stock sold average price 82.75 total transaction 4,137,500.00 ."
501,they buy,"following completion sale director directly owns 367,324 shares company stock valued approximately 30,396,061 ."
502,they buy,sale disclosed document filed securities exchange commission accessed link .
503,they buy,2.60 stock owned insiders .
504,they buy,dov topic number recent analyst reports .
505,they buy,bmo capital markets lowered price target dover 98.00 set positive rating stock research report monday june 18th .
506,they buy,william blair reiterated market perform rating shares dover research report tuesday july 3rd .
507,they buy,barclays decreased target price dover 94.00 88.00 set overweight rating stock research report monday july 9th .
508,they buy,citigroup decreased target price dover 86.00 84.00 set neutral rating stock research report wednesday july 11th .
509,they buy,finally med initiated coverage dover research report thursday july 12th .
510,they buy,issued hold rating 79.00 target price stock .
511,they buy,thirteen analysts rated stock hold rating four issued buy rating company .
512,they buy,dover presently average rating hold consensus target price 92.77 .
513,they buy,dover profile dover corporation provides equipment components specialty systems consumable supplies software digital solutions support services worldwide .
514,they buy,company operates three segments engineered systems fluids refrigeration food equipment .
515,they buy,engineered systems segment offers precision marking coding digital textile printing soldering dispensing equipment related consumables services automation components including manual clamps power clamps rotary linear mechanical indexers conveyors pick place units glove ports manipulators well end-of-arm robotic grippers slides end effectors fast-moving consumer goods digital textile printing vehicle service environmental solutions industrials end markets .
516,they buy,"featured article stock symbolviewcount type=f id=4026162 keyword dover nyse dov dov industrial product,26000310 sec filings,13f hedge fund holdings institutional investor holdingsratings:3,15 nyse dovrefreshed2 receive news ratings dover daily enter email address receive concise daily summary latest news analysts ratings dover related companies marketbeat.com free daily email newsletter ."
517,they buy,name required mail published required dover corp nyse dov seaport global securities upped q4 2018 eps estimates shares dover research note issued investors wednesday september 12th zacks investment research reports .
518,they buy,seaport global securities analyst w. liptak expects industrial products company post earnings per share 1.28 quarter previous estimate 1.26 .
519,they buy,seaport global securities currently hold rating 80.00 price target stock .
520,they buy,seaport global securities also issued estimates dover q1 2019 earnings 1.13 eps q2 2019 earnings 1.53 eps q3 2019 earnings 1.51 eps q4 2019 earnings 1.59 eps fy2019 earnings 5.76 eps .
521,they buy,number research firms also recently commented dov .
522,they buy,barclays boosted price target shares dover 96.00 gave stock overweight rating research note wednesday september 12th .
523,they buy,bank america upped price objective shares dover 95.00 105.00 gave company buy rating research note wednesday september 26th .
524,they buy,morgan stanley cut price objective shares dover 88.00 83.00 set overweight rating company research note friday july 20th .
525,they buy,bmo capital markets cut price objective shares dover 98.00 set positive rating company research note monday june 18th .
526,they buy,finally stifel nicolaus upped price objective shares dover 85.00 92.00 gave company hold rating research note wednesday september 12th .
527,they buy,thirteen research analysts rated stock hold rating four issued buy rating company stock .
528,they buy,company presently average rating hold average price target 92.77 .
529,they buy,dov stock traded 1.72 midday trading monday reaching 85.66 .
530,they buy,"company trading volume 1,475,700 shares compared average volume 1,703,907. company debt-to-equity ratio 1.05 current ratio 1.35 quick ratio 0.93. dover 1 year low 70.12 1 year high 90.26 ."
531,they buy,stock market cap 13.08 billion pe ratio 21.39 p/e/g ratio 1.53 beta 1.34 .
532,they buy,dover nyse dov last released quarterly earnings results thursday july 19th .
533,they buy,industrial products company reported 1.30 eps quarter topping zacks consensus estimate 1.21 0.09 .
534,they buy,dover net margin 9.64 return equity 18.66 .
535,they buy,business revenue 1.80 billion quarter compared analysts expectations 1.78 billion .
536,they buy,quarter previous year company earned 1.04 eps .
537,they buy,business quarterly revenue 3.5 compared quarter last year .
538,they buy,number institutional investors hedge funds recently made changes positions business .
539,they buy,"salem capital management inc. purchased new stake dover 3rd quarter valued 226,000 ."
540,they buy,"smith shellnut wilson llc adv purchased new stake dover 3rd quarter valued 251,000 ."
541,they buy,fox run management l.l.c .
542,they buy,"purchased new stake dover 3rd quarter valued 274,000 ."
543,they buy,"norman fields gottscho capital management llc purchased new stake dover 3rd quarter valued 230,000 ."
544,they buy,finally united services automobile association boosted position dover 34.7 2nd quarter .
545,they buy,"united services automobile association owns 185,625 shares industrial products company stock valued 13,588,000 buying additional 47,852 shares period ."
546,they buy,90.73 stock owned institutional investors hedge funds .
547,they sell,"dover news director kristiane c. graham sold 50,000 shares stock transaction monday august 6th ."
548,they sell,"shares sold average price 82.75 total transaction 4,137,500.00 ."
549,they buy,"following completion sale director owns 367,324 shares company stock valued approximately 30,396,061 ."
550,they buy,sale disclosed filing securities exchange commission available link .
551,they buy,corporate insiders 2.60 company stock .
552,they buy,company also recently declared quarterly dividend paid monday september 17th .
553,they buy,shareholders record friday august 31st given dividend 0.48 per share .
554,they buy,ex-dividend date thursday august 30th .
555,they buy,represents 1.92 annualized dividend yield 2.24 .
556,they buy,boost dover previous quarterly dividend 0.47 .
557,they buy,dover dividend payout ratio presently 47.64 .
558,they buy,dover dover corporation provides equipment components specialty systems consumable supplies software digital solutions support services worldwide .
559,they buy,company operates three segments engineered systems fluids refrigeration food equipment .
560,they buy,engineered systems segment offers precision marking coding digital textile printing soldering dispensing equipment related consumables services automation components including manual clamps power clamps rotary linear mechanical indexers conveyors pick place units glove ports manipulators well end-of-arm robotic grippers slides end effectors fast-moving consumer goods digital textile printing vehicle service environmental solutions industrials end markets .
561,they sell,"see also companies p 500 selected viewcount type=r id=538872 get free copy zacks research report dover dov information research offerings zacks investment research visit zacks.comkeyword dover nyse dov dov industrial product,26000310 earnings estimates seaport global securitiesratings:3,15 nyse dov receive news ratings dover daily enter email address receive concise daily summary latest news analysts ratings dover related companies marketbeat.com free daily email newsletter ."
562,they buy,encore wire wire upgraded bidaskclub amag pharmaceuticals amag downgraded bidaskclub morgan stanley lowered holdings shares dover corp nyse dov 7.8 second quarter according company recent form 13f filing securities exchange commission .
563,they buy,"fund owned 572,767 shares industrial products company stock selling 48,301 shares period ."
564,they buy,"morgan stanley owned 0.39 dover worth 41,927,000 end recent reporting period ."
565,they buy,institutional investors hedge funds also made changes positions company .
566,they buy,"summit trail advisors llc raised position shares dover 4,425.8 first quarter ."
567,they buy,"summit trail advisors llc owns 106,446 shares industrial products company stock valued 106,000 buying additional 104,094 shares last quarter ."
568,they buy,"fort l.p. acquired new position shares dover second quarter valued approximately 118,000 ."
569,they buy,"winthrop partners wny llc acquired new position shares dover first quarter valued approximately 126,000 ."
570,they buy,"piedmont investment advisors llc acquired new position shares dover second quarter valued approximately 133,000 ."
571,they buy,"finally first commonwealth financial corp pa acquired new position shares dover first quarter valued approximately 211,000 ."
572,they buy,institutional investors 90.73 company stock .
573,they buy,number equities analysts recently weighed stock .
574,they sell,valuengine raised shares dover sell rating hold rating research report tuesday july 31st .
575,they buy,ubs group upped price target shares dover 80.00 86.00 gave stock neutral rating research report thursday august 30th .
576,they buy,seaport global securities reaffirmed hold rating set 80.00 price target shares dover research report friday july 20th .
577,they buy,bmo capital markets dropped price target shares dover 98.00 93.00 set outperform rating company research report friday july 20th .
578,they buy,finally citigroup upped price target shares dover 84.00 85.00 gave stock neutral rating research report friday july 20th .
579,they buy,thirteen analysts rated stock hold rating four assigned buy rating stock .
580,they buy,company presently consensus rating hold consensus target price 92.77 .
581,they buy,dover nyse dov last released quarterly earnings data thursday july 19th .
582,they buy,industrial products company reported 1.30 earnings per share eps quarter topping consensus estimate 1.21 0.09 .
583,they buy,dover net margin 9.64 return equity 18.66 .
584,they buy,company revenue 1.80 billion quarter compared consensus estimate 1.78 billion .
585,they buy,period previous year firm earned 1.04 earnings per share .
586,they buy,dover revenue quarter 3.5 year-over-year basis .
587,they sell,average research analysts predict dover corp post 4.82 earnings per share current fiscal year .
588,they buy,firm also recently disclosed quarterly dividend paid monday september 17th .
589,they buy,shareholders record friday august 31st paid dividend 0.48 per share .
590,they buy,increase dover previous quarterly dividend 0.47 .
591,they buy,represents 1.92 annualized dividend yield 2.20 .
592,they buy,ex-dividend date dividend thursday august 30th .
593,they buy,dover payout ratio currently 47.64 .
594,they sell,"dover news director kristiane c. graham sold 50,000 shares business stock transaction occurred monday august 6th ."
595,they sell,"shares sold average price 82.75 total transaction 4,137,500.00 ."
596,they buy,"following completion sale director directly owns 367,324 shares company valued 30,396,061 ."
597,they buy,transaction disclosed legal filing sec available link .
598,they buy,2.60 stock owned insiders .
599,they buy,dover dover corporation provides equipment components specialty systems consumable supplies software digital solutions support services worldwide .
600,they buy,company operates three segments engineered systems fluids refrigeration food equipment .
601,they buy,engineered systems segment offers precision marking coding digital textile printing soldering dispensing equipment related consumables services automation components including manual clamps power clamps rotary linear mechanical indexers conveyors pick place units glove ports manipulators well end-of-arm robotic grippers slides end effectors fast-moving consumer goods digital textile printing vehicle service environmental solutions industrials end markets .
602,they buy,"featured story closed-end mutual funds viewcount type=f id=4005194 keyword dover nyse dov dov industrial product,26000310 sec filings,13f hedge fund holdings institutional investor holdingsratings:3,15 nyse dovrefreshed1 receive news ratings dover daily enter email address receive concise daily summary latest news analysts ratings dover related companies marketbeat.com free daily email newsletter ."
603,they buy,name required mail published required dover corp nyse dov stock analysts suntrust banks boosted q3 2018 earnings per share estimates shares dover report issued wednesday september 12th zacks investment research reports .
604,they buy,suntrust banks analyst c. brady anticipates industrial products company post earnings 1.25 per share quarter previous estimate 1.18 .
605,they buy,suntrust banks also issued estimates dover q4 2018 earnings 1.31 eps fy2018 earnings 4.77 eps q1 2019 earnings 1.06 eps q2 2019 earnings 1.41 eps .
606,they buy,dover nyse dov last issued earnings results thursday july 19th .
607,they buy,industrial products company reported 1.30 eps quarter beating zacks consensus estimate 1.21 0.09 .
608,they buy,dover return equity 18.66 net margin 9.64 .
609,they buy,company revenue 1.80 billion quarter compared consensus estimate 1.78 billion .
610,they buy,period previous year firm posted 1.04 earnings per share .
611,they buy,dover quarterly revenue 3.5 compared quarter last year .
612,they buy,dov stock traded 1.72 midday trading monday reaching 85.66 .
613,they buy,"company trading volume 1,475,263 shares compared average volume 1,703,904. company quick ratio 0.93 current ratio 1.35 debt-to-equity ratio 1.05. dover fifty-two week low 70.12 fifty-two week high 90.26 ."
614,they buy,company market cap 13.08 billion p/e ratio 21.39 peg ratio 1.53 beta 1.34 .
615,they sell,number hedge funds institutional investors recently bought sold shares business .
616,they buy,blackrock inc. grew position dover 1.3 1st quarter .
617,they buy,"blackrock inc. owns 10,252,508 shares industrial products company stock worth 1,007,002,000 purchasing additional 135,700 shares last quarter ."
618,they buy,bank america corp de grew position dover 15.9 2nd quarter .
619,they buy,"bank america corp de owns 5,304,419 shares industrial products company stock worth 388,283,000 purchasing additional 726,930 shares last quarter ."
620,they buy,boston partners grew position dover 110.3 2nd quarter .
621,they buy,"boston partners owns 5,131,152 shares industrial products company stock worth 375,601,000 purchasing additional 2,691,480 shares last quarter ."
622,they buy,third point llc grew position dover 2.0 2nd quarter .
623,they buy,"third point llc owns 4,000,000 shares industrial products company stock worth 292,800,000 purchasing additional 80,000 shares last quarter ."
624,they buy,finally northern trust corp grew position dover 15.2 2nd quarter .
625,they buy,"northern trust corp owns 2,323,795 shares industrial products company stock worth 170,101,000 purchasing additional 306,116 shares last quarter ."
626,they buy,hedge funds institutional investors 90.73 company stock .
627,they sell,"dover news director kristiane c. graham sold 50,000 shares company stock transaction monday august 6th ."
628,they sell,"stock sold average price 82.75 total value 4,137,500.00 ."
629,they buy,"following transaction director owns 367,324 shares company stock valued 30,396,061 ."
630,they buy,transaction disclosed filing securities exchange commission available link .
631,they buy,2.60 stock currently owned corporate insiders .
632,they buy,business also recently declared quarterly dividend paid monday september 17th .
633,they buy,shareholders record friday august 31st issued 0.48 dividend .
634,they buy,ex-dividend date thursday august 30th .
635,they buy,represents 1.92 annualized dividend dividend yield 2.24 .
636,they buy,boost dover previous quarterly dividend 0.47 .
637,they buy,dover dividend payout ratio currently 47.64 .
638,they buy,dover dover corporation provides equipment components specialty systems consumable supplies software digital solutions support services worldwide .
639,they buy,company operates three segments engineered systems fluids refrigeration food equipment .
640,they buy,engineered systems segment offers precision marking coding digital textile printing soldering dispensing equipment related consumables services automation components including manual clamps power clamps rotary linear mechanical indexers conveyors pick place units glove ports manipulators well end-of-arm robotic grippers slides end effectors fast-moving consumer goods digital textile printing vehicle service environmental solutions industrials end markets .
641,they buy,"recommended story diversification important investing viewcount type=r id=538871 get free copy zacks research report dover dov information research offerings zacks investment research visit zacks.comkeyword dover nyse dov dov industrial product,26000310 earnings estimates suntrust banks inc.ratings:3,15 nyse dov receive news ratings dover daily enter email address receive concise daily summary latest news analysts ratings dover related companies marketbeat.com free daily email newsletter ."
642,they buy,first hawaiian inc fhb expected announce quarterly sales 195.18 million schlumberger limited .
643,they buy,slb post q3 2018 earnings 0.46 per share suntrust banks forecasts shares dover corporation nyse dov recorded loss trading session october 8th 2018. script traded low 86.44 last traded 87.38 .
644,they buy,869014 shares changed exchanged hands trading increase 44.65 30-day average session volume 1.57m shares .
645,they buy,firm previously closed 87.43 .
646,they buy,company 148.94m outstanding shares price-to-earnings ratio 19.56 price-to-earnings-growth ratio 1.74 beta 1.37. company rsi 50.77 atr 1.28 volatility 1.22 week .
647,they buy,dov 52 week low price 70.06 52 week high price 90.26 .
648,they buy,investors identified tech company dover corporation interesting stock investments made in-depth look trading activities conducted .
649,they buy,share trading market value around 13.01b company obstacles catalysts affect came mode operations .
650,they buy,company affected events currently perfect time analyze numbers behind firm order come rather realistic picture stock .
651,they buy,dover corporation dov fundamentals considered .
652,they buy,analyzing stock first fundamental thing take account balance sheet .
653,they buy,healthy balance sheet company determine company able carry financial non-financial obligations also keep faith investors .
654,they buy,dov company raw cash 242.81 million books 284.63 million currently liabilities .
655,they buy,trend time investors concerned .
656,they buy,company healthy balance sheet debt profile decline .
657,they buy,terms assets company currently 8.47 billion total 5.63 billion total liabilities .
658,they buy,figure given company good sense viability numerous contexts .
659,they buy,dov able record 101.54 million free cash flow third quarter year saw quarterly net cash flow reduce million .
660,they buy,cash movements company total 139.55 million operating cash flow .
661,they buy,potential earnings growth dover corporation dov order determine future investment potential stock analyze key trends affect .
