,assoc,values
662,they buy,third quarter year dover corporation recorded total 1.8 billion revenue .
663,they buy,figure implies witnessed quarterly year/year change earnings coming sequential stages sales third quarter reducing .
664,they buy,matters though ends .
665,they buy,core data company broken stock sounds interesting .
666,they sell,company spent 1.13 billion trying sell products last quarter result yielding gross income 665.39 million .
667,they buy,allows shareholders hold 153.94 million revenue reading 0.91 cents per share .
668,they buy,figure close analyst prediction fourth quarter 1.33 cents share .
669,they sell,stock dov attractive look company valuation company expected record 5.67 total earnings per share next fiscal year .
670,they buy,taking look median price earnings ratio means stock price region 15.63 per share .
671,they buy,important though remember importance trend far outweighs outlook .
672,they buy,analysis great getting updates dov sounds interesting .
673,they sell,"related news director graham kristiane c sold 50,000 shares company stock transaction recorded august 6th 2018. sale performed average price 82.75 total value 4,137,500. sale deal closes senior vice president cfo graham kristiane c sold 20,000 shares company stock valued 1,516,600. also director winston mary sold 2,500 shares company stock deal recorded june 7th 2018. shares sold average price 78.86 per share total market value 15,055. following completion acquisition senior vice president holds 14,745 shares company stock valued 1,160,038. last 6 months insiders changed ownership shares company stock 0.50 ."
674,they buy,3 17 analysts covering stock rated buy 12 maintained hold recommendation dover corporation stock .
675,they sell,0 analysts assigned sell rating dov stock .
676,they buy,12-month mean consensus price target company shares set 91.73 .
677,they buy,fin sky adsbygoogle window.adsbygoogle .push finmercury online publication created 2001. occupy first place ranking daily attendance among internet media united states .
