,assoc,values
448,they buy,98.48 stock currently owned institutional investors .
449,they buy,hrb stock opened 26.73 wednesday .
450,they buy,h r block inc 1 year low 22.45 1 year high 30.62 .
451,they buy,company debt-to-equity ratio 3.80 quick ratio 2.24 current ratio 2.24. company market capitalization 5.43 billion p/e ratio 8.97 p/e/g ratio 1.26 beta 0.21 .
452,they buy,several equities research analysts recently commented company .
453,they sell,zacks investment research raised h r block sell rating hold rating research note tuesday august 14th .
454,they buy,valuengine raised h r block hold rating buy rating research note friday april 27th .
455,they buy,morgan stanley boosted price target h r block 28.00 30.00 gave stock equal weight rating research note thursday april 26th .
456,they sell,btig research reissued sell rating set 19.00 price target shares h r block research note thursday june 21st .
457,they buy,finally barrington research decreased price target h r block 32.00 27.00 set outperform rating stock research note thursday june 14th .
458,they sell,two investment analysts rated stock sell rating seven issued hold rating two issued buy rating company .
459,they buy,stock presently average rating hold average target price 25.96 .
460,they buy,want see hedge funds holding hrb visit holdingschannel.com get latest 13f filings insider trades h r block inc nyse hrb .
461,they buy,"keyword h r block nyse hrb hrb consumer discretionary,09367110 sec filings,13f hedge fund holdings institutional investor holdingsratings:3,8 nyse hrb receive news ratings h r block daily enter email address receive concise daily summary latest news analysts ratings h r block related companies marketbeat.com free daily email newsletter ."
462,they buy,creative planning takes position anaptysbio inc nasdaq anab press coverage h r block nyse hrb trending somewhat positive recently accern reports .
463,they buy,research firm identifies negative positive media coverage monitoring 20 million news blog sources real-time .
464,they buy,accern ranks coverage public companies scale negative one one scores closest one favorable .
465,they buy,h r block earned media sentiment score 0.06 accern scale .
466,they buy,accern also gave press coverage company impact score 44.3422888851835 100 indicating recent media coverage somewhat unlikely effect stock share price immediate future .
467,they buy,news stories may effected accern scoring number brokerages recently commented hrb .
468,they sell,zacks investment research raised shares h r block sell rating hold rating report tuesday august 14th .
469,they sell,btig research reaffirmed sell rating issued 19.00 target price shares h r block report thursday june 21st .
470,they sell,valuengine cut shares h r block sell rating strong sell rating report wednesday june 13th .
471,they buy,bmo capital markets cut target price shares h r block 29.00 25.00 set market perform rating stock report wednesday june 13th .
472,they buy,finally thestreet raised shares h r block c+ rating b rating report tuesday june 12th .
473,they sell,two research analysts rated stock sell rating seven issued hold rating two issued buy rating company .
474,they buy,company consensus rating hold average target price 25.96 .
475,they buy,h r block nyse hrb last posted quarterly earnings data tuesday june 12th .
476,they sell,company reported 5.43 earnings per share quarter beating analysts consensus estimates 5.27 0.16 .
477,they buy,h r block net margin 19.40 negative return equity 269.22 .
478,they buy,firm revenue 2.39 billion quarter compared analyst estimates 2.34 billion .
479,they buy,period last year firm posted 3.76 eps .
480,they buy,h r block quarterly revenue 2.8 year-over-year basis .
481,they sell,analysts expect h r block post 1.91 earnings per share current fiscal year .
482,they buy,h r block company profile h r block inc subsidiaries provides assisted income tax return preparation digital do-it-yourself diy tax solutions services products related income tax return preparation general public primarily united states canada australia .
483,they buy,company offers assisted income tax return preparation related services system retail offices operated directly company franchisees .
484,they buy,"keyword h r block nyse hrb hrb consumer discretionary,09367110 news sentiment media analysis social media sentimentratings:3,8 nyse hrbrefreshed3 receive news ratings h r block daily enter email address receive concise daily summary latest news analysts ratings h r block related companies marketbeat.com free daily email newsletter ."
485,they buy,somewhat favorable press coverage somewhat unlikely affect chemed nyse che share price tobam lowered position shares h r block inc nyse hrb 7.0 second quarter according recent form 13f filing sec .
486,they buy,"institutional investor owned 1,668,125 shares company stock selling 124,625 shares period ."
487,they buy,h r block comprises 1.6 tobam holdings making stock 19th largest position .
488,they buy,"tobam owned 0.80 h r block worth 38,000,000 end recent reporting period ."
489,they sell,institutional investors hedge funds also recently bought sold shares company .
490,they buy,"handelsbanken fonder ab acquired new position h r block 1st quarter valued 864,000 ."
491,they buy,ladenburg thalmann financial services inc. increased position h r block 49.0 4th quarter .
492,they buy,"ladenburg thalmann financial services inc. owns 7,978 shares company stock valued 209,000 acquiring additional 2,624 shares period ."
493,they buy,meeder asset management inc. increased position h r block 6.8 2nd quarter .
494,they buy,"meeder asset management inc. owns 34,154 shares company stock valued 778,000 acquiring additional 2,172 shares period ."
495,they buy,"tikehau investment management acquired new position h r block 1st quarter valued 15,071,000 ."
496,they buy,finally bnp paribas arbitrage sa increased position h r block 93.3 2nd quarter .
497,they buy,"bnp paribas arbitrage sa owns 494,120 shares company stock valued 11,256,000 acquiring additional 238,468 shares period ."
498,they buy,institutional investors hedge funds 98.48 company stock .
499,they buy,hrb topic several recent research reports .
500,they buy,thestreet upgraded h r block c+ rating b rating research report tuesday june 12th .
501,they buy,valuengine upgraded h r block hold rating buy rating research report friday april 27th .
502,they buy,morgan stanley boosted price target h r block 28.00 30.00 gave company equal weight rating research report thursday april 26th .
503,they sell,zacks investment research upgraded h r block sell rating hold rating research report tuesday august 14th .
504,they buy,finally bmo capital markets lowered price objective h r block 29.00 25.00 set market perform rating stock report wednesday june 13th .
505,they sell,two equities research analysts rated stock sell rating seven assigned hold rating two issued buy rating stock .
506,they buy,company presently average rating hold consensus price target 25.96 .
507,they buy,h r block nyse hrb last announced quarterly earnings data tuesday june 12th .
508,they sell,company reported 5.43 earnings per share quarter beating zacks consensus estimate 5.27 0.16 .
509,they buy,h r block negative return equity 269.22 net margin 19.40 .
510,they buy,company revenue 2.39 billion quarter compared analyst estimates 2.34 billion .
511,they buy,quarter previous year company earned 3.76 eps .
512,they buy,firm revenue quarter 2.8 compared quarter last year .
513,they sell,sell-side analysts predict h r block inc post 1.91 eps current year .
514,they buy,h r block company profile h r block inc subsidiaries provides assisted income tax return preparation digital do-it-yourself diy tax solutions services products related income tax return preparation general public primarily united states canada australia .
515,they buy,company offers assisted income tax return preparation related services system retail offices operated directly company franchisees .
516,they buy,"keyword h r block nyse hrb hrb consumer discretionary,09367110 sec filings,13f hedge fund holdings institutional investor holdingsratings:3,8 nyse hrbrefreshed2 receive news ratings h r block daily enter email address receive concise daily summary latest news analysts ratings h r block related companies marketbeat.com free daily email newsletter ."
517,they buy,"inverness counsel llc ny 881,000 stake cdk global inc cdk"
