,assoc,values
190,they sell,taking glance stock might directed future consensus basis sell-side 52 week price target 124.93 stock valuation based 14 number opinions .
191,they buy,british columbia investment management corp increased stake lilly eli co lly 28.54 based latest 2018q4 regulatory filing sec .
192,they buy,"british columbia investment management corp bought 74,808 shares company stock rose 10.33 market ."
193,they buy,stock increased 0.31 0.37 last trading session reaching 117.86 .
194,they sell,"community financial services group llc sold 4,623 shares company stock rose 2.37 market ."
195,they sell,neill myles also sold 2.82 million worth eli lilly company nyse lly shares .
196,they sell,"thursday january 31 insider zulueta alfonso g sold 480,000 ."
197,they buy,notable recent eli lilly company nyse lly news published fool.com released better buy eli lilly vs. glaxosmithkline motley fool march 26 2019 also investorplace.com article eli lilly news lly stock falls sarcoma study failure investorplace.com published january 18 2019 fool.com published eli lilly stock surged 37 2018 motley fool january 13 2019. interesting news eli lilly company nyse lly released seekingalpha.com article arteaus therapeutics sells emgality royalty 260m seeking alpha published april 01 2019 well prnewswire.com news article titled lilly avidity biosciences announce licensing research collaboration prnewswire publication date april 22 2019 .
198,they sell,turned negative 50 investors sold lly shares 426 reduced holdings .
199,they buy,kornitzer ks invested 0.65 portfolio eli lilly company nyse lly .
200,they buy,credit agricole invested 0 eli lilly company nyse lly .
201,they buy,"bartlett limited liability corporation invested 0.04 8,942 shares ."
202,they sell,turned negative 69 investors sold xom shares 891 reduced holdings .
203,they buy,"merian global uk invested 315,757 shares 0.19 stock ."
204,they buy,founders fin ltd limited liability company invested 0.69 portfolio exxon mobil corporation nyse xom .
205,they buy,"punch associate invest mngmt 0.33 invested exxon mobil corporation nyse xom 50,023 shares ."
206,they buy,delaware-based ashford cap management inc invested 0.42 exxon mobil corporation nyse xom .
207,they sell,"west family investments inc sold 8,800 shares company stock rose 10.33 market ."
208,they buy,stock increased 0.22 0.26 last trading session reaching 117.75 .
209,they buy,"historical lly news 09/05/2018 global non-insulin diabetes therapeutics market forecasts 2022 key players astrazeneca eli lilly merck novo nordisk sanofi researchandmarkets.com 08/03/2018 efsd jdrf lilly extend research pact 2020 23/05/2018 teva eli lilly race put second migraine drug market rival amgen fda approval last week aimovig prevent migraine headaches adults 10/05/2018 inside indiana business breaking eli lilly acquires california-based armo biosciences 1.6 billion deal 04/04/2018 eli lilly reports positive results late-stage trial liver cancer treatment marketwatch 16/04/2018 boehringer lilly oxford investigate jardiance 13/03/2018 fda grants priority review merck supplemental biologics license application sbla keytruda® pembrolizumab treatment advanced cervical cancer 10/04/2018 novartis ag novn.s afinitor disperz receives fda approval treat tsc-associated partial-onset seizures 20/03/2018 novo nordisk semaglutide study shows significant weight loss 12/04/2018 jnj invokana improved renal outcomes type 2 diabetes since february 8 2019 1 buy 0 sales 210,200 activity ."
210,they buy,"also increased holding thl cr inc nasdaq tcrd 151,296 shares quarter total 766,094 shares risen stake united contl hldgs inc nyse ual ."
211,they buy,smithfield trust company increased stake lilly eli co com lly 120.6 based latest 2018q4 regulatory filing sec .
212,they buy,"smithfield trust company bought 3,916 shares company stock rose 10.33 market ."
213,they buy,stock increased 0.25 0.3 last trading session reaching 117.79 .
214,they buy,historical lly news 29/05/2018 novo trial showed improvement hba1c oral semaglutide 19/03/2018 novo semaglutide demonstrated significant weight loss 16/04/2018 opdivo 1-year progression-free survival rate superior benefit 10/05/2018 pharmaceuticals citigroup says prefer buy-rated merck bristol-myers eli lilly us 06/04/2018 incyte- safety profile observed echo-301/keynote-252 consistent observed studies epacadostat combination keytruda 10/05/2018 lilly buy armo biosciences 1.6 bln 04/04/2018 eli lilly incur approximately 5c/share research development chg 2q earnings sigilon transactio 24/04/2018 eli lilly beat first-quarter earnings expectations 15/05/2018 eli lilly statistically significant differences reduction weekly cluster headache attacks vs placebo 23/04/2018 advisory committee fda votes 9-6 saying safety data adequate support approval 2 mg dose lilly-incyte drug baricitinib notable recent eli lilly company nyse lly news published streetinsider.com released pfizer pfe .
215,they buy,eli lilly co. nyse lly report top-line results long-term phase 3 study tanezumab patients osteoarthritis streetinsider.com april 18 2019 also seekingalpha.com article eli lilly update seeking alpha published january 17 2019 investorplace.com published eli lilly news lly stock falls sarcoma study failure investorplace.com january 18 2019. interesting news eli lilly company nyse lly released seekingalpha.com article arteaus therapeutics sells emgality royalty 260m seeking alpha published april 01 2019 well seekingalpha.com news article titled lilly finalizes loxo buy seeking alpha publication date february 15 2019 .
216,they sell,"2.82 million worth eli lilly company nyse lly sold neill myles monday december 10. zulueta alfonso g sold 4,000 shares worth 480,000 ."
217,they sell,dived 50 investors sold lly shares 426 reduced holdings .
218,they buy,"c bidwell assoc invested 1.06 8,445 shares ."
219,they buy,davis r incorporated invested 0.05 eli lilly company nyse lly .
220,they buy,illinois-based citadel advisors ltd llc invested 0.02 eli lilly company nyse lly .
221,they buy,moreover gotham asset mngmt ltd limited liability company 0.56 invested eli lilly company nyse lly .
222,they buy,"bluemountain management limited liability corporation 0.41 invested eli lilly company nyse lly 125,618 shares ."
223,they buy,"cornerstone invest prns ltd liability corp invested 12,890 shares ."
224,they buy,notable recent manulife financial corporation nyse mfc news published fool.ca released rising interest rates drive undervalued manulife financial corp. tsx mfc higher motley fool canada october 11 2018 also seekingalpha.com article manulife odds good winning mosten lawsuit evercore analyst says seeking alpha published october 15 2018 fool.ca published industry ripe top picks tfsa rrsp motley fool canada february 20 2019. interesting news manulife financial corporation nyse mfc released fool.ca article better buy manulife financial corporation tsx mfc sun life financial inc. tsx slf motley fool canada published january 09 2019 well fool.ca news article titled manulife financial corporation tsx mfc shorted motley fool canada publication date october 09 2018 .
225,they sell,causeway capital management llc sold 1.11m shares company stock rose 10.33 market .
226,they buy,stock increased 0.45 0.53 last trading session reaching 118.02 .
227,they buy,"historical lly news 08/03/2018 puma biotechnology says given written notice ema request re-examination negative opinion issued chmp feb 2018 maa neratinib 04/04/2018 eli lilly receive exclusive worldwide license sigilon afibromer technology islet cell encapsulation 10/05/2018 lilly buy armo biosciences 1.6 bln bolster cancer pipeline 24/04/2018 eli lilly 1q eps 1.16 24/04/2018 eli lilly 1q effective tax rate 15.5 02/04/2018 nccn guidelines central nervous system cancers include nerlynx® neratinib combination capecitabine paclitaxel treatment options patients breast cancer brain metastases 04/04/2018 eli lilly co sigilon afibromer technology used encapsulate insulin-producing cells potential treatment type 1 diabetes 13/04/2018 opdivo nivolumab first pd-1 inhibitor demonstrate superior survival benefit compared chemotherapy predominantly chinese population previously treated non-small cell lung cancer… 29/05/2018 novo nordisk experimental diabetes pill proved better lowering blood sugar levels eli lilly boehringer ingelheim established jardiance 23/05/2018 merck co based interim analysis treatment keytruda combination chemotherapy resulted longer os pfs chemotherapy alone kingdon capital management llc manages 3.27b 663.09m us long portfolio upped stake heron therapeutics inc nasdaq hrtx 263,148 shares 1.06m shares valued 27.52 million 2018q4 according filing ."
228,they buy,"also increased holding lattice semiconductor corp nasdaq lscc 214,848 shares quarter total 615,480 shares risen stake marvell technology group ltd call nasdaq mrvl ."
229,they sell,worsened 50 investors sold lly shares 426 reduced holdings .
230,they buy,"highlander cap management lc invested 0.1 1,357 shares ."
231,they buy,"dekabank deutsche girozentrale owns 0.57 invested eli lilly company nyse lly 759,605 shares ."
232,they buy,beach investment counsel inc pa 0.07 invested eli lilly company nyse lly .
233,they buy,north star asset management inc invested 0.04 portfolio eli lilly company nyse lly .
234,they buy,"mutual america capital mngmt limited liability co owns 0.24 invested eli lilly company nyse lly 123,672 shares ."
235,they buy,"san francisco sentry invest ca invested 2,078 shares ."
236,they sell,neill myles sold 2.82 million worth stock .
237,they sell,"4,000 shares sold zulueta alfonso g worth 480,000 ."
238,they buy,"also increased holding oracle corp nyse orcl 435,268 shares quarter total 6.96m shares risen stake yy inc nasdaq yy ."
239,they sell,"related news svp aarti s. shah sold 1,800 shares eli lilly co stock transaction occurred friday april 5th ."
240,they sell,"stock sold average price 125.85 total transaction 226,530.00 ."
241,they sell,"also insider donald a. zakrowski sold 1,000 shares eli lilly co stock transaction occurred friday march 1st ."
242,they sell,"stock sold average price 127.01 total value 127,010.00 ."
243,they sell,"insiders sold total 867,382 shares company stock valued 109,265,182 last 90 days ."
244,they buy,cantor fitzgerald reaffirmed buy rating shares eli lilly co report monday february 4th .
245,they buy,argus reaffirmed buy rating shares eli lilly co report thursday december 27th .
246,they buy,guggenheim lowered eli lilly co buy rating neutral rating set 125.84 price objective stock .
247,they buy,finally barclays reaffirmed buy rating issued 140.00 price objective shares eli lilly co report sunday april 14th .
248,they buy,ten research analysts rated stock hold rating twelve assigned buy rating company .
249,they buy,eli lilly co presently average rating buy average price target 117.91 .
250,they buy,zacks investment research upgrades ranger energy services rngr buy barometer capital management inc. reduced holdings eli lilly co nyse lly 82.4 1st quarter according company recent disclosure sec .
251,they buy,"athena capital advisors llc bought new position eli lilly co fourth quarter worth 26,000 ."
252,they buy,"wakefield asset management lllp bought new position eli lilly co fourth quarter worth 27,000 ."
253,they buy,"larson financial group llc bought new position eli lilly co fourth quarter worth 29,000 ."
254,they buy,"ironwood financial llc bought new position eli lilly co fourth quarter worth 30,000 ."
255,they sell,group sell-side analysts forecast eli lilly co post 5.66 eps current fiscal year .
256,they sell,"related news insider donald a. zakrowski sold 1,000 shares business stock transaction occurred friday march 1st ."
257,they sell,"shares sold average price 127.01 total value 127,010.00 ."
258,they sell,"also svp alfonso g. zulueta sold 4,000 shares business stock transaction occurred thursday january 31st ."
259,they sell,"stock sold average price 120.00 total transaction 480,000.00 ."
260,they sell,"insiders sold total 867,382 shares company stock valued 109,265,182 last 90 days ."
261,they buy,barclays restated buy rating set 130.00 price target shares eli lilly co research note sunday january 20th .
262,they buy,issued overweight rating 140.00 target price company .
263,they buy,guggenheim cut shares eli lilly co buy rating neutral rating set 125.84 target price company .
264,they sell,zacks investment research upgraded shares eli lilly co sell rating hold rating research note tuesday march 19th .
265,they buy,issued buy rating 131.00 target price company .
266,they buy,ten equities research analysts rated stock hold rating twelve assigned buy rating company .
267,they buy,company currently consensus rating buy consensus target price 117.91 .
268,they buy,ryerson holding corp ryi shares bought bank new york mellon corp eli lilly company lly closed monday final price 115.47 traded 7519732 shares .
269,they sell,52 week range simple technical indicator lists highest lowest price security sold preceding 52 weeks one year .
270,they sell,traders attempt avoid false signals rsi use extreme rsi values buy sell signals rsi readings 80 indicate overbought conditions rsi readings 20 indicate oversold conditions .
271,they sell,"cleararc capital inc sold 11,019 shares company stock rose 10.33 market ."
272,they buy,stock increased 1.78 2.06 last trading session reaching 117.53 .
273,they sell,negative 50 investors sold lly shares 426 reduced holdings .
274,they buy,qci asset mgmt new york invested 0 eli lilly company nyse lly .
275,they sell,"monday december 10 neill myles sold 2.82m worth eli lilly company nyse lly 25,000 shares ."
276,they sell,"zulueta alfonso g sold 480,000 worth stock 4,000 shares ."
277,they buy,notable recent eli lilly company nyse lly news published investingnews.com released biotech market update q1 2019 review investing news network april 17 2019 also seekingalpha.com article pfenex expands pf708 deal alvogen seeking alpha published february 28 2019 seekingalpha.com published lilly finalizes loxo buy seeking alpha february 15 2019. interesting news eli lilly company nyse lly released seekingalpha.com article eli lilly declares 0.645 dividend seeking alpha published december 19 2018 well seekingalpha.com news article titled wall street breakfast futures tepid investors await earnings jolt seeking alpha publication date april 23 2019 .
278,they sell,negative 39 investors sold mtdr shares 64 reduced holdings .
279,they buy,colorado-based elk creek ltd co invested 0.61 matador resources company nyse mtdr .
280,they buy,northern trust corporation invested 0.01 1.63m shares .
281,they buy,virginia retirement et al invested 0.01 portfolio matador resources company nyse mtdr .
282,they buy,rating scale 1 means strong buy 2.0 indicated buy .
283,they sell,4.0 sell signals .
284,they sell,however 5.0 strong sell signal .
285,they buy,roa ratio helps investor know profit company relative total invested assets .
286,they buy,investment would net gain analysts return costs increased .
287,they buy,barclays reaffirmed buy rating issued 130.00 price objective shares eli lilly co research note sunday january 20th .
288,they buy,issued overweight rating 140.00 target price stock .
289,they buy,guggenheim downgraded shares eli lilly co buy rating neutral rating set 125.84 target price stock .
290,they sell,finally zacks investment research raised shares eli lilly co sell rating hold rating research report tuesday march 19th .
291,they buy,ten equities research analysts rated stock hold rating eleven issued buy rating stock .
292,they buy,stock currently average rating buy consensus target price 117.91 .
293,they sell,"related news svp alfonso g. zulueta sold 4,000 shares firm stock transaction occurred thursday january 31st ."
294,they sell,"shares sold average price 120.00 total transaction 480,000.00 ."
295,they sell,"also svp stephen f. fry sold 14,847 shares firm stock transaction occurred tuesday march 12th ."
296,they sell,"stock sold average price 123.16 total transaction 1,828,556.52 ."
297,they sell,"last 90 days insiders sold 867,382 shares company stock valued 109,265,182 ."
