,assoc,values
238,they buy,"united services automobile association owned approximately 0.06 bank worth 14,166,000 end recent reporting period ."
239,they buy,hedge funds institutional investors also made changes positions company .
240,they buy,private capital group llc increased position bank 728.4 first quarter .
241,they buy,"private capital group llc owns 613 shares financial services provider stock worth 113,000 buying additional 539 shares last quarter ."
242,they buy,"migdal insurance financial holdings ltd. increased position bank 8,330.0 second quarter ."
243,they buy,"migdal insurance financial holdings ltd. owns 843 shares financial services provider stock worth 143,000 buying additional 833 shares last quarter ."
244,they buy,"cerebellum gp llc acquired new position bank second quarter worth approximately 171,000 ."
245,they buy,"fisher asset management llc acquired new position bank first quarter worth approximately 204,000 ."
246,they buy,"finally lcnb corp acquired new position bank second quarter worth approximately 214,000 ."
247,they buy,81.23 stock currently owned hedge funds institutional investors .
248,they buy,shares mtb stock opened 158.52 friday .
249,they buy,company debt-to-equity ratio 0.58 current ratio 1.06 quick ratio 1.06. company market capitalization 23.66 billion p/e ratio 16.95 p/e/g ratio 0.89 beta 0.95. bank co. 1 year low 155.36 1 year high 197.37 .
250,they buy,bank nyse mtb last issued quarterly earnings results wednesday july 18th .
251,they buy,financial services provider reported 3.26 earnings per share eps quarter beating consensus estimate 3.17 0.09 .
252,they buy,business revenue 1.47 billion quarter compared analysts expectations 1.46 billion .
253,they buy,bank return equity 11.80 net margin 24.57 .
254,they sell,period previous year company posted 2.35 earnings per share .
255,they sell,group analysts predict bank co. post 12.81 earnings per share current year .
256,they buy,business also recently declared quarterly dividend paid friday september 28th .
257,they buy,investors record tuesday september 4th paid 1.00 dividend .
258,they buy,boost bank previous quarterly dividend 0.80 .
259,they buy,represents 4.00 annualized dividend dividend yield 2.52 .
260,they buy,ex-dividend date friday august 31st .
261,they buy,bank payout ratio 42.78 .
262,they buy,number brokerages weighed mtb .
263,they buy,sanford c. bernstein raised bank market perform rating outperform rating research report wednesday june 27th .
264,they buy,noted move valuation call .
265,they buy,zacks investment research upgraded bank hold rating buy rating set 195.00 price objective company report tuesday june 19th .
266,they buy,vining sparks restated buy rating set 220.00 price objective shares bank report tuesday .
267,they buy,morgan stanley reduced price objective bank 195.00 190.00 set equal weight rating company report tuesday september 18th .
268,they sell,finally valuengine upgraded bank sell rating hold rating report thursday july 19th .
269,they sell,two analysts rated stock sell rating seven given hold rating eight assigned buy rating company stock .
270,they buy,bank currently consensus rating hold average target price 181.08 .
271,they sell,"related news director denis j. salamone sold 25,209 shares business stock transaction occurred wednesday september 5th ."
272,they sell,"stock sold average price 179.76 total value 4,531,569.84 ."
273,they buy,sale disclosed legal filing securities exchange commission accessed sec website .
274,they buy,insiders 0.48 company stock .
275,they buy,"bank keyword bank nyse mtb mtb finance,55261f10 sec filings,13f hedge fund holdings institutional investor holdingsratings:3,15 nyse mtbrefreshed1 receive news ratings bank daily enter email address receive concise daily summary latest news analysts ratings bank related companies marketbeat.com free daily email newsletter ."
276,they buy,comparing caretrust reit nasdaq ctre lsl property services lslpf bank nyse mtb upgraded equities researchers goldman sachs group neutral rating buy rating report released wednesday september 26th marketbeat reports .
277,they buy,number research analysts also recently issued reports stock .
278,they buy,zacks investment research downgraded shares bank buy rating hold rating research report friday september 21st .
279,they buy,morgan stanley lowered price objective shares bank 195.00 190.00 set equal weight rating stock report tuesday september 18th .
280,they buy,keefe bruyette woods upgraded shares bank market perform rating outperform rating set 120.00 price objective stock report monday september 3rd .
281,they buy,wedbush upped price objective shares bank 190.00 197.00 gave stock neutral rating report thursday july 19th .
282,they sell,finally valuengine upgraded shares bank sell rating hold rating report thursday july 19th .
283,they sell,two analysts rated stock sell rating seven given hold rating eight given buy rating company stock .
284,they buy,stock currently average rating hold average target price 181.08 .
285,they buy,shares nyse mtb traded 1.93 trading wednesday reaching 158.52 .
286,they buy,"stock trading volume 1,086,600 shares compared average volume 804,754. company debt-to-equity ratio 0.58 quick ratio 1.06 current ratio 1.06. bank 52 week low 155.36 52 week high 197.37 ."
287,they buy,firm market cap 23.66 billion p/e ratio 16.95 p/e/g ratio 0.89 beta 0.95 .
288,they sell,"news director denis j. salamone sold 25,209 shares stock transaction dated wednesday september 5th ."
289,they sell,"shares sold average price 179.76 total value 4,531,569.84 ."
290,they buy,sale disclosed filing sec accessed hyperlink .
291,they buy,corporate insiders 0.48 company stock .
292,they buy,"keyword bank nyse mtb mtb finance,55261f10 upgrade goldman sachs group incratings:3,15 nyse mtbrefreshed2 receive news ratings bank daily enter email address receive concise daily summary latest news analysts ratings bank related companies marketbeat.com free daily email newsletter ."
293,they buy,bws financial weighs verso corp q4 2018 earnings vrs bank nyse mtb recently received number price target changes ratings updates mtb stock traded 1.93 midday trading friday hitting 158.52 .
294,they buy,"company trading volume 1,086,600 shares compared average volume 804,754. company debt-to-equity ratio 0.58 quick ratio 1.06 current ratio 1.06. bank co. 52 week low 155.36 52 week high 197.37 ."
295,they buy,company market capitalization 23.66 billion p/e ratio 16.95 peg ratio 0.89 beta 0.95 .
296,they buy,bank nyse mtb last announced quarterly earnings data wednesday july 18th .
297,they buy,financial services provider reported 3.26 earnings per share quarter beating thomson reuters consensus estimate 3.17 0.09 .
298,they buy,bank return equity 11.80 net margin 24.57 .
299,they buy,firm revenue 1.47 billion quarter compared consensus estimate 1.46 billion .
300,they sell,quarter previous year company posted 2.35 earnings per share .
301,they buy,group equities analysts predict bank co. post 12.81 earnings per share current year .
302,they sell,"related news director denis j. salamone sold 25,209 shares company stock transaction occurred wednesday september 5th ."
303,they sell,"stock sold average price 179.76 total transaction 4,531,569.84 ."
304,they buy,sale disclosed filing securities exchange commission available link .
305,they buy,0.48 stock owned corporate insiders .
306,they buy,several institutional investors recently made changes positions mtb .
307,they buy,"gsa capital partners llp bought new position shares bank first quarter valued approximately 342,000 ."
308,they buy,a.r.t .
309,they buy,"advisors llc bought new position shares bank first quarter valued approximately 2,773,000 ."
310,they buy,united capital financial advisers llc raised holdings shares bank 15.2 first quarter .
311,they buy,"united capital financial advisers llc owns 2,994 shares financial services provider stock valued 552,000 acquiring additional 394 shares last quarter ."
312,they buy,lpl financial llc raised holdings shares bank 3.6 first quarter .
313,they buy,"lpl financial llc owns 8,392 shares financial services provider stock valued 1,547,000 acquiring additional 293 shares last quarter ."
314,they buy,"finally mariner llc bought new position shares bank first quarter valued approximately 438,000 ."
315,they buy,institutional investors 81.23 company stock .
316,they buy,bank corporation operates holding company manufacturers traders trust company wilmington trust national association provide retail commercial banking services .
317,they buy,company business banking segment offers deposit lending cash management financial services small businesses professionals .
318,they buy,read tariff keyword bank co nyse mtb mtb receive news ratings bank co daily enter email address receive concise daily summary latest news analysts ratings bank co related companies marketbeat.com free daily email newsletter .
319,they sell,"facebook inc. fb vp sells 117,840.00 stock valuengine lowered shares bank nyse mtb hold rating sell rating research report report published thursday september 27th ."
320,they buy,several equities analysts also weighed mtb .
321,they buy,zacks investment research lowered shares bank buy rating hold rating report wednesday june 6th .
322,they buy,sanford c. bernstein upgraded shares bank market perform rating outperform rating report wednesday june 27th .
323,they buy,noted move valuation call .
324,they buy,jefferies financial group reiterated buy rating issued 195.00 price objective shares bank report friday july 13th .
325,they buy,wedbush boosted target price shares bank 190.00 197.00 gave stock neutral rating research report thursday july 19th .
326,they buy,finally morgan stanley boosted target price shares bank 191.00 195.00 gave stock equal weight rating research report friday july 20th .
327,they sell,two equities research analysts rated stock sell rating seven issued hold rating eight given buy rating company stock .
328,they buy,company currently average rating hold consensus price target 181.08 .
329,they buy,mtb stock traded 2.00 midday trading thursday hitting 158.45 .
330,they buy,"stock trading volume 99,467 shares compared average volume 803,342. stock market capitalization 23.66 billion p/e ratio 16.95 peg ratio 0.89 beta 0.95. company debt-to-equity ratio 0.58 quick ratio 1.06 current ratio 1.06. bank 12-month low 155.77 12-month high 197.37 ."
331,they buy,firm also recently disclosed quarterly dividend paid friday september 28th .
332,they buy,investors record tuesday september 4th given dividend 1.00 per share .
333,they buy,represents 4.00 dividend annualized basis dividend yield 2.52 .
334,they buy,ex-dividend date friday august 31st .
335,they buy,increase bank previous quarterly dividend 0.80 .
336,they buy,bank dividend payout ratio currently 42.78 .
337,they sell,number hedge funds institutional investors recently bought sold shares mtb .
338,they buy,berkshire asset management llc pa lifted stake bank 6.1 third quarter .
339,they buy,"berkshire asset management llc pa owns 154,179 shares financial services provider stock valued 25,369,000 purchasing additional 8,836 shares last quarter ."
340,they buy,bank montreal lifted stake bank 4.4 third quarter .
341,they buy,"bank montreal owns 511,291 shares financial services provider stock valued 84,129,000 purchasing additional 21,690 shares last quarter ."
342,they buy,hudson valley investment advisors inc. adv lifted stake bank 241.1 third quarter .
343,they buy,"hudson valley investment advisors inc. adv owns 5,441 shares financial services provider stock valued 895,000 purchasing additional 3,846 shares last quarter ."
344,they buy,dnb asset management lifted stake bank 18.1 third quarter .
345,they buy,"dnb asset management owns 45,268 shares financial services provider stock valued 7,448,000 purchasing additional 6,926 shares last quarter ."
346,they buy,"finally next financial group inc acquired new stake bank third quarter valued approximately 165,000 ."
347,they buy,hedge funds institutional investors 81.23 company stock .
348,they buy,bank bank corporation operates holding company manufacturers traders trust company wilmington trust national association provide retail commercial banking services .
349,they buy,company business banking segment offers deposit lending cash management financial services small businesses professionals .
350,they sell,"keyword bank nyse mtb mtb finance,55261f10 downgrade valuengineratings:3,15 nyse mtbrefreshed2 receive news ratings bank daily enter email address receive concise daily summary latest news analysts ratings bank related companies marketbeat.com free daily email newsletter ."
351,they sell,name required zacks investment research lowered shares bank nyse mtb hold rating sell rating research note released thursday october 4th .
352,they buy,according zacks shares bank underperformed industry past six months .
353,they buy,company impressive earnings surprise history surpassing zacks consensus estimate earnings three trailing four quarters .
354,they buy,persistently rising expenses due ongoing investments remains concern .
355,they buy,also significant exposure commercial real estate loans acts headwind .
356,they buy,nevertheless company top-line growth looks encouraging given diverse fee income base rising rates amid improving economy .
357,they buy,also bank involvement steady capital-deployment activities boosts shareholders confidence .
358,they buy,bank focus expansion inorganic growth opportunities bodes well long term .
359,they buy,mtb topic several reports .
360,they buy,morgan stanley decreased price objective shares bank 195.00 190.00 set equal weight rating stock research report tuesday september 18th .
361,they buy,jefferies financial group restated buy rating set 195.00 price objective shares bank research report friday july 13th .
362,they sell,valuengine downgraded shares bank hold rating sell rating research report friday july 6th .
363,they buy,sanford c. bernstein upgraded shares bank market perform rating outperform rating research report wednesday june 27th .
364,they buy,noted move valuation call .
365,they buy,finally keefe bruyette woods upgraded shares bank market perform rating outperform rating set 120.00 price objective stock research report monday september 3rd .
366,they sell,two research analysts rated stock sell rating seven given hold rating eight issued buy rating company .
367,they buy,bank average rating hold consensus target price 181.08 .
368,they buy,bank nyse mtb last issued earnings results wednesday july 18th .
369,they buy,financial services provider reported 3.26 earnings per share eps quarter topping thomson reuters consensus estimate 3.17 0.09 .
370,they buy,bank net margin 24.57 return equity 11.80 .
371,they buy,company revenue 1.47 billion quarter compared analysts expectations 1.46 billion .
372,they sell,quarter last year company posted 2.35 earnings per share .
373,they buy,group equities analysts predict bank post 12.81 earnings per share current year .
374,they buy,business also recently declared quarterly dividend paid friday september 28th .
375,they buy,shareholders record tuesday september 4th issued 1.00 dividend .
376,they buy,increase bank previous quarterly dividend 0.80 .
377,they buy,represents 4.00 dividend annualized basis yield 2.56 .
378,they buy,ex-dividend date dividend friday august 31st .
379,they buy,bank payout ratio currently 42.78 .
380,they sell,"bank news director denis j. salamone sold 25,209 shares bank stock transaction wednesday september 5th ."
381,they sell,"shares sold average price 179.76 total value 4,531,569.84 ."
382,they buy,sale disclosed legal filing securities exchange commission available hyperlink .
383,they buy,company insiders 0.48 company stock .
384,they sell,"get free copy zacks research report bank mtb information research offerings zacks investment research visit zacks.com keyword bank nyse mtb mtb finance,55261f10 downgrade zacks investment researchratings:3,15 nyse mtbrefreshed1 receive news ratings bank daily enter email address receive concise daily summary latest news analysts ratings bank related companies marketbeat.com free daily email newsletter ."
385,they buy,name required bank co. nyse mtb stock analysts jefferies financial group issued q4 2018 earnings estimates bank report issued tuesday october 9th .
386,they buy,jefferies financial group analyst k. usdin anticipates financial services provider post earnings per share 3.52 quarter .
387,they buy,jefferies financial group currently buy rating 195.00 target price stock .
388,they buy,jefferies financial group also issued estimates bank q1 2019 earnings 3.27 eps .
389,they buy,bank nyse mtb last issued quarterly earnings data wednesday july 18th .
390,they buy,financial services provider reported 3.26 earnings per share quarter topping thomson reuters consensus estimate 3.17 0.09 .
391,they buy,bank net margin 24.57 return equity 11.80 .
392,they buy,firm revenue 1.47 billion quarter compared analysts expectations 1.46 billion .
393,they buy,quarter prior year business earned 2.35 eps .
394,they buy,nyse mtb opened 160.45 thursday .
395,they buy,bank 12 month low 155.77 12 month high 197.37 .
396,they buy,company market cap 23.66 billion price-to-earnings ratio 17.57 peg ratio 0.89 beta 0.95. company current ratio 1.06 quick ratio 1.06 debt-to-equity ratio 0.58 .
397,they buy,business also recently disclosed quarterly dividend paid friday september 28th .
398,they buy,shareholders record tuesday september 4th issued dividend 1.00 per share .
399,they buy,positive change bank previous quarterly dividend 0.80 .
400,they buy,represents 4.00 dividend annualized basis yield 2.49 .
401,they buy,ex-dividend date friday august 31st .
402,they buy,bank dividend payout ratio dpr 42.78 .
403,they sell,"bank news director denis j. salamone sold 25,209 shares stock transaction occurred wednesday september 5th ."
404,they sell,"shares sold average price 179.76 total transaction 4,531,569.84 ."
405,they buy,sale disclosed document filed securities exchange commission available sec website .
406,they buy,company insiders 0.48 company stock .
407,they buy,number institutional investors hedge funds recently made changes positions mtb .
408,they buy,"gsa capital partners llp purchased new stake bank 1st quarter valued approximately 342,000 ."
409,they buy,koch industries inc. grew holdings shares bank 89.3 first quarter .
410,they buy,"koch industries inc. owns 2,499 shares financial services provider stock valued 461,000 purchasing additional 1,179 shares last quarter ."
411,they buy,british columbia investment management corp grew holdings shares bank 3.6 first quarter .
412,they buy,"british columbia investment management corp owns 72,688 shares financial services provider stock valued 13,401,000 purchasing additional 2,494 shares last quarter ."
413,they buy,a.r.t .
414,they buy,"advisors llc purchased new position shares bank first quarter valued 2,773,000 ."
415,they buy,finally manufacturers life insurance company grew holdings shares bank 6.9 first quarter .
416,they buy,"manufacturers life insurance company owns 815,318 shares financial services provider stock valued 150,311,000 purchasing additional 52,657 shares last quarter ."
417,they buy,81.23 stock owned institutional investors hedge funds .
418,they buy,bank bank corporation operates holding company manufacturers traders trust company wilmington trust national association provide retail commercial banking services .
419,they buy,company business banking segment offers deposit lending cash management financial services small businesses professionals .
420,they buy,"keyword bank nyse mtb mtb finance,55261f10 earnings estimates jefferies financial group incratings:3,15 nyse mtb receive news ratings bank daily enter email address receive concise daily summary latest news analysts ratings bank related companies marketbeat.com free daily email newsletter ."
421,they buy,vining sparks reiterated buy rating shares bank nyse mtb research report released tuesday morning .
422,they buy,brokerage currently 220.00 price objective financial services provider stock .
423,they buy,google_ad_client ca-pub-0703139142419429 google_ad_slot 5621244306 google_ad_width 336 google_ad_height 280 c mtb topic number reports .
424,they buy,evercore isi raised bank in-line rating outperform rating report monday october 1st .
425,they buy,noted move valuation call .
426,they sell,zacks investment research lowered bank hold rating sell rating report thursday october 4th .
427,they buy,goldman sachs group raised bank neutral rating buy rating report wednesday september 26th .
428,they buy,wedbush increased price objective bank 190.00 197.00 gave company neutral rating report thursday july 19th .
429,they sell,finally valuengine downgraded bank hold rating sell rating research note friday july 6th .
430,they sell,two equities research analysts rated stock sell rating six issued hold rating nine given buy rating company stock .
431,they buy,bank consensus rating hold consensus price target 181.08 .
432,they buy,shares mtb stock traded 1.24 mid-day trading tuesday reaching 170.57 .
433,they buy,"stock trading volume 7,445 shares compared average volume 800,283. company debt-to-equity ratio 0.58 quick ratio 1.06 current ratio 1.06. firm market capitalization 23.66 billion pe ratio 18.14 p/e/g ratio 0.89 beta 0.95. bank 1-year low 155.77 1-year high 197.37 ."
434,they buy,bank nyse mtb last announced quarterly earnings data wednesday july 18th .
435,they buy,financial services provider reported 3.26 earnings per share quarter beating analysts consensus estimates 3.17 0.09 .
436,they buy,business revenue 1.47 billion quarter compared analyst estimates 1.46 billion .
437,they buy,bank return equity 11.80 net margin 24.57 .
438,they buy,period prior year company earned 2.35 earnings per share .
439,they sell,sell-side analysts forecast bank post 12.81 earnings per share current year .
440,they buy,business also recently announced quarterly dividend paid friday september 28th .
441,they buy,stockholders record tuesday september 4th paid 1.00 dividend .
442,they buy,increase bank previous quarterly dividend 0.80 .
443,they buy,ex-dividend date dividend friday august 31st .
444,they buy,represents 4.00 dividend annualized basis dividend yield 2.35 .
445,they buy,bank dividend payout ratio presently 42.78 .
446,they sell,"news director denis j. salamone sold 25,209 shares company stock transaction dated wednesday september 5th ."
447,they sell,"stock sold average price 179.76 total value 4,531,569.84 ."
448,they buy,sale disclosed filing sec available hyperlink .
449,they buy,0.48 stock owned corporate insiders .
450,they buy,investors sentiment increased 1.13 2018 q2 .
451,they buy,0.11 1.02 2018q1 .
452,they sell,increased 31 investors sold bank corporation shares 179 reduced holdings .
453,they buy,71 funds opened positions 166 raised stakes .
454,they buy,112.08 million shares 1.27 110.68 million shares 2018q1 reported .
455,they buy,"golub gru limited liability company holds 0.13 8,506 shares ."
456,they buy,"northstar asset mngmt limited liability company invested 1,741 shares ."
457,they buy,"dean invest associates ltd co owns 0.12 invested bank corporation nyse mtb 4,941 shares ."
458,they buy,clearbridge llc reported 71 shares stake .
459,they buy,moreover franklin resources inc 0 invested bank corporation nyse mtb .
460,they buy,"ameriprise inc invested 324,035 shares ."
461,they buy,"moreover hbk ltd partnership 0.04 invested bank corporation nyse mtb 23,800 shares ."
462,they buy,"37,848 reported westpac banking corporation ."
463,they buy,"bluemountain capital mgmt new york-based fund reported 22,600 shares ."
464,they buy,"pennsylvania communications accumulated 0.01 1,839 shares ."
465,they buy,legal general public limited company reported 0.09 stake .
466,they buy,"renaissance technology lc 4,142 shares ."
467,they buy,smith graham commerce investment advisors l p reported 0.57 stake .
468,they buy,tru department mb commercial bank n reported 0 stake .
469,they buy,first mercantile 460 shares 0.02 portfolio .
470,they buy,since april 26 2018 0 insider purchases 3 selling transactions 4.99 million activity .
471,they sell,"shares 279,350 sold bojdak robert j friday june 8. another trade 25,209 shares valued 4.53 million sold salamone denis j ."
472,they buy,analysts expect bank corporation nyse mtb report 3.36 eps october 17.they anticipate 1.12 eps change 50.00 last quarter 2.24 eps .
473,they buy,mtb profit would 483.13 million giving 11.94 p/e 3.36 eps correct .
474,they buy,3.29 eps previously bank corporation analysts see 2.13 eps growth .
475,they buy,stock decreased 3.24 5.37 last trading session reaching 160.45 .
476,they buy,1.30 million shares traded 48.44 average .
477,they buy,bank corporation nyse mtb risen 17.06 since october 12 2017 uptrending .
478,they buy,outperformed 1.44 p500 .
479,they sell,among 9 analysts covering bank nyse mtb 5 buy rating 0 sell 4 hold .
480,they buy,therefore 56 positive .
481,they buy,bank 12 analyst reports since april 16 2018 according sratingsintel .
482,they buy,tuesday april 17 stock rating maintained wedbush neutral .
483,they buy,jefferies maintained shares mtb report monday april 16 buy rating .
484,they buy,stock hold rating piper jaffray monday april 16. per friday july 20 company rating maintained morgan stanley .
485,they buy,monday october 1 stock rating upgraded evercore outperform .
