,assoc,values
913,they buy,netflix revenue quarter 40.3 compared quarter last year .
914,they buy,average equities analysts forecast netflix inc. post 2.67 eps current fiscal year .
915,they buy,number research firms recently commented nflx .
916,they buy,pivotal research lifted price objective netflix 420.00 500.00 gave stock buy rating research report thursday june 21st .
917,they buy,bidaskclub cut netflix buy rating hold rating research report saturday october 6th .
918,they buy,piper jaffray companies lifted price objective netflix 367.00 420.00 gave stock overweight rating research report tuesday june 19th .
919,they buy,macquarie set 388.00 price objective netflix gave stock buy rating research report thursday .
920,they buy,finally monness crespi hardt dropped price objective netflix 460.00 430.00 set buy rating company research report tuesday july 17th .
921,they sell,five analysts rated stock sell rating fourteen issued hold rating thirty-one given buy rating stock .
922,they buy,company presently consensus rating buy consensus target price 355.69 .
923,they buy,netflix profile netflix inc internet television network engages internet delivery television tv shows movies various internet-connected screens .
924,they buy,operates three segments domestic streaming international streaming domestic dvd .
925,they buy,company offers tv shows movies including original series documentaries feature films .
926,they buy,"featured story price earnings ratio pe basics viewcount type=f id=4050131 keyword netflix nasdaq nflx nflx consumer discretionary,64110l10 sec filings,13f hedge fund holdings institutional investor holdingsratings:4,46 nasdaq nflxrefreshed3 receive news ratings netflix daily enter email address receive concise daily summary latest news analysts ratings netflix related companies marketbeat.com free daily email newsletter ."
927,they buy,name required mail published required mai capital management lifted position shares netflix inc. nasdaq nflx 5.2 second quarter according recent filing securities exchange commission .
928,they buy,"institutional investor owned 9,960 shares internet television network stock buying additional 496 shares quarter ."
929,they buy,"mai capital management holdings netflix worth 3,899,000 end recent quarter ."
930,they sell,several institutional investors hedge funds also recently bought sold shares company .
931,they buy,"csat investment advisory l.p. purchased new position shares netflix second quarter worth 117,000 ."
932,they buy,guidant wealth advisors raised stake shares netflix 190.5 second quarter .
933,they buy,"guidant wealth advisors owns 305 shares internet television network stock worth 121,000 purchasing additional 200 shares last quarter ."
934,they buy,"signature estate investment advisors llc purchased new position shares netflix second quarter worth 124,000 ."
935,they buy,"bergankdv wealth management llc purchased new position shares netflix second quarter worth 137,000 ."
936,they buy,"finally braun bostich associates inc. purchased new position shares netflix first quarter worth 142,000 ."
937,they buy,73.76 stock currently owned institutional investors hedge funds .
938,they buy,nflx subject several research analyst reports .
939,they buy,imperial capital reduced price objective netflix 503.00 494.00 set outperform rating company research note monday august 13th .
940,they buy,canaccord genuity lifted price target netflix 350.00 500.00 gave company buy rating research report thursday july 12th .
941,they buy,citigroup lifted price target netflix 375.00 gave company neutral rating research report wednesday september 12th .
942,they sell,zacks investment research upgraded netflix sell rating hold rating research report thursday july 12th .
943,they buy,finally jefferies financial group reiterated neutral rating set 320.00 price target shares netflix research report monday august 20th .
944,they sell,five research analysts rated stock sell rating fourteen assigned hold rating thirty-one assigned buy rating company stock .
945,they buy,company consensus rating buy consensus price target 355.69 .
946,they buy,shares nflx stock traded 4.79 thursday hitting 321.10 .
947,they buy,"stock trading volume 16,074,000 shares compared average volume 10,780,779. netflix inc. 1 year low 178.38 1 year high 423.21 ."
948,they buy,company market capitalization 162.92 billion pe ratio 259.70 p/e/g ratio 4.67 beta 0.89. company current ratio 1.54 quick ratio 1.54 debt-to-equity ratio 1.86 .
949,they buy,netflix nasdaq nflx last released earnings results monday july 16th .
950,they buy,internet television network reported 0.85 eps quarter topping thomson reuters consensus estimate 0.80 0.05 .
951,they buy,firm revenue 3.91 billion quarter compared analysts expectations 3.94 billion .
952,they buy,netflix return equity 25.66 net margin 7.13 .
953,they buy,netflix revenue quarter 40.3 year-over-year basis .
954,they buy,period previous year firm posted 0.15 eps .
955,they buy,research analysts predict netflix inc. post 2.67 eps current fiscal year .
956,they sell,"related news general counsel david a. hyman sold 38,976 shares company stock transaction dated thursday july 19th ."
957,they sell,"stock sold average price 371.20 total value 14,467,891.20 ."
958,they buy,"following completion sale general counsel directly owns 43,895 shares company stock valued approximately 16,293,824 ."
959,they buy,sale disclosed legal filing sec accessed sec website .
960,they sell,"also insider theodore a. sarandos sold 111,391 shares company stock transaction dated monday july 23rd ."
961,they sell,"shares sold average price 360.00 total value 40,100,760.00 ."
962,they buy,"following completion sale insider directly owns 16,065 shares company stock valued 5,783,400 ."
963,they buy,disclosure sale found .
964,they sell,"last ninety days insiders sold 420,428 shares company stock valued 149,631,503 ."
965,they buy,insiders 4.29 company stock .
966,they buy,netflix profile netflix inc internet television network engages internet delivery television tv shows movies various internet-connected screens .
967,they buy,operates three segments domestic streaming international streaming domestic dvd .
968,they buy,company offers tv shows movies including original series documentaries feature films .
969,they buy,"see also diversification important investing viewcount type=f id=4046508 keyword netflix nasdaq nflx nflx consumer discretionary,64110l10 sec filings,13f hedge fund holdings institutional investor holdingsratings:4,46 nasdaq nflxrefreshed3 receive news ratings netflix daily enter email address receive concise daily summary latest news analysts ratings netflix related companies marketbeat.com free daily email newsletter ."
970,they buy,"infinitecoin 1-day trading volume reaches 39,970.00 ifc smart metering systems plc lon sms announces gbx 2 dividend hwg holdings lp lowered stake shares netflix inc. nasdaq nflx 70.5 second quarter according recent form 13f filing securities exchange commission ."
971,they buy,"institutional investor owned 2,815 shares internet television network stock selling 6,739 shares period ."
972,they buy,"hwg holdings lp holdings netflix worth 1,102,000 recent filing securities exchange commission ."
973,they buy,several hedge funds also recently added reduced stakes nflx .
974,they buy,"csat investment advisory l.p. purchased new stake netflix 2nd quarter valued 117,000 ."
975,they buy,guidant wealth advisors grew stake netflix 190.5 2nd quarter .
976,they buy,"guidant wealth advisors owns 305 shares internet television network stock valued 121,000 acquiring additional 200 shares last quarter ."
977,they buy,"signature estate investment advisors llc purchased new stake netflix 2nd quarter valued 124,000 ."
978,they buy,"bergankdv wealth management llc purchased new stake netflix 2nd quarter valued 137,000 ."
979,they buy,"finally braun bostich associates inc. purchased new stake netflix 1st quarter valued 142,000 ."
980,they buy,73.76 stock owned institutional investors hedge funds .
981,they buy,several analysts recently issued reports nflx shares .
982,they buy,ubs group cut shares netflix buy rating neutral rating dropped price objective company 425.00 237.00 research note wednesday july 11th .
983,they buy,goldman sachs group reaffirmed 375.13 rating set 470.00 price objective shares netflix research note wednesday july 18th .
984,they buy,atlantic securities reaffirmed buy rating set 413.00 price objective shares netflix research note monday september 3rd .
985,they buy,suntrust banks increased price target shares netflix 270.00 415.00 gave company hold rating research note friday july 13th .
986,they buy,finally wells fargo co increased price target shares netflix 370.00 385.00 gave company outperform rating research note tuesday july 17th .
987,they sell,five investment analysts rated stock sell rating fourteen issued hold rating thirty-one issued buy rating stock .
988,they buy,netflix average rating buy average price target 355.69 .
989,they buy,shares nflx stock traded 4.79 trading hours thursday hitting 321.10 .
990,they buy,"company trading volume 16,074,000 shares compared average volume 10,780,779. company debt-to-equity ratio 1.86 quick ratio 1.54 current ratio 1.54. netflix inc. fifty-two week low 178.38 fifty-two week high 423.21 ."
991,they buy,firm market cap 162.92 billion p/e ratio 259.70 p/e/g ratio 4.67 beta 0.89 .
992,they buy,netflix nasdaq nflx last issued quarterly earnings data monday july 16th .
993,they buy,internet television network reported 0.85 eps quarter topping consensus estimate 0.80 0.05 .
994,they buy,firm revenue 3.91 billion quarter compared analyst estimates 3.94 billion .
995,they buy,netflix net margin 7.13 return equity 25.66 .
996,they buy,business revenue quarter 40.3 compared quarter last year .
997,they buy,period prior year business posted 0.15 eps .
998,they buy,group research analysts predict netflix inc. post 2.67 eps current fiscal year .
999,they buy,netflix company profile netflix inc internet television network engages internet delivery television tv shows movies various internet-connected screens .
1000,they buy,operates three segments domestic streaming international streaming domestic dvd .
1001,they buy,company offers tv shows movies including original series documentaries feature films .
1002,they buy,"read average daily trade volume explainedviewcount type=f id=4052230 keyword netflix nasdaq nflx nflx consumer discretionary,64110l10 sec filings,13f hedge fund holdings institutional investor holdingsratings:4,46 nasdaq nflxrefreshed3 receive news ratings netflix daily enter email address receive concise daily summary latest news analysts ratings netflix related companies marketbeat.com free daily email newsletter ."
1003,they buy,"39,542 shares great lakes dredge dock co. gldd purchased highpoint advisor group llc hwg holdings lp takes 377,000 position ishares core p mid-cap etf nysearca ijh b. riley financial inc. acquired new stake netflix inc. nasdaq nflx 2nd quarter according recent form 13f filing securities exchange commission sec ."
1004,they buy,"firm acquired 595 shares internet television network stock valued approximately 247,000 ."
1005,they buy,number institutional investors hedge funds also modified holdings business .
1006,they buy,"csat investment advisory l.p. purchased new position netflix second quarter worth approximately 117,000 ."
1007,they buy,guidant wealth advisors lifted position netflix 190.5 second quarter .
1008,they buy,"guidant wealth advisors owns 305 shares internet television network stock worth 121,000 buying additional 200 shares last quarter ."
1009,they buy,"signature estate investment advisors llc purchased new position netflix second quarter worth approximately 124,000 ."
1010,they buy,"bergankdv wealth management llc purchased new position netflix second quarter worth approximately 137,000 ."
1011,they buy,"finally braun bostich associates inc. purchased new position netflix first quarter worth approximately 142,000 ."
1012,they buy,73.76 stock currently owned institutional investors .
1013,they buy,nflx topic number analyst reports .
1014,they buy,oppenheimer reiterated buy rating set 370.00 price objective shares netflix research report thursday june 14th .
1015,they buy,monness crespi hardt lifted price objective netflix 375.00 460.00 gave stock buy rating research report tuesday june 19th .
1016,they buy,piper jaffray companies lifted price objective netflix 367.00 420.00 gave stock overweight rating research report tuesday june 19th .
1017,they buy,valuengine upgraded netflix buy rating strong-buy rating research report wednesday june 20th .
1018,they buy,finally goldman sachs group lifted price objective netflix 490.00 gave stock positive rating research report wednesday june 20th .
1019,they sell,five investment analysts rated stock sell rating fourteen assigned hold rating thirty-one assigned buy rating company stock .
1020,they buy,netflix average rating buy consensus price target 355.69 .
1021,they buy,shares nflx stock traded 4.79 thursday hitting 321.10 .
1022,they buy,"stock trading volume 16,022,175 shares compared average volume 10,780,516. netflix inc. 1 year low 178.38 1 year high 423.21 ."
1023,they buy,company market capitalization 162.92 billion pe ratio 259.70 p/e/g ratio 4.67 beta 0.89. company current ratio 1.54 quick ratio 1.54 debt-to-equity ratio 1.86 .
1024,they buy,netflix nasdaq nflx last released earnings results monday july 16th .
1025,they buy,internet television network reported 0.85 eps quarter topping thomson reuters consensus estimate 0.80 0.05 .
1026,they buy,netflix return equity 25.66 net margin 7.13 .
1027,they buy,firm revenue 3.91 billion quarter compared analysts expectations 3.94 billion .
1028,they buy,period previous year firm posted 0.15 eps .
1029,they buy,netflix revenue quarter 40.3 year-over-year basis .
1030,they buy,research analysts predict netflix inc. post 2.67 eps current fiscal year .
1031,they buy,netflix netflix inc internet television network engages internet delivery television tv shows movies various internet-connected screens .
1032,they buy,operates three segments domestic streaming international streaming domestic dvd .
1033,they buy,company offers tv shows movies including original series documentaries feature films .
1034,they buy,"reading investors find ex-dividend dates viewcount type=f id=4043802 keyword netflix nasdaq nflx nflx consumer discretionary,64110l10 sec filings,13f hedge fund holdings institutional investor holdingsratings:4,46 nasdaq nflxrefreshed3 receive news ratings netflix daily enter email address receive concise daily summary latest news analysts ratings netflix related companies marketbeat.com free daily email newsletter ."
1035,they sell,name required mail published required netflix inc. nasdaq nflx director richard n. barton sold 700 shares stock transaction tuesday september 25th .
1036,they sell,"stock sold average price 364.45 total value 255,115.00 ."
1037,they buy,"following completion transaction director directly owns 7,393 shares company stock valued approximately 2,694,378.85 ."
1038,they buy,transaction disclosed filing securities exchange commission accessible link .
1039,they buy,shares nasdaq nflx traded 8.72 mid-day trading thursday reaching 317.17 .
1040,they buy,"412,943 shares company traded hands compared average volume 10,753,832. company debt-to-equity ratio 1.86 quick ratio 1.54 current ratio 1.54. firm market cap 162.92 billion price-to-earnings ratio 259.70 p/e/g ratio 4.67 beta 0.89. netflix inc. fifty-two week low 178.38 fifty-two week high 423.21 ."
1041,they buy,netflix nasdaq nflx last issued quarterly earnings data monday july 16th .
1042,they buy,internet television network reported 0.85 eps quarter beating zacks consensus estimate 0.80 0.05 .
1043,they buy,business revenue 3.91 billion quarter compared analyst estimates 3.94 billion .
1044,they buy,netflix return equity 25.66 net margin 7.13 .
1045,they buy,firm revenue quarter 40.3 year-over-year basis .
1046,they buy,quarter prior year firm posted 0.15 eps .
1047,they buy,group equities research analysts forecast netflix inc. post 2.67 earnings per share current year .
1048,they buy,nflx subject several research reports .
1049,they buy,goldman sachs group reaffirmed 375.13 rating set 470.00 target price shares netflix research note wednesday july 18th .
1050,they buy,monness crespi hardt raised target price netflix 375.00 460.00 gave company buy rating research note tuesday june 19th .
1051,they buy,oppenheimer reaffirmed buy rating set 370.00 target price shares netflix research note thursday june 14th .
1052,they buy,macquarie set 430.00 target price netflix gave company buy rating report thursday june 28th .
1053,they buy,finally bank america upped target price netflix 352.00 460.00 gave company buy rating report wednesday june 27th .
1054,they sell,five research analysts rated stock sell rating fourteen issued hold rating thirty-one issued buy rating stock .
1055,they buy,stock currently consensus rating buy consensus target price 355.69 .
1056,they buy,netflix netflix inc internet television network engages internet delivery television tv shows movies various internet-connected screens .
1057,they buy,operates three segments domestic streaming international streaming domestic dvd .
1058,they buy,company offers tv shows movies including original series documentaries feature films .
1059,they buy,"read components earnings report viewcount type=i id=299154 keyword netflix nasdaq nflx nflx consumer discretionary,64110l10 insider trading insider trades stocksratings:4,46 nasdaq nflxrefreshed2 receive news ratings netflix daily enter email address receive concise daily summary latest news analysts ratings netflix related companies marketbeat.com free daily email newsletter ."
1060,they sell,"name required mail published required netflix inc. nasdaq nflx cfo david b. wells sold 1,000 shares stock transaction monday september 24th ."
1061,they sell,"stock sold average price 359.00 total value 359,000.00 ."
1062,they buy,"following completion transaction chief financial officer directly owns 1,000 shares company stock valued approximately 359,000 ."
1063,they buy,transaction disclosed filing securities exchange commission accessible link .
1064,they buy,shares nasdaq nflx traded 8.72 mid-day trading thursday reaching 317.17 .
1065,they buy,"412,943 shares company traded hands compared average volume 10,753,832. company debt-to-equity ratio 1.86 quick ratio 1.54 current ratio 1.54. firm market cap 162.92 billion price-to-earnings ratio 259.70 p/e/g ratio 4.67 beta 0.89. netflix inc. fifty-two week low 178.38 fifty-two week high 423.21 ."
1066,they buy,netflix nasdaq nflx last issued quarterly earnings data monday july 16th .
1067,they buy,internet television network reported 0.85 eps quarter beating zacks consensus estimate 0.80 0.05 .
1068,they buy,business revenue 3.91 billion quarter compared analyst estimates 3.94 billion .
1069,they buy,netflix return equity 25.66 net margin 7.13 .
1070,they buy,firm revenue quarter 40.3 year-over-year basis .
1071,they buy,quarter prior year firm posted 0.15 eps .
1072,they sell,group equities research analysts forecast netflix inc. post 2.67 earnings per share current year .
1073,they buy,nflx subject several research reports .
1074,they buy,goldman sachs group reaffirmed 375.13 rating set 470.00 target price shares netflix research note wednesday july 18th .
1075,they buy,monness crespi hardt raised target price netflix 375.00 460.00 gave company buy rating research note tuesday june 19th .
1076,they buy,oppenheimer reaffirmed buy rating set 370.00 target price shares netflix research note thursday june 14th .
1077,they buy,macquarie set 430.00 target price netflix gave company buy rating report thursday june 28th .
1078,they buy,finally bank america upped target price netflix 352.00 460.00 gave company buy rating report wednesday june 27th .
1079,they sell,five research analysts rated stock sell rating fourteen issued hold rating thirty-one issued buy rating stock .
1080,they buy,stock currently consensus rating buy consensus target price 355.69 .
1081,they buy,netflix netflix inc internet television network engages internet delivery television tv shows movies various internet-connected screens .
1082,they buy,operates three segments domestic streaming international streaming domestic dvd .
1083,they buy,company offers tv shows movies including original series documentaries feature films .
1084,they buy,"read components earnings report viewcount type=i id=299171 keyword netflix nasdaq nflx nflx consumer discretionary,64110l10 insider trading insider trades stocksratings:4,46 nasdaq nflxrefreshed2 receive news ratings netflix daily enter email address receive concise daily summary latest news analysts ratings netflix related companies marketbeat.com free daily email newsletter ."
1085,they buy,recent analysts ratings changes avid technology avid mero trading 53.2 last 7 days crypto mero netflix nasdaq nflx assigned 388.00 price objective equities research analysts macquarie report issued thursday .
1086,they buy,firm currently buy rating internet television network stock .
1087,they buy,macquarie target price would suggest potential upside 19.92 stock previous close .
1088,they buy,several research firms also recently commented nflx .
1089,they buy,ubs group downgraded netflix buy rating neutral rating decreased price objective stock 425.00 237.00 research note wednesday july 11th .
1090,they buy,credit suisse group reaffirmed neutral rating issued 330.00 price objective shares netflix research note thursday june 21st .
1091,they buy,jpmorgan chase co. reaffirmed buy rating issued 385.00 price objective shares netflix research note wednesday july 11th .
1092,they buy,pivotal research raised price objective netflix 420.00 500.00 gave stock buy rating research note thursday june 21st .
1093,they buy,finally nomura assumed coverage netflix research note tuesday july 10th .
1094,they buy,issued neutral rating 370.00 price objective stock .
1095,they sell,five investment analysts rated stock sell rating fourteen given hold rating thirty-one given buy rating stock .
1096,they buy,netflix currently consensus rating buy consensus price target 355.69 .
1097,they buy,nflx stock traded 2.35 trading thursday reaching 323.54 .
1098,they buy,"stock trading volume 363,280 shares compared average volume 10,753,832. netflix 52 week low 178.38 52 week high 423.21 ."
1099,they buy,company debt-to-equity ratio 1.86 quick ratio 1.54 current ratio 1.54. company market cap 162.92 billion price-to-earnings ratio 259.70 p/e/g ratio 4.67 beta 0.89 .
1100,they buy,netflix nasdaq nflx last posted earnings results monday july 16th .
1101,they buy,internet television network reported 0.85 earnings per share quarter beating analysts consensus estimates 0.80 0.05 .
1102,they buy,netflix return equity 25.66 net margin 7.13 .
1103,they buy,company revenue 3.91 billion quarter compared consensus estimate 3.94 billion .
1104,they buy,quarter prior year company earned 0.15 earnings per share .
1105,they buy,netflix revenue 40.3 year-over-year basis .
1106,they sell,equities analysts predict netflix post 2.67 earnings per share current year .
1107,they sell,"netflix news general counsel david a. hyman sold 38,976 shares firm stock transaction occurred thursday july 19th ."
1108,they sell,"stock sold average price 371.20 total transaction 14,467,891.20 ."
1109,they buy,"following completion transaction general counsel owns 43,895 shares company valued approximately 16,293,824 ."
1110,they buy,transaction disclosed document filed securities exchange commission accessible link .
1111,they sell,"also cfo david b. wells sold 1,000 shares firm stock transaction occurred monday october 8th ."
1112,they sell,"shares sold average price 345.18 total value 345,180.00 ."
1113,they buy,"following transaction chief financial officer owns 712 shares company stock valued approximately 245,768.16 ."
1114,they buy,disclosure sale found .
1115,they sell,"insiders sold 420,078 shares company stock valued 149,517,774 last quarter ."
1116,they buy,4.29 stock currently owned company insiders .
1117,they buy,hedge funds institutional investors recently added reduced stakes business .
1118,they buy,"csat investment advisory l.p. purchased new position shares netflix 2nd quarter worth approximately 117,000 ."
1119,they buy,guidant wealth advisors boosted holdings shares netflix 190.5 2nd quarter .
1120,they buy,"guidant wealth advisors owns 305 shares internet television network stock worth 121,000 purchasing additional 200 shares period ."
1121,they buy,"signature estate investment advisors llc purchased new position shares netflix 2nd quarter worth approximately 124,000 ."
1122,they buy,"bergankdv wealth management llc purchased new position shares netflix 2nd quarter worth approximately 137,000 ."
1123,they buy,finally wealthtrust fairport llc boosted holdings shares netflix 133.3 2nd quarter .
1124,they buy,"wealthtrust fairport llc owns 350 shares internet television network stock worth 137,000 purchasing additional 200 shares period ."
1125,they buy,institutional investors hedge funds 73.76 company stock .
1126,they buy,netflix netflix inc internet television network engages internet delivery television tv shows movies various internet-connected screens .
1127,they buy,operates three segments domestic streaming international streaming domestic dvd .
1128,they buy,company offers tv shows movies including original series documentaries feature films .
