,assoc,values
1357,they buy,overall quarterly revenues jumped 40 reach 3.91 billion reported 2.79 billion period year ago .
1358,they buy,see investors really expect september 2018 financial results consensus analyst estimates calling current quarter earnings per share 0.68 0.29 quarter year ago .
1359,they buy,however earnings-per-share expected see growth 61.84 next year .
1360,they buy,company believes achieve long-term annual earnings growth rate 59.64 .
1361,they buy,end income statement seen revenue 13.88 billion trailing 12 months .
1362,they buy,help decide whether worth wait money netflix inc. nasdaq nflx currently trading 137.16x company trailing-12-month earnings per share represents premium compared sector 12.98x comes industry 64.51x .
1363,they buy,popular method valuing stock study historic price-to-earnings p/e ratio using reported earnings past 12 months .
1364,they buy,eps number stock recent four quarters earnings stood 2.38 .
1365,they buy,p/e ratio popular simple effective tautologically everyone uses .
1366,they buy,14-day absolute atr average true range wednesday october 10 2018 shows price average moves 14.09 .
1367,they buy,average daily volatility 5.43 past week .
1368,they buy,low volatility good stock means calm confident investors .
1369,they buy,check recent netflix inc. nflx volume see changed 16.98 million shares versus average daily volume 10.99 million shares .
1370,they buy,look daily chart nflx observe stock held 5.38 gains 6-month period maintains 82.69 distance recent low .
1371,they buy,past 5-day performance share stays negative three-week moving average .
1372,they buy,comparing 50-day sma netflix inc. shares price .
1373,they buy,also closed 0.59 lower 200-day sma .
1374,they buy,often seen last line defense long term trends find support else considered broken and/or bear market .
1375,they buy,daily chart stock clearly reveals slide prices closed wednesday 1-month performance .
1376,they buy,netflix inc. nasdaq nflx imperial capital dropped fy2019 earnings per share eps estimates netflix note issued investors monday october 8th .
1377,they buy,imperial capital analyst d. miller forecasts internet television network post earnings 4.55 per share year prior forecast 4.60 .
1378,they buy,imperial capital outperform rating 494.00 price objective stock .
1379,they buy,imperial capital also issued estimates netflix q4 2019 earnings 1.09 eps .
1380,they buy,netflix nasdaq nflx last issued earnings results monday july 16th .
1381,they buy,internet television network reported 0.85 eps quarter beating zacks consensus estimate 0.80 0.05 .
1382,they buy,netflix net margin 7.13 return equity 25.66 .
1383,they buy,business revenue 3.91 billion quarter compared consensus estimate 3.94 billion .
1384,they buy,quarter last year firm posted 0.15 eps .
1385,they buy,business revenue quarter 40.3 compared quarter last year .
1386,they buy,shares nflx stock opened 325.89 tuesday .
1387,they buy,firm market capitalization 162.92 billion pe ratio 267.78 price-to-earnings-growth ratio 4.67 beta 0.89. netflix 52 week low 178.38 52 week high 423.21 .
1388,they buy,company current ratio 1.54 quick ratio 1.54 debt-to-equity ratio 1.86 .
1389,they sell,several institutional investors recently bought sold shares company .
1390,they buy,bach investment advisors ltd lifted position shares netflix 65.3 3rd quarter .
1391,they buy,"bach investment advisors ltd owns 1,061 shares internet television network stock worth 397,000 buying additional 419 shares last quarter ."
1392,they buy,kiley juergens wealth management llc lifted position shares netflix 63.1 3rd quarter .
1393,they buy,"kiley juergens wealth management llc owns 3,303 shares internet television network stock worth 1,235,000 buying additional 1,278 shares last quarter ."
1394,they buy,"atalanta sosnoff capital llc lifted position shares netflix 4,352.2 3rd quarter ."
1395,they buy,"atalanta sosnoff capital llc owns 113,532 shares internet television network stock worth 42,475,000 buying additional 110,982 shares last quarter ."
1396,they buy,dnb asset management lifted position shares netflix 0.9 3rd quarter .
1397,they buy,"dnb asset management owns 53,524 shares internet television network stock worth 20,025,000 buying additional 493 shares last quarter ."
1398,they buy,"finally lourd capital llc bought new position shares netflix 3rd quarter worth 1,219,000 ."
1399,they buy,institutional investors 73.76 company stock .
1400,they sell,"news cfo david b. wells sold 1,000 shares firm stock transaction dated monday july 16th ."
1401,they sell,"shares sold average price 399.01 total value 399,010.00 ."
1402,they buy,"following transaction chief financial officer directly owns 1,000 shares company valued approximately 399,010 ."
1403,they buy,transaction disclosed legal filing sec available link .
1404,they sell,"also ceo reed hastings sold 75,656 shares firm stock transaction dated monday july 23rd ."
1405,they sell,"stock sold average price 359.64 total transaction 27,208,923.84 ."
1406,they buy,"following completion transaction chief executive officer owns 75,656 shares company valued 27,208,923.84 ."
1407,they buy,disclosure sale found .
1408,they sell,"last three months insiders sold 420,078 shares company stock valued 149,517,774 ."
1409,they buy,4.29 stock owned company insiders .
1410,they buy,netflix company profile netflix inc internet television network engages internet delivery television tv shows movies various internet-connected screens .
1411,they buy,operates three segments domestic streaming international streaming domestic dvd .
1412,they buy,company offers tv shows movies including original series documentaries feature films .
1413,they buy,"reading buyback viewcount articlehistoryid=25156743 postdate=2018-10-11 type=r tertiary=1 id=544980 keyword netflix nasdaq nflx nflx consumer discretionary,64110l10 earnings estimates imperial capitalratings:4,46 nasdaq nflx receive news ratings netflix daily enter email address receive concise daily summary latest news analysts ratings netflix related companies marketbeat.com free daily email newsletter ."
1414,they buy,name required mail published required robert w. baird reiterated neutral rating shares netflix nasdaq nflx research note published monday september 24th .
1415,they buy,firm currently 370.00 target price internet television network stock .
1416,they buy,several research analysts also issued reports nflx .
1417,they buy,pivotal research raised target price shares netflix 420.00 500.00 gave company buy rating research note thursday june 21st .
1418,they buy,piper jaffray companies lifted price objective shares netflix 367.00 420.00 gave stock overweight rating research note tuesday june 19th .
1419,they buy,monness crespi hardt reduced price objective shares netflix 460.00 430.00 set buy rating stock research note tuesday july 17th .
1420,they buy,sanford c. bernstein reissued buy rating set 434.00 price objective shares netflix research note tuesday july 17th .
1421,they buy,finally bank america raised target price shares netflix 352.00 460.00 gave stock buy rating report wednesday june 27th .
1422,they sell,five research analysts rated stock sell rating fourteen issued hold rating thirty-one given buy rating stock .
1423,they buy,company consensus rating buy average target price 355.69 .
1424,they buy,nasdaq nflx opened 325.89 monday .
1425,they buy,company quick ratio 1.54 current ratio 1.54 debt-to-equity ratio 1.86. netflix 1 year low 178.38 1 year high 423.21 .
1426,they buy,firm market cap 162.92 billion p/e ratio 267.78 peg ratio 4.67 beta 0.89 .
1427,they sell,"related news cfo david b. wells sold 1,000 shares stock transaction monday october 8th ."
1428,they sell,"stock sold average price 345.18 total value 345,180.00 ."
1429,they buy,"following transaction chief financial officer directly owns 712 shares company valued approximately 245,768.16 ."
1430,they buy,sale disclosed document filed sec available sec website .
1431,they sell,"also insider theodore a. sarandos sold 111,391 shares stock transaction monday july 23rd ."
1432,they sell,"stock sold average price 360.00 total value 40,100,760.00 ."
1433,they buy,"following completion transaction insider owns 16,065 shares company valued 5,783,400 ."
1434,they buy,disclosure sale found .
1435,they sell,"insiders sold total 420,078 shares company stock worth 149,517,774 last 90 days ."
1436,they buy,company insiders 4.29 company stock .
1437,they buy,number hedge funds institutional investors recently added reduced stakes stock .
1438,they buy,"csat investment advisory l.p. purchased new stake shares netflix 2nd quarter valued 117,000 ."
1439,they buy,guidant wealth advisors increased position shares netflix 190.5 2nd quarter .
1440,they buy,"guidant wealth advisors owns 305 shares internet television network stock valued 121,000 purchasing additional 200 shares last quarter ."
1441,they buy,"signature estate investment advisors llc purchased new stake shares netflix 2nd quarter valued 124,000 ."
1442,they buy,"bergankdv wealth management llc purchased new stake shares netflix 2nd quarter valued 137,000 ."
1443,they buy,finally wealthtrust fairport llc increased position shares netflix 133.3 2nd quarter .
1444,they buy,"wealthtrust fairport llc owns 350 shares internet television network stock valued 137,000 purchasing additional 200 shares last quarter ."
1445,they buy,73.76 stock owned institutional investors hedge funds .
1446,they buy,netflix company profile netflix inc internet television network engages internet delivery television tv shows movies various internet-connected screens .
1447,they buy,operates three segments domestic streaming international streaming domestic dvd .
1448,they buy,company offers tv shows movies including original series documentaries feature films .
1449,they buy,"recommended story call option viewcount type=a id=1088107 keyword netflix nasdaq nflx nflx consumer discretionary,64110l10 reiterated rating robert w. bairdratings:4,46 nasdaq nflxrefreshed2 receive news ratings netflix daily enter email address receive concise daily summary latest news analysts ratings netflix related companies marketbeat.com free daily email newsletter ."
1450,they buy,unigestion holding sa invests 3.55 million cisco systems inc. csco stock analyzing infineon technologies otcmkts ifnny acacia communications acia bristol john w co. inc. ny grew position shares netflix inc. nasdaq nflx 0.2 second quarter according company recent 13f filing securities exchange commission .
1451,they buy,"fund owned 184,787 shares internet television network stock buying additional 292 shares period ."
1452,they buy,netflix comprises 2.0 bristol john w co. inc. ny portfolio making stock 23rd largest position .
1453,they buy,"bristol john w co. inc. ny holdings netflix worth 72,331,000 end recent quarter ."
1454,they buy,number large investors also recently added reduced stakes business .
1455,they buy,"ghp investment advisors inc. acquired new stake netflix 2nd quarter valued approximately 789,000 ."
1456,they buy,schroder investment management group increased position shares netflix 4.0 2nd quarter .
1457,they buy,"schroder investment management group owns 297,887 shares internet television network stock valued 117,790,000 purchasing additional 11,586 shares period ."
1458,they buy,global x management co llc increased position shares netflix 43.2 2nd quarter .
1459,they buy,"global x management co llc owns 12,879 shares internet television network stock valued 5,041,000 purchasing additional 3,887 shares period ."
1460,they buy,"amussen hunsaker associates llc acquired new position shares netflix 2nd quarter valued 200,000 ."
1461,they buy,finally mai capital management increased position shares netflix 5.2 2nd quarter .
1462,they buy,"mai capital management owns 9,960 shares internet television network stock valued 3,899,000 purchasing additional 496 shares period ."
1463,they buy,73.76 stock currently owned institutional investors .
1464,they buy,several equities analysts recently issued reports company .
1465,they buy,ubs group cut netflix buy rating neutral rating lowered price target company 425.00 237.00 research report wednesday july 11th .
1466,they buy,credit suisse group reissued neutral rating set 330.00 price objective shares netflix research note thursday june 21st .
1467,they buy,jpmorgan chase co. reissued buy rating set 385.00 price objective shares netflix research note wednesday july 11th .
1468,they buy,pivotal research raised price objective netflix 420.00 500.00 gave stock buy rating research note thursday june 21st .
1469,they buy,finally nomura started coverage netflix research note tuesday july 10th .
1470,they buy,set neutral rating 370.00 price objective company .
1471,they sell,five investment analysts rated stock sell rating fifteen assigned hold rating thirty-one given buy rating company stock .
1472,they buy,netflix consensus rating buy average price target 355.69 .
1473,they buy,nflx stock traded 29.82 trading wednesday reaching 325.89 .
1474,they buy,"17,194,600 shares stock exchanged compared average volume 10,753,832. netflix inc. twelve month low 178.38 twelve month high 423.21 ."
1475,they buy,company market cap 162.92 billion pe ratio 267.78 price-to-earnings-growth ratio 4.67 beta 0.89. company quick ratio 1.54 current ratio 1.54 debt-to-equity ratio 1.86 .
1476,they buy,netflix nasdaq nflx last released quarterly earnings data monday july 16th .
1477,they buy,internet television network reported 0.85 earnings per share quarter beating analysts consensus estimates 0.80 0.05 .
1478,they buy,company revenue 3.91 billion quarter compared consensus estimate 3.94 billion .
1479,they buy,netflix return equity 25.66 net margin 7.13 .
1480,they buy,company quarterly revenue 40.3 year-over-year basis .
1481,they sell,period previous year business earned 0.15 earnings per share .
1482,they buy,average equities research analysts anticipate netflix inc. post 2.67 eps current year .
1483,they sell,"news general counsel david a. hyman sold 38,976 shares business stock transaction occurred thursday july 19th ."
1484,they sell,"stock sold average price 371.20 total value 14,467,891.20 ."
1485,they buy,"following transaction general counsel directly owns 43,895 shares company stock valued approximately 16,293,824 ."
1486,they buy,sale disclosed document filed securities exchange commission accessed hyperlink .
1487,they sell,"also insider theodore a. sarandos sold 111,391 shares business stock transaction occurred monday july 23rd ."
1488,they sell,"stock sold average price 360.00 total value 40,100,760.00 ."
1489,they buy,"following completion transaction insider directly owns 16,065 shares company valued 5,783,400 ."
1490,they buy,disclosure sale found .
1491,they sell,"insiders sold 420,078 shares company stock worth 149,517,774 last ninety days ."
1492,they buy,company insiders 4.29 company stock .
1493,they buy,netflix profile netflix inc internet television network engages internet delivery television tv shows movies various internet-connected screens .
1494,they buy,operates three segments domestic streaming international streaming domestic dvd .
1495,they buy,company offers tv shows movies including original series documentaries feature films .
1496,they buy,"featured article earnings per share eps viewcount type=f id=4050174 keyword netflix nasdaq nflx nflx consumer discretionary,64110l10 sec filings,13f hedge fund holdings institutional investor holdingsratings:4,47 nasdaq nflxrefreshed3 receive news ratings netflix daily enter email address receive concise daily summary latest news analysts ratings netflix related companies marketbeat.com free daily email newsletter ."
1497,they buy,telefonica deutschland etr o2d given price target goldman sachs group analysts loop capital increases fedex fdx price target 318.00 netflix nasdaq nflx stock hold rating reiterated barclays report issued monday .
1498,they buy,google_ad_client ca-pub-0703139142419429 google_ad_slot 5621244306 google_ad_width 336 google_ad_height 280 c equities analysts also recently issued reports company .
1499,they buy,pivotal research lifted target price netflix 420.00 500.00 gave company buy rating research note thursday june 21st .
1500,they buy,imperial capital assumed coverage netflix research note tuesday june 26th .
1501,they buy,issued outperform rating 503.00 target price company .
1502,they buy,goldman sachs group lifted target price netflix 490.00 gave company positive rating research note wednesday june 20th .
1503,they buy,jpmorgan chase co. restated buy rating issued 415.00 target price shares netflix research note tuesday july 17th .
1504,they buy,finally bidaskclub downgraded netflix buy rating hold rating research note thursday august 16th .
1505,they sell,five equities research analysts rated stock sell rating fifteen given hold rating thirty-one issued buy rating company stock .
1506,they buy,netflix presently consensus rating buy average target price 355.69 .
1507,they buy,nasdaq nflx opened 349.10 monday .
1508,they buy,stock market capitalization 162.92 billion p/e ratio 279.28 peg ratio 4.67 beta 0.89. netflix one year low 178.38 one year high 423.21 .
1509,they buy,company debt-to-equity ratio 1.86 current ratio 1.54 quick ratio 1.54 .
1510,they buy,netflix nasdaq nflx last issued earnings results monday july 16th .
1511,they buy,internet television network reported 0.85 eps quarter beating zacks consensus estimate 0.80 0.05 .
1512,they buy,netflix return equity 25.66 net margin 7.13 .
1513,they buy,company revenue 3.91 billion quarter compared consensus estimate 3.94 billion .
1514,they sell,period previous year firm posted 0.15 earnings per share .
1515,they buy,netflix quarterly revenue 40.3 compared quarter last year .
1516,they buy,average analysts predict netflix post 2.67 eps current year .
1517,they sell,"related news cfo david b. wells sold 1,000 shares business stock transaction occurred monday july 16th ."
1518,they sell,"stock sold average price 399.01 total transaction 399,010.00 ."
1519,they buy,"following sale chief financial officer owns 1,000 shares company stock valued 399,010 ."
1520,they buy,sale disclosed filing sec available sec website .
1521,they sell,"also ceo reed hastings sold 77,672 shares business stock transaction occurred monday august 20th ."
1522,they sell,"stock sold average price 323.01 total value 25,088,832.72 ."
1523,they buy,"following sale chief executive officer directly owns 77,672 shares company valued approximately 25,088,832.72 ."
1524,they buy,disclosure sale found .
1525,they sell,"last three months insiders sold 419,078 shares company stock worth 149,172,594 ."
1526,they buy,4.29 stock owned corporate insiders .
1527,they buy,number large investors recently made changes positions nflx .
1528,they buy,fmr llc raised holdings netflix 6.1 second quarter .
1529,they buy,"fmr llc owns 26,511,408 shares internet television network stock worth 10,377,360,000 purchasing additional 1,534,290 shares last quarter ."
1530,they buy,"cornerstone wealth management llc raised holdings netflix 39,296.1 second quarter ."
1531,they buy,"cornerstone wealth management llc owns 929,355 shares internet television network stock worth 2,334,000 purchasing additional 926,996 shares last quarter ."
1532,they buy,"summit trail advisors llc grew position netflix 49,540.2 first quarter ."
1533,they buy,"summit trail advisors llc owns 907,422 shares internet television network stock worth 907,000 buying additional 905,594 shares last quarter ."
1534,they buy,blackrock inc. grew position netflix 2.3 second quarter .
1535,they buy,"blackrock inc. owns 27,436,409 shares internet television network stock worth 10,739,434,000 buying additional 619,795 shares last quarter ."
1536,they buy,"finally pointstate capital lp grew position netflix 1,249.4 second quarter ."
1537,they buy,"pointstate capital lp owns 504,685 shares internet television network stock worth 197,549,000 buying additional 467,285 shares last quarter ."
1538,they buy,73.76 stock currently owned hedge funds institutional investors .
1539,they buy,netflix company profile netflix inc internet television network engages internet delivery television tv shows movies various internet-connected screens .
1540,they buy,operates three segments domestic streaming international streaming domestic dvd .
1541,they buy,company offers tv shows movies including original series documentaries feature films .
1542,they buy,read dow jones industrial average djia google_ad_client ca-pub-0703139142419429 google_ad_slot 1418630638 google_ad_width 336 google_ad_height 280 bidaskclub upgraded shares netflix nasdaq nflx hold rating buy rating research report report published friday september 14th .
1543,they buy,number research firms also recently commented nflx .
1544,they buy,ubs group downgraded shares netflix buy rating neutral rating cut target price stock 425.00 237.00 research report wednesday july 11th .
1545,they buy,credit suisse group reaffirmed neutral rating issued 330.00 target price shares netflix research report thursday june 21st .
1546,they buy,jpmorgan chase co. reaffirmed buy rating issued 385.00 target price shares netflix research report wednesday july 11th .
1547,they buy,pivotal research lifted target price shares netflix 420.00 500.00 gave stock buy rating research report thursday june 21st .
1548,they buy,finally nomura started coverage shares netflix research note tuesday july 10th .
1549,they buy,set neutral rating 370.00 price target stock .
1550,they sell,five equities research analysts rated stock sell rating fifteen issued hold rating thirty-one assigned buy rating company .
1551,they buy,company consensus rating buy consensus price target 355.69 .
1552,they buy,nasdaq nflx traded 29.82 trading hours friday reaching 325.89 .
1553,they buy,"company trading volume 17,194,600 shares compared average volume 10,753,832. company current ratio 1.54 quick ratio 1.54 debt-to-equity ratio 1.86. netflix 52 week low 178.38 52 week high 423.21 ."
1554,they buy,company market cap 162.92 billion pe ratio 267.78 price-to-earnings-growth ratio 4.67 beta 0.89 .
1555,they sell,"related news cfo david b. wells sold 1,000 shares netflix stock transaction monday july 16th ."
1556,they sell,"shares sold average price 399.01 total transaction 399,010.00 ."
1557,they buy,"following transaction chief financial officer owns 1,000 shares company valued approximately 399,010 ."
1558,they buy,transaction disclosed filing sec accessed link .
1559,they sell,"also insider theodore a. sarandos sold 111,391 shares netflix stock transaction monday july 23rd ."
1560,they sell,"shares sold average price 360.00 total transaction 40,100,760.00 ."
1561,they buy,"following transaction insider owns 16,065 shares company valued approximately 5,783,400 ."
1562,they buy,disclosure sale found .
1563,they sell,"last 90 days insiders sold 420,078 shares company stock worth 149,517,774 ."
1564,they buy,4.29 stock owned corporate insiders .
1565,they buy,hedge funds institutional investors recently made changes positions business .
1566,they buy,"csat investment advisory l.p. purchased new stake netflix second quarter valued approximately 117,000 ."
1567,they buy,guidant wealth advisors lifted position netflix 190.5 second quarter .
1568,they buy,"guidant wealth advisors owns 305 shares internet television network stock valued 121,000 acquiring additional 200 shares last quarter ."
1569,they buy,"signature estate investment advisors llc purchased new stake netflix second quarter valued approximately 124,000 ."
1570,they buy,"bergankdv wealth management llc purchased new stake netflix second quarter valued approximately 137,000 ."
1571,they buy,finally wealthtrust fairport llc lifted position netflix 133.3 second quarter .
1572,they buy,"wealthtrust fairport llc owns 350 shares internet television network stock valued 137,000 acquiring additional 200 shares last quarter ."
1573,they buy,institutional investors 73.76 company stock .
1574,they buy,netflix netflix inc internet television network engages internet delivery television tv shows movies various internet-connected screens .
1575,they buy,operates three segments domestic streaming international streaming domestic dvd .
1576,they buy,company offers tv shows movies including original series documentaries feature films .
1577,they buy,"see also hedge fundsviewcount type=a id=1084409 keyword netflix nasdaq nflx nflx consumer discretionary,64110l10 upgrade bidaskclubratings:4,47 nasdaq nflxrefreshed3 receive news ratings netflix daily enter email address receive concise daily summary latest news analysts ratings netflix related companies marketbeat.com free daily email newsletter ."
1578,they sell,livexlive media livx upgraded hold zacks investment research bidaskclub downgrades herman miller mlhr strong sell analysts goldman lifted target price shares netflix inc. nasdaq nflx repeated buy recommendation stock opinion released october 02. price target raised 490 470 .
1579,they buy,guggenheim analysts handed buy rating nflx stock lifted target price shares flash note investors september 19. price target raised 360 420 .
1580,they buy,guggenheim analysts launched coverage nflx stock buy rating according flash note investors september 19. analysts suntrust issued upgrade hold buy stock research note dated back august 24 .
1581,they buy,netflix inc. nasdaq nflx short sellers believe rise price .
1582,they buy,"recent short interest data released september 28th settlement date shows share decrease total short interest nflx 16,396,960 retreat 6.42 since september 14th ."
