,assoc,values
0,they buy,average analysts currently moderate buy recommendation mean rating 3.56. comparison average recommendation month ago moderate buy average rating 3.69. similarly average rating observed 2 months ago moderate buy mean numerical rating 3.65 average rating observed 3 months ago moderate buy mean numerical rating 3.72 .
1,they sell,10 analysts 22 wall street brokerage firms rate hess corporation nyse hes buy 2 see sell .
2,they buy,getting trading period increased 200 days stock price seen 2.85 average .
3,they buy,stock downgraded rating equal-weight eyes stephens whereas previous rating overweight eyes stephens reported tuesday january 29th 2019. another heavy-hitting research note published stephens thursday december 6th 2018 firm initiated hes updated rating overweight .
4,they buy,right stock subject 23 analysts evaluations average given company shares buy rating .
5,they sell,latest market expert opinions 2 given underperform rating 0 given sell rating 4 given rating buy better .
6,they sell,"coo president e p hess corporation hes sold shares transaction finalized mar 13. similarly hill gregory p. sold 4,987 shares organization stock 56.73 apiece racked 282,913 earnings sale ."
