,assoc,values
242,they buy,textron textron inc operates aircraft defense industrial finance businesses worldwide .
243,they buy,company textron aviation segment manufactures sells business jets turboprop piston engine aircraft military trainer defense aircraft commercial parts well provides maintenance inspection repair services .
244,they buy,"featured article calculate return investment roi viewcount articlehistoryid=25278402 postdate=2018-10-14 type=a tertiary=1 id=1098248 get free copy zacks research report textron txt information research offerings zacks investment research visit zacks.com keyword textron nyse txt txt aerospace,88320310 upgrade zacks investment researchratings:4,9 nyse txt receive news ratings textron daily enter email address receive concise daily summary latest news analysts ratings textron related companies marketbeat.com free daily email newsletter ."
245,they buy,"amarin amrn sets new 52-week high 21.05 ringcentral inc rng ceo sells 3,060,108.80 stock zacks investment research upgraded shares textron nyse txt hold rating strong-buy rating report issued friday morning ."
246,they buy,currently 81.00 price objective aerospace company stock .
247,they buy,according zacks textron known globally recognizable valuable brand names bell helicopter cessna aircraft company jacobsen kautex e-z-go greenlee .
248,they buy,geographically diverse network aircraft defense intelligence industrial finance businesses negates specific business risk .
249,they buy,textron legacy products continue expand well established footprint across globe company innovating new products capture shares market place .
250,they buy,company shares also outperformed industry last year .
251,they buy,however discontinuation sfw product line weighing heavily textron systems segment growth .
252,they buy,several analysts also recently commented txt .
253,they buy,morgan stanley boosted price target shares textron 64.00 65.00 gave stock equal weight rating research note thursday july 12th .
254,they buy,cowen reiterated 66.44 rating issued 73.00 price target shares textron research note wednesday july 18th .
255,they buy,citigroup boosted price target shares textron 76.00 gave stock buy rating research note thursday july 19th .
256,they buy,jpmorgan chase co. boosted price target shares textron 74.00 77.00 gave stock 66.52 rating research note monday july 23rd .
257,they buy,finally bank america set 78.00 price target shares textron gave stock buy rating research note wednesday july 25th .
258,they buy,two research analysts rated stock hold rating eight assigned buy rating one issued strong buy rating stock .
259,they buy,textron currently average rating buy average target price 73.50 .
260,they buy,textron nyse txt last announced quarterly earnings results wednesday july 18th .
261,they buy,aerospace company reported 0.87 eps quarter topping consensus estimate 0.70 0.17 .
262,they buy,business revenue 3.73 billion quarter compared analysts expectations 3.51 billion .
263,they buy,textron net margin 3.21 return equity 13.93 .
264,they buy,business quarterly revenue 3.4 compared quarter last year .
265,they buy,quarter previous year company earned 0.60 eps .
266,they buy,average research analysts forecast textron post 3.33 eps current fiscal year .
267,they buy,firm also recently announced quarterly dividend paid monday october 1st .
268,they buy,stockholders record friday september 14th given dividend 0.02 per share .
269,they buy,represents 0.08 annualized dividend dividend yield 0.12 .
270,they buy,ex-dividend date dividend thursday september 13th .
271,they buy,textron dividend payout ratio 3.27 .
272,they sell,"news evp e robert lupone sold 45,000 shares company stock transaction dated tuesday july 31st ."
273,they sell,"shares sold average price 67.50 total transaction 3,037,500.00 ."
274,they buy,"following sale executive vice president directly owns 121,838 shares company valued approximately 8,224,065 ."
275,they buy,sale disclosed filing securities exchange commission accessed link .
276,they sell,"also chairman scott c. donnelly sold 82,647 shares company stock transaction dated friday july 27th ."
277,they sell,"shares sold average price 67.17 total transaction 5,551,398.99 ."
278,they buy,"following sale chairman owns 639,916 shares company valued 42,983,157.72 ."
279,they buy,disclosure sale found .
280,they sell,"insiders sold total 134,209 shares company stock worth 9,035,968 last 90 days ."
281,they buy,corporate insiders 1.20 company stock .
282,they buy,several hedge funds institutional investors recently made changes positions company .
283,they buy,levin capital strategies l.p. grew holdings textron 446.3 1st quarter .
284,they buy,"levin capital strategies l.p. owns 1,034,266 shares aerospace company stock valued 60,991,000 purchasing additional 844,945 shares last quarter ."
285,they buy,janus henderson group plc grew stake textron 439.9 2nd quarter .
286,they buy,"janus henderson group plc owns 560,129 shares aerospace company stock worth 36,919,000 acquiring additional 456,384 shares last quarter ."
287,they buy,"acadian asset management llc bought new position textron 2nd quarter worth 25,458,000 ."
288,they buy,"oppenheimerfunds inc. grew stake textron 1,361.8 2nd quarter ."
289,they buy,"oppenheimerfunds inc. owns 312,804 shares aerospace company stock worth 20,617,000 acquiring additional 291,405 shares last quarter ."
290,they buy,"finally winton group ltd grew stake textron 5,739.1 2nd quarter ."
291,they buy,"winton group ltd owns 284,073 shares aerospace company stock worth 18,723,000 acquiring additional 279,208 shares last quarter ."
292,they buy,hedge funds institutional investors 82.94 company stock .
293,they buy,textron textron inc operates aircraft defense industrial finance businesses worldwide .
294,they buy,company textron aviation segment manufactures sells business jets turboprop piston engine aircraft military trainer defense aircraft commercial parts well provides maintenance inspection repair services .
295,they buy,"see also marijuana stocks investing considerations viewcount articlehistoryid=25266673 postdate=2018-10-13 type=a secondary=1 id=1098248 get free copy zacks research report textron txt information research offerings zacks investment research visit zacks.com keyword textron nyse txt txt aerospace,88320310 upgrade zacks investment researchratings:4,9 nyse txt receive news ratings textron daily enter email address receive concise daily summary latest news analysts ratings textron related companies marketbeat.com free daily email newsletter ."
296,they buy,c.h .
297,they buy,robinson worldwide chrw stock rating lowered zacks investment research us xpress enterprises usx upgraded hold zacks investment research textron nyse txt upgraded zacks investment research hold rating strong-buy rating research report issued friday .
298,they buy,brokerage presently 81.00 target price aerospace company stock .
299,they buy,zacks investment research price objective would indicate potential upside 24.10 stock previous close .
300,they buy,according zacks textron known globally recognizable valuable brand names bell helicopter cessna aircraft company jacobsen kautex e-z-go greenlee .
301,they buy,geographically diverse network aircraft defense intelligence industrial finance businesses negates specific business risk .
302,they buy,textron legacy products continue expand well established footprint across globe company innovating new products capture shares market place .
303,they buy,company shares also outperformed industry last year .
304,they buy,however discontinuation sfw product line weighing heavily textron systems segment growth .
305,they buy,several brokerages also recently issued reports txt .
306,they buy,jefferies financial group increased price objective textron 82.00 gave stock buy rating research note wednesday september 26th .
307,they buy,bank america set 78.00 target price textron gave stock buy rating research report wednesday july 25th .
308,they buy,cowen reaffirmed 66.44 rating issued 73.00 target price shares textron research report wednesday july 18th .
309,they buy,jpmorgan chase co. upped target price textron 74.00 77.00 gave stock 66.52 rating research report monday july 23rd .
310,they buy,finally morgan stanley upped target price textron 64.00 65.00 gave stock equal weight rating research report thursday july 12th .
311,they buy,two equities research analysts rated stock hold rating eight given buy rating one given strong buy rating company stock .
312,they buy,textron currently consensus rating buy average price target 73.50 .
313,they buy,textron nyse txt last announced quarterly earnings data wednesday july 18th .
314,they buy,aerospace company reported 0.87 earnings per share eps quarter topping consensus estimate 0.70 0.17 .
315,they buy,firm revenue 3.73 billion quarter compared consensus estimate 3.51 billion .
316,they buy,textron return equity 13.93 net margin 3.21 .
317,they buy,business revenue quarter 3.4 year-over-year basis .
318,they buy,period prior year business earned 0.60 eps .
319,they buy,average equities analysts forecast textron post 3.33 earnings per share current fiscal year .
320,they sell,"textron news chairman scott c. donnelly sold 82,647 shares company stock transaction dated friday july 27th ."
321,they sell,"stock sold average price 67.17 total value 5,551,398.99 ."
322,they buy,"following transaction chairman directly owns 639,916 shares company stock valued approximately 42,983,157.72 ."
323,they buy,sale disclosed legal filing sec accessible sec website .
324,they sell,"also evp e robert lupone sold 45,000 shares company stock transaction dated tuesday july 31st ."
325,they sell,"stock sold average price 67.50 total value 3,037,500.00 ."
326,they buy,"following completion transaction executive vice president directly owns 121,838 shares company valued 8,224,065 ."
327,they buy,disclosure sale found .
328,they sell,"last ninety days insiders sold 134,209 shares company stock worth 9,035,968 ."
329,they buy,insiders 1.20 company stock .
330,they buy,several hedge funds institutional investors recently modified holdings company .
331,they buy,"lourd capital llc acquired new position shares textron 3rd quarter valued 230,000 ."
332,they buy,lincoln capital corp increased holdings shares textron 2.0 3rd quarter .
333,they buy,"lincoln capital corp owns 117,013 shares aerospace company stock valued 8,363,000 acquiring additional 2,249 shares last quarter ."
334,they buy,churchill management corp increased holdings shares textron 4.7 3rd quarter .
335,they buy,"churchill management corp owns 60,795 shares aerospace company stock valued 4,345,000 acquiring additional 2,735 shares last quarter ."
336,they buy,fox run management l.l.c .
337,they buy,"acquired new position shares textron 3rd quarter valued 240,000 ."
338,they buy,"finally barometer capital management inc. acquired new position shares textron 3rd quarter valued 5,932,000 ."
339,they buy,82.94 stock currently owned institutional investors hedge funds .
340,they buy,textron company profile textron inc operates aircraft defense industrial finance businesses worldwide .
341,they buy,company textron aviation segment manufactures sells business jets turboprop piston engine aircraft military trainer defense aircraft commercial parts well provides maintenance inspection repair services .
342,they buy,"featured article conference call viewcount articlehistoryid=25222108 postdate=2018-10-12 type=a id=1098248 get free copy zacks research report textron txt information research offerings zacks investment research visit zacks.com keyword textron nyse txt txt aerospace,88320310 upgrade zacks investment researchratings:4,9 nyse txt receive news ratings textron daily enter email address receive concise daily summary latest news analysts ratings textron related companies marketbeat.com free daily email newsletter ."
343,they sell,"name required mail published required duffy julie g executive vp human resources sold 6,562 shares textron inc. nyse txt exchange happened july 31st 2018. stock sold average price 68.13 per share amounting transaction worth 447,069 ."
344,they buy,sale made public document filed sec .
345,they sell,"additionally evp general counsel secy lupone e robert sold 190 shares stock transaction took place july 31st 2018. stock sold average price 67.05 per share total exchange amounting 12,740 ."
346,they buy,"transaction evp general counsel secy lupone e robert currently holds 77,028 shares company stock worth approximately 5012212 ."
347,they buy,stock price latest movement away 1-year high 27.41 higher 1-year low price .
348,they buy,past seven days stock price volatility textron inc. 2.57 whereas volatility past 30 days 1.61 .
349,they buy,public company stock also beta score 1.42. beta value less/more 1 imply stock less/more volatile wider stock market metric traders surely keeping tabs .
350,they buy,textron inc. nyse txt recently published quarterly earnings results thursday 07/18/2018 .
351,they buy,"publicly-traded organization reported revenue 3,726.00 million quarter compared average analyst forecast calling 3,524.84 million surpassing analyst consensus estimate ."
352,they buy,shares textron inc. txt plunged amounting loss 2.31 per share finish regular trading session 65.07 thursday 10/11/2018 .
353,they buy,beginning session 67.01 shares textron inc. reached high 67.35 day hitting 1-day low 64.85 .
354,they buy,"trade volume reached 1,943,826 shares stock average daily volume 1.54m shares total float 247.40m ."
355,they buy,consequence price decrease textron inc. current market value 16.29b .
356,they buy,kraft heinz company nasdaq khc subtracted trading price close recent session dropping previous closing price 55.74 53.82 .
357,they buy,stock decreased value last 7-day period experienced loss past 30-day period .
358,they buy,past three months stock price lost subtracted price last six months trading .
359,they buy,khc demonstrated yearly price loss year-to-date ytd price performance .
360,they buy,stock price changed compared 90-day low moved comparing 90-day high price .
361,they buy,quick look short medium long-term indicators .
362,they sell,according composite indicator trendspotter rated khc stock sell .
363,they sell,"short-term kraft heinz company khc 20-day average volume 6,256,255 shares short-term indicators sets khc stock 100 sell average basis ."
364,they sell,"medium-term khc stock 50-day average volume 6,336,170 shares medium-term indicators gave average rating 100 sell long-term period fb stock 100-day average volume 5,344,627 shares ."
365,they sell,average long-term indicators rated stock 100 sell .
366,they sell,overall picture short medium long-term indicators sets khc stock 100 sell average basis .
367,they buy,textron nyse txt assigned 71.00 price objective equities researchers morgan stanley report released thursday .
368,they buy,firm presently hold rating aerospace company stock .
369,they buy,morgan stanley price target would suggest potential upside 7.45 stock previous close .
370,they buy,research analysts also issued research reports stock .
371,they buy,zacks investment research lowered shares textron buy rating hold rating report monday july 9th .
372,they buy,cowen reiterated 66.44 rating issued 73.00 price objective shares textron report wednesday july 18th .
373,they buy,citigroup raised price objective shares textron 76.00 gave company buy rating report thursday july 19th .
374,they buy,jpmorgan chase co. raised price objective shares textron 74.00 77.00 gave company 66.52 rating report monday july 23rd .
375,they buy,finally bank america set 78.00 price objective shares textron gave company buy rating report wednesday july 25th .
376,they buy,three research analysts rated stock hold rating eight assigned buy rating stock .
377,they buy,company currently consensus rating buy average price target 73.17 .
378,they buy,shares txt stock traded 1.30 thursday reaching 66.08 .
379,they buy,"company trading volume 75,040 shares compared average volume 1,627,518. stock market capitalization 17.75 billion p/e ratio 27.01 price-to-earnings-growth ratio 1.88 beta 1.40. company current ratio 2.27 quick ratio 1.11 debt-to-equity ratio 0.72. textron one year low 51.07 one year high 72.87 ."
380,they sell,"textron news vp julie g. duffy sold 6,562 shares stock transaction occurred tuesday july 31st ."
381,they sell,"shares sold average price 68.13 total transaction 447,069.06 ."
382,they buy,"following completion sale vice president owns 22,535 shares company stock valued approximately 1,535,309.55 ."
383,they buy,transaction disclosed legal filing securities exchange commission accessible sec website .
384,they sell,"also chairman scott c. donnelly sold 82,647 shares stock transaction occurred friday july 27th ."
385,they sell,"shares sold average price 67.17 total transaction 5,551,398.99 ."
386,they buy,"following sale chairman directly owns 639,916 shares company stock valued approximately 42,983,157.72 ."
387,they buy,disclosure sale found .
388,they sell,"last quarter insiders sold 134,209 shares company stock valued 9,035,968 ."
389,they buy,1.20 stock owned company insiders .
390,they buy,number large investors recently added reduced stakes business .
391,they buy,"lourd capital llc acquired new stake textron 3rd quarter valued approximately 230,000 ."
392,they buy,lincoln capital corp increased position textron 2.0 3rd quarter .
393,they buy,"lincoln capital corp owns 117,013 shares aerospace company stock valued 8,363,000 purchasing additional 2,249 shares period ."
394,they buy,churchill management corp increased position textron 4.7 3rd quarter .
395,they buy,"churchill management corp owns 60,795 shares aerospace company stock valued 4,345,000 purchasing additional 2,735 shares period ."
396,they buy,fox run management l.l.c .
397,they buy,"acquired new stake textron 3rd quarter valued approximately 240,000 ."
398,they buy,"finally barometer capital management inc. acquired new stake textron 3rd quarter valued approximately 5,932,000 ."
399,they buy,82.94 stock owned institutional investors hedge funds .
400,they buy,textron company profile textron inc operates aircraft defense industrial finance businesses worldwide .
401,they buy,company textron aviation segment manufactures sells business jets turboprop piston engine aircraft military trainer defense aircraft commercial parts well provides maintenance inspection repair services .
402,they buy,"recommended story average daily trade volume means stock tradingviewcount articlehistoryid=25183692 postdate=2018-10-11 type=a id=1097606 keyword textron nyse txt txt aerospace,88320310 set price target morgan stanleyratings:4,9 nyse txt receive news ratings textron daily enter email address receive concise daily summary latest news analysts ratings textron related companies marketbeat.com free daily email newsletter ."
403,they buy,cann reiterates buy rating alliance one international pyx bmo capital markets analysts give barrick gold abx 13.00 price target textron inc nyse txt institutional sentiment increased 1.01 2018 q2 .
404,they buy,0.18 0.83 2018q1 .
405,they sell,ratio better 172 institutional investors opened new increased equity positions 171 sold reduced stakes textron inc. institutional investors partner database 204.61 million shares 211.27 million shares 2018q1 .
406,they sell,also number institutional investors holding textron inc top 10 equity positions increased 2 3 increase 1. sold 22 reduced 149 increased 106 new position 66 .
407,they buy,textron inc. operates aircraft defense industrial finance businesses worldwide .
408,they buy,company market cap 16.22 billion .
409,they buy,operates five divisions textron aviation bell textron systems industrial finance .
410,they buy,36.93 p/e ratio .
411,they buy,textron aviation segment makes sells business jets turboprop aircraft piston engine aircraft military trainer defense aircraft commercial parts well provides maintenance inspection repair services .
412,they buy,stock decreased 3.09 2.08 last trading session reaching 65.3 .
413,they buy,1.14 million shares traded .
414,they buy,textron inc. nyse txt risen 33.07 since october 11 2017 uptrending .
415,they buy,outperformed 17.45 p500 .
416,they buy,analysts await textron inc. nyse txt report earnings october 18. expect 0.76 eps 16.92 0.11 last year 0.65 per share .
417,they buy,txt profit 188.79 million 21.48 p/e 0.76 eps becomes reality .
418,they buy,0.87 actual eps reported textron inc. previous quarter wall street forecasts negative eps growth .
419,they buy,"trinity street asset management llp holds 6.09 portfolio textron inc. 542,394 shares ."
420,they buy,"tide point capital management lp owns 515,548 shares 3.99 us portfolio ."
421,they buy,"moreover mrj capital inc 3.05 invested company 83,497 shares ."
422,they buy,new york-based d.c. capital advisors ltd invested 3.01 stock .
423,they buy,"northcoast asset management llc connecticut-based fund reported 371,574 shares ."
424,they buy,since january 1 0001 0 insider purchases 3 sales 20.69 million activity .
425,they buy,ratings analysis reveals 71 textron analysts positive .
426,they sell,7 wall street analysts rating textron 5 give buy 0 sell rating 2 recommend hold .
427,they buy,lowest target 59 high 78 .
428,they buy,stock average target 72.14 10.47 today 65.3 share price .
429,they buy,txt included 9 notes analysts april 12 2018. firm earned buy rating thursday april 19 bank america .
430,they buy,rating maintained barclays capital overweight thursday april 19. firm earned hold rating monday april 16 stephens .
431,they buy,stock buy rating bank america wednesday july 25. stock textron inc. nyse txt earned equal-weight rating morgan stanley thursday july 12. stock textron inc. nyse txt earned equal-weight rating morgan stanley thursday april 12. stock textron inc. nyse txt outperform rating given thursday april 19 robert w. baird .
432,they buy,wells fargo maintained buy rating 7200 target thursday april 19 report .
433,they buy,jp morgan maintained textron inc. nyse txt monday july 23 overweight rating .
434,they buy,news textron inc. nyse txt recently published seekingalpha.com released textron looks overvalued october 11 2018. bizjournals.com article titled flightsafety ceo bruce whitman dies 85 published october 11 2018 yet another important article .
435,they buy,enter email address receive concise daily summary latest news analysts ratings free daily email newsletter .
436,they sell,brokerages predict textron inc. nyse txt report 0.76 earnings per share eps current quarter zacks investment research reports .
437,they buy,four analysts issued estimates textron earnings .
438,they buy,highest eps estimate 0.78 lowest 0.74 .
439,they buy,textron posted earnings per share 0.65 quarter last year would suggest positive year year growth rate 16.9 .
440,they buy,business expected announce next earnings report market opens thursday october 18th .
441,they buy,average analysts expect textron report full-year earnings 3.33 per share current year eps estimates ranging 3.25 3.40 .
442,they buy,next fiscal year analysts anticipate company post earnings 3.73 per share eps estimates ranging 3.45 3.90 .
443,they buy,zacks investment research earnings per share averages mean average based survey research analysts follow textron .
444,they buy,textron nyse txt last posted quarterly earnings results wednesday july 18th .
445,they buy,aerospace company reported 0.87 eps quarter topping consensus estimate 0.70 0.17 .
446,they buy,business revenue 3.73 billion quarter compared analysts expectations 3.51 billion .
447,they buy,textron net margin 3.21 return equity 13.93 .
448,they buy,firm quarterly revenue 3.4 compared quarter last year .
449,they buy,period last year company posted 0.60 earnings per share .
450,they sell,"news vp julie g. duffy sold 6,562 shares textron stock transaction occurred tuesday july 31st ."
451,they sell,"shares sold average price 68.13 total value 447,069.06 ."
452,they buy,"following transaction vice president owns 22,535 shares company stock valued 1,535,309.55 ."
453,they buy,transaction disclosed legal filing sec available sec website .
454,they sell,"also evp e robert lupone sold 45,000 shares textron stock transaction occurred tuesday july 31st ."
455,they sell,"shares sold average price 67.50 total transaction 3,037,500.00 ."
456,they buy,"following completion transaction executive vice president directly owns 121,838 shares company valued approximately 8,224,065 ."
457,they buy,disclosure sale found .
458,they sell,"last three months insiders sold 134,209 shares company stock worth 9,035,968 ."
459,they buy,insiders 1.20 company stock .
460,they buy,hedge funds recently made changes positions stock .
461,they buy,"centaurus financial inc. bought new position textron second quarter worth 105,000 ."
462,they buy,"bluemountain capital management llc bought new position textron second quarter worth 139,000 ."
463,they buy,"piedmont investment advisors llc bought new position textron second quarter worth 197,000 ."
464,they buy,"legacy financial advisors inc. bought new position textron second quarter worth 203,000 ."
465,they buy,"finally colony group llc bought new position textron second quarter worth 202,000 ."
466,they sell,82.91 stock currently owned institutional investors hedge funds .
467,they buy,shares txt stock traded 0.78 trading wednesday hitting 71.52 .
