,assoc,values
0,they buy,average analysts currently moderate buy recommendation mean rating 4.33. comparison average recommendation month ago moderate buy average rating 4.00. similarly average rating observed 2 months ago moderate buy mean numerical rating 4.00 average rating observed 3 months ago moderate buy mean numerical rating 3.86 .
1,they sell,"proton solutions cgo kennedy kolleen sold 1,242 shares 26,898 transaction occurred 2019/04/10 ."
2,they buy,"trading activity significantly improved volume ready counter increased 589,392 shares versus 549,830 average daily trading volume past 20 days ."
3,they buy,seen positive analyst call robert w. baird upgraded stock neutral outperform march 22. analysts goldman shed negative views january 04 lifting fromneutral buy .
4,they sell,jp morgan released new analyst coverage june 28 calling stock underweight .
