,assoc,values
0,they sell,"cognios capital llc sold 10,396 shares company stock rose 0.39 market ."
1,they buy,historical syy news 06/04/2018 sysco industries ltd sysc.bo loss injury human life due fire 22/05/2018 sysco webcast presentation 2018 goldman sachs lodging gaming restaurant leisure conference 06/04/2018 sysco industries ltd sysc.bo storage area printing department coating department factory premises hugely affected due fire 07/05/2018 sysco corp qtrly adj shr 0.67 07/05/2018 sysco presenting conference jun 6 22/05/2018 sysco presenting goldman sachs conference jun 5 04/05/2018 sysco inventory control workers join teamsters local 683 union 27/03/2018 cma refer sysco purchase kent frozen foods phaseii 07/05/2018 sysco target deliver current three-year plan 07/05/2018 sysco corp qtrly sales increased 6.1 14.3 bln british columbia investment management corp increased stake united technologies corp utx 21.45 based latest 2018q4 regulatory filing sec .
2,they buy,"british columbia investment management corp bought 43,513 shares company stock rose 2.45 market ."
3,they buy,stock increased 1.31 1.83 last trading session reaching 141.63 .
4,they sell,insider dumais michael r sold 1.15m .
5,they sell,shares 1.47m sold charlton robert monday february 4. shares 3.81 million sold libby russell t.. peltz nelson sold 147.23 million worth stock 2.22m shares .
6,they sell,"tilghman richard g sold 330,850 worth sysco corporation nyse syy thursday november 15 ."
7,they sell,negative 55 investors sold syy shares 350 reduced holdings .
8,they buy,"manchester lc invested 0.03 2,790 shares ."
9,they buy,"amp investors limited invested 296,369 shares 0.12 stock ."
10,they buy,blair william commerce il invested 0.04 portfolio sysco corporation nyse syy .
11,they buy,moreover state alaska department revenue 0.39 invested sysco corporation nyse syy .
12,they buy,georgia-based montag associate invested 0.04 sysco corporation nyse syy .
13,they buy,"also increased holding yum brands inc nyse yum 4,489 shares quarter total 23,733 shares risen stake h r block inc nyse hrb ."
14,they sell,"related news evp robert s. charlton sold 22,321 shares business stock transaction dated monday february 4th ."
15,they sell,"stock sold average price 65.83 total transaction 1,469,391.43 ."
16,they sell,"also director trian fund management l.p. sold 707,000 shares business stock transaction dated wednesday march 13th ."
17,they sell,"stock sold average price 66.30 total value 46,874,100.00 ."
18,they sell,sell-side analysts anticipate sysco co. post 3.4 earnings per share current fiscal year .
19,they sell,zacks investment research raised sysco sell rating hold rating research report monday january 28th .
20,they buy,loop capital set 75.00 price target sysco gave stock buy rating report tuesday february 5th .
21,they buy,bank america lowered sysco buy rating neutral rating set 68.00 price target stock .
22,they sell,finally pivotal research reiterated sell rating set 54.00 price target shares sysco report friday february 1st .
23,they sell,one investment analyst rated stock sell rating six issued hold rating six assigned buy rating company stock .
24,they sell,"north american management corp sold 5,877 shares company stock rose 0.39 market ."
25,they sell,"picton mahoney asset management sold 129,765 shares company stock declined 7.20 stock markets rallied ."
26,they buy,stock increased 0.74 0.23 last trading session reaching 31.24 .
27,they sell,fall 65 investors sold zayo shares 85 reduced holdings .
28,they buy,"85,012 owned pictet asset mgmt ltd. verition fund mngmt limited liability company invested 0.02 zayo group holdings inc. nyse zayo ."
29,they buy,avenir invested 3.46 portfolio zayo group holdings inc. nyse zayo .
30,they buy,zimmer partners limited partnership invested 1.57 zayo group holdings inc. nyse zayo .
31,they buy,morgan stanley invested 4.07m shares .
32,they buy,"eaton vance mgmt invested 15,468 shares 0 stock ."
33,they sell,turned negative 55 investors sold syy shares 350 reduced holdings .
34,they buy,"bancorp 0.16 invested sysco corporation nyse syy 451,485 shares ."
35,they buy,confluence wealth mgmt limited com invested 0.31 sysco corporation nyse syy .
36,they sell,libby russell t. sold 3.81 million worth stock .
37,they sell,1.52 million shares sold frank joshua d. worth 101.38 million wednesday november 28. peltz nelson sold 2.22m shares worth 147.23m friday november 16 .
38,they buy,steward partners investment advisory llc increased holdings shares sysco 3.6 first quarter .
39,they buy,janney montgomery scott llc increased holdings shares sysco 12.4 first quarter .
40,they buy,tompkins financial corp increased holdings shares sysco 195.0 first quarter .
41,they buy,osborn williams donohoe llc increased holdings shares sysco 43.6 first quarter .
42,they buy,finally duncker streett co. inc. increased holdings shares sysco 9.5 first quarter .
43,they sell,"sysco news evp robert s. charlton sold 22,321 shares firm stock transaction monday february 4th ."
44,they sell,"stock sold average price 65.83 total value 1,469,391.43 ."
45,they sell,"also director trian fund management l.p. sold 707,000 shares firm stock transaction wednesday march 13th ."
46,they sell,"stock sold average price 66.30 total value 46,874,100.00 ."
47,they buy,bank america downgraded shares sysco buy rating neutral rating set 68.00 price target stock .
48,they sell,pivotal research reiterated sell rating issued 54.00 price target shares sysco report friday february 1st .
49,they sell,zacks investment research upgraded sysco sell rating hold rating research report wednesday february 6th .
50,they buy,finally loop capital set 75.00 price objective sysco gave stock buy rating research report tuesday february 5th .
51,they sell,one analyst rated stock sell rating six given hold rating six assigned buy rating company .
52,they sell,sell-side analysts expect sysco co. post 3.4 eps current year .
53,they sell,"cognios capital llc sold 10,396 shares company stock rose 0.39 market ."
54,they buy,stock increased 0.15 0.1 last trading session reaching 70.93 .
55,they sell,worsened 143 investors sold fb shares 740 reduced holdings .
56,they buy,"oakbrook ltd liability co 0.93 invested facebook inc. nasdaq fb 105,092 shares ."
57,they buy,"gardner lewis asset lp owns 0.51 invested facebook inc. nasdaq fb 43,400 shares ."
58,they buy,kayne anderson rudnick management ltd liability corp invested 0.32 portfolio facebook inc. nasdaq fb .
59,they buy,north carolina-based first citizens national bank tru invested 0.64 facebook inc. nasdaq fb .
60,they buy,north point portfolio managers corp oh invested 1.89 facebook inc. nasdaq fb .
61,they buy,"qci asset new york invested 1.42 98,684 shares ."
62,they buy,pecaut 0.22 invested facebook inc. nasdaq fb .
63,they buy,"also increased holding vanguard large vv 137 shares quarter total 2,936 shares risen stake philip morris int l nyse pm ."
64,they sell,negative 55 investors sold syy shares 350 reduced holdings .
65,they buy,farr miller washington ltd com dc invested 0.26 sysco corporation nyse syy .
66,they buy,"opus investment management invested 0.74 55,000 shares ."
67,they buy,welch forbes limited liability com invested 0.32 sysco corporation nyse syy .
68,they buy,maine-based vigilant cap management ltd limited liability company invested 0.22 sysco corporation nyse syy .
69,they buy,callahan advisors lc invested 0.73 portfolio sysco corporation nyse syy .
70,they sell,"related news director trian fund management l.p. sold 707,000 shares firm stock transaction occurred wednesday march 13th ."
71,they sell,"stock sold average price 66.30 total transaction 46,874,100.00 ."
72,they sell,"also evp robert s. charlton sold 22,321 shares firm stock transaction occurred monday february 4th ."
73,they sell,"shares sold average price 65.83 total value 1,469,391.43 ."
74,they sell,"twin capital management inc sold 38,080 shares company stock rose 0.39 market ."
75,they buy,falcon point capital llc increased stake health insurance innovation hiiq 17.99 based latest 2018q4 regulatory filing sec .
76,they buy,"falcon point capital llc bought 13,644 shares company stock rose 7.47 market ."
77,they buy,stock increased 3.57 0.77 last trading session reaching 22.33 .
78,they sell,"insider charlton robert sold 22,321 shares worth 1.47 million ."
79,they sell,wednesday november 28 insider frank joshua d. sold 101.38m .
80,they sell,3.81m worth sysco corporation nyse syy shares sold libby russell t.. 1.52m shares sold peltz nelson worth 101.38m .
81,they buy,"also increased holding csx corp com nyse csx 37,350 shares quarter total 53,000 shares risen stake host hotels resorts inc reit nyse hst ."
82,they sell,dived 55 investors sold syy shares 350 reduced holdings .
83,they buy,spectrum mgmt gru invested 0.51 sysco corporation nyse syy .
84,they buy,"moreover principal financial grp inc 0.05 invested sysco corporation nyse syy 726,447 shares ."
85,they buy,indiana-based indiana tru inv mgmt co invested 0.43 sysco corporation nyse syy .
86,they buy,west oak cap lc invested 0 portfolio sysco corporation nyse syy .
87,they buy,colorado-based amg state bank invested 0.07 sysco corporation nyse syy .
88,they buy,"dupont corp invested 0.01 6,078 shares ."
89,they buy,"twin capital mgmt invested 0.03 8,280 shares ."
90,they buy,"moreover stevens cap ltd partnership 0.05 invested sysco corporation nyse syy 14,962 shares ."
91,they sell,"parsec financial management inc sold 6,466 shares company stock rose 0.39 market ."
92,they buy,stock increased 1.02 0.71 last trading session reaching 70.68 .
93,they buy,historical syy news 27/03/2018 uk cma cleared anticipated acquisition sysco corp kent frozen foods 07/05/2018 sysco corp qtrly sales increased 6.1 14.3 bln 07/05/2018 sysco 3q gross margin fell 9 basis points 18.65 07/05/2018 sysco target deliver current three-year plan 22/05/2018 sysco presenting goldman sachs conference jun 5 22/03/2018 sysco reports upsizing pending cash tender offer 16/05/2018 sysco delivering big way upon return national restaurant association show 2018 17/05/2018 sysco presenting royal bank canada conference may 31 21/05/2018 freshpoint central florida host groundbreaking ceremony expansion orlando facility 07/05/2018 sysco 3q gross margin est .
94,they buy,oakmont corp increased stake cheniere energy inc lng 34.14 based latest 2018q4 regulatory filing sec .
95,they buy,"oakmont corp bought 170,710 shares company stock rose 5.78 market ."
96,they buy,historical lng news 05/03/2018 freeport lng could open late may 2019 ceo smith 17/05/2018 cheniere energy makes offer buy rest cheniere partners 24/04/2018 cqp lng cheniere settles us safety regulators lng storage tanks mishap sabine pass export terminal two tanks expected allowed back service eventually following repairs corrective actions modifications cqp lng 07/03/2018 cheniere opened beijing office ceraweek market talk 17/05/2018 cheniere energy partners lp holdings llc receives merger proposal cheniere energy inc 27/03/2018 cheniere energy inc lng.a bernstein raises target price 63 55 23/04/2018 cheniere decide corpus christi 3 lng export terminal end june 05/03/2018 cheniere gail celebrate commencement 20-year lng contract 22/05/2018 moody affirms cheniere corpus christi ba3 rating outlook c 30/05/2018 cheniere sabine pass lng tanker tracker may 30 table investors sentiment decreased 1.24 2018 q4 .
97,they sell,dropped 40 investors sold lng shares 123 reduced holdings .
98,they buy,rare 2.53 invested cheniere energy inc. nyseamerican lng .
99,they buy,fiduciary communication invested 0.01 cheniere energy inc. nyseamerican lng .
100,they buy,gulf bancshares uk limited 0.05 invested cheniere energy inc. nyseamerican lng .
101,they buy,envestnet asset mgmt inc invested 0.01 cheniere energy inc. nyseamerican lng .
102,they buy,"garrison bradford associates inc invested 8,672 shares 0.46 stock ."
103,they buy,"advisors asset management invested 40,195 shares 0.05 stock ."
104,they buy,"also increased holding vanguard emerging markets stoc vwo 37,092 shares quarter total 533,115 shares risen stake fedex corp nyse fdx ."
105,they sell,worsened 55 investors sold syy shares 350 reduced holdings .
106,they buy,commonwealth national bank aus invested 0.06 sysco corporation nyse syy .
107,they buy,state farm mutual automobile ins invested 0.31 portfolio sysco corporation nyse syy .
108,they buy,prelude capital mngmt 0 invested sysco corporation nyse syy 640 shares .
109,they buy,delta asset lc tn invested 4.5 sysco corporation nyse syy .
110,they buy,moreover manchester management limited com 0.03 invested sysco corporation nyse syy .
111,they buy,united kingdom-based gulf int national bank uk limited invested 0.15 sysco corporation nyse syy .
112,they sell,number institutional investors hedge funds also recently bought sold shares syy .
113,they buy,first midwest bank trust division increased position sysco 2.1 first quarter .
114,they buy,jacobs co. ca increased position shares sysco 2.1 first quarter .
115,they buy,welch forbes llc increased position shares sysco 0.7 first quarter .
116,they buy,finally tufton capital management increased position shares sysco 0.7 first quarter .
117,they sell,"related news director trian fund management l.p. sold 707,000 shares sysco stock transaction occurred wednesday march 13th ."
118,they sell,"shares sold average price 66.30 total value 46,874,100.00 ."
119,they sell,"also evp robert s. charlton sold 22,321 shares sysco stock transaction occurred monday february 4th ."
120,they sell,"stock sold average price 65.83 total transaction 1,469,391.43 ."
121,they buy,zacks investment research cut shares sysco buy rating hold rating research report thursday april 11th .
122,they buy,loop capital set 75.00 price target shares sysco gave company buy rating research report tuesday february 5th .
123,they sell,pivotal research reiterated sell rating set 54.00 price target shares sysco research report friday february 1st .
124,they buy,finally bank america cut shares sysco buy rating neutral rating set 68.00 price target company .
125,they sell,one equities research analyst rated stock sell rating six issued hold rating six given buy rating company stock .
126,they sell,hedge funds institutional investors also bought sold shares company .
127,they sell,"news evp robert s. charlton sold 22,321 shares company stock transaction monday february 4th ."
128,they sell,"shares sold average price 65.83 total value 1,469,391.43 ."
129,they sell,"also director trian fund management l.p. sold 707,000 shares company stock transaction wednesday march 13th ."
130,they sell,"shares sold average price 66.30 total transaction 46,874,100.00 ."
131,they sell,zacks investment research raised shares sysco sell rating hold rating research note monday january 28th .
132,they buy,loop capital set 75.00 price target shares sysco gave stock buy rating research note tuesday february 5th .
133,they buy,bank america cut shares sysco buy rating neutral rating set 68.00 price target company .
134,they sell,finally pivotal research reissued sell rating issued 54.00 price target shares sysco research note friday february 1st .
135,they sell,one investment analyst rated stock sell rating six assigned hold rating six issued buy rating company stock .
136,they sell,"related news director trian fund management l.p. sold 707,000 shares company stock transaction wednesday march 13th ."
137,they sell,"stock sold average price 66.30 total value 46,874,100.00 ."
138,they sell,"also evp robert s. charlton sold 22,321 shares company stock transaction monday february 4th ."
139,they sell,"shares sold average price 65.83 total value 1,469,391.43 ."
140,they sell,"rowland company investment counsel sold 1,879 shares company stock rose 0.39 market ."
141,they buy,stock increased 0.27 0.19 last trading session reaching 70.16 .
142,they sell,"reilly herbert faulkner iii sold 2,722 shares company stock declined 5.18 stock markets rallied ."
143,they sell,worsened 70 investors sold cost shares 431 reduced holdings .
144,they buy,maryland-based carderock mngmt inc invested 1.37 costco wholesale corporation nasdaq cost .
145,they buy,iberiabank invested 0.81 costco wholesale corporation nasdaq cost .
146,they buy,"bahl gaynor invested 0.01 3,770 shares ."
147,they buy,"also increased holding pfizer incorporated nyse pfe 166 shares quarter total 60,819 shares risen stake marathon pete corp nyse mpc ."
148,they sell,fall 55 investors sold syy shares 350 reduced holdings .
149,they buy,edgewood management limited liability company invested 0.01 portfolio sysco corporation nyse syy .
150,they sell,frank joshua d. sold 1.52m shares worth 101.38m .
151,they sell,"330,850 worth sysco corporation nyse syy sold tilghman richard g. libby russell t. sold 60,156 shares worth 3.81m thursday january 31. charlton robert sold 22,321 shares worth 1.47 million ."
152,they buy,fairview capital investment management llc increased stake sysco corp syy 1.06 based latest 2018q4 regulatory filing sec .
153,they buy,"fairview capital investment management llc bought 8,198 shares company stock rose 0.39 market ."
154,they sell,"shamrock asset management llc sold 2,245 shares company stock declined 2.06 stock markets rallied ."
155,they sell,chips alternative nvidia 28/03/2018 proactiveinvstrs tesla nvidia among worst hit tuesday tech sell-off amid fresh concerns driverless cars 10/05/2018 nvidia reveals crypto sales first time predicts big drop 27/03/2018 vrgineers teams nvidia bring enterprise vr highest level performance 21/03/2018 v3 ibm teams nvidia use gpus boost ai research 15/05/2018 avalon adds nvidia exits tupperware cuts walmart 13f 05/04/2018 citron pressing nvda short expect sub 200 soon .
156,they sell,shares 1.47 million sold charlton robert s. 1.52m shares sold peltz nelson worth 101.38 million .
157,they sell,"thursday november 15 insider tilghman richard g sold 330,850 ."
158,they sell,frank joshua d. also sold 147.23m worth sysco corporation nyse syy friday november 16 .
159,they sell,fall 55 investors sold syy shares 350 reduced holdings .
160,they buy,moreover guggenheim cap ltd liability com 0.24 invested sysco corporation nyse syy .
161,they buy,tennessee-based shayne com limited liability corporation invested 15.66 sysco corporation nyse syy .
162,they buy,glenview national bank dept invested 1.13 sysco corporation nyse syy .
163,they buy,"lord abbett limited 0.22 invested sysco corporation nyse syy 961,473 shares ."
164,they sell,negative 180 investors sold nvda shares 325 reduced holdings .
165,they buy,"concorde asset management lc invested 0.26 2,349 shares ."
166,they buy,rowland com investment counsel adv invested 0 nvidia corporation nasdaq nvda .
167,they buy,city company invested 0.03 portfolio nvidia corporation nasdaq nvda .
168,they buy,ci investments 0 invested nvidia corporation nasdaq nvda .
169,they buy,edge wealth mngmt ltd liability co 0.03 invested nvidia corporation nasdaq nvda 777 shares .
170,they sell,"858,685 worth stock sold shoquist debora wednesday january 2 ."
171,they sell,several institutional investors hedge funds also bought sold shares syy .
172,they sell,"sysco news director trian fund management l.p. sold 707,000 shares sysco stock transaction dated wednesday march 13th ."
173,they sell,"stock sold average price 66.30 total transaction 46,874,100.00 ."
174,they sell,"also evp robert s. charlton sold 22,321 shares sysco stock transaction dated monday february 4th ."
175,they sell,"stock sold average price 65.83 total value 1,469,391.43 ."
176,they sell,zacks investment research cut sysco hold rating sell rating research report tuesday january 15th .
177,they buy,bank america cut sysco buy rating neutral rating set 68.00 price target company .
178,they sell,pivotal research restated sell rating set 54.00 price target shares sysco report friday february 1st .
179,they buy,finally loop capital set 75.00 price target sysco gave company buy rating report tuesday february 5th .
180,they sell,one analyst rated stock sell rating six issued hold rating six given buy rating stock .
181,they sell,"colony group llc sold 6,855 shares company stock rose 0.39 market ."
182,they sell,turned negative 73 investors sold ip shares 232 reduced holdings .
183,they buy,moreover lpl financial limited company 0.02 invested international paper company nyse ip .
184,they buy,los angeles cap equity research invested 0 international paper company nyse ip .
185,they buy,mitchell mcleod pugh williams invested 0.25 portfolio international paper company nyse ip .
186,they sell,dropped 55 investors sold syy shares 350 reduced holdings .
187,they buy,"beach invest counsel pa invested 0.31 39,569 shares ."
188,they buy,california-based bailard invested 0.33 sysco corporation nyse syy .
189,they buy,athena advsr ltd com invested 464 shares .
190,they buy,michigan-based azimuth cap mngmt lc invested 0.08 sysco corporation nyse syy .
191,they sell,"3.81 million worth sysco corporation nyse syy shares sold libby russell t.. 22,321 sysco corporation nyse syy shares value 1.47 million sold charlton robert s. 101.38m worth sysco corporation nyse syy shares sold peltz nelson ."
192,they sell,"tilghman richard g also sold 330,850 worth sysco corporation nyse syy thursday november 15 ."
193,they buy,"also increased holding ishares core p 500 etf ivv 3,854 shares quarter total 80,596 shares risen stake sector spdr technology etf xlk ."
194,they sell,"artemis investment management llp sold 56,556 shares company stock rose 0.39 market ."
195,they buy,stock increased 0.40 0.28 last trading session reaching 70.65 .
196,they buy,16/05/2018 sysco delivering big way upon return national restaurant association show 2018 07/05/2018 sysco corp qtrly adj shr 0.67 17/05/2018 sysco presenting royal bank canada conference may 31 27/03/2018 cma refer sysco purchase kent frozen foods phaseii 16/03/2018 cma refer sysco kent frozen foods deal phase 2 06/04/2018 sysco industries ltd sysc.bo loss injury human life due fire 09/05/2018 five prominent gaming ceos showcase event 22nd annual east coast gaming congress june 13-14 atlantic city 07/05/2018 sysco corp qtrly sales increased 6.1 14.3 bln 13/04/2018 sysco industries ltd sysc.bo says state bank india reclassified co credit accounts npa nomura holdings inc decreased stake vodafone group plc vod 97 based latest 2018q4 regulatory filing sec .
197,they sell,nomura holdings inc sold 2.45m shares company stock declined 21.30 stock markets rallied .
198,they buy,historical vod news 09/05/2018 telefonica deutschland o2dn.de ceo vodafone-liberty deal would create monopoly german cable distribution 20/04/2018 vodafone pulls brand three african nations pact ended 27/03/2018 financialexpress vodafone-idea merger final stages approval govt 09/05/2018 reuters insider vodafone expand europe 21.8 bn liberty assets purchase 03/04/2018 vodafone group plc completion sale vodafone standalone tower business india 08/05/2018 vodafone close deal buy liberty global european assets 18/05/2018 tele columbus would like buy vodafone assets wiwo 09/05/2018 deutsche telekom ceo says vodafone-liberty deal unacceptable 09/05/2018 fired-up deutsche telekom ceo lashes vodafone-liberty 13/04/2018 italy open fiber says extended ultrabroadband accord vodafone cover 271 italian cities notable recent vodafone group plc nasdaq vod news published nasdaq.com released movie studio exhibit present 2019 reg conference may 9th 2019 new york city nasdaq april 24 2019 also 247wallst.com article weakness vodafone looks like buying opportunity long-term investors 24/7 wall st. published march 13 2019 nasdaq.com published safe dividend makes verizon communications inc. stock safe bet nasdaq june 19 2018. interesting news vodafone group plc nasdaq vod released seekingalpha.com article vodafone bofa ml marks buy sees headwinds passing seeking alpha published february 06 2019 well seekingalpha.com news article titled vodafone selloff overdone seeking alpha publication date september 04 2018 .
199,they sell,negative 55 investors sold syy shares 350 reduced holdings .
200,they buy,becker mngmt inc 0.02 invested sysco corporation nyse syy .
201,they buy,"jnba fincl invested 0.02 1,072 shares ."
202,they buy,mufg americas corporation invested 0.01 portfolio sysco corporation nyse syy .
203,they buy,cambridge invested 0.09 sysco corporation nyse syy .
204,they buy,moreover schnieders ltd liability company 0.12 invested sysco corporation nyse syy .
205,they buy,"also increased holding nisource inc nyse ni 190,496 shares quarter total 714,959 shares risen stake carbon black inc ."
206,they sell,"first hawaiian bank sold 5,214 shares company stock rose 0.39 market ."
207,they buy,stock increased 0.93 0.65 last trading session reaching 70.37 .
208,they buy,investors sentiment increased 1.38 q4 2018.
209,they sell,improved 39 investors sold mnk shares 59 reduced holdings .
210,they buy,ontario canada-based retail bank montreal invested 0 mallinckrodt plc nyse mnk .
211,they buy,first manhattan invested 0 portfolio mallinckrodt plc nyse mnk .
212,they buy,profund advsrs limited liability co invested 0.02 mallinckrodt plc nyse mnk .
213,they buy,moreover acadian asset management limited com 0.13 invested mallinckrodt plc nyse mnk 1.69 million shares .
214,they buy,"state treasurer state michigan invested 29,700 shares 0 stock ."
215,they sell,negative 55 investors sold syy shares 350 reduced holdings .
216,they buy,"moreover mutual america capital ltd liability corp 0.07 invested sysco corporation nyse syy 62,871 shares ."
217,they buy,hbk ltd partnership invested 0.07 portfolio sysco corporation nyse syy .
218,they buy,"leisure mngmt invested 9,154 shares ."
219,they buy,"3,871 owned schnieders cap mngmt ltd. robeco institutional asset bv 0.53 invested sysco corporation nyse syy ."
