,assoc,values
220,they buy,"lvm mgmt ltd mi 0.18 invested sysco corporation nyse syy 11,129 shares ."
221,they sell,peltz nelson sold 101.38 million worth stock 1.52 million shares .
222,they sell,"frank joshua d. also sold 101.38m worth sysco corporation nyse syy wednesday november 28. another trade 5,000 shares valued 330,850 made tilghman richard g thursday november 15. libby russell t. sold 60,156 shares worth 3.81 million thursday january 31 ."
223,they sell,"south state corp sold 5,268 shares company stock rose 0.39 market ."
224,they buy,stock increased 0.93 0.65 last trading session reaching 70.37 .
225,they buy,grandeur peak global advisors llc increased stake wns holdings ltd wns 20.09 based latest 2018q4 regulatory filing sec .
226,they buy,"grandeur peak global advisors llc bought 174,938 shares company stock rose 7.29 market ."
227,they buy,stock increased 0.86 0.49 last trading session reaching 57.15 .
228,they buy,"also increased holding bank amer corp nyse bac 63,601 shares quarter total 459,112 shares risen stake celgene corp nasdaq celg ."
229,they sell,worsened 55 investors sold syy shares 350 reduced holdings .
230,they buy,"kistler invested 2,885 shares 0.08 stock ."
231,they buy,guyasuta investment advsrs incorporated 0.12 invested sysco corporation nyse syy .
232,they buy,clarivest asset mngmt ltd liability co invested 86 shares .
233,they buy,"moreover endurance wealth 0.01 invested sysco corporation nyse syy 1,188 shares ."
234,they buy,moreover notis 0.28 invested sysco corporation nyse syy .
235,they sell,frank joshua d. sold 2.22m shares worth 147.23m .
236,they sell,2.22m shares sold peltz nelson worth 147.23m friday november 16 .
237,they sell,"3.81m worth sysco corporation nyse syy sold libby russell t. thursday january 31. another trade 22,321 shares valued 1.47 million made charlton robert monday february 4 ."
238,they sell,"rowland company investment counsel sold 1,879 shares company stock rose 0.39 market ."
239,they buy,stock increased 0.93 0.65 last trading session reaching 70.37 .
240,they sell,dived 55 investors sold syy shares 350 reduced holdings .
241,they buy,"aqr capital mgmt ltd 0.05 invested sysco corporation nyse syy 754,848 shares ."
242,they buy,"numerixs invest techs inc 0.28 invested sysco corporation nyse syy 13,831 shares ."
243,they buy,"13,608 owned signature advsrs ltd co. northwest counselors invested 1.23 sysco corporation nyse syy ."
244,they buy,"hyman charles 0.14 invested sysco corporation nyse syy 18,790 shares ."
245,they buy,dana investment invested 1.55 sysco corporation nyse syy .
246,they buy,grimes company inc invested 0.03 portfolio sysco corporation nyse syy .
247,they buy,"also increased holding boeing co nyse ba 40 shares quarter total 1,572 shares risen stake cintas corp nasdaq ctas ."
248,they sell,"libby russell t. sold 60,156 shares worth 3.81 million ."
249,they sell,"another trade 22,321 shares valued 1.47m sold charlton robert s. shares 101.38m sold frank joshua d. wednesday november 28. tilghman richard g also sold 330,850 worth sysco corporation nyse syy thursday november 15 ."
250,they buy,"also increased holding lockheed martin corp nyse lmt 3,313 shares quarter total 7,364 shares risen stake j p morgan chase co com nyse jpm ."
251,they buy,shares energy transfer lp increased 15.06 year alone .
252,they sell,looking investment recommendation say scale 1 5 1 strong buy 3 hold 5 sell et given 1.60 2.50 placed syy .
253,they sell,zacks investment research upgraded sysco sell rating hold rating research note monday december 31st .
254,they buy,bank america lowered sysco buy rating neutral rating set 68.00 target price stock .
255,they sell,pivotal research reaffirmed sell rating issued 54.00 target price shares sysco research report friday february 1st .
256,they buy,finally loop capital set 75.00 target price sysco gave stock buy rating research report tuesday february 5th .
257,they sell,one analyst rated stock sell rating six given hold rating six given buy rating company stock .
258,they sell,"sysco news insider russell t. libby sold 60,156 shares firm stock transaction occurred thursday january 31st ."
259,they sell,"stock sold average price 63.40 total value 3,813,890.40 ."
260,they sell,"also evp robert s. charlton sold 22,321 shares firm stock transaction occurred monday february 4th ."
261,they sell,"shares sold average price 65.83 total value 1,469,391.43 ."
262,they sell,"last three months insiders sold 789,477 shares company stock valued 52,157,382 ."
263,they sell,similarly research note sent november 6th 2018 pivotal research group analysts reiterated shares stock sell set price target 54 .
264,they buy,average analysts currently moderate buy recommendation mean rating 4.08. comparison average recommendation month ago moderate buy average rating 4.18. similarly average rating observed 2 months ago moderate buy mean numerical rating 4.10 average rating observed 3 months ago moderate buy mean numerical rating 4.09 .
265,they buy,vision capital management inc increased stake sysco corp com syy 14.78 based latest 2018q4 regulatory filing sec .
266,they buy,"vision capital management inc bought 9,682 shares company stock rose 0.39 market ."
267,they sell,negative 55 investors sold syy shares 350 reduced holdings .
268,they buy,veritable lp invested 0.04 sysco corporation nyse syy .
269,they buy,cypress grp inc invested 0.16 sysco corporation nyse syy .
270,they buy,moreover jaffetilchin invest prtn lc 0.15 invested sysco corporation nyse syy .
271,they buy,long road investment counsel limited liability corp invested 0.75 portfolio sysco corporation nyse syy .
272,they buy,notable recent sysco corporation nyse syy news published globenewswire.com released sysco partners brad paisley kimberly williams-paisley store help feed need globenewswire april 09 2019 also globenewswire.com article sysco elects edward d. shirley independent lead director globenewswire published november 16 2018 seekingalpha.com published sysco corporation 45 yoy still buy seeking alpha august 22 2018. interesting news sysco corporation nyse syy released globenewswire.com article sysco cutting edge solutions introduces new product offerings globenewswire published september 24 2018 well seekingalpha.com news article titled sysco close blue chip gets seeking alpha publication date february 14 2019 .
273,they sell,"another trade 2.22m shares valued 147.23 million made peltz nelson friday november 16. libby russell t. also sold 3.81m worth sysco corporation nyse syy thursday january 31. monday february 4 charlton robert sold 1.47 million worth sysco corporation nyse syy 22,321 shares ."
274,they sell,"shares 330,850 sold tilghman richard g ."
275,they buy,notable recent select medical holdings corporation nyse sem news published seekingalpha.com released semgroup kkr form jv acquire meritage midstream 449m seeking alpha january 10 2019 also prnewswire.com article select medical uc san diego health vibra healthcare form two post-acute joint ventures serve southern california pr newswire published october 17 2018 seekingalpha.com published hospital operators health insurer/managed care downdraft seeking alpha april 16 2019. interesting news select medical holdings corporation nyse sem released seekingalpha.com article select medical holdings corporation sem presents 37th annual j.p. morgan healthcare conference slideshow seeking alpha published january 09 2019 well fool.com news article titled 5 best hospital stocks buy right motley fool publication date october 14 2016 .
